********************************************************************************************************************************************

 TAX YEAR: 2014 

********************************************************************************************************************************************

1: SELL 2346 PAYl Stocks on 24/03/2014 at GBP 11.3681 each gives PROFIT of GBP 21,667 equals GBP 21,666.64
 Commission GBP 6 and taxes GBP 0 on SELL
Trade details:ID 47 Code PAYl Date 2014-03-24 05:38:09 Quantity -2,346 Price 11.3681 Value per block 11.3681
Total allowable cost GBP 4,996.92   Total disposal proceeds GBP 26,663.56

Matches with:
PRO-RATA SECTION 104: Quantity 2346.000000 PAYl allocated from total holding of 2,346, made up of 1 trades between 2010-05-25 and 2010-05-25
 At average value of GBP 2.11407 Commissions GBP 12.5000 Taxes GBP 24.8100  

Trades:
ID 2045 Code PAYl Date 2010-05-25 00:00:00 Quantity 2,346 Price 2.11407 Value per block 2.11407

CALCULATION: (2346*11.3681) - 6 - 0 -(2346*2.11407) - 12.5000 - 24.8100  = 21,667 

********************************************************************************************************************************************

1: SELL 40867 RSA Stocks on 17/12/2013 at GBP 0.911000 each gives LOSS of GBP -8,275 equals GBP -8,274.56
 Commission GBP 6 and taxes GBP 0 on SELL
Trade details:ID 2047 Code RSA Date 2013-12-17 00:00:00 Quantity -40,867 Price 0.911000 Value per block 0.911000
Total allowable cost GBP 45,498.40   Total disposal proceeds GBP 37,223.84

Matches with:
PRO-RATA SECTION 104: Quantity 40867.000000 RSA allocated from total holding of 40,867, made up of 1 trades between 2012-03-05 and 2012-03-05
 At average value of GBP 1.10746 Commissions GBP 12.5000 Taxes GBP 227.290  

Trades:
ID 2046 Code RSA Date 2012-03-05 00:00:00 Quantity 40,867 Price 1.10746 Value per block 1.10746

CALCULATION: (40867*0.911000) - 6 - 0 -(40867*1.10746) - 12.5000 - 227.290  = -8,275 

********************************************************************************************************************************************


                Summary for tax year ending 5th April 2014 

                              Figures in GBP

Disposal Proceeds = 63,887.40, Allowable Costs = 50,495.32, Disposals = 2 
 Year Gains = 21,666.64  Year Losses = -8,274.56 PROFIT = 13,392.08


********************************************************************************************************************************************
********************************************************************************************************************************************

 TAX YEAR: 2015 

********************************************************************************************************************************************

1: SELL 1 014U Futures on 22/06/2014 at KRW 128,675,000 each gives LOSS of KRW -2,785,405 equals GBP -1,603.43
 Commission KRW 5,147 and taxes KRW 0 on SELL
Trade details:ID 1149 Code 014U Date 2014-06-22 20:13:32 Quantity -1 Price 257.350 Value per block 128,675,000
Total allowable cost KRW 5,258   Total disposal proceeds KRW -2,780,147

Matches with:
SUBSEQUENT 1 TRADE(S) Within 30 days between 2014-07-03 and 2014-07-03: Matches with BUY of 1 014U at of KRW 131,450,000 each 
 Commissions KRW 5,258 Taxes KRW 0  

Trades:
ID 1148 Code 014U Date 2014-07-03 21:22:35 Quantity 1 Price 262.900 Value per block 131,450,000

CALCULATION: (1*128675000) - 5,147 - 0 -(1*131450000) - 5,258 - 0  = -2,785,405 

********************************************************************************************************************************************

2: SELL 1 014U Futures on 08/07/2014 at KRW 129,625,000 each gives LOSS of KRW -85,373 equals GBP -49.0076
 Commission KRW 5,185 and taxes KRW 0 on SELL
Trade details:ID 1150 Code 014U Date 2014-07-08 21:18:25 Quantity -1 Price 259.250 Value per block 129,625,000
Total allowable cost KRW 5,188   Total disposal proceeds KRW -80,185

Matches with:
PRO-RATA SECTION 104: Quantity 1.000000 014U allocated from total holding of 2, made up of 1 trades between 2014-06-15 and 2014-06-15
 At average value of KRW 129,700,000 Commissions KRW 5,188 Taxes KRW 0  

Trades:
ID 1147a Code 014U Date 2014-06-15 20:02:57 Quantity 1 Price 259.400 Value per block 129,700,000 (Allocated from: ID 1147 Quantity 2)

CALCULATION: (1*129625000) - 5,185 - 0 -(1*129700000) - 5,188 - 0  = -85,373 

********************************************************************************************************************************************

3: SELL 1 014U Futures on 11/09/2014 at KRW 129,900,000 each gives PROFIT of KRW 189,616 equals GBP 108.819
 Commission KRW 5,196 and taxes KRW 0 on SELL
Trade details:ID 1151 Code 014U Date 2014-09-11 00:00:00 Quantity -1 Price 259.800 Value per block 129,900,000
Total allowable cost KRW 5,188   Total disposal proceeds KRW 194,804

Matches with:
PRO-RATA SECTION 104: Quantity 1.000000 014U allocated from total holding of 2, made up of 1 trades between 2014-06-15 and 2014-06-15
 At average value of KRW 129,700,000 Commissions KRW 5,188 Taxes KRW 0  

Trades:
ID 1147b Code 014U Date 2014-06-15 20:02:57 Quantity 1 Price 259.400 Value per block 129,700,000 (Allocated from: ID 1147 Quantity 2)

CALCULATION: (1*129900000) - 5,196 - 0 -(1*129700000) - 5,188 - 0  = 189,616 

********************************************************************************************************************************************

1: SELL 1 014Z Futures on 05/10/2014 at KRW 126,025,000 each gives PROFIT of KRW 2,014,999 equals GBP 1,154.79
 Commission KRW 5,041 and taxes KRW 0 on SELL
Trade details:ID 1156 Code 014Z Date 2014-10-05 20:00:59 Quantity -1 Price 252.050 Value per block 126,025,000
Total allowable cost KRW 4,960   Total disposal proceeds KRW 2,019,959

Matches with:
SUBSEQUENT 1 TRADE(S) Within 30 days between 2014-11-06 and 2014-11-06: Matches with BUY of 1 014Z at of KRW 124,000,000 each 
 Commissions KRW 4,960 Taxes KRW 0  

Trades:
ID 1154 Code 014Z Date 2014-11-06 20:27:13 Quantity 1 Price 248 Value per block 124,000,000

CALCULATION: (1*126025000) - 5,041 - 0 -(1*124000000) - 4,960 - 0  = 2,014,999 

********************************************************************************************************************************************

2: SELL 1 014Z Futures on 01/12/2014 at KRW 125,100,000 each gives LOSS of KRW -4,685,195 equals GBP -2,685.09
 Commission KRW 5,004 and taxes KRW 0 on SELL
Trade details:ID 1157 Code 014Z Date 2014-12-01 20:37:05 Quantity -1 Price 250.200 Value per block 125,100,000
Total allowable cost KRW 5,191   Total disposal proceeds KRW -4,680,004

Matches with:
PRO-RATA SECTION 104: Quantity 1.000000 014Z allocated from total holding of 3, made up of 3 trades between 2014-09-14 and 2014-11-11
 At average value of KRW 129,775,000 Commissions KRW 5,191 Taxes KRW 0  

Trades:
ID 1152a Code 014Z Date 2014-09-14 20:01:21 Quantity 0.333333 Price 261.700 Value per block 130,850,000 (Allocated from: ID 1152 Quantity 1)
ID 1153a Code 014Z Date 2014-09-16 20:29:24 Quantity 0.333333 Price 264.750 Value per block 132,375,000 (Allocated from: ID 1153 Quantity 1)
ID 1155a Code 014Z Date 2014-11-11 22:28:28 Quantity 0.333333 Price 252.200 Value per block 126,100,000 (Allocated from: ID 1155 Quantity 1)

CALCULATION: (1*125100000) - 5,004 - 0 -(1*129775000) - 5,191 - 0  = -4,685,195 

********************************************************************************************************************************************

3: SELL 2 014Z Futures on 11/12/2014 at KRW 122,770,000 each gives LOSS of KRW -14,030,204 equals GBP -8,035.27
 Commission KRW 9,821.60 and taxes KRW 0 on SELL
Trade details:ID 1158 Code 014Z Date 2014-12-11 00:00:00 Quantity -2 Price 245.540 Value per block 122,770,000
Total allowable cost KRW 10,382   Total disposal proceeds KRW -14,019,822

Matches with:
PRO-RATA SECTION 104: Quantity 2.000000 014Z allocated from total holding of 3, made up of 3 trades between 2014-09-14 and 2014-11-11
 At average value of KRW 129,775,000 Commissions KRW 10,382 Taxes KRW 0  

Trades:
ID 1152b Code 014Z Date 2014-09-14 20:01:21 Quantity 0.666667 Price 261.700 Value per block 130,850,000 (Allocated from: ID 1152 Quantity 1)
ID 1153b Code 014Z Date 2014-09-16 20:29:24 Quantity 0.666667 Price 264.750 Value per block 132,375,000 (Allocated from: ID 1153 Quantity 1)
ID 1155b Code 014Z Date 2014-11-11 22:28:28 Quantity 0.666667 Price 252.200 Value per block 126,100,000 (Allocated from: ID 1155 Quantity 1)

CALCULATION: (2*122770000) - 9,821.60 - 0 -(2*129775000) - 10,382 - 0  = -14,030,204 

********************************************************************************************************************************************

1: SELL 1 015H Futures on 13/01/2015 at KRW 123,750,000 each gives PROFIT of KRW 2,015,181 equals GBP 1,149.87
 Commission KRW 4,950 and taxes KRW 0 on SELL
Trade details:ID 1160 Code 015H Date 2015-01-13 20:00:53 Quantity -1 Price 247.500 Value per block 123,750,000
Total allowable cost KRW 4,869   Total disposal proceeds KRW 2,020,050

Matches with:
PRO-RATA SECTION 104: Quantity 1.000000 015H allocated from total holding of 1, made up of 1 trades between 2014-12-14 and 2014-12-14
 At average value of KRW 121,725,000 Commissions KRW 4,869 Taxes KRW 0  

Trades:
ID 1159 Code 015H Date 2014-12-14 20:05:54 Quantity 1 Price 243.450 Value per block 121,725,000

CALCULATION: (1*123750000) - 4,950 - 0 -(1*121725000) - 4,869 - 0  = 2,015,181 

********************************************************************************************************************************************

1: SELL 1 1654M Futures on 17/04/2014 at KRW 105,730,000 each gives LOSS of KRW -128,463 equals GBP -73.6131
 Commission KRW 4,229.20 and taxes KRW 0 on SELL
Trade details:ID 1173 Code 1654M Date 2014-04-17 21:06:20 Quantity -1 Price 105.730 Value per block 105,730,000
Total allowable cost KRW 4,234   Total disposal proceeds KRW -124,229

Matches with:
SUBSEQUENT 1 TRADE(S) Within 30 days between 2014-05-06 and 2014-05-06: Matches with BUY of 1 1654M at of KRW 105,850,000 each 
 Commissions KRW 4,234 Taxes KRW 0  

Trades:
ID 1165a Code 1654M Date 2014-05-06 20:13:45 Quantity 1 Price 105.850 Value per block 105,850,000 (Allocated from: ID 1165 Quantity 2)

CALCULATION: (1*105730000) - 4,229.20 - 0 -(1*105850000) - 4,234 - 0  = -128,463 

********************************************************************************************************************************************

2: SELL 1 1654M Futures on 20/04/2014 at KRW 105,700,000 each gives LOSS of KRW -158,462 equals GBP -90.8032
 Commission KRW 4,228 and taxes KRW 0 on SELL
Trade details:ID 1174 Code 1654M Date 2014-04-20 21:58:51 Quantity -1 Price 105.700 Value per block 105,700,000
Total allowable cost KRW 4,234   Total disposal proceeds KRW -154,228

Matches with:
SUBSEQUENT 1 TRADE(S) Within 30 days between 2014-05-06 and 2014-05-06: Matches with BUY of 1 1654M at of KRW 105,850,000 each 
 Commissions KRW 4,234 Taxes KRW 0  

Trades:
ID 1165 Code 1654M Date 2014-05-06 20:13:45 Quantity 1 Price 105.850 Value per block 105,850,000

CALCULATION: (1*105700000) - 4,228 - 0 -(1*105850000) - 4,234 - 0  = -158,462 

********************************************************************************************************************************************

3: SELL 1 1654M Futures on 21/04/2014 at KRW 105,700,000 each gives LOSS of KRW -188,463 equals GBP -107.991
 Commission KRW 4,228 and taxes KRW 0 on SELL
Trade details:ID 1175 Code 1654M Date 2014-04-21 20:10:17 Quantity -1 Price 105.700 Value per block 105,700,000
Total allowable cost KRW 4,235.20   Total disposal proceeds KRW -184,228

Matches with:
SUBSEQUENT 1 TRADE(S) Within 30 days between 2014-05-06 and 2014-05-06: Matches with BUY of 1 1654M at of KRW 105,880,000 each 
 Commissions KRW 4,235.20 Taxes KRW 0  

Trades:
ID 1166a Code 1654M Date 2014-05-06 21:13:31 Quantity 1 Price 105.880 Value per block 105,880,000 (Allocated from: ID 1166 Quantity 2)

CALCULATION: (1*105700000) - 4,228 - 0 -(1*105880000) - 4,235.20 - 0  = -188,463 

********************************************************************************************************************************************

4: SELL 1 1654M Futures on 11/06/2014 at KRW 106,200,000 each gives PROFIT of KRW 338,018 equals GBP 192.381
 Commission KRW 4,248 and taxes KRW 0 on SELL
Trade details:ID 1176 Code 1654M Date 2014-06-11 23:35:10 Quantity -1 Price 106.200 Value per block 106,200,000
Total allowable cost KRW 4,234.14   Total disposal proceeds KRW 342,252

Matches with:
PRO-RATA SECTION 104: Quantity 1.000000 1654M allocated from total holding of 21, made up of 11 trades between 2014-04-10 and 2014-05-28
 At average value of KRW 105,853,500 Commissions KRW 4,234.14 Taxes KRW 0  

Trades:
ID 1161a Code 1654M Date 2014-04-10 20:12:02 Quantity 0.250000 Price 105.810 Value per block 105,810,000 (Allocated from: ID 1161 Quantity 5)
ID 1162a Code 1654M Date 2014-04-13 20:17:48 Quantity 0.250000 Price 105.770 Value per block 105,770,000 (Allocated from: ID 1162 Quantity 5)
ID 1163a Code 1654M Date 2014-04-14 20:03:54 Quantity 0.100000 Price 105.710 Value per block 105,710,000 (Allocated from: ID 1163 Quantity 2)
ID 1164a Code 1654M Date 2014-04-15 20:32:29 Quantity 0.0500000 Price 105.740 Value per block 105,740,000 (Allocated from: ID 1164 Quantity 1)
ID 1166b Code 1654M Date 2014-05-06 21:13:31 Quantity 0.0500000 Price 105.880 Value per block 105,880,000 (Allocated from: ID 1166 Quantity 2)
ID 1167a Code 1654M Date 2014-05-07 21:29:11 Quantity 0.0500000 Price 105.960 Value per block 105,960,000 (Allocated from: ID 1167 Quantity 1)
ID 1168a Code 1654M Date 2014-05-08 21:36:38 Quantity 0.0500000 Price 105.960 Value per block 105,960,000 (Allocated from: ID 1168 Quantity 1)
ID 1169a Code 1654M Date 2014-05-14 21:15:15 Quantity 0.0500000 Price 106.020 Value per block 106,020,000 (Allocated from: ID 1169 Quantity 1)
ID 1170a Code 1654M Date 2014-05-19 20:34:11 Quantity 0.0500000 Price 105.990 Value per block 105,990,000 (Allocated from: ID 1170 Quantity 1)
ID 1171a Code 1654M Date 2014-05-26 22:42:12 Quantity 0.0500000 Price 106.070 Value per block 106,070,000 (Allocated from: ID 1171 Quantity 1)
ID 1172a Code 1654M Date 2014-05-28 20:50:21 Quantity 0.0500000 Price 106.130 Value per block 106,130,000 (Allocated from: ID 1172 Quantity 1)

CALCULATION: (1*106200000) - 4,248 - 0 -(1*105853500) - 4,234.14 - 0  = 338,018 

********************************************************************************************************************************************

5: SELL 19 1654M Futures on 15/06/2014 at KRW 106,340,000 each gives PROFIT of KRW 9,082,233 equals GBP 5,169.14
 Commission KRW 80,818.40 and taxes KRW 0 on SELL
Trade details:ID 1177 Code 1654M Date 2014-06-15 20:04:21 Quantity -19 Price 106.340 Value per block 106,340,000
Total allowable cost KRW 80,448.66   Total disposal proceeds KRW 9,162,682

Matches with:
PRO-RATA SECTION 104: Quantity 19.000000 1654M allocated from total holding of 21, made up of 11 trades between 2014-04-10 and 2014-05-28
 At average value of KRW 105,853,500 Commissions KRW 80,448.66 Taxes KRW 0  

Trades:
ID 1161b Code 1654M Date 2014-04-10 20:12:02 Quantity 4.75000 Price 105.810 Value per block 105,810,000 (Allocated from: ID 1161 Quantity 5)
ID 1162b Code 1654M Date 2014-04-13 20:17:48 Quantity 4.75000 Price 105.770 Value per block 105,770,000 (Allocated from: ID 1162 Quantity 5)
ID 1163b Code 1654M Date 2014-04-14 20:03:54 Quantity 1.90000 Price 105.710 Value per block 105,710,000 (Allocated from: ID 1163 Quantity 2)
ID 1164b Code 1654M Date 2014-04-15 20:32:29 Quantity 0.950000 Price 105.740 Value per block 105,740,000 (Allocated from: ID 1164 Quantity 1)
ID 1166c Code 1654M Date 2014-05-06 21:13:31 Quantity 0.950000 Price 105.880 Value per block 105,880,000 (Allocated from: ID 1166 Quantity 2)
ID 1167b Code 1654M Date 2014-05-07 21:29:11 Quantity 0.950000 Price 105.960 Value per block 105,960,000 (Allocated from: ID 1167 Quantity 1)
ID 1168b Code 1654M Date 2014-05-08 21:36:38 Quantity 0.950000 Price 105.960 Value per block 105,960,000 (Allocated from: ID 1168 Quantity 1)
ID 1169b Code 1654M Date 2014-05-14 21:15:15 Quantity 0.950000 Price 106.020 Value per block 106,020,000 (Allocated from: ID 1169 Quantity 1)
ID 1170b Code 1654M Date 2014-05-19 20:34:11 Quantity 0.950000 Price 105.990 Value per block 105,990,000 (Allocated from: ID 1170 Quantity 1)
ID 1171b Code 1654M Date 2014-05-26 22:42:12 Quantity 0.950000 Price 106.070 Value per block 106,070,000 (Allocated from: ID 1171 Quantity 1)
ID 1172b Code 1654M Date 2014-05-28 20:50:21 Quantity 0.950000 Price 106.130 Value per block 106,130,000 (Allocated from: ID 1172 Quantity 1)

CALCULATION: (19*106340000) - 80,818.40 - 0 -(19*105853500) - 80,448.66 - 0  = 9,082,233 

********************************************************************************************************************************************

1: SELL 1 1654U Futures on 23/06/2014 at KRW 106,340,000 each gives LOSS of KRW -368,522 equals GBP -207.145
 Commission KRW 4,253.60 and taxes KRW 0 on SELL
Trade details:ID 1195 Code 1654U Date 2014-06-23 20:43:00 Quantity -1 Price 106.340 Value per block 106,340,000
Total allowable cost KRW 4,268   Total disposal proceeds KRW -364,254

Matches with:
SUBSEQUENT 1 TRADE(S) Within 30 days between 2014-07-07 and 2014-07-07: Matches with BUY of 1 1654U at of KRW 106,700,000 each 
 Commissions KRW 4,268 Taxes KRW 0  

Trades:
ID 1183 Code 1654U Date 2014-07-07 20:06:27 Quantity 1 Price 106.700 Value per block 106,700,000

CALCULATION: (1*106340000) - 4,253.60 - 0 -(1*106700000) - 4,268 - 0  = -368,522 

********************************************************************************************************************************************

2: SELL 4 1654U Futures on 03/07/2014 at KRW 106,680,000 each gives LOSS of KRW -544,158 equals GBP -306.621
 Commission KRW 17,068.80 and taxes KRW 0 on SELL
Trade details:ID 1196 Code 1654U Date 2014-07-03 00:12:53 Quantity -4 Price 106.680 Value per block 106,680,000
Total allowable cost KRW 17,089.20   Total disposal proceeds KRW -527,069

Matches with:
SUBSEQUENT 3 TRADE(S) Within 30 days between 2014-07-09 and 2014-07-16: Matches with BUY of 4 1654U at of KRW 106,807,500 each 
 Commissions KRW 17,089.20 Taxes KRW 0  

Trades:
ID 1184 Code 1654U Date 2014-07-09 22:17:18 Quantity 1 Price 106.730 Value per block 106,730,000
ID 1185 Code 1654U Date 2014-07-14 21:21:31 Quantity 1 Price 106.800 Value per block 106,800,000
ID 1186 Code 1654U Date 2014-07-16 21:19:49 Quantity 2 Price 106.850 Value per block 106,850,000

CALCULATION: (4*106680000) - 17,068.80 - 0 -(4*106807500) - 17,089.20 - 0  = -544,158 

********************************************************************************************************************************************

3: SELL 1 1654U Futures on 07/07/2014 at KRW 106,560,000 each gives LOSS of KRW -518,545 equals GBP -292.392
 Commission KRW 4,262.40 and taxes KRW 0 on SELL
Trade details:ID 1197 Code 1654U Date 2014-07-07 23:20:23 Quantity -1 Price 106.560 Value per block 106,560,000
Total allowable cost KRW 4,282.80   Total disposal proceeds KRW -514,262

Matches with:
SUBSEQUENT 1 TRADE(S) Within 30 days between 2014-07-22 and 2014-07-22: Matches with BUY of 1 1654U at of KRW 107,070,000 each 
 Commissions KRW 4,282.80 Taxes KRW 0  

Trades:
ID 1187 Code 1654U Date 2014-07-22 21:21:46 Quantity 1 Price 107.070 Value per block 107,070,000

CALCULATION: (1*106560000) - 4,262.40 - 0 -(1*107070000) - 4,282.80 - 0  = -518,545 

********************************************************************************************************************************************

4: SELL 1 1654U Futures on 16/07/2014 at KRW 107,000,000 each gives LOSS of KRW -28,561 equals GBP -16.1056
 Commission KRW 4,280 and taxes KRW 0 on SELL
Trade details:ID 1198 Code 1654U Date 2014-07-16 22:21:06 Quantity -1 Price 107 Value per block 107,000,000
Total allowable cost KRW 4,280.80   Total disposal proceeds KRW -24,280

Matches with:
SUBSEQUENT 1 TRADE(S) Within 30 days between 2014-07-27 and 2014-07-27: Matches with BUY of 1 1654U at of KRW 107,020,000 each 
 Commissions KRW 4,280.80 Taxes KRW 0  

Trades:
ID 1188 Code 1654U Date 2014-07-27 21:32:52 Quantity 1 Price 107.020 Value per block 107,020,000

CALCULATION: (1*107000000) - 4,280 - 0 -(1*107020000) - 4,280.80 - 0  = -28,561 

********************************************************************************************************************************************

5: SELL 1 1654U Futures on 23/07/2014 at KRW 107,030,000 each gives PROFIT of KRW 81,441 equals GBP 46.0551
 Commission KRW 4,281.20 and taxes KRW 0 on SELL
Trade details:ID 1199 Code 1654U Date 2014-07-23 22:24:02 Quantity -1 Price 107.030 Value per block 107,030,000
Total allowable cost KRW 4,277.60   Total disposal proceeds KRW 85,718.80

Matches with:
SUBSEQUENT 1 TRADE(S) Within 30 days between 2014-08-17 and 2014-08-17: Matches with BUY of 1 1654U at of KRW 106,940,000 each 
 Commissions KRW 4,277.60 Taxes KRW 0  

Trades:
ID 1189 Code 1654U Date 2014-08-17 20:03:08 Quantity 1 Price 106.940 Value per block 106,940,000

CALCULATION: (1*107030000) - 4,281.20 - 0 -(1*106940000) - 4,277.60 - 0  = 81,441 

********************************************************************************************************************************************

6: SELL 1 1654U Futures on 24/07/2014 at KRW 106,980,000 each gives PROFIT of KRW 121,447 equals GBP 68.9176
 Commission KRW 4,279.20 and taxes KRW 0 on SELL
Trade details:ID 1200 Code 1654U Date 2014-07-24 21:24:46 Quantity -1 Price 106.980 Value per block 106,980,000
Total allowable cost KRW 4,274   Total disposal proceeds KRW 125,721

Matches with:
SUBSEQUENT 1 TRADE(S) Within 30 days between 2014-08-17 and 2014-08-17: Matches with BUY of 1 1654U at of KRW 106,850,000 each 
 Commissions KRW 4,274 Taxes KRW 0  

Trades:
ID 1190 Code 1654U Date 2014-08-17 23:01:28 Quantity 1 Price 106.850 Value per block 106,850,000

CALCULATION: (1*106980000) - 4,279.20 - 0 -(1*106850000) - 4,274 - 0  = 121,447 

********************************************************************************************************************************************

7: SELL 1 1654U Futures on 30/07/2014 at KRW 106,940,000 each gives LOSS of KRW -78,558 equals GBP -44.8177
 Commission KRW 4,277.60 and taxes KRW 0 on SELL
Trade details:ID 1201 Code 1654U Date 2014-07-30 22:29:30 Quantity -1 Price 106.940 Value per block 106,940,000
Total allowable cost KRW 4,280.40   Total disposal proceeds KRW -74,277.60

Matches with:
SUBSEQUENT 1 TRADE(S) Within 30 days between 2014-08-27 and 2014-08-27: Matches with BUY of 1 1654U at of KRW 107,010,000 each 
 Commissions KRW 4,280.40 Taxes KRW 0  

Trades:
ID 1191a Code 1654U Date 2014-08-27 20:06:57 Quantity 1 Price 107.010 Value per block 107,010,000 (Allocated from: ID 1191 Quantity 3)

CALCULATION: (1*106940000) - 4,277.60 - 0 -(1*107010000) - 4,280.40 - 0  = -78,558 

********************************************************************************************************************************************

8: SELL 1 1654U Futures on 07/08/2014 at KRW 107,020,000 each gives PROFIT of KRW 1,439 equals GBP 0.859038
 Commission KRW 4,280.80 and taxes KRW 0 on SELL
Trade details:ID 1202 Code 1654U Date 2014-08-07 20:08:27 Quantity -1 Price 107.020 Value per block 107,020,000
Total allowable cost KRW 4,280.40   Total disposal proceeds KRW 5,719.20

Matches with:
SUBSEQUENT 1 TRADE(S) Within 30 days between 2014-08-27 and 2014-08-27: Matches with BUY of 1 1654U at of KRW 107,010,000 each 
 Commissions KRW 4,280.40 Taxes KRW 0  

Trades:
ID 1191b Code 1654U Date 2014-08-27 20:06:57 Quantity 1 Price 107.010 Value per block 107,010,000 (Allocated from: ID 1191 Quantity 3)

CALCULATION: (1*107020000) - 4,280.80 - 0 -(1*107010000) - 4,280.40 - 0  = 1,439 

********************************************************************************************************************************************

9: SELL 3 1654U Futures on 10/09/2014 at KRW 107,050,000 each gives PROFIT of KRW 1,260,359 equals GBP 726.119
 Commission KRW 12,846 and taxes KRW 0 on SELL
Trade details:ID 1203 Code 1654U Date 2014-09-10 21:31:19 Quantity -3 Price 107.050 Value per block 107,050,000
Total allowable cost KRW 12,794.56   Total disposal proceeds KRW 1,273,154

Matches with:
SUBSEQUENT 1 TRADE(S) Within 30 days between 2014-09-11 and 2014-09-11: Matches with BUY of 1 1654U at of KRW 107,130,000 each 
 Commissions KRW 4,285.20 Taxes KRW 0  

Trades:
ID 1194 Code 1654U Date 2014-09-11 21:21:12 Quantity 1 Price 107.130 Value per block 107,130,000
PRO-RATA SECTION 104: Quantity 2.000000 1654U allocated from total holding of 22, made up of 8 trades between 2014-06-16 and 2014-08-28
 At average value of KRW 106,367,000 Commissions KRW 8,509.36 Taxes KRW 0  

Trades:
ID 1178a Code 1654U Date 2014-06-16 20:03:39 Quantity 0.500000 Price 106.270 Value per block 106,270,000 (Allocated from: ID 1178 Quantity 5)
ID 1179a Code 1654U Date 2014-06-17 20:04:19 Quantity 0.500000 Price 106.190 Value per block 106,190,000 (Allocated from: ID 1179 Quantity 5)
ID 1180a Code 1654U Date 2014-06-18 20:06:14 Quantity 0.500000 Price 106.270 Value per block 106,270,000 (Allocated from: ID 1180 Quantity 5)
ID 1181a Code 1654U Date 2014-06-19 20:09:02 Quantity 0.100000 Price 106.320 Value per block 106,320,000 (Allocated from: ID 1181 Quantity 1)
ID 1182a Code 1654U Date 2014-06-19 20:36:11 Quantity 0.100000 Price 106.320 Value per block 106,320,000 (Allocated from: ID 1182 Quantity 1)
ID 1191c Code 1654U Date 2014-08-27 20:06:57 Quantity 0.100000 Price 107.010 Value per block 107,010,000 (Allocated from: ID 1191 Quantity 3)
ID 1192a Code 1654U Date 2014-08-27 21:11:42 Quantity 0.100000 Price 107 Value per block 107,000,000 (Allocated from: ID 1192 Quantity 1)
ID 1193a Code 1654U Date 2014-08-28 21:22:36 Quantity 0.100000 Price 107.040 Value per block 107,040,000 (Allocated from: ID 1193 Quantity 1)

CALCULATION: (3*107050000) - 12,846 - 0 -(1*107130000) - 4,285.20 - 0 -(2*106367000) - 8,509.36 - 0  = 1,260,359 

********************************************************************************************************************************************

10: SELL 1 1654U Futures on 11/09/2014 at KRW 107,240,000 each gives PROFIT of KRW 864,456 equals GBP 497.976
 Commission KRW 4,289.60 and taxes KRW 0 on SELL
Trade details:ID 1204 Code 1654U Date 2014-09-11 23:26:33 Quantity -1 Price 107.240 Value per block 107,240,000
Total allowable cost KRW 4,254.68   Total disposal proceeds KRW 868,710

Matches with:
PRO-RATA SECTION 104: Quantity 1.000000 1654U allocated from total holding of 22, made up of 8 trades between 2014-06-16 and 2014-08-28
 At average value of KRW 106,367,000 Commissions KRW 4,254.68 Taxes KRW 0  

Trades:
ID 1178b Code 1654U Date 2014-06-16 20:03:39 Quantity 0.250000 Price 106.270 Value per block 106,270,000 (Allocated from: ID 1178 Quantity 5)
ID 1179b Code 1654U Date 2014-06-17 20:04:19 Quantity 0.250000 Price 106.190 Value per block 106,190,000 (Allocated from: ID 1179 Quantity 5)
ID 1180b Code 1654U Date 2014-06-18 20:06:14 Quantity 0.250000 Price 106.270 Value per block 106,270,000 (Allocated from: ID 1180 Quantity 5)
ID 1181b Code 1654U Date 2014-06-19 20:09:02 Quantity 0.0500000 Price 106.320 Value per block 106,320,000 (Allocated from: ID 1181 Quantity 1)
ID 1182b Code 1654U Date 2014-06-19 20:36:11 Quantity 0.0500000 Price 106.320 Value per block 106,320,000 (Allocated from: ID 1182 Quantity 1)
ID 1191d Code 1654U Date 2014-08-27 20:06:57 Quantity 0.0500000 Price 107.010 Value per block 107,010,000 (Allocated from: ID 1191 Quantity 3)
ID 1192b Code 1654U Date 2014-08-27 21:11:42 Quantity 0.0500000 Price 107 Value per block 107,000,000 (Allocated from: ID 1192 Quantity 1)
ID 1193b Code 1654U Date 2014-08-28 21:22:36 Quantity 0.0500000 Price 107.040 Value per block 107,040,000 (Allocated from: ID 1193 Quantity 1)

CALCULATION: (1*107240000) - 4,289.60 - 0 -(1*106367000) - 4,254.68 - 0  = 864,456 

********************************************************************************************************************************************

11: SELL 17 1654U Futures on 17/09/2014 at KRW 107,370,000 each gives PROFIT of KRW 16,905,659 equals GBP 9,738.53
 Commission KRW 73,011.60 and taxes KRW 0 on SELL
Trade details:ID 1205 Code 1654U Date 2014-09-17 00:00:00 Quantity -17 Price 107.370 Value per block 107,370,000
Total allowable cost KRW 72,329.56   Total disposal proceeds KRW 16,977,988

Matches with:
PRO-RATA SECTION 104: Quantity 17.000000 1654U allocated from total holding of 22, made up of 8 trades between 2014-06-16 and 2014-08-28
 At average value of KRW 106,367,000 Commissions KRW 72,329.56 Taxes KRW 0  

Trades:
ID 1178c Code 1654U Date 2014-06-16 20:03:39 Quantity 4.25000 Price 106.270 Value per block 106,270,000 (Allocated from: ID 1178 Quantity 5)
ID 1179c Code 1654U Date 2014-06-17 20:04:19 Quantity 4.25000 Price 106.190 Value per block 106,190,000 (Allocated from: ID 1179 Quantity 5)
ID 1180c Code 1654U Date 2014-06-18 20:06:14 Quantity 4.25000 Price 106.270 Value per block 106,270,000 (Allocated from: ID 1180 Quantity 5)
ID 1181c Code 1654U Date 2014-06-19 20:09:02 Quantity 0.850000 Price 106.320 Value per block 106,320,000 (Allocated from: ID 1181 Quantity 1)
ID 1182c Code 1654U Date 2014-06-19 20:36:11 Quantity 0.850000 Price 106.320 Value per block 106,320,000 (Allocated from: ID 1182 Quantity 1)
ID 1191e Code 1654U Date 2014-08-27 20:06:57 Quantity 0.850000 Price 107.010 Value per block 107,010,000 (Allocated from: ID 1191 Quantity 3)
ID 1192c Code 1654U Date 2014-08-27 21:11:42 Quantity 0.850000 Price 107 Value per block 107,000,000 (Allocated from: ID 1192 Quantity 1)
ID 1193c Code 1654U Date 2014-08-28 21:22:36 Quantity 0.850000 Price 107.040 Value per block 107,040,000 (Allocated from: ID 1193 Quantity 1)

CALCULATION: (17*107370000) - 73,011.60 - 0 -(17*106367000) - 72,329.56 - 0  = 16,905,659 

********************************************************************************************************************************************

1: SELL 1 1654Z Futures on 30/09/2014 at KRW 107,800,000 each gives PROFIT of KRW 31,378 equals GBP 18.4238
 Commission KRW 4,312 and taxes KRW 0 on SELL
Trade details:ID 1225 Code 1654Z Date 2014-09-30 22:41:10 Quantity -1 Price 107.800 Value per block 107,800,000
Total allowable cost KRW 4,310.40   Total disposal proceeds KRW 35,688

Matches with:
SUBSEQUENT 1 TRADE(S) Within 30 days between 2014-10-05 and 2014-10-05: Matches with BUY of 1 1654Z at of KRW 107,760,000 each 
 Commissions KRW 4,310.40 Taxes KRW 0  

Trades:
ID 1213 Code 1654Z Date 2014-10-05 21:29:51 Quantity 1 Price 107.760 Value per block 107,760,000

CALCULATION: (1*107800000) - 4,312 - 0 -(1*107760000) - 4,310.40 - 0  = 31,378 

********************************************************************************************************************************************

2: SELL 2 1654Z Futures on 01/10/2014 at KRW 107,950,000 each gives PROFIT of KRW 382,744 equals GBP 225.131
 Commission KRW 8,636 and taxes KRW 0 on SELL
Trade details:ID 1226 Code 1654Z Date 2014-10-01 21:30:27 Quantity -2 Price 107.950 Value per block 107,950,000
Total allowable cost KRW 8,620   Total disposal proceeds KRW 391,364

Matches with:
SUBSEQUENT 2 TRADE(S) Within 30 days between 2014-10-09 and 2014-10-14: Matches with BUY of 2 1654Z at of KRW 107,750,000 each 
 Commissions KRW 8,620 Taxes KRW 0  

Trades:
ID 1214 Code 1654Z Date 2014-10-09 20:08:01 Quantity 1 Price 107.700 Value per block 107,700,000
ID 1215a Code 1654Z Date 2014-10-14 21:28:07 Quantity 1 Price 107.800 Value per block 107,800,000 (Allocated from: ID 1215 Quantity 2)

CALCULATION: (2*107950000) - 8,636 - 0 -(2*107750000) - 8,620 - 0  = 382,744 

********************************************************************************************************************************************

3: SELL 1 1654Z Futures on 01/10/2014 at KRW 107,830,000 each gives PROFIT of KRW 21,375 equals GBP 12.5710
 Commission KRW 4,313.20 and taxes KRW 0 on SELL
Trade details:ID 1227 Code 1654Z Date 2014-10-01 23:30:52 Quantity -1 Price 107.830 Value per block 107,830,000
Total allowable cost KRW 4,312   Total disposal proceeds KRW 25,686.80

Matches with:
SUBSEQUENT 1 TRADE(S) Within 30 days between 2014-10-14 and 2014-10-14: Matches with BUY of 1 1654Z at of KRW 107,800,000 each 
 Commissions KRW 4,312 Taxes KRW 0  

Trades:
ID 1215 Code 1654Z Date 2014-10-14 21:28:07 Quantity 1 Price 107.800 Value per block 107,800,000

CALCULATION: (1*107830000) - 4,313.20 - 0 -(1*107800000) - 4,312 - 0  = 21,375 

********************************************************************************************************************************************

4: SELL 1 1654Z Futures on 02/10/2014 at KRW 107,820,000 each gives PROFIT of KRW 51,377 equals GBP 30.4510
 Commission KRW 4,312.80 and taxes KRW 0 on SELL
Trade details:ID 1228 Code 1654Z Date 2014-10-02 00:36:10 Quantity -1 Price 107.820 Value per block 107,820,000
Total allowable cost KRW 4,310.40   Total disposal proceeds KRW 55,687.20

Matches with:
SUBSEQUENT 1 TRADE(S) Within 30 days between 2014-10-21 and 2014-10-21: Matches with BUY of 1 1654Z at of KRW 107,760,000 each 
 Commissions KRW 4,310.40 Taxes KRW 0  

Trades:
ID 1216 Code 1654Z Date 2014-10-21 00:29:13 Quantity 1 Price 107.760 Value per block 107,760,000

CALCULATION: (1*107820000) - 4,312.80 - 0 -(1*107760000) - 4,310.40 - 0  = 51,377 

********************************************************************************************************************************************

5: SELL 1 1654Z Futures on 06/10/2014 at KRW 107,660,000 each gives LOSS of KRW -188,620 equals GBP -109.118
 Commission KRW 4,306.40 and taxes KRW 0 on SELL
Trade details:ID 1229 Code 1654Z Date 2014-10-06 23:44:01 Quantity -1 Price 107.660 Value per block 107,660,000
Total allowable cost KRW 4,313.60   Total disposal proceeds KRW -184,306

Matches with:
SUBSEQUENT 1 TRADE(S) Within 30 days between 2014-10-22 and 2014-10-22: Matches with BUY of 1 1654Z at of KRW 107,840,000 each 
 Commissions KRW 4,313.60 Taxes KRW 0  

Trades:
ID 1217 Code 1654Z Date 2014-10-22 21:27:11 Quantity 1 Price 107.840 Value per block 107,840,000

CALCULATION: (1*107660000) - 4,306.40 - 0 -(1*107840000) - 4,313.60 - 0  = -188,620 

********************************************************************************************************************************************

6: SELL 1 1654Z Futures on 08/10/2014 at KRW 107,640,000 each gives LOSS of KRW -608,635 equals GBP -351.955
 Commission KRW 4,305.60 and taxes KRW 0 on SELL
Trade details:ID 1230 Code 1654Z Date 2014-10-08 00:31:29 Quantity -1 Price 107.640 Value per block 107,640,000
Total allowable cost KRW 4,329.60   Total disposal proceeds KRW -604,306

Matches with:
SUBSEQUENT 1 TRADE(S) Within 30 days between 2014-11-04 and 2014-11-04: Matches with BUY of 1 1654Z at of KRW 108,240,000 each 
 Commissions KRW 4,329.60 Taxes KRW 0  

Trades:
ID 1218 Code 1654Z Date 2014-11-04 23:29:28 Quantity 1 Price 108.240 Value per block 108,240,000

CALCULATION: (1*107640000) - 4,305.60 - 0 -(1*108240000) - 4,329.60 - 0  = -608,635 

********************************************************************************************************************************************

7: SELL 1 1654Z Futures on 19/10/2014 at KRW 107,720,000 each gives LOSS of KRW -618,642 equals GBP -357.735
 Commission KRW 4,308.80 and taxes KRW 0 on SELL
Trade details:ID 1231 Code 1654Z Date 2014-10-19 21:26:45 Quantity -1 Price 107.720 Value per block 107,720,000
Total allowable cost KRW 4,333.20   Total disposal proceeds KRW -614,309

Matches with:
SUBSEQUENT 1 TRADE(S) Within 30 days between 2014-11-05 and 2014-11-05: Matches with BUY of 1 1654Z at of KRW 108,330,000 each 
 Commissions KRW 4,333.20 Taxes KRW 0  

Trades:
ID 1219 Code 1654Z Date 2014-11-05 21:25:03 Quantity 1 Price 108.330 Value per block 108,330,000

CALCULATION: (1*107720000) - 4,308.80 - 0 -(1*108330000) - 4,333.20 - 0  = -618,642 

********************************************************************************************************************************************

8: SELL 1 1654Z Futures on 23/10/2014 at KRW 107,900,000 each gives LOSS of KRW -128,637 equals GBP -74.5334
 Commission KRW 4,316 and taxes KRW 0 on SELL
Trade details:ID 1232 Code 1654Z Date 2014-10-23 21:24:26 Quantity -1 Price 107.900 Value per block 107,900,000
Total allowable cost KRW 4,320.80   Total disposal proceeds KRW -124,316

Matches with:
SUBSEQUENT 1 TRADE(S) Within 30 days between 2014-11-19 and 2014-11-19: Matches with BUY of 1 1654Z at of KRW 108,020,000 each 
 Commissions KRW 4,320.80 Taxes KRW 0  

Trades:
ID 1220 Code 1654Z Date 2014-11-19 20:05:36 Quantity 1 Price 108.020 Value per block 108,020,000

CALCULATION: (1*107900000) - 4,316 - 0 -(1*108020000) - 4,320.80 - 0  = -128,637 

********************************************************************************************************************************************

9: SELL 4 1654Z Futures on 10/11/2014 at KRW 107,990,000 each gives LOSS of KRW -1,014,596 equals GBP -588.614
 Commission KRW 17,278.40 and taxes KRW 0 on SELL
Trade details:ID 1233 Code 1654Z Date 2014-11-10 20:05:42 Quantity -4 Price 107.990 Value per block 107,990,000
Total allowable cost KRW 17,317.60   Total disposal proceeds KRW -997,278

Matches with:
SUBSEQUENT 4 TRADE(S) Within 30 days between 2014-11-23 and 2014-12-01: Matches with BUY of 4 1654Z at of KRW 108,235,000 each 
 Commissions KRW 17,317.60 Taxes KRW 0  

Trades:
ID 1221 Code 1654Z Date 2014-11-23 21:26:50 Quantity 1 Price 108.160 Value per block 108,160,000
ID 1222 Code 1654Z Date 2014-11-24 21:38:52 Quantity 1 Price 108.220 Value per block 108,220,000
ID 1223 Code 1654Z Date 2014-11-26 23:51:29 Quantity 1 Price 108.250 Value per block 108,250,000
ID 1224 Code 1654Z Date 2014-12-01 20:09:05 Quantity 1 Price 108.310 Value per block 108,310,000

CALCULATION: (4*107990000) - 17,278.40 - 0 -(4*108235000) - 17,317.60 - 0  = -1,014,596 

********************************************************************************************************************************************

10: SELL 1 1654Z Futures on 10/11/2014 at KRW 108,010,000 each gives PROFIT of KRW 636,385 equals GBP 369.067
 Commission KRW 4,320.40 and taxes KRW 0 on SELL
Trade details:ID 1234 Code 1654Z Date 2014-11-10 21:15:26 Quantity -1 Price 108.010 Value per block 108,010,000
Total allowable cost KRW 4,294.60   Total disposal proceeds KRW 640,680

Matches with:
PRO-RATA SECTION 104: Quantity 1.000000 1654Z allocated from total holding of 18, made up of 7 trades between 2014-09-18 and 2014-09-28
 At average value of KRW 107,365,000 Commissions KRW 4,294.60 Taxes KRW 0  

Trades:
ID 1206a Code 1654Z Date 2014-09-18 20:08:17 Quantity 0.277778 Price 107.310 Value per block 107,310,000 (Allocated from: ID 1206 Quantity 5)
ID 1207a Code 1654Z Date 2014-09-21 20:03:59 Quantity 0.277778 Price 107.350 Value per block 107,350,000 (Allocated from: ID 1207 Quantity 5)
ID 1208a Code 1654Z Date 2014-09-22 20:09:56 Quantity 0.222222 Price 107.370 Value per block 107,370,000 (Allocated from: ID 1208 Quantity 4)
ID 1209a Code 1654Z Date 2014-09-22 21:45:08 Quantity 0.0555556 Price 107.390 Value per block 107,390,000 (Allocated from: ID 1209 Quantity 1)
ID 1210a Code 1654Z Date 2014-09-23 21:16:39 Quantity 0.0555556 Price 107.410 Value per block 107,410,000 (Allocated from: ID 1210 Quantity 1)
ID 1211a Code 1654Z Date 2014-09-24 21:30:23 Quantity 0.0555556 Price 107.460 Value per block 107,460,000 (Allocated from: ID 1211 Quantity 1)
ID 1212a Code 1654Z Date 2014-09-28 21:27:15 Quantity 0.0555556 Price 107.530 Value per block 107,530,000 (Allocated from: ID 1212 Quantity 1)

CALCULATION: (1*108010000) - 4,320.40 - 0 -(1*107365000) - 4,294.60 - 0  = 636,385 

********************************************************************************************************************************************

11: SELL 2 1654Z Futures on 11/11/2014 at KRW 107,960,000 each gives PROFIT of KRW 1,172,774 equals GBP 680.140
 Commission KRW 8,636.80 and taxes KRW 0 on SELL
Trade details:ID 1235 Code 1654Z Date 2014-11-11 20:01:08 Quantity -2 Price 107.960 Value per block 107,960,000
Total allowable cost KRW 8,589.20   Total disposal proceeds KRW 1,181,363

Matches with:
PRO-RATA SECTION 104: Quantity 2.000000 1654Z allocated from total holding of 18, made up of 7 trades between 2014-09-18 and 2014-09-28
 At average value of KRW 107,365,000 Commissions KRW 8,589.20 Taxes KRW 0  

Trades:
ID 1206b Code 1654Z Date 2014-09-18 20:08:17 Quantity 0.555556 Price 107.310 Value per block 107,310,000 (Allocated from: ID 1206 Quantity 5)
ID 1207b Code 1654Z Date 2014-09-21 20:03:59 Quantity 0.555556 Price 107.350 Value per block 107,350,000 (Allocated from: ID 1207 Quantity 5)
ID 1208b Code 1654Z Date 2014-09-22 20:09:56 Quantity 0.444444 Price 107.370 Value per block 107,370,000 (Allocated from: ID 1208 Quantity 4)
ID 1209b Code 1654Z Date 2014-09-22 21:45:08 Quantity 0.111111 Price 107.390 Value per block 107,390,000 (Allocated from: ID 1209 Quantity 1)
ID 1210b Code 1654Z Date 2014-09-23 21:16:39 Quantity 0.111111 Price 107.410 Value per block 107,410,000 (Allocated from: ID 1210 Quantity 1)
ID 1211b Code 1654Z Date 2014-09-24 21:30:23 Quantity 0.111111 Price 107.460 Value per block 107,460,000 (Allocated from: ID 1211 Quantity 1)
ID 1212b Code 1654Z Date 2014-09-28 21:27:15 Quantity 0.111111 Price 107.530 Value per block 107,530,000 (Allocated from: ID 1212 Quantity 1)

CALCULATION: (2*107960000) - 8,636.80 - 0 -(2*107365000) - 8,589.20 - 0  = 1,172,774 

********************************************************************************************************************************************

12: SELL 1 1654Z Futures on 11/11/2014 at KRW 107,920,000 each gives PROFIT of KRW 546,389 equals GBP 319.635
 Commission KRW 4,316.80 and taxes KRW 0 on SELL
Trade details:ID 1236 Code 1654Z Date 2014-11-11 21:36:41 Quantity -1 Price 107.920 Value per block 107,920,000
Total allowable cost KRW 4,294.60   Total disposal proceeds KRW 550,683

Matches with:
PRO-RATA SECTION 104: Quantity 1.000000 1654Z allocated from total holding of 18, made up of 7 trades between 2014-09-18 and 2014-09-28
 At average value of KRW 107,365,000 Commissions KRW 4,294.60 Taxes KRW 0  

Trades:
ID 1206c Code 1654Z Date 2014-09-18 20:08:17 Quantity 0.277778 Price 107.310 Value per block 107,310,000 (Allocated from: ID 1206 Quantity 5)
ID 1207c Code 1654Z Date 2014-09-21 20:03:59 Quantity 0.277778 Price 107.350 Value per block 107,350,000 (Allocated from: ID 1207 Quantity 5)
ID 1208c Code 1654Z Date 2014-09-22 20:09:56 Quantity 0.222222 Price 107.370 Value per block 107,370,000 (Allocated from: ID 1208 Quantity 4)
ID 1209c Code 1654Z Date 2014-09-22 21:45:08 Quantity 0.0555556 Price 107.390 Value per block 107,390,000 (Allocated from: ID 1209 Quantity 1)
ID 1210c Code 1654Z Date 2014-09-23 21:16:39 Quantity 0.0555556 Price 107.410 Value per block 107,410,000 (Allocated from: ID 1210 Quantity 1)
ID 1211c Code 1654Z Date 2014-09-24 21:30:23 Quantity 0.0555556 Price 107.460 Value per block 107,460,000 (Allocated from: ID 1211 Quantity 1)
ID 1212c Code 1654Z Date 2014-09-28 21:27:15 Quantity 0.0555556 Price 107.530 Value per block 107,530,000 (Allocated from: ID 1212 Quantity 1)

CALCULATION: (1*107920000) - 4,316.80 - 0 -(1*107365000) - 4,294.60 - 0  = 546,389 

********************************************************************************************************************************************

13: SELL 1 1654Z Futures on 19/11/2014 at KRW 108,030,000 each gives PROFIT of KRW 656,384 equals GBP 383.984
 Commission KRW 4,321.20 and taxes KRW 0 on SELL
Trade details:ID 1237 Code 1654Z Date 2014-11-19 21:27:10 Quantity -1 Price 108.030 Value per block 108,030,000
Total allowable cost KRW 4,294.60   Total disposal proceeds KRW 660,679

Matches with:
PRO-RATA SECTION 104: Quantity 1.000000 1654Z allocated from total holding of 18, made up of 7 trades between 2014-09-18 and 2014-09-28
 At average value of KRW 107,365,000 Commissions KRW 4,294.60 Taxes KRW 0  

Trades:
ID 1206d Code 1654Z Date 2014-09-18 20:08:17 Quantity 0.277778 Price 107.310 Value per block 107,310,000 (Allocated from: ID 1206 Quantity 5)
ID 1207d Code 1654Z Date 2014-09-21 20:03:59 Quantity 0.277778 Price 107.350 Value per block 107,350,000 (Allocated from: ID 1207 Quantity 5)
ID 1208d Code 1654Z Date 2014-09-22 20:09:56 Quantity 0.222222 Price 107.370 Value per block 107,370,000 (Allocated from: ID 1208 Quantity 4)
ID 1209d Code 1654Z Date 2014-09-22 21:45:08 Quantity 0.0555556 Price 107.390 Value per block 107,390,000 (Allocated from: ID 1209 Quantity 1)
ID 1210d Code 1654Z Date 2014-09-23 21:16:39 Quantity 0.0555556 Price 107.410 Value per block 107,410,000 (Allocated from: ID 1210 Quantity 1)
ID 1211d Code 1654Z Date 2014-09-24 21:30:23 Quantity 0.0555556 Price 107.460 Value per block 107,460,000 (Allocated from: ID 1211 Quantity 1)
ID 1212d Code 1654Z Date 2014-09-28 21:27:15 Quantity 0.0555556 Price 107.530 Value per block 107,530,000 (Allocated from: ID 1212 Quantity 1)

CALCULATION: (1*108030000) - 4,321.20 - 0 -(1*107365000) - 4,294.60 - 0  = 656,384 

********************************************************************************************************************************************

14: SELL 1 1654Z Futures on 02/12/2014 at KRW 108,220,000 each gives PROFIT of KRW 846,377 equals GBP 493.991
 Commission KRW 4,328.80 and taxes KRW 0 on SELL
Trade details:ID 1238 Code 1654Z Date 2014-12-02 23:32:43 Quantity -1 Price 108.220 Value per block 108,220,000
Total allowable cost KRW 4,294.60   Total disposal proceeds KRW 850,671

Matches with:
PRO-RATA SECTION 104: Quantity 1.000000 1654Z allocated from total holding of 18, made up of 7 trades between 2014-09-18 and 2014-09-28
 At average value of KRW 107,365,000 Commissions KRW 4,294.60 Taxes KRW 0  

Trades:
ID 1206e Code 1654Z Date 2014-09-18 20:08:17 Quantity 0.277778 Price 107.310 Value per block 107,310,000 (Allocated from: ID 1206 Quantity 5)
ID 1207e Code 1654Z Date 2014-09-21 20:03:59 Quantity 0.277778 Price 107.350 Value per block 107,350,000 (Allocated from: ID 1207 Quantity 5)
ID 1208e Code 1654Z Date 2014-09-22 20:09:56 Quantity 0.222222 Price 107.370 Value per block 107,370,000 (Allocated from: ID 1208 Quantity 4)
ID 1209e Code 1654Z Date 2014-09-22 21:45:08 Quantity 0.0555556 Price 107.390 Value per block 107,390,000 (Allocated from: ID 1209 Quantity 1)
ID 1210e Code 1654Z Date 2014-09-23 21:16:39 Quantity 0.0555556 Price 107.410 Value per block 107,410,000 (Allocated from: ID 1210 Quantity 1)
ID 1211e Code 1654Z Date 2014-09-24 21:30:23 Quantity 0.0555556 Price 107.460 Value per block 107,460,000 (Allocated from: ID 1211 Quantity 1)
ID 1212e Code 1654Z Date 2014-09-28 21:27:15 Quantity 0.0555556 Price 107.530 Value per block 107,530,000 (Allocated from: ID 1212 Quantity 1)

CALCULATION: (1*108220000) - 4,328.80 - 0 -(1*107365000) - 4,294.60 - 0  = 846,377 

********************************************************************************************************************************************

15: SELL 2 1654Z Futures on 03/12/2014 at KRW 107,990,000 each gives PROFIT of KRW 1,232,772 equals GBP 719.512
 Commission KRW 8,639.20 and taxes KRW 0 on SELL
Trade details:ID 1239 Code 1654Z Date 2014-12-03 21:28:14 Quantity -2 Price 107.990 Value per block 107,990,000
Total allowable cost KRW 8,589.20   Total disposal proceeds KRW 1,241,361

Matches with:
PRO-RATA SECTION 104: Quantity 2.000000 1654Z allocated from total holding of 18, made up of 7 trades between 2014-09-18 and 2014-09-28
 At average value of KRW 107,365,000 Commissions KRW 8,589.20 Taxes KRW 0  

Trades:
ID 1206f Code 1654Z Date 2014-09-18 20:08:17 Quantity 0.555556 Price 107.310 Value per block 107,310,000 (Allocated from: ID 1206 Quantity 5)
ID 1207f Code 1654Z Date 2014-09-21 20:03:59 Quantity 0.555556 Price 107.350 Value per block 107,350,000 (Allocated from: ID 1207 Quantity 5)
ID 1208f Code 1654Z Date 2014-09-22 20:09:56 Quantity 0.444444 Price 107.370 Value per block 107,370,000 (Allocated from: ID 1208 Quantity 4)
ID 1209f Code 1654Z Date 2014-09-22 21:45:08 Quantity 0.111111 Price 107.390 Value per block 107,390,000 (Allocated from: ID 1209 Quantity 1)
ID 1210f Code 1654Z Date 2014-09-23 21:16:39 Quantity 0.111111 Price 107.410 Value per block 107,410,000 (Allocated from: ID 1210 Quantity 1)
ID 1211f Code 1654Z Date 2014-09-24 21:30:23 Quantity 0.111111 Price 107.460 Value per block 107,460,000 (Allocated from: ID 1211 Quantity 1)
ID 1212f Code 1654Z Date 2014-09-28 21:27:15 Quantity 0.111111 Price 107.530 Value per block 107,530,000 (Allocated from: ID 1212 Quantity 1)

CALCULATION: (2*107990000) - 8,639.20 - 0 -(2*107365000) - 8,589.20 - 0  = 1,232,772 

********************************************************************************************************************************************

16: SELL 1 1654Z Futures on 03/12/2014 at KRW 107,970,000 each gives PROFIT of KRW 596,387 equals GBP 348.003
 Commission KRW 4,318.80 and taxes KRW 0 on SELL
Trade details:ID 1240 Code 1654Z Date 2014-12-03 22:35:43 Quantity -1 Price 107.970 Value per block 107,970,000
Total allowable cost KRW 4,294.60   Total disposal proceeds KRW 600,681

Matches with:
PRO-RATA SECTION 104: Quantity 1.000000 1654Z allocated from total holding of 18, made up of 7 trades between 2014-09-18 and 2014-09-28
 At average value of KRW 107,365,000 Commissions KRW 4,294.60 Taxes KRW 0  

Trades:
ID 1206g Code 1654Z Date 2014-09-18 20:08:17 Quantity 0.277778 Price 107.310 Value per block 107,310,000 (Allocated from: ID 1206 Quantity 5)
ID 1207g Code 1654Z Date 2014-09-21 20:03:59 Quantity 0.277778 Price 107.350 Value per block 107,350,000 (Allocated from: ID 1207 Quantity 5)
ID 1208g Code 1654Z Date 2014-09-22 20:09:56 Quantity 0.222222 Price 107.370 Value per block 107,370,000 (Allocated from: ID 1208 Quantity 4)
ID 1209g Code 1654Z Date 2014-09-22 21:45:08 Quantity 0.0555556 Price 107.390 Value per block 107,390,000 (Allocated from: ID 1209 Quantity 1)
ID 1210g Code 1654Z Date 2014-09-23 21:16:39 Quantity 0.0555556 Price 107.410 Value per block 107,410,000 (Allocated from: ID 1210 Quantity 1)
ID 1211g Code 1654Z Date 2014-09-24 21:30:23 Quantity 0.0555556 Price 107.460 Value per block 107,460,000 (Allocated from: ID 1211 Quantity 1)
ID 1212g Code 1654Z Date 2014-09-28 21:27:15 Quantity 0.0555556 Price 107.530 Value per block 107,530,000 (Allocated from: ID 1212 Quantity 1)

CALCULATION: (1*107970000) - 4,318.80 - 0 -(1*107365000) - 4,294.60 - 0  = 596,387 

********************************************************************************************************************************************

17: SELL 1 1654Z Futures on 04/12/2014 at KRW 107,960,000 each gives PROFIT of KRW 586,387 equals GBP 344.452
 Commission KRW 4,318.40 and taxes KRW 0 on SELL
Trade details:ID 1241 Code 1654Z Date 2014-12-04 20:05:39 Quantity -1 Price 107.960 Value per block 107,960,000
Total allowable cost KRW 4,294.60   Total disposal proceeds KRW 590,682

Matches with:
PRO-RATA SECTION 104: Quantity 1.000000 1654Z allocated from total holding of 18, made up of 7 trades between 2014-09-18 and 2014-09-28
 At average value of KRW 107,365,000 Commissions KRW 4,294.60 Taxes KRW 0  

Trades:
ID 1206h Code 1654Z Date 2014-09-18 20:08:17 Quantity 0.277778 Price 107.310 Value per block 107,310,000 (Allocated from: ID 1206 Quantity 5)
ID 1207h Code 1654Z Date 2014-09-21 20:03:59 Quantity 0.277778 Price 107.350 Value per block 107,350,000 (Allocated from: ID 1207 Quantity 5)
ID 1208h Code 1654Z Date 2014-09-22 20:09:56 Quantity 0.222222 Price 107.370 Value per block 107,370,000 (Allocated from: ID 1208 Quantity 4)
ID 1209h Code 1654Z Date 2014-09-22 21:45:08 Quantity 0.0555556 Price 107.390 Value per block 107,390,000 (Allocated from: ID 1209 Quantity 1)
ID 1210h Code 1654Z Date 2014-09-23 21:16:39 Quantity 0.0555556 Price 107.410 Value per block 107,410,000 (Allocated from: ID 1210 Quantity 1)
ID 1211h Code 1654Z Date 2014-09-24 21:30:23 Quantity 0.0555556 Price 107.460 Value per block 107,460,000 (Allocated from: ID 1211 Quantity 1)
ID 1212h Code 1654Z Date 2014-09-28 21:27:15 Quantity 0.0555556 Price 107.530 Value per block 107,530,000 (Allocated from: ID 1212 Quantity 1)

CALCULATION: (1*107960000) - 4,318.40 - 0 -(1*107365000) - 4,294.60 - 0  = 586,387 

********************************************************************************************************************************************

18: SELL 1 1654Z Futures on 07/12/2014 at KRW 107,850,000 each gives PROFIT of KRW 476,391 equals GBP 279.842
 Commission KRW 4,314 and taxes KRW 0 on SELL
Trade details:ID 1242 Code 1654Z Date 2014-12-07 21:29:44 Quantity -1 Price 107.850 Value per block 107,850,000
Total allowable cost KRW 4,294.60   Total disposal proceeds KRW 480,686

Matches with:
PRO-RATA SECTION 104: Quantity 1.000000 1654Z allocated from total holding of 18, made up of 7 trades between 2014-09-18 and 2014-09-28
 At average value of KRW 107,365,000 Commissions KRW 4,294.60 Taxes KRW 0  

Trades:
ID 1206i Code 1654Z Date 2014-09-18 20:08:17 Quantity 0.277778 Price 107.310 Value per block 107,310,000 (Allocated from: ID 1206 Quantity 5)
ID 1207i Code 1654Z Date 2014-09-21 20:03:59 Quantity 0.277778 Price 107.350 Value per block 107,350,000 (Allocated from: ID 1207 Quantity 5)
ID 1208i Code 1654Z Date 2014-09-22 20:09:56 Quantity 0.222222 Price 107.370 Value per block 107,370,000 (Allocated from: ID 1208 Quantity 4)
ID 1209i Code 1654Z Date 2014-09-22 21:45:08 Quantity 0.0555556 Price 107.390 Value per block 107,390,000 (Allocated from: ID 1209 Quantity 1)
ID 1210i Code 1654Z Date 2014-09-23 21:16:39 Quantity 0.0555556 Price 107.410 Value per block 107,410,000 (Allocated from: ID 1210 Quantity 1)
ID 1211i Code 1654Z Date 2014-09-24 21:30:23 Quantity 0.0555556 Price 107.460 Value per block 107,460,000 (Allocated from: ID 1211 Quantity 1)
ID 1212i Code 1654Z Date 2014-09-28 21:27:15 Quantity 0.0555556 Price 107.530 Value per block 107,530,000 (Allocated from: ID 1212 Quantity 1)

CALCULATION: (1*107850000) - 4,314 - 0 -(1*107365000) - 4,294.60 - 0  = 476,391 

********************************************************************************************************************************************

19: SELL 7 1654Z Futures on 14/12/2014 at KRW 108,200,000 each gives PROFIT of KRW 5,784,642 equals GBP 3,369.81
 Commission KRW 30,296 and taxes KRW 0 on SELL
Trade details:ID 1243 Code 1654Z Date 2014-12-14 20:13:13 Quantity -7 Price 108.200 Value per block 108,200,000
Total allowable cost KRW 30,062.20   Total disposal proceeds KRW 5,814,704

Matches with:
PRO-RATA SECTION 104: Quantity 7.000000 1654Z allocated from total holding of 18, made up of 7 trades between 2014-09-18 and 2014-09-28
 At average value of KRW 107,365,000 Commissions KRW 30,062.20 Taxes KRW 0  

Trades:
ID 1206j Code 1654Z Date 2014-09-18 20:08:17 Quantity 1.94444 Price 107.310 Value per block 107,310,000 (Allocated from: ID 1206 Quantity 5)
ID 1207j Code 1654Z Date 2014-09-21 20:03:59 Quantity 1.94444 Price 107.350 Value per block 107,350,000 (Allocated from: ID 1207 Quantity 5)
ID 1208j Code 1654Z Date 2014-09-22 20:09:56 Quantity 1.55556 Price 107.370 Value per block 107,370,000 (Allocated from: ID 1208 Quantity 4)
ID 1209j Code 1654Z Date 2014-09-22 21:45:08 Quantity 0.388889 Price 107.390 Value per block 107,390,000 (Allocated from: ID 1209 Quantity 1)
ID 1210j Code 1654Z Date 2014-09-23 21:16:39 Quantity 0.388889 Price 107.410 Value per block 107,410,000 (Allocated from: ID 1210 Quantity 1)
ID 1211j Code 1654Z Date 2014-09-24 21:30:23 Quantity 0.388889 Price 107.460 Value per block 107,460,000 (Allocated from: ID 1211 Quantity 1)
ID 1212j Code 1654Z Date 2014-09-28 21:27:15 Quantity 0.388889 Price 107.530 Value per block 107,530,000 (Allocated from: ID 1212 Quantity 1)

CALCULATION: (7*108200000) - 30,296 - 0 -(7*107365000) - 30,062.20 - 0  = 5,784,642 

********************************************************************************************************************************************

1: SELL 3 1655H Futures on 15/12/2014 at KRW 108,070,000 each gives LOSS of KRW -525,957 equals GBP -308.882
 Commission KRW 12,968.40 and taxes KRW 0 on SELL
Trade details:ID 1249 Code 1655H Date 2014-12-15 20:09:47 Quantity -3 Price 108.070 Value per block 108,070,000
Total allowable cost KRW 12,988.40   Total disposal proceeds KRW -512,968

Matches with:
SUBSEQUENT 3 TRADE(S) Within 30 days between 2014-12-21 and 2015-01-12: Matches with BUY of 3 1655H at of KRW 108,236,667 each 
 Commissions KRW 12,988.40 Taxes KRW 0  

Trades:
ID 1245 Code 1655H Date 2014-12-21 23:10:47 Quantity 1 Price 108.010 Value per block 108,010,000
ID 1246 Code 1655H Date 2015-01-04 21:51:23 Quantity 1 Price 108.120 Value per block 108,120,000
ID 1247 Code 1655H Date 2015-01-12 21:01:29 Quantity 1 Price 108.580 Value per block 108,580,000

CALCULATION: (3*108070000) - 12,968.40 - 0 -(3*108236667) - 12,988.40 - 0  = -525,957 

********************************************************************************************************************************************

2: SELL 1 1655H Futures on 05/01/2015 at KRW 108,290,000 each gives LOSS of KRW -388,678 equals GBP -228.712
 Commission KRW 4,331.60 and taxes KRW 0 on SELL
Trade details:ID 1250 Code 1655H Date 2015-01-05 21:26:20 Quantity -1 Price 108.290 Value per block 108,290,000
Total allowable cost KRW 4,346.80   Total disposal proceeds KRW -384,332

Matches with:
SUBSEQUENT 1 TRADE(S) Within 30 days between 2015-01-29 and 2015-01-29: Matches with BUY of 1 1655H at of KRW 108,670,000 each 
 Commissions KRW 4,346.80 Taxes KRW 0  

Trades:
ID 1248 Code 1655H Date 2015-01-29 21:16:50 Quantity 1 Price 108.670 Value per block 108,670,000

CALCULATION: (1*108290000) - 4,331.60 - 0 -(1*108670000) - 4,346.80 - 0  = -388,678 

********************************************************************************************************************************************

3: SELL 1 1655H Futures on 14/01/2015 at KRW 108,480,000 each gives PROFIT of KRW 311,334 equals GBP 183.840
 Commission KRW 4,339.20 and taxes KRW 0 on SELL
Trade details:ID 1251 Code 1655H Date 2015-01-14 22:05:42 Quantity -1 Price 108.480 Value per block 108,480,000
Total allowable cost KRW 4,326.40   Total disposal proceeds KRW 315,661

Matches with:
PRO-RATA SECTION 104: Quantity 1.000000 1655H allocated from total holding of 7, made up of 1 trades between 2014-12-14 and 2014-12-14
 At average value of KRW 108,160,000 Commissions KRW 4,326.40 Taxes KRW 0  

Trades:
ID 1244a Code 1655H Date 2014-12-14 20:09:58 Quantity 1 Price 108.160 Value per block 108,160,000 (Allocated from: ID 1244 Quantity 7)

CALCULATION: (1*108480000) - 4,339.20 - 0 -(1*108160000) - 4,326.40 - 0  = 311,334 

********************************************************************************************************************************************

4: SELL 1 1655H Futures on 26/01/2015 at KRW 108,540,000 each gives PROFIT of KRW 371,332 equals GBP 219.260
 Commission KRW 4,341.60 and taxes KRW 0 on SELL
Trade details:ID 1252 Code 1655H Date 2015-01-26 21:11:11 Quantity -1 Price 108.540 Value per block 108,540,000
Total allowable cost KRW 4,326.40   Total disposal proceeds KRW 375,658

Matches with:
PRO-RATA SECTION 104: Quantity 1.000000 1655H allocated from total holding of 7, made up of 1 trades between 2014-12-14 and 2014-12-14
 At average value of KRW 108,160,000 Commissions KRW 4,326.40 Taxes KRW 0  

Trades:
ID 1244b Code 1655H Date 2014-12-14 20:09:58 Quantity 1 Price 108.160 Value per block 108,160,000 (Allocated from: ID 1244 Quantity 7)

CALCULATION: (1*108540000) - 4,341.60 - 0 -(1*108160000) - 4,326.40 - 0  = 371,332 

********************************************************************************************************************************************

1: SELL 1 1674M Futures on 13/04/2014 at KRW 112,230,000 each gives LOSS of KRW -939,016 equals GBP -554.966
 Commission KRW 4,489.20 and taxes KRW 0 on SELL
Trade details:ID 1255 Code 1674M Date 2014-04-13 22:37:02 Quantity -1 Price 112.230 Value per block 112,230,000
Total allowable cost KRW 4,526.40   Total disposal proceeds KRW -934,489

Matches with:
SUBSEQUENT 1 TRADE(S) Within 30 days between 2014-05-07 and 2014-05-07: Matches with BUY of 1 1674M at of KRW 113,160,000 each 
 Commissions KRW 4,526.40 Taxes KRW 0  

Trades:
ID 1254 Code 1674M Date 2014-05-07 21:18:14 Quantity 1 Price 113.160 Value per block 113,160,000

CALCULATION: (1*112230000) - 4,489.20 - 0 -(1*113160000) - 4,526.40 - 0  = -939,016 

********************************************************************************************************************************************

2: SELL 3 1674M Futures on 15/06/2014 at KRW 114,650,000 each gives PROFIT of KRW 6,542,747 equals GBP 3,866.82
 Commission KRW 13,758 and taxes KRW 0 on SELL
Trade details:ID 1256 Code 1674M Date 2014-06-15 20:09:05 Quantity -3 Price 114.650 Value per block 114,650,000
Total allowable cost KRW 13,495.20   Total disposal proceeds KRW 6,556,242

Matches with:
PRO-RATA SECTION 104: Quantity 3.000000 1674M allocated from total holding of 3, made up of 1 trades between 2014-04-10 and 2014-04-10
 At average value of KRW 112,460,000 Commissions KRW 13,495.20 Taxes KRW 0  

Trades:
ID 1253 Code 1674M Date 2014-04-10 20:21:16 Quantity 3 Price 112.460 Value per block 112,460,000

CALCULATION: (3*114650000) - 13,758 - 0 -(3*112460000) - 13,495.20 - 0  = 6,542,747 

********************************************************************************************************************************************

1: SELL 2 1674U Futures on 16/06/2014 at KRW 114,180,000 each gives LOSS of KRW -4,888,464 equals GBP -2,925.36
 Commission KRW 9,134.40 and taxes KRW 0 on SELL
Trade details:ID 1262 Code 1674U Date 2014-06-16 20:04:37 Quantity -2 Price 114.180 Value per block 114,180,000
Total allowable cost KRW 9,329.20   Total disposal proceeds KRW -4,879,134

Matches with:
SUBSEQUENT 2 TRADE(S) Within 30 days between 2014-07-14 and 2014-08-17: Matches with BUY of 2 1674U at of KRW 116,615,000 each 
 Commissions KRW 9,329.20 Taxes KRW 0  

Trades:
ID 1259 Code 1674U Date 2014-07-14 20:03:13 Quantity 1 Price 116.490 Value per block 116,490,000
ID 1260 Code 1674U Date 2014-08-17 20:06:35 Quantity 1 Price 116.740 Value per block 116,740,000

CALCULATION: (2*114180000) - 9,134.40 - 0 -(2*116615000) - 9,329.20 - 0  = -4,888,464 

********************************************************************************************************************************************

2: SELL 1 1674U Futures on 10/07/2014 at KRW 116,530,000 each gives LOSS of KRW -269,333 equals GBP -161.093
 Commission KRW 4,661.20 and taxes KRW 0 on SELL
Trade details:ID 1263 Code 1674U Date 2014-07-10 20:05:06 Quantity -1 Price 116.530 Value per block 116,530,000
Total allowable cost KRW 4,671.60   Total disposal proceeds KRW -264,661

Matches with:
SUBSEQUENT 1 TRADE(S) Within 30 days between 2014-08-27 and 2014-08-27: Matches with BUY of 1 1674U at of KRW 116,790,000 each 
 Commissions KRW 4,671.60 Taxes KRW 0  

Trades:
ID 1261 Code 1674U Date 2014-08-27 21:03:12 Quantity 1 Price 116.790 Value per block 116,790,000

CALCULATION: (1*116530000) - 4,661.20 - 0 -(1*116790000) - 4,671.60 - 0  = -269,333 

********************************************************************************************************************************************

3: SELL 1 1674U Futures on 17/07/2014 at KRW 117,500,000 each gives PROFIT of KRW 3,335,734 equals GBP 1,995.10
 Commission KRW 4,700 and taxes KRW 0 on SELL
Trade details:ID 1264 Code 1674U Date 2014-07-17 22:17:51 Quantity -1 Price 117.500 Value per block 117,500,000
Total allowable cost KRW 4,566.20   Total disposal proceeds KRW 3,340,300

Matches with:
PRO-RATA SECTION 104: Quantity 1.000000 1674U allocated from total holding of 6, made up of 2 trades between 2014-06-15 and 2014-06-15
 At average value of KRW 114,155,000 Commissions KRW 4,566.20 Taxes KRW 0  

Trades:
ID 1257a Code 1674U Date 2014-06-15 20:02:04 Quantity 0.500000 Price 114.100 Value per block 114,100,000 (Allocated from: ID 1257 Quantity 3)
ID 1258a Code 1674U Date 2014-06-15 20:07:39 Quantity 0.500000 Price 114.210 Value per block 114,210,000 (Allocated from: ID 1258 Quantity 3)

CALCULATION: (1*117500000) - 4,700 - 0 -(1*114155000) - 4,566.20 - 0  = 3,335,734 

********************************************************************************************************************************************

4: SELL 1 1674U Futures on 07/08/2014 at KRW 116,780,000 each gives PROFIT of KRW 2,615,763 equals GBP 1,567.17
 Commission KRW 4,671.20 and taxes KRW 0 on SELL
Trade details:ID 1265 Code 1674U Date 2014-08-07 21:08:45 Quantity -1 Price 116.780 Value per block 116,780,000
Total allowable cost KRW 4,566.20   Total disposal proceeds KRW 2,620,329

Matches with:
PRO-RATA SECTION 104: Quantity 1.000000 1674U allocated from total holding of 6, made up of 2 trades between 2014-06-15 and 2014-06-15
 At average value of KRW 114,155,000 Commissions KRW 4,566.20 Taxes KRW 0  

Trades:
ID 1257b Code 1674U Date 2014-06-15 20:02:04 Quantity 0.500000 Price 114.100 Value per block 114,100,000 (Allocated from: ID 1257 Quantity 3)
ID 1258b Code 1674U Date 2014-06-15 20:07:39 Quantity 0.500000 Price 114.210 Value per block 114,210,000 (Allocated from: ID 1258 Quantity 3)

CALCULATION: (1*116780000) - 4,671.20 - 0 -(1*114155000) - 4,566.20 - 0  = 2,615,763 

********************************************************************************************************************************************

5: SELL 1 1674U Futures on 10/09/2014 at KRW 116,440,000 each gives PROFIT of KRW 2,275,776 equals GBP 1,361.51
 Commission KRW 4,657.60 and taxes KRW 0 on SELL
Trade details:ID 1266 Code 1674U Date 2014-09-10 21:20:11 Quantity -1 Price 116.440 Value per block 116,440,000
Total allowable cost KRW 4,566.20   Total disposal proceeds KRW 2,280,342

Matches with:
PRO-RATA SECTION 104: Quantity 1.000000 1674U allocated from total holding of 6, made up of 2 trades between 2014-06-15 and 2014-06-15
 At average value of KRW 114,155,000 Commissions KRW 4,566.20 Taxes KRW 0  

Trades:
ID 1257c Code 1674U Date 2014-06-15 20:02:04 Quantity 0.500000 Price 114.100 Value per block 114,100,000 (Allocated from: ID 1257 Quantity 3)
ID 1258c Code 1674U Date 2014-06-15 20:07:39 Quantity 0.500000 Price 114.210 Value per block 114,210,000 (Allocated from: ID 1258 Quantity 3)

CALCULATION: (1*116440000) - 4,657.60 - 0 -(1*114155000) - 4,566.20 - 0  = 2,275,776 

********************************************************************************************************************************************

6: SELL 3 1674U Futures on 17/09/2014 at KRW 117,100,000 each gives PROFIT of KRW 8,807,249 equals GBP 5,269.05
 Commission KRW 14,052 and taxes KRW 0 on SELL
Trade details:ID 1267 Code 1674U Date 2014-09-17 00:00:00 Quantity -3 Price 117.100 Value per block 117,100,000
Total allowable cost KRW 13,698.60   Total disposal proceeds KRW 8,820,948

Matches with:
PRO-RATA SECTION 104: Quantity 3.000000 1674U allocated from total holding of 6, made up of 2 trades between 2014-06-15 and 2014-06-15
 At average value of KRW 114,155,000 Commissions KRW 13,698.60 Taxes KRW 0  

Trades:
ID 1257d Code 1674U Date 2014-06-15 20:02:04 Quantity 1.50000 Price 114.100 Value per block 114,100,000 (Allocated from: ID 1257 Quantity 3)
ID 1258d Code 1674U Date 2014-06-15 20:07:39 Quantity 1.50000 Price 114.210 Value per block 114,210,000 (Allocated from: ID 1258 Quantity 3)

CALCULATION: (3*117100000) - 14,052 - 0 -(3*114155000) - 13,698.60 - 0  = 8,807,249 

********************************************************************************************************************************************

1: SELL 1 1674Z Futures on 05/10/2014 at KRW 118,720,000 each gives LOSS of KRW -239,507 equals GBP -143.212
 Commission KRW 4,748.80 and taxes KRW 0 on SELL
Trade details:ID 1274 Code 1674Z Date 2014-10-05 20:24:19 Quantity -1 Price 118.720 Value per block 118,720,000
Total allowable cost KRW 4,758   Total disposal proceeds KRW -234,749

Matches with:
SUBSEQUENT 1 TRADE(S) Within 30 days between 2014-10-09 and 2014-10-09: Matches with BUY of 1 1674Z at of KRW 118,950,000 each 
 Commissions KRW 4,758 Taxes KRW 0  

Trades:
ID 1271 Code 1674Z Date 2014-10-09 21:23:39 Quantity 1 Price 118.950 Value per block 118,950,000

CALCULATION: (1*118720000) - 4,748.80 - 0 -(1*118950000) - 4,758 - 0  = -239,507 

********************************************************************************************************************************************

2: SELL 1 1674Z Futures on 19/10/2014 at KRW 119,480,000 each gives LOSS of KRW -1,039,600 equals GBP -621.611
 Commission KRW 4,779.20 and taxes KRW 0 on SELL
Trade details:ID 1275 Code 1674Z Date 2014-10-19 21:24:10 Quantity -1 Price 119.480 Value per block 119,480,000
Total allowable cost KRW 4,820.40   Total disposal proceeds KRW -1,034,779

Matches with:
SUBSEQUENT 1 TRADE(S) Within 30 days between 2014-11-02 and 2014-11-02: Matches with BUY of 1 1674Z at of KRW 120,510,000 each 
 Commissions KRW 4,820.40 Taxes KRW 0  

Trades:
ID 1272 Code 1674Z Date 2014-11-02 21:09:41 Quantity 1 Price 120.510 Value per block 120,510,000

CALCULATION: (1*119480000) - 4,779.20 - 0 -(1*120510000) - 4,820.40 - 0  = -1,039,600 

********************************************************************************************************************************************

3: SELL 1 1674Z Futures on 09/11/2014 at KRW 120,560,000 each gives LOSS of KRW -149,650 equals GBP -89.4803
 Commission KRW 4,822.40 and taxes KRW 0 on SELL
Trade details:ID 1276 Code 1674Z Date 2014-11-09 20:06:28 Quantity -1 Price 120.560 Value per block 120,560,000
Total allowable cost KRW 4,828   Total disposal proceeds KRW -144,822

Matches with:
SUBSEQUENT 1 TRADE(S) Within 30 days between 2014-11-24 and 2014-11-24: Matches with BUY of 1 1674Z at of KRW 120,700,000 each 
 Commissions KRW 4,828 Taxes KRW 0  

Trades:
ID 1273 Code 1674Z Date 2014-11-24 21:19:12 Quantity 1 Price 120.700 Value per block 120,700,000

CALCULATION: (1*120560000) - 4,822.40 - 0 -(1*120700000) - 4,828 - 0  = -149,650 

********************************************************************************************************************************************

4: SELL 1 1674Z Futures on 11/11/2014 at KRW 119,760,000 each gives PROFIT of KRW 2,140,505 equals GBP 1,279.87
 Commission KRW 4,790.40 and taxes KRW 0 on SELL
Trade details:ID 1277 Code 1674Z Date 2014-11-11 22:54:12 Quantity -1 Price 119.760 Value per block 119,760,000
Total allowable cost KRW 4,704.40   Total disposal proceeds KRW 2,145,210

Matches with:
PRO-RATA SECTION 104: Quantity 1.000000 1674Z allocated from total holding of 5, made up of 3 trades between 2014-09-18 and 2014-10-01
 At average value of KRW 117,610,000 Commissions KRW 4,704.40 Taxes KRW 0  

Trades:
ID 1268a Code 1674Z Date 2014-09-18 20:05:22 Quantity 0.600000 Price 117.140 Value per block 117,140,000 (Allocated from: ID 1268 Quantity 3)
ID 1269a Code 1674Z Date 2014-09-24 22:25:04 Quantity 0.200000 Price 117.510 Value per block 117,510,000 (Allocated from: ID 1269 Quantity 1)
ID 1270a Code 1674Z Date 2014-10-01 22:34:19 Quantity 0.200000 Price 119.120 Value per block 119,120,000 (Allocated from: ID 1270 Quantity 1)

CALCULATION: (1*119760000) - 4,790.40 - 0 -(1*117610000) - 4,704.40 - 0  = 2,140,505 

********************************************************************************************************************************************

5: SELL 1 1674Z Futures on 04/12/2014 at KRW 120,200,000 each gives PROFIT of KRW 2,580,488 equals GBP 1,542.94
 Commission KRW 4,808 and taxes KRW 0 on SELL
Trade details:ID 1278 Code 1674Z Date 2014-12-04 01:00:59 Quantity -1 Price 120.200 Value per block 120,200,000
Total allowable cost KRW 4,704.40   Total disposal proceeds KRW 2,585,192

Matches with:
PRO-RATA SECTION 104: Quantity 1.000000 1674Z allocated from total holding of 5, made up of 3 trades between 2014-09-18 and 2014-10-01
 At average value of KRW 117,610,000 Commissions KRW 4,704.40 Taxes KRW 0  

Trades:
ID 1268b Code 1674Z Date 2014-09-18 20:05:22 Quantity 0.600000 Price 117.140 Value per block 117,140,000 (Allocated from: ID 1268 Quantity 3)
ID 1269b Code 1674Z Date 2014-09-24 22:25:04 Quantity 0.200000 Price 117.510 Value per block 117,510,000 (Allocated from: ID 1269 Quantity 1)
ID 1270b Code 1674Z Date 2014-10-01 22:34:19 Quantity 0.200000 Price 119.120 Value per block 119,120,000 (Allocated from: ID 1270 Quantity 1)

CALCULATION: (1*120200000) - 4,808 - 0 -(1*117610000) - 4,704.40 - 0  = 2,580,488 

********************************************************************************************************************************************

6: SELL 1 1674Z Futures on 04/12/2014 at KRW 119,840,000 each gives PROFIT of KRW 2,220,502 equals GBP 1,327.70
 Commission KRW 4,793.60 and taxes KRW 0 on SELL
Trade details:ID 1279 Code 1674Z Date 2014-12-04 20:03:28 Quantity -1 Price 119.840 Value per block 119,840,000
Total allowable cost KRW 4,704.40   Total disposal proceeds KRW 2,225,206

Matches with:
PRO-RATA SECTION 104: Quantity 1.000000 1674Z allocated from total holding of 5, made up of 3 trades between 2014-09-18 and 2014-10-01
 At average value of KRW 117,610,000 Commissions KRW 4,704.40 Taxes KRW 0  

Trades:
ID 1268c Code 1674Z Date 2014-09-18 20:05:22 Quantity 0.600000 Price 117.140 Value per block 117,140,000 (Allocated from: ID 1268 Quantity 3)
ID 1269c Code 1674Z Date 2014-09-24 22:25:04 Quantity 0.200000 Price 117.510 Value per block 117,510,000 (Allocated from: ID 1269 Quantity 1)
ID 1270c Code 1674Z Date 2014-10-01 22:34:19 Quantity 0.200000 Price 119.120 Value per block 119,120,000 (Allocated from: ID 1270 Quantity 1)

CALCULATION: (1*119840000) - 4,793.60 - 0 -(1*117610000) - 4,704.40 - 0  = 2,220,502 

********************************************************************************************************************************************

7: SELL 2 1674Z Futures on 14/12/2014 at KRW 120,590,000 each gives PROFIT of KRW 5,940,944 equals GBP 3,548.99
 Commission KRW 9,647.20 and taxes KRW 0 on SELL
Trade details:ID 1280 Code 1674Z Date 2014-12-14 20:53:43 Quantity -2 Price 120.590 Value per block 120,590,000
Total allowable cost KRW 9,408.80   Total disposal proceeds KRW 5,950,353

Matches with:
PRO-RATA SECTION 104: Quantity 2.000000 1674Z allocated from total holding of 5, made up of 3 trades between 2014-09-18 and 2014-10-01
 At average value of KRW 117,610,000 Commissions KRW 9,408.80 Taxes KRW 0  

Trades:
ID 1268d Code 1674Z Date 2014-09-18 20:05:22 Quantity 1.20000 Price 117.140 Value per block 117,140,000 (Allocated from: ID 1268 Quantity 3)
ID 1269d Code 1674Z Date 2014-09-24 22:25:04 Quantity 0.400000 Price 117.510 Value per block 117,510,000 (Allocated from: ID 1269 Quantity 1)
ID 1270d Code 1674Z Date 2014-10-01 22:34:19 Quantity 0.400000 Price 119.120 Value per block 119,120,000 (Allocated from: ID 1270 Quantity 1)

CALCULATION: (2*120590000) - 9,647.20 - 0 -(2*117610000) - 9,408.80 - 0  = 5,940,944 

********************************************************************************************************************************************

1: SELL 3 1675H Futures on 15/12/2014 at KRW 120,270,000 each gives PROFIT of KRW 274,481 equals GBP 165.442
 Commission KRW 14,432.40 and taxes KRW 0 on SELL
Trade details:ID 1285 Code 1675H Date 2014-12-15 23:06:14 Quantity -3 Price 120.270 Value per block 120,270,000
Total allowable cost KRW 14,420.27   Total disposal proceeds KRW 288,901

Matches with:
SUBSEQUENT 1 TRADE(S) Within 30 days between 2014-12-23 and 2014-12-23: Matches with BUY of 1 1675H at of KRW 120,040,000 each 
 Commissions KRW 4,801.60 Taxes KRW 0  

Trades:
ID 1284 Code 1675H Date 2014-12-23 22:05:13 Quantity 1 Price 120.040 Value per block 120,040,000
PRO-RATA SECTION 104: Quantity 2.000000 1675H allocated from total holding of 6, made up of 3 trades between 2014-12-14 and 2014-12-14
 At average value of KRW 120,233,333 Commissions KRW 9,618.67 Taxes KRW 0  

Trades:
ID 1281a Code 1675H Date 2014-12-14 20:19:59 Quantity 0.666667 Price 120.250 Value per block 120,250,000 (Allocated from: ID 1281 Quantity 2)
ID 1282a Code 1675H Date 2014-12-14 20:27:16 Quantity 0.666667 Price 120.240 Value per block 120,240,000 (Allocated from: ID 1282 Quantity 2)
ID 1283a Code 1675H Date 2014-12-14 20:43:45 Quantity 0.666667 Price 120.210 Value per block 120,210,000 (Allocated from: ID 1283 Quantity 2)

CALCULATION: (3*120270000) - 14,432.40 - 0 -(1*120040000) - 4,801.60 - 0 -(2*120233333) - 9,618.67 - 0  = 274,481 

********************************************************************************************************************************************

2: SELL 2 1675H Futures on 16/12/2014 at KRW 120,110,000 each gives LOSS of KRW -265,894 equals GBP -161.742
 Commission KRW 9,608.80 and taxes KRW 0 on SELL
Trade details:ID 1286 Code 1675H Date 2014-12-16 22:04:03 Quantity -2 Price 120.110 Value per block 120,110,000
Total allowable cost KRW 9,618.67   Total disposal proceeds KRW -256,275

Matches with:
PRO-RATA SECTION 104: Quantity 2.000000 1675H allocated from total holding of 6, made up of 3 trades between 2014-12-14 and 2014-12-14
 At average value of KRW 120,233,333 Commissions KRW 9,618.67 Taxes KRW 0  

Trades:
ID 1281b Code 1675H Date 2014-12-14 20:19:59 Quantity 0.666667 Price 120.250 Value per block 120,250,000 (Allocated from: ID 1281 Quantity 2)
ID 1282b Code 1675H Date 2014-12-14 20:27:16 Quantity 0.666667 Price 120.240 Value per block 120,240,000 (Allocated from: ID 1282 Quantity 2)
ID 1283b Code 1675H Date 2014-12-14 20:43:45 Quantity 0.666667 Price 120.210 Value per block 120,210,000 (Allocated from: ID 1283 Quantity 2)

CALCULATION: (2*120110000) - 9,608.80 - 0 -(2*120233333) - 9,618.67 - 0  = -265,894 

********************************************************************************************************************************************

3: SELL 1 1675H Futures on 15/01/2015 at KRW 123,680,000 each gives PROFIT of KRW 3,436,910 equals GBP 2,131.78
 Commission KRW 4,947.20 and taxes KRW 0 on SELL
Trade details:ID 1287 Code 1675H Date 2015-01-15 23:05:42 Quantity -1 Price 123.680 Value per block 123,680,000
Total allowable cost KRW 4,809.33   Total disposal proceeds KRW 3,441,719

Matches with:
PRO-RATA SECTION 104: Quantity 1.000000 1675H allocated from total holding of 6, made up of 3 trades between 2014-12-14 and 2014-12-14
 At average value of KRW 120,233,333 Commissions KRW 4,809.33 Taxes KRW 0  

Trades:
ID 1281c Code 1675H Date 2014-12-14 20:19:59 Quantity 0.333333 Price 120.250 Value per block 120,250,000 (Allocated from: ID 1281 Quantity 2)
ID 1282c Code 1675H Date 2014-12-14 20:27:16 Quantity 0.333333 Price 120.240 Value per block 120,240,000 (Allocated from: ID 1282 Quantity 2)
ID 1283c Code 1675H Date 2014-12-14 20:43:45 Quantity 0.333333 Price 120.210 Value per block 120,210,000 (Allocated from: ID 1283 Quantity 2)

CALCULATION: (1*123680000) - 4,947.20 - 0 -(1*120233333) - 4,809.33 - 0  = 3,436,910 

********************************************************************************************************************************************

1: CLOSE SHORT 1 6MH5 Futures on 12/12/2014 at USD 33,435 each gives PROFIT of USD 70 equals GBP 42.1612
 Commission USD 2.46000 and taxes USD 0 on CLOSE SHORT
Trade details:ID 54 Code 6MH5 Date 2014-12-12 05:58:55 Quantity 1 Price 0.0668700 Value per block 33,435
Total allowable cost USD 2.46000   Total disposal proceeds USD 72.5400

Matches with:
SAME DAY TRADE(S) Matches with OPEN SHORT of 1 6MH5 at average of USD 33,510 each 
 Commissions USD 2.46000 Taxes USD 0 

Trades:
ID 58a Code 6MH5 Date 2014-12-12 04:47:40 Quantity -1 Price 0.0670200 Value per block 33,510 (Allocated from: ID 58 Quantity -2)

CALCULATION: -(1*33435) - 2.46000 - 0 +(1*33510) - 2.46000 - 0  = 70 

********************************************************************************************************************************************

2: CLOSE SHORT 1 6MH5 Futures on 17/12/2014 at USD 34,525 each gives LOSS of USD -585 equals GBP -351.897
 Commission USD 2.46000 and taxes USD 0 on CLOSE SHORT
Trade details:ID 55 Code 6MH5 Date 2014-12-17 14:26:24 Quantity 1 Price 0.0690500 Value per block 34,525
Total allowable cost USD 2.46000   Total disposal proceeds USD -582.460

Matches with:
SUBSEQUENT 1 TRADE(S) Within 30 days between 2014-12-19 and 2014-12-19: Matches with OPEN SHORT of 1 6MH5 at of USD 33,945 each 
 Commissions USD 2.46000 Taxes USD 0  

Trades:
ID 60 Code 6MH5 Date 2014-12-19 14:14:45 Quantity -1 Price 0.0678900 Value per block 33,945

CALCULATION: -(1*34525) - 2.46000 - 0 +(1*33945) - 2.46000 - 0  = -585 

********************************************************************************************************************************************

3: CLOSE SHORT 1 6MH5 Futures on 07/01/2015 at USD 33,760 each gives LOSS of USD -258 equals GBP -155.369
 Commission USD 2.46000 and taxes USD 0 on CLOSE SHORT
Trade details:ID 56 Code 6MH5 Date 2015-01-07 14:33:09 Quantity 1 Price 0.0675200 Value per block 33,760
Total allowable cost USD 2.46000   Total disposal proceeds USD -255.793

Matches with:
PRO-RATA SECTION 104: Quantity 1.000000 6MH5 allocated from total holding of -4, made up of 3 trades between 2014-12-12 and 2015-01-06
 At average value of USD 33,506.67 Commissions USD 2.46000 Taxes USD 0  

Trades:
ID 58b Code 6MH5 Date 2014-12-12 04:47:40 Quantity -0.333333 Price 0.0670200 Value per block 33,510 (Allocated from: ID 58 Quantity -2)
ID 59a Code 6MH5 Date 2014-12-15 20:31:09 Quantity -0.333333 Price 0.0674000 Value per block 33,700 (Allocated from: ID 59 Quantity -1)
ID 61a Code 6MH5 Date 2015-01-06 07:59:58 Quantity -0.333333 Price 0.0666200 Value per block 33,310 (Allocated from: ID 61 Quantity -1)

CALCULATION: -(1*33760) - 2.46000 - 0 +(1*33506.67) - 2.46000 - 0  = -258 

********************************************************************************************************************************************

4: CLOSE SHORT 1 6MH5 Futures on 14/01/2015 at USD 34,360 each gives LOSS of USD -858 equals GBP -516.339
 Commission USD 2.46000 and taxes USD 0 on CLOSE SHORT
Trade details:ID 57 Code 6MH5 Date 2015-01-14 20:44:05 Quantity 1 Price 0.0687200 Value per block 34,360
Total allowable cost USD 2.46000   Total disposal proceeds USD -855.793

Matches with:
PRO-RATA SECTION 104: Quantity 1.000000 6MH5 allocated from total holding of -4, made up of 3 trades between 2014-12-12 and 2015-01-06
 At average value of USD 33,506.67 Commissions USD 2.46000 Taxes USD 0  

Trades:
ID 58c Code 6MH5 Date 2014-12-12 04:47:40 Quantity -0.333333 Price 0.0670200 Value per block 33,510 (Allocated from: ID 58 Quantity -2)
ID 59b Code 6MH5 Date 2014-12-15 20:31:09 Quantity -0.333333 Price 0.0674000 Value per block 33,700 (Allocated from: ID 59 Quantity -1)
ID 61b Code 6MH5 Date 2015-01-06 07:59:58 Quantity -0.333333 Price 0.0666200 Value per block 33,310 (Allocated from: ID 61 Quantity -1)

CALCULATION: -(1*34360) - 2.46000 - 0 +(1*33506.67) - 2.46000 - 0  = -858 

********************************************************************************************************************************************

1: SELL 3 6MU4 Futures on 02/07/2014 at USD 38,387.50 each gives LOSS of USD -127 equals GBP -76.5977
 Commission USD 7.41000 and taxes USD 0 on SELL
Trade details:ID 68 Code 6MU4 Date 2014-07-02 09:03:01 Quantity -3 Price 0.0767750 Value per block 38,387.50
Total allowable cost USD 7.41000   Total disposal proceeds USD -119.910

Matches with:
SAME DAY TRADE(S) Matches with BUY of 3 6MU4 at average of USD 38,425 each 
 Commissions USD 7.41000 Taxes USD 0 

Trades:
ID 66 Code 6MU4 Date 2014-07-02 01:06:17 Quantity 3 Price 0.0768500 Value per block 38,425

CALCULATION: (3*38387.50) - 7.41000 - 0 -(3*38425) - 7.41000 - 0  = -127 

********************************************************************************************************************************************

2: SELL 1 6MU4 Futures on 02/07/2014 at USD 38,287.50 each gives LOSS of USD -130 equals GBP -78.1740
 Commission USD 2.47000 and taxes USD 0 on SELL
Trade details:ID 69 Code 6MU4 Date 2014-07-02 20:08:43 Quantity -1 Price 0.0765750 Value per block 38,287.50
Total allowable cost USD 2.47000   Total disposal proceeds USD -127.470

Matches with:
SUBSEQUENT 1 TRADE(S) Within 30 days between 2014-07-09 and 2014-07-09: Matches with BUY of 1 6MU4 at of USD 38,412.50 each 
 Commissions USD 2.47000 Taxes USD 0  

Trades:
ID 67 Code 6MU4 Date 2014-07-09 21:45:53 Quantity 1 Price 0.0768250 Value per block 38,412.50

CALCULATION: (1*38287.50) - 2.47000 - 0 -(1*38412.50) - 2.47000 - 0  = -130 

********************************************************************************************************************************************

3: SELL 1 6MU4 Futures on 10/07/2014 at USD 38,250 each gives LOSS of USD -14 equals GBP -8.61213
 Commission USD 2.47000 and taxes USD 0 on SELL
Trade details:ID 70 Code 6MU4 Date 2014-07-10 07:26:10 Quantity -1 Price 0.0765000 Value per block 38,250
Total allowable cost USD 2.47000   Total disposal proceeds USD -11.8450

Matches with:
PRO-RATA SECTION 104: Quantity 1.000000 6MU4 allocated from total holding of 4, made up of 4 trades between 2014-06-13 and 2014-06-30
 At average value of USD 38,259.38 Commissions USD 2.47000 Taxes USD 0  

Trades:
ID 62a Code 6MU4 Date 2014-06-13 05:57:58 Quantity 0.250000 Price 0.0763750 Value per block 38,187.50 (Allocated from: ID 62 Quantity 1)
ID 63a Code 6MU4 Date 2014-06-19 22:12:31 Quantity 0.250000 Price 0.0763750 Value per block 38,187.50 (Allocated from: ID 63 Quantity 1)
ID 64a Code 6MU4 Date 2014-06-23 01:19:09 Quantity 0.250000 Price 0.0766500 Value per block 38,325 (Allocated from: ID 64 Quantity 1)
ID 65a Code 6MU4 Date 2014-06-30 13:39:10 Quantity 0.250000 Price 0.0766750 Value per block 38,337.50 (Allocated from: ID 65 Quantity 1)

CALCULATION: (1*38250) - 2.47000 - 0 -(1*38259.38) - 2.47000 - 0  = -14 

********************************************************************************************************************************************

4: SELL 1 6MU4 Futures on 21/07/2014 at USD 38,400 each gives PROFIT of USD 136 equals GBP 81.6303
 Commission USD 2.47000 and taxes USD 0 on SELL
Trade details:ID 71 Code 6MU4 Date 2014-07-21 23:06:49 Quantity -1 Price 0.0768000 Value per block 38,400
Total allowable cost USD 2.47000   Total disposal proceeds USD 138.155

Matches with:
PRO-RATA SECTION 104: Quantity 1.000000 6MU4 allocated from total holding of 4, made up of 4 trades between 2014-06-13 and 2014-06-30
 At average value of USD 38,259.38 Commissions USD 2.47000 Taxes USD 0  

Trades:
ID 62b Code 6MU4 Date 2014-06-13 05:57:58 Quantity 0.250000 Price 0.0763750 Value per block 38,187.50 (Allocated from: ID 62 Quantity 1)
ID 63b Code 6MU4 Date 2014-06-19 22:12:31 Quantity 0.250000 Price 0.0763750 Value per block 38,187.50 (Allocated from: ID 63 Quantity 1)
ID 64b Code 6MU4 Date 2014-06-23 01:19:09 Quantity 0.250000 Price 0.0766500 Value per block 38,325 (Allocated from: ID 64 Quantity 1)
ID 65b Code 6MU4 Date 2014-06-30 13:39:10 Quantity 0.250000 Price 0.0766750 Value per block 38,337.50 (Allocated from: ID 65 Quantity 1)

CALCULATION: (1*38400) - 2.47000 - 0 -(1*38259.38) - 2.47000 - 0  = 136 

********************************************************************************************************************************************

5: SELL 2 6MU4 Futures on 07/08/2014 at USD 37,635 each gives LOSS of USD -1,259 equals GBP -757.212
 Commission USD 4.94000 and taxes USD 0 on SELL
Trade details:ID 72 Code 6MU4 Date 2014-08-07 11:20:28 Quantity -2 Price 0.0752700 Value per block 37,635
Total allowable cost USD 4.94000   Total disposal proceeds USD -1,253.69

Matches with:
PRO-RATA SECTION 104: Quantity 2.000000 6MU4 allocated from total holding of 4, made up of 4 trades between 2014-06-13 and 2014-06-30
 At average value of USD 38,259.38 Commissions USD 4.94000 Taxes USD 0  

Trades:
ID 62c Code 6MU4 Date 2014-06-13 05:57:58 Quantity 0.500000 Price 0.0763750 Value per block 38,187.50 (Allocated from: ID 62 Quantity 1)
ID 63c Code 6MU4 Date 2014-06-19 22:12:31 Quantity 0.500000 Price 0.0763750 Value per block 38,187.50 (Allocated from: ID 63 Quantity 1)
ID 64c Code 6MU4 Date 2014-06-23 01:19:09 Quantity 0.500000 Price 0.0766500 Value per block 38,325.00 (Allocated from: ID 64 Quantity 1)
ID 65c Code 6MU4 Date 2014-06-30 13:39:10 Quantity 0.500000 Price 0.0766750 Value per block 38,337.50 (Allocated from: ID 65 Quantity 1)

CALCULATION: (2*37635) - 4.94000 - 0 -(2*38259.38) - 4.94000 - 0  = -1,259 

********************************************************************************************************************************************

1: CLOSE SHORT 1 6MZ4 Futures on 02/10/2014 at USD 37,085 each gives LOSS of USD -80 equals GBP -48.0872
 Commission USD 2.47000 and taxes USD 0 on CLOSE SHORT
Trade details:ID 73 Code 6MZ4 Date 2014-10-02 11:37:57 Quantity 1 Price 0.0741700 Value per block 37,085
Total allowable cost USD 2.46000   Total disposal proceeds USD -77.4700

Matches with:
SUBSEQUENT 1 TRADE(S) Within 30 days between 2014-10-06 and 2014-10-06: Matches with OPEN SHORT of 1 6MZ4 at of USD 37,010 each 
 Commissions USD 2.46000 Taxes USD 0  

Trades:
ID 87 Code 6MZ4 Date 2014-10-06 01:20:17 Quantity -1 Price 0.0740200 Value per block 37,010

CALCULATION: -(1*37085) - 2.47000 - 0 +(1*37010) - 2.46000 - 0  = -80 

********************************************************************************************************************************************

2: CLOSE SHORT 1 6MZ4 Futures on 02/10/2014 at USD 37,195 each gives LOSS of USD -300 equals GBP -180.437
 Commission USD 2.46000 and taxes USD 0 on CLOSE SHORT
Trade details:ID 74 Code 6MZ4 Date 2014-10-02 21:14:06 Quantity 1 Price 0.0743900 Value per block 37,195
Total allowable cost USD 2.46000   Total disposal proceeds USD -297.460

Matches with:
SUBSEQUENT 1 TRADE(S) Within 30 days between 2014-10-07 and 2014-10-07: Matches with OPEN SHORT of 1 6MZ4 at of USD 36,900 each 
 Commissions USD 2.46000 Taxes USD 0  

Trades:
ID 88 Code 6MZ4 Date 2014-10-07 21:05:46 Quantity -1 Price 0.0738000 Value per block 36,900

CALCULATION: -(1*37195) - 2.46000 - 0 +(1*36900) - 2.46000 - 0  = -300 

********************************************************************************************************************************************

3: CLOSE SHORT 1 6MZ4 Futures on 07/10/2014 at USD 37,170 each gives LOSS of USD -125 equals GBP -75.1539
 Commission USD 2.46000 and taxes USD 0 on CLOSE SHORT
Trade details:ID 75 Code 6MZ4 Date 2014-10-07 03:47:19 Quantity 1 Price 0.0743400 Value per block 37,170
Total allowable cost USD 2.46000   Total disposal proceeds USD -122.460

Matches with:
SUBSEQUENT 1 TRADE(S) Within 30 days between 2014-10-10 and 2014-10-10: Matches with OPEN SHORT of 1 6MZ4 at of USD 37,050 each 
 Commissions USD 2.46000 Taxes USD 0  

Trades:
ID 89 Code 6MZ4 Date 2014-10-10 01:34:26 Quantity -1 Price 0.0741000 Value per block 37,050

CALCULATION: -(1*37170) - 2.46000 - 0 +(1*37050) - 2.46000 - 0  = -125 

********************************************************************************************************************************************

4: CLOSE SHORT 1 6MZ4 Futures on 08/10/2014 at USD 37,350 each gives LOSS of USD -390 equals GBP -234.582
 Commission USD 2.46000 and taxes USD 0 on CLOSE SHORT
Trade details:ID 76 Code 6MZ4 Date 2014-10-08 21:07:34 Quantity 1 Price 0.0747000 Value per block 37,350
Total allowable cost USD 2.46000   Total disposal proceeds USD -387.460

Matches with:
SUBSEQUENT 1 TRADE(S) Within 30 days between 2014-11-02 and 2014-11-02: Matches with OPEN SHORT of 1 6MZ4 at of USD 36,965 each 
 Commissions USD 2.46000 Taxes USD 0  

Trades:
ID 90 Code 6MZ4 Date 2014-11-02 21:01:31 Quantity -1 Price 0.0739300 Value per block 36,965

CALCULATION: -(1*37350) - 2.46000 - 0 +(1*36965) - 2.46000 - 0  = -390 

********************************************************************************************************************************************

5: CLOSE SHORT 1 6MZ4 Futures on 09/10/2014 at USD 37,355 each gives LOSS of USD -720 equals GBP -433.115
 Commission USD 2.46000 and taxes USD 0 on CLOSE SHORT
Trade details:ID 77 Code 6MZ4 Date 2014-10-09 01:37:26 Quantity 1 Price 0.0747100 Value per block 37,355
Total allowable cost USD 2.46000   Total disposal proceeds USD -717.460

Matches with:
SUBSEQUENT 1 TRADE(S) Within 30 days between 2014-11-03 and 2014-11-03: Matches with OPEN SHORT of 1 6MZ4 at of USD 36,640 each 
 Commissions USD 2.46000 Taxes USD 0  

Trades:
ID 91 Code 6MZ4 Date 2014-11-03 21:09:58 Quantity -1 Price 0.0732800 Value per block 36,640

CALCULATION: -(1*37355) - 2.46000 - 0 +(1*36640) - 2.46000 - 0  = -720 

********************************************************************************************************************************************

6: CLOSE SHORT 1 6MZ4 Futures on 17/10/2014 at USD 36,870 each gives LOSS of USD -170 equals GBP -102.227
 Commission USD 2.46000 and taxes USD 0 on CLOSE SHORT
Trade details:ID 78 Code 6MZ4 Date 2014-10-17 05:11:09 Quantity 1 Price 0.0737400 Value per block 36,870
Total allowable cost USD 2.46000   Total disposal proceeds USD -167.460

Matches with:
SUBSEQUENT 1 TRADE(S) Within 30 days between 2014-11-05 and 2014-11-05: Matches with OPEN SHORT of 1 6MZ4 at of USD 36,705 each 
 Commissions USD 2.46000 Taxes USD 0  

Trades:
ID 92 Code 6MZ4 Date 2014-11-05 20:59:40 Quantity -1 Price 0.0734100 Value per block 36,705

CALCULATION: -(1*36870) - 2.46000 - 0 +(1*36705) - 2.46000 - 0  = -170 

********************************************************************************************************************************************

7: CLOSE SHORT 1 6MZ4 Futures on 04/11/2014 at USD 36,790 each gives LOSS of USD -210 equals GBP -126.291
 Commission USD 2.46000 and taxes USD 0 on CLOSE SHORT
Trade details:ID 79 Code 6MZ4 Date 2014-11-04 14:10:02 Quantity 1 Price 0.0735800 Value per block 36,790
Total allowable cost USD 2.46000   Total disposal proceeds USD -207.460

Matches with:
SUBSEQUENT 1 TRADE(S) Within 30 days between 2014-11-11 and 2014-11-11: Matches with OPEN SHORT of 1 6MZ4 at of USD 36,585 each 
 Commissions USD 2.46000 Taxes USD 0  

Trades:
ID 93 Code 6MZ4 Date 2014-11-11 05:50:02 Quantity -1 Price 0.0731700 Value per block 36,585

CALCULATION: -(1*36790) - 2.46000 - 0 +(1*36585) - 2.46000 - 0  = -210 

********************************************************************************************************************************************

8: CLOSE SHORT 1 6MZ4 Futures on 06/11/2014 at USD 36,730 each gives LOSS of USD -195 equals GBP -117.267
 Commission USD 2.46000 and taxes USD 0 on CLOSE SHORT
Trade details:ID 80 Code 6MZ4 Date 2014-11-06 04:39:23 Quantity 1 Price 0.0734600 Value per block 36,730
Total allowable cost USD 2.46000   Total disposal proceeds USD -192.460

Matches with:
SUBSEQUENT 1 TRADE(S) Within 30 days between 2014-11-25 and 2014-11-25: Matches with OPEN SHORT of 1 6MZ4 at of USD 36,540 each 
 Commissions USD 2.46000 Taxes USD 0  

Trades:
ID 94 Code 6MZ4 Date 2014-11-25 01:19:54 Quantity -1 Price 0.0730800 Value per block 36,540

CALCULATION: -(1*36730) - 2.46000 - 0 +(1*36540) - 2.46000 - 0  = -195 

********************************************************************************************************************************************

9: CLOSE SHORT 1 6MZ4 Futures on 09/11/2014 at USD 36,920 each gives LOSS of USD -1,620 equals GBP -974.570
 Commission USD 2.46000 and taxes USD 0 on CLOSE SHORT
Trade details:ID 81 Code 6MZ4 Date 2014-11-09 20:59:47 Quantity 1 Price 0.0738400 Value per block 36,920
Total allowable cost USD 2.46000   Total disposal proceeds USD -1,617.46

Matches with:
SUBSEQUENT 1 TRADE(S) Within 30 days between 2014-12-05 and 2014-12-05: Matches with OPEN SHORT of 1 6MZ4 at of USD 35,305 each 
 Commissions USD 2.46000 Taxes USD 0  

Trades:
ID 95 Code 6MZ4 Date 2014-12-05 02:15:11 Quantity -1 Price 0.0706100 Value per block 35,305

CALCULATION: -(1*36920) - 2.46000 - 0 +(1*35305) - 2.46000 - 0  = -1,620 

********************************************************************************************************************************************

10: CLOSE SHORT 1 6MZ4 Futures on 11/11/2014 at USD 36,675 each gives PROFIT of USD 303 equals GBP 182.532
 Commission USD 2.46000 and taxes USD 0 on CLOSE SHORT
Trade details:ID 82 Code 6MZ4 Date 2014-11-11 21:16:33 Quantity 1 Price 0.0733500 Value per block 36,675
Total allowable cost USD 2.47000   Total disposal proceeds USD 305.873

Matches with:
PRO-RATA SECTION 104: Quantity 1.000000 6MZ4 allocated from total holding of -3, made up of 3 trades between 2014-09-25 and 2014-09-29
 At average value of USD 36,983.33 Commissions USD 2.47000 Taxes USD 0  

Trades:
ID 84a Code 6MZ4 Date 2014-09-25 21:03:13 Quantity -0.333333 Price 0.0743600 Value per block 37,180 (Allocated from: ID 84 Quantity -1)
ID 85a Code 6MZ4 Date 2014-09-26 10:30:27 Quantity -0.333333 Price 0.0738500 Value per block 36,925 (Allocated from: ID 85 Quantity -1)
ID 86a Code 6MZ4 Date 2014-09-29 21:00:49 Quantity -0.333333 Price 0.0736900 Value per block 36,845 (Allocated from: ID 86 Quantity -1)

CALCULATION: -(1*36675) - 2.46000 - 0 +(1*36983.33) - 2.47000 - 0  = 303 

********************************************************************************************************************************************

11: CLOSE SHORT 2 6MZ4 Futures on 12/12/2014 at USD 33,700 each gives PROFIT of USD 6,557 equals GBP 3,944.68
 Commission USD 4.92000 and taxes USD 0 on CLOSE SHORT
Trade details:ID 83 Code 6MZ4 Date 2014-12-12 04:50:24 Quantity 2 Price 0.0674000 Value per block 33,700
Total allowable cost USD 4.94000   Total disposal proceeds USD 6,561.75

Matches with:
PRO-RATA SECTION 104: Quantity 2.000000 6MZ4 allocated from total holding of -3, made up of 3 trades between 2014-09-25 and 2014-09-29
 At average value of USD 36,983.33 Commissions USD 4.94000 Taxes USD 0  

Trades:
ID 84b Code 6MZ4 Date 2014-09-25 21:03:13 Quantity -0.666667 Price 0.0743600 Value per block 37,180 (Allocated from: ID 84 Quantity -1)
ID 85b Code 6MZ4 Date 2014-09-26 10:30:27 Quantity -0.666667 Price 0.0738500 Value per block 36,925 (Allocated from: ID 85 Quantity -1)
ID 86b Code 6MZ4 Date 2014-09-29 21:00:49 Quantity -0.666667 Price 0.0736900 Value per block 36,845 (Allocated from: ID 86 Quantity -1)

CALCULATION: -(2*33700) - 4.92000 - 0 +(2*36983.33) - 4.94000 - 0  = 6,557 

********************************************************************************************************************************************

1: SELL 1 6NM4 Futures on 20/04/2014 at USD 85,440 each gives LOSS of USD -495 equals GBP -297.764
 Commission USD 2.47000 and taxes USD 0 on SELL
Trade details:ID 98 Code 6NM4 Date 2014-04-20 20:21:00 Quantity -1 Price 0.854400 Value per block 85,440
Total allowable cost USD 2.47000   Total disposal proceeds USD -492.470

Matches with:
SUBSEQUENT 1 TRADE(S) Within 30 days between 2014-05-01 and 2014-05-01: Matches with BUY of 1 6NM4 at of USD 85,930 each 
 Commissions USD 2.47000 Taxes USD 0  

Trades:
ID 97 Code 6NM4 Date 2014-05-01 03:53:28 Quantity 1 Price 0.859300 Value per block 85,930

CALCULATION: (1*85440) - 2.47000 - 0 -(1*85930) - 2.47000 - 0  = -495 

********************************************************************************************************************************************

2: SELL 1 6NM4 Futures on 20/05/2014 at USD 85,700 each gives LOSS of USD -815 equals GBP -490.281
 Commission USD 2.47000 and taxes USD 0 on SELL
Trade details:ID 99 Code 6NM4 Date 2014-05-20 03:40:09 Quantity -1 Price 0.857000 Value per block 85,700
Total allowable cost USD 2.47000   Total disposal proceeds USD -812.470

Matches with:
PRO-RATA SECTION 104: Quantity 1.000000 6NM4 allocated from total holding of 1, made up of 1 trades between 2014-04-10 and 2014-04-10
 At average value of USD 86,510 Commissions USD 2.47000 Taxes USD 0  

Trades:
ID 96 Code 6NM4 Date 2014-04-10 13:25:56 Quantity 1 Price 0.865100 Value per block 86,510

CALCULATION: (1*85700) - 2.47000 - 0 -(1*86510) - 2.47000 - 0  = -815 

********************************************************************************************************************************************

1: CLOSE SHORT 1 ADH5 Futures on 15/01/2015 at USD 82,380 each gives LOSS of USD -1,825 equals GBP -1,097.90
 Commission USD 2.46000 and taxes USD 0 on CLOSE SHORT
Trade details:ID 100 Code ADH5 Date 2015-01-15 08:21:52 Quantity 1 Price 0.823800 Value per block 82,380
Total allowable cost USD 2.46000   Total disposal proceeds USD -1,822.46

Matches with:
SUBSEQUENT 1 TRADE(S) Within 30 days between 2015-01-21 and 2015-01-21: Matches with OPEN SHORT of 1 ADH5 at of USD 80,560 each 
 Commissions USD 2.46000 Taxes USD 0  

Trades:
ID 102 Code ADH5 Date 2015-01-21 21:30:02 Quantity -1 Price 0.805600 Value per block 80,560

CALCULATION: -(1*82380) - 2.46000 - 0 +(1*80560) - 2.46000 - 0  = -1,825 

********************************************************************************************************************************************

1: SELL 1 ADU4 Futures on 02/07/2014 at USD 94,100 each gives LOSS of USD -55 equals GBP -33.0528
 Commission USD 2.47000 and taxes USD 0 on SELL
Trade details:ID 105 Code ADU4 Date 2014-07-02 05:55:48 Quantity -1 Price 0.941000 Value per block 94,100
Total allowable cost USD 2.47000   Total disposal proceeds USD -52.4700

Matches with:
SAME DAY TRADE(S) Matches with BUY of 1 ADU4 at average of USD 94,150 each 
 Commissions USD 2.47000 Taxes USD 0 

Trades:
ID 104 Code ADU4 Date 2014-07-02 00:10:01 Quantity 1 Price 0.941500 Value per block 94,150

CALCULATION: (1*94100) - 2.47000 - 0 -(1*94150) - 2.47000 - 0  = -55 

********************************************************************************************************************************************

2: SELL 1 ADU4 Futures on 16/07/2014 at USD 93,080 each gives LOSS of USD -675 equals GBP -406.055
 Commission USD 2.47000 and taxes USD 0 on SELL
Trade details:ID 106 Code ADU4 Date 2014-07-16 06:47:20 Quantity -1 Price 0.930800 Value per block 93,080
Total allowable cost USD 2.47000   Total disposal proceeds USD -672.470

Matches with:
PRO-RATA SECTION 104: Quantity 1.000000 ADU4 allocated from total holding of 1, made up of 1 trades between 2014-06-30 and 2014-06-30
 At average value of USD 93,750 Commissions USD 2.47000 Taxes USD 0  

Trades:
ID 103 Code ADU4 Date 2014-06-30 00:56:53 Quantity 1 Price 0.937500 Value per block 93,750

CALCULATION: (1*93080) - 2.47000 - 0 -(1*93750) - 2.47000 - 0  = -675 

********************************************************************************************************************************************

1: CLOSE SHORT 1 ADZ4 Futures on 07/10/2014 at USD 87,540 each gives LOSS of USD -3,845 equals GBP -2,313.17
 Commission USD 2.46000 and taxes USD 0 on CLOSE SHORT
Trade details:ID 107 Code ADZ4 Date 2014-10-07 07:55:34 Quantity 1 Price 0.875400 Value per block 87,540
Total allowable cost USD 2.46000   Total disposal proceeds USD -3,842.46

Matches with:
SUBSEQUENT 1 TRADE(S) Within 30 days between 2014-12-04 and 2014-12-04: Matches with OPEN SHORT of 1 ADZ4 at of USD 83,700 each 
 Commissions USD 2.46000 Taxes USD 0  

Trades:
ID 110 Code ADZ4 Date 2014-12-04 23:38:53 Quantity -1 Price 0.837000 Value per block 83,700

CALCULATION: -(1*87540) - 2.46000 - 0 +(1*83700) - 2.46000 - 0  = -3,845 

********************************************************************************************************************************************

2: CLOSE SHORT 1 ADZ4 Futures on 15/12/2014 at USD 82,100 each gives PROFIT of USD 5,525 equals GBP 3,323.97
 Commission USD 2.46000 and taxes USD 0 on CLOSE SHORT
Trade details:ID 108 Code ADZ4 Date 2014-12-15 00:00:00 Quantity 1 Price 0.821000 Value per block 82,100
Total allowable cost USD 2.47000   Total disposal proceeds USD 5,527.54

Matches with:
PRO-RATA SECTION 104: Quantity 1.000000 ADZ4 allocated from total holding of -1, made up of 1 trades between 2014-09-25 and 2014-09-25
 At average value of USD 87,630 Commissions USD 2.47000 Taxes USD 0  

Trades:
ID 109 Code ADZ4 Date 2014-09-25 01:11:16 Quantity -1 Price 0.876300 Value per block 87,630

CALCULATION: -(1*82100) - 2.46000 - 0 +(1*87630) - 2.47000 - 0  = 5,525 

********************************************************************************************************************************************

1: SELL 1 APM4 Futures on 01/05/2014 at AUD 135,925 each gives LOSS of AUD -985 equals GBP -544.532
 Commission AUD 5 and taxes AUD 0 on SELL
Trade details:ID 873 Code APM4 Date 2014-05-01 01:00:18 Quantity -1 Price 5,437 Value per block 135,925
Total allowable cost AUD 5   Total disposal proceeds AUD -980

Matches with:
SUBSEQUENT 1 TRADE(S) Within 30 days between 2014-05-05 and 2014-05-05: Matches with BUY of 1 APM4 at of AUD 136,900 each 
 Commissions AUD 5 Taxes AUD 0  

Trades:
ID 870 Code APM4 Date 2014-05-05 20:39:59 Quantity 1 Price 5,476 Value per block 136,900

CALCULATION: (1*135925) - 5 - 0 -(1*136900) - 5 - 0  = -985 

********************************************************************************************************************************************

2: SELL 1 APM4 Futures on 06/05/2014 at AUD 136,000 each gives LOSS of AUD -1,335 equals GBP -737.241
 Commission AUD 5 and taxes AUD 0 on SELL
Trade details:ID 874 Code APM4 Date 2014-05-06 20:10:07 Quantity -1 Price 5,440 Value per block 136,000
Total allowable cost AUD 5   Total disposal proceeds AUD -1,330

Matches with:
SUBSEQUENT 1 TRADE(S) Within 30 days between 2014-05-12 and 2014-05-12: Matches with BUY of 1 APM4 at of AUD 137,325 each 
 Commissions AUD 5 Taxes AUD 0  

Trades:
ID 871 Code APM4 Date 2014-05-12 20:54:45 Quantity 1 Price 5,493 Value per block 137,325

CALCULATION: (1*136000) - 5 - 0 -(1*137325) - 5 - 0  = -1,335 

********************************************************************************************************************************************

3: SELL 1 APM4 Futures on 19/05/2014 at AUD 135,725 each gives LOSS of AUD -2,610 equals GBP -1,440.31
 Commission AUD 5 and taxes AUD 0 on SELL
Trade details:ID 875 Code APM4 Date 2014-05-19 01:15:14 Quantity -1 Price 5,429 Value per block 135,725
Total allowable cost AUD 5   Total disposal proceeds AUD -2,605

Matches with:
SUBSEQUENT 1 TRADE(S) Within 30 days between 2014-05-26 and 2014-05-26: Matches with BUY of 1 APM4 at of AUD 138,325 each 
 Commissions AUD 5 Taxes AUD 0  

Trades:
ID 872 Code APM4 Date 2014-05-26 20:09:03 Quantity 1 Price 5,533 Value per block 138,325

CALCULATION: (1*135725) - 5 - 0 -(1*138325) - 5 - 0  = -2,610 

********************************************************************************************************************************************

4: SELL 3 APM4 Futures on 15/06/2014 at AUD 134,900 each gives LOSS of AUD -3,655 equals GBP -2,013.18
 Commission AUD 15 and taxes AUD 0 on SELL
Trade details:ID 876 Code APM4 Date 2014-06-15 20:00:20 Quantity -3 Price 5,396 Value per block 134,900
Total allowable cost AUD 15   Total disposal proceeds AUD -3,640

Matches with:
PRO-RATA SECTION 104: Quantity 3.000000 APM4 allocated from total holding of 3, made up of 2 trades between 2014-04-10 and 2014-04-22
 At average value of AUD 136,108 Commissions AUD 15 Taxes AUD 0  

Trades:
ID 868 Code APM4 Date 2014-04-10 20:00:54 Quantity 2 Price 5,420 Value per block 135,500
ID 869 Code APM4 Date 2014-04-22 20:06:49 Quantity 1 Price 5,493 Value per block 137,325

CALCULATION: (3*134900) - 15 - 0 -(3*136108) - 15 - 0  = -3,655 

********************************************************************************************************************************************

1: SELL 1 APU4 Futures on 27/06/2014 at AUD 135,150 each gives PROFIT of AUD 240 equals GBP 131.910
 Commission AUD 5 and taxes AUD 0 on SELL
Trade details:ID 882 Code APU4 Date 2014-06-27 00:49:04 Quantity -1 Price 5,406 Value per block 135,150
Total allowable cost AUD 5   Total disposal proceeds AUD 245

Matches with:
SUBSEQUENT 1 TRADE(S) Within 30 days between 2014-07-02 and 2014-07-02: Matches with BUY of 1 APU4 at of AUD 134,900 each 
 Commissions AUD 5 Taxes AUD 0  

Trades:
ID 879 Code APU4 Date 2014-07-02 00:55:51 Quantity 1 Price 5,396 Value per block 134,900

CALCULATION: (1*135150) - 5 - 0 -(1*134900) - 5 - 0  = 240 

********************************************************************************************************************************************

2: SELL 1 APU4 Futures on 02/07/2014 at AUD 135,750 each gives LOSS of AUD -2,060 equals GBP -1,132.23
 Commission AUD 5 and taxes AUD 0 on SELL
Trade details:ID 883 Code APU4 Date 2014-07-02 20:02:18 Quantity -1 Price 5,430 Value per block 135,750
Total allowable cost AUD 5   Total disposal proceeds AUD -2,055

Matches with:
SUBSEQUENT 1 TRADE(S) Within 30 days between 2014-08-17 and 2014-08-17: Matches with BUY of 1 APU4 at of AUD 137,800 each 
 Commissions AUD 5 Taxes AUD 0  

Trades:
ID 880 Code APU4 Date 2014-08-17 23:01:46 Quantity 1 Price 5,512 Value per block 137,800

CALCULATION: (1*135750) - 5 - 0 -(1*137800) - 5 - 0  = -2,060 

********************************************************************************************************************************************

3: SELL 1 APU4 Futures on 10/08/2014 at AUD 135,125 each gives LOSS of AUD -5,010 equals GBP -2,753.63
 Commission AUD 5 and taxes AUD 0 on SELL
Trade details:ID 884 Code APU4 Date 2014-08-10 21:18:42 Quantity -1 Price 5,405 Value per block 135,125
Total allowable cost AUD 5   Total disposal proceeds AUD -5,005

Matches with:
SUBSEQUENT 1 TRADE(S) Within 30 days between 2014-08-27 and 2014-08-27: Matches with BUY of 1 APU4 at of AUD 140,125 each 
 Commissions AUD 5 Taxes AUD 0  

Trades:
ID 881 Code APU4 Date 2014-08-27 20:20:07 Quantity 1 Price 5,605 Value per block 140,125

CALCULATION: (1*135125) - 5 - 0 -(1*140125) - 5 - 0  = -5,010 

********************************************************************************************************************************************

4: SELL 1 APU4 Futures on 14/09/2014 at AUD 137,400 each gives PROFIT of AUD 3,498 equals GBP 1,924.08
 Commission AUD 5 and taxes AUD 0 on SELL
Trade details:ID 885 Code APU4 Date 2014-09-14 20:28:27 Quantity -1 Price 5,496 Value per block 137,400
Total allowable cost AUD 5   Total disposal proceeds AUD 3,503.33

Matches with:
PRO-RATA SECTION 104: Quantity 1.000000 APU4 allocated from total holding of 3, made up of 2 trades between 2014-06-15 and 2014-06-16
 At average value of AUD 133,892 Commissions AUD 5 Taxes AUD 0  

Trades:
ID 877a Code APU4 Date 2014-06-15 20:02:40 Quantity 0.666667 Price 5,350 Value per block 133,750 (Allocated from: ID 877 Quantity 2)
ID 878a Code APU4 Date 2014-06-16 23:08:23 Quantity 0.333333 Price 5,367 Value per block 134,175 (Allocated from: ID 878 Quantity 1)

CALCULATION: (1*137400) - 5 - 0 -(1*133892) - 5 - 0  = 3,498 

********************************************************************************************************************************************

5: SELL 2 APU4 Futures on 18/09/2014 at AUD 135,528 each gives PROFIT of AUD 3,252 equals GBP 1,788.41
 Commission AUD 10 and taxes AUD 0 on SELL
Trade details:ID 886 Code APU4 Date 2014-09-18 00:00:00 Quantity -2 Price 5,421.10 Value per block 135,528
Total allowable cost AUD 10.0000   Total disposal proceeds AUD 3,261.67

Matches with:
PRO-RATA SECTION 104: Quantity 2.000000 APU4 allocated from total holding of 3, made up of 2 trades between 2014-06-15 and 2014-06-16
 At average value of AUD 133,892 Commissions AUD 10.0000 Taxes AUD 0  

Trades:
ID 877b Code APU4 Date 2014-06-15 20:02:40 Quantity 1.33333 Price 5,350 Value per block 133,750 (Allocated from: ID 877 Quantity 2)
ID 878b Code APU4 Date 2014-06-16 23:08:23 Quantity 0.666667 Price 5,367 Value per block 134,175 (Allocated from: ID 878 Quantity 1)

CALCULATION: (2*135528) - 10 - 0 -(2*133892) - 10.0000 - 0  = 3,252 

********************************************************************************************************************************************

1: SELL 1 APZ4 Futures on 28/09/2014 at AUD 131,825 each gives LOSS of AUD -6,535 equals GBP -3,628.85
 Commission AUD 5 and taxes AUD 0 on SELL
Trade details:ID 890 Code APZ4 Date 2014-09-28 20:26:21 Quantity -1 Price 5,273 Value per block 131,825
Total allowable cost AUD 5   Total disposal proceeds AUD -6,530

Matches with:
SUBSEQUENT 1 TRADE(S) Within 30 days between 2014-11-06 and 2014-11-06: Matches with BUY of 1 APZ4 at of AUD 138,350 each 
 Commissions AUD 5 Taxes AUD 0  

Trades:
ID 888 Code APZ4 Date 2014-11-06 20:25:29 Quantity 1 Price 5,534 Value per block 138,350

CALCULATION: (1*131825) - 5 - 0 -(1*138350) - 5 - 0  = -6,535 

********************************************************************************************************************************************

2: SELL 1 APZ4 Futures on 01/12/2014 at AUD 131,250 each gives LOSS of AUD -3,935 equals GBP -2,184.51
 Commission AUD 5 and taxes AUD 0 on SELL
Trade details:ID 891 Code APZ4 Date 2014-12-01 20:02:00 Quantity -1 Price 5,250 Value per block 131,250
Total allowable cost AUD 5   Total disposal proceeds AUD -3,930

Matches with:
PRO-RATA SECTION 104: Quantity 1.000000 APZ4 allocated from total holding of 3, made up of 2 trades between 2014-09-22 and 2014-11-11
 At average value of AUD 135,175 Commissions AUD 5 Taxes AUD 0  

Trades:
ID 887a Code APZ4 Date 2014-09-22 01:54:54 Quantity 0.666667 Price 5,361 Value per block 134,025 (Allocated from: ID 887 Quantity 2)
ID 889a Code APZ4 Date 2014-11-11 20:24:20 Quantity 0.333333 Price 5,499 Value per block 137,475 (Allocated from: ID 889 Quantity 1)

CALCULATION: (1*131250) - 5 - 0 -(1*135175) - 5 - 0  = -3,935 

********************************************************************************************************************************************

3: SELL 2 APZ4 Futures on 18/12/2014 at AUD 129,765 each gives LOSS of AUD -10,840 equals GBP -6,017.82
 Commission AUD 10 and taxes AUD 0 on SELL
Trade details:ID 892 Code APZ4 Date 2014-12-18 00:00:00 Quantity -2 Price 5,190.60 Value per block 129,765
Total allowable cost AUD 10.0000   Total disposal proceeds AUD -10,830.00

Matches with:
PRO-RATA SECTION 104: Quantity 2.000000 APZ4 allocated from total holding of 3, made up of 2 trades between 2014-09-22 and 2014-11-11
 At average value of AUD 135,175 Commissions AUD 10.0000 Taxes AUD 0  

Trades:
ID 887b Code APZ4 Date 2014-09-22 01:54:54 Quantity 1.33333 Price 5,361 Value per block 134,025 (Allocated from: ID 887 Quantity 2)
ID 889b Code APZ4 Date 2014-11-11 20:24:20 Quantity 0.666667 Price 5,499 Value per block 137,475 (Allocated from: ID 889 Quantity 1)

CALCULATION: (2*129765) - 10 - 0 -(2*135175) - 10.0000 - 0  = -10,840 

********************************************************************************************************************************************

1: CLOSE SHORT 100000 AUD.USD Forex on 16/12/2014 at USD 0.821980 each gives LOSS of USD -99 equals GBP -59.7284
 Commission USD 1.28000 and taxes USD 0 on CLOSE SHORT
Trade details:ID 0 Code AUD.USD Date 2014-12-16 03:28:07 Quantity 100,000 Price 0.821980 Value per block 0.821980
Total allowable cost USD 0   Total disposal proceeds USD -99.2800

Matches with:
PRO-RATA SECTION 104: Quantity 100000.000000 AUD.USD allocated from total holding of -100,000, made up of 1 trades between 2014-12-15 and 2014-12-15
 At average value of USD 0.821000 Commissions USD 0 Taxes USD 0  

Trades:
ID 1 Code AUD.USD Date 2014-12-15 00:00:00 Quantity -100,000 Price 0.821000 Value per block 0.821000

CALCULATION: -(100000*0.821980) - 1.28000 - 0 +(100000*0.821000) - 0 - 0  = -99 

********************************************************************************************************************************************

1: CLOSE SHORT 1 BPH5 Futures on 09/01/2015 at USD 94,731.25 each gives PROFIT of USD 51 equals GBP 30.8809
 Commission USD 2.46000 and taxes USD 0 on CLOSE SHORT
Trade details:ID 111 Code BPH5 Date 2015-01-09 13:51:41 Quantity 1 Price 1.51570 Value per block 94,731.25
Total allowable cost USD 2.46000   Total disposal proceeds USD 53.7900

Matches with:
SUBSEQUENT 1 TRADE(S) Within 30 days between 2015-01-12 and 2015-01-12: Matches with OPEN SHORT of 1 BPH5 at of USD 94,787.50 each 
 Commissions USD 2.46000 Taxes USD 0  

Trades:
ID 116 Code BPH5 Date 2015-01-12 20:29:55 Quantity -1 Price 1.51660 Value per block 94,787.50

CALCULATION: -(1*94731.25) - 2.46000 - 0 +(1*94787.50) - 2.46000 - 0  = 51 

********************************************************************************************************************************************

2: CLOSE SHORT 1 BPH5 Futures on 27/01/2015 at USD 94,931.25 each gives LOSS of USD -849 equals GBP -510.573
 Commission USD 2.46000 and taxes USD 0 on CLOSE SHORT
Trade details:ID 112 Code BPH5 Date 2015-01-27 11:32:46 Quantity 1 Price 1.51890 Value per block 94,931.25
Total allowable cost USD 2.46000   Total disposal proceeds USD -846.210

Matches with:
SUBSEQUENT 1 TRADE(S) Within 30 days between 2015-02-02 and 2015-02-02: Matches with OPEN SHORT of 1 BPH5 at of USD 94,087.50 each 
 Commissions USD 2.46000 Taxes USD 0  

Trades:
ID 117 Code BPH5 Date 2015-02-02 02:53:26 Quantity -1 Price 1.50540 Value per block 94,087.50

CALCULATION: -(1*94931.25) - 2.46000 - 0 +(1*94087.50) - 2.46000 - 0  = -849 

********************************************************************************************************************************************

3: CLOSE SHORT 1 BPH5 Futures on 03/02/2015 at USD 94,581.25 each gives PROFIT of USD 1,486 equals GBP 893.824
 Commission USD 2.46000 and taxes USD 0 on CLOSE SHORT
Trade details:ID 113 Code BPH5 Date 2015-02-03 11:36:00 Quantity 1 Price 1.51330 Value per block 94,581.25
Total allowable cost USD 2.46000   Total disposal proceeds USD 1,488.16

Matches with:
PRO-RATA SECTION 104: Quantity 1.000000 BPH5 allocated from total holding of -2, made up of 2 trades between 2014-12-16 and 2015-01-08
 At average value of USD 96,071.88 Commissions USD 2.46000 Taxes USD 0  

Trades:
ID 114a Code BPH5 Date 2014-12-16 01:55:00 Quantity -0.500000 Price 1.56510 Value per block 97,818.75 (Allocated from: ID 114 Quantity -1)
ID 115a Code BPH5 Date 2015-01-08 20:31:07 Quantity -0.500000 Price 1.50920 Value per block 94,325 (Allocated from: ID 115 Quantity -1)

CALCULATION: -(1*94581.25) - 2.46000 - 0 +(1*96071.88) - 2.46000 - 0  = 1,486 

********************************************************************************************************************************************

1: SELL 1 BPU4 Futures on 02/07/2014 at USD 107,188 each gives PROFIT of USD 64 equals GBP 38.3891
 Commission USD 2.47000 and taxes USD 0 on SELL
Trade details:ID 120 Code BPU4 Date 2014-07-02 05:58:28 Quantity -1 Price 1.71500 Value per block 107,188
Total allowable cost USD 2.47000   Total disposal proceeds USD 66.2800

Matches with:
SAME DAY TRADE(S) Matches with BUY of 1 BPU4 at average of USD 107,119 each 
 Commissions USD 2.47000 Taxes USD 0 

Trades:
ID 118a Code BPU4 Date 2014-07-02 00:19:13 Quantity 1 Price 1.71390 Value per block 107,119 (Allocated from: ID 118 Quantity 2)

CALCULATION: (1*107188) - 2.47000 - 0 -(1*107119) - 2.47000 - 0  = 64 

********************************************************************************************************************************************

2: SELL 1 BPU4 Futures on 04/07/2014 at USD 107,156 each gives PROFIT of USD 6,439 equals GBP 3,873.69
 Commission USD 2.47000 and taxes USD 0 on SELL
Trade details:ID 121 Code BPU4 Date 2014-07-04 03:39:18 Quantity -1 Price 1.71450 Value per block 107,156
Total allowable cost USD 2.47000   Total disposal proceeds USD 6,441.28

Matches with:
SUBSEQUENT 1 TRADE(S) Within 30 days between 2014-09-09 and 2014-09-09: Matches with BUY of 1 BPU4 at of USD 100,712 each 
 Commissions USD 2.47000 Taxes USD 0  

Trades:
ID 119 Code BPU4 Date 2014-09-09 09:09:56 Quantity 1 Price 1.61140 Value per block 100,712

CALCULATION: (1*107156) - 2.47000 - 0 -(1*100712) - 2.47000 - 0  = 6,439 

********************************************************************************************************************************************

3: SELL 1 BPU4 Futures on 04/09/2014 at USD 101,850 each gives LOSS of USD -5,274 equals GBP -3,172.74
 Commission USD 2.47000 and taxes USD 0 on SELL
Trade details:ID 122 Code BPU4 Date 2014-09-04 20:51:05 Quantity -1 Price 1.62960 Value per block 101,850
Total allowable cost USD 2.47000   Total disposal proceeds USD -5,271.22

Matches with:
PRO-RATA SECTION 104: Quantity 1.000000 BPU4 allocated from total holding of 2, made up of 1 trades between 2014-07-02 and 2014-07-02
 At average value of USD 107,119 Commissions USD 2.47000 Taxes USD 0  

Trades:
ID 118b Code BPU4 Date 2014-07-02 00:19:13 Quantity 1 Price 1.71390 Value per block 107,119 (Allocated from: ID 118 Quantity 2)

CALCULATION: (1*101850) - 2.47000 - 0 -(1*107119) - 2.47000 - 0  = -5,274 

********************************************************************************************************************************************

1: CLOSE SHORT 1 BPZ4 Futures on 03/10/2014 at USD 99,681.25 each gives LOSS of USD -80 equals GBP -48.0811
 Commission USD 2.46000 and taxes USD 0 on CLOSE SHORT
Trade details:ID 123 Code BPZ4 Date 2014-10-03 10:39:53 Quantity 1 Price 1.59490 Value per block 99,681.25
Total allowable cost USD 2.46000   Total disposal proceeds USD -77.4600

Matches with:
SUBSEQUENT 1 TRADE(S) Within 30 days between 2014-11-02 and 2014-11-02: Matches with OPEN SHORT of 1 BPZ4 at of USD 99,606.25 each 
 Commissions USD 2.46000 Taxes USD 0  

Trades:
ID 130 Code BPZ4 Date 2014-11-02 20:41:58 Quantity -1 Price 1.59370 Value per block 99,606.25

CALCULATION: -(1*99681.25) - 2.46000 - 0 +(1*99606.25) - 2.46000 - 0  = -80 

********************************************************************************************************************************************

2: CLOSE SHORT 1 BPZ4 Futures on 16/10/2014 at USD 99,800 each gives LOSS of USD -2,199 equals GBP -1,322.75
 Commission USD 2.46000 and taxes USD 0 on CLOSE SHORT
Trade details:ID 124 Code BPZ4 Date 2014-10-16 01:37:10 Quantity 1 Price 1.59680 Value per block 99,800
Total allowable cost USD 2.46000   Total disposal proceeds USD -2,196.21

Matches with:
SUBSEQUENT 1 TRADE(S) Within 30 days between 2014-11-19 and 2014-11-19: Matches with OPEN SHORT of 1 BPZ4 at of USD 97,606.25 each 
 Commissions USD 2.46000 Taxes USD 0  

Trades:
ID 131 Code BPZ4 Date 2014-11-19 01:04:49 Quantity -1 Price 1.56170 Value per block 97,606.25

CALCULATION: -(1*99800) - 2.46000 - 0 +(1*97606.25) - 2.46000 - 0  = -2,199 

********************************************************************************************************************************************

3: CLOSE SHORT 1 BPZ4 Futures on 17/11/2014 at USD 98,243.75 each gives LOSS of USD -405 equals GBP -243.606
 Commission USD 2.46000 and taxes USD 0 on CLOSE SHORT
Trade details:ID 125 Code BPZ4 Date 2014-11-17 01:01:29 Quantity 1 Price 1.57190 Value per block 98,243.75
Total allowable cost USD 2.46000   Total disposal proceeds USD -402.460

Matches with:
SUBSEQUENT 1 TRADE(S) Within 30 days between 2014-11-23 and 2014-11-23: Matches with OPEN SHORT of 1 BPZ4 at of USD 97,843.75 each 
 Commissions USD 2.46000 Taxes USD 0  

Trades:
ID 132 Code BPZ4 Date 2014-11-23 20:48:12 Quantity -1 Price 1.56550 Value per block 97,843.75

CALCULATION: -(1*98243.75) - 2.46000 - 0 +(1*97843.75) - 2.46000 - 0  = -405 

********************************************************************************************************************************************

4: CLOSE SHORT 1 BPZ4 Futures on 21/11/2014 at USD 97,993.75 each gives PROFIT of USD 2,917 equals GBP 1,754.88
 Commission USD 2.46000 and taxes USD 0 on CLOSE SHORT
Trade details:ID 126 Code BPZ4 Date 2014-11-21 01:19:03 Quantity 1 Price 1.56790 Value per block 97,993.75
Total allowable cost USD 2.47000   Total disposal proceeds USD 2,919.41

Matches with:
PRO-RATA SECTION 104: Quantity 1.000000 BPZ4 allocated from total holding of -2, made up of 2 trades between 2014-09-09 and 2014-10-01
 At average value of USD 100,916 Commissions USD 2.47000 Taxes USD 0  

Trades:
ID 128a Code BPZ4 Date 2014-09-09 09:09:56 Quantity -0.500000 Price 1.61010 Value per block 100,631 (Allocated from: ID 128 Quantity -1)
ID 129a Code BPZ4 Date 2014-10-01 06:00:22 Quantity -0.500000 Price 1.61920 Value per block 101,200 (Allocated from: ID 129 Quantity -1)

CALCULATION: -(1*97993.75) - 2.46000 - 0 +(1*100916) - 2.47000 - 0  = 2,917 

********************************************************************************************************************************************

5: CLOSE SHORT 1 BPZ4 Futures on 15/12/2014 at USD 97,668.75 each gives PROFIT of USD 3,242 equals GBP 1,950.41
 Commission USD 2.46000 and taxes USD 0 on CLOSE SHORT
Trade details:ID 127 Code BPZ4 Date 2014-12-15 00:00:00 Quantity 1 Price 1.56270 Value per block 97,668.75
Total allowable cost USD 2.47000   Total disposal proceeds USD 3,244.41

Matches with:
PRO-RATA SECTION 104: Quantity 1.000000 BPZ4 allocated from total holding of -2, made up of 2 trades between 2014-09-09 and 2014-10-01
 At average value of USD 100,916 Commissions USD 2.47000 Taxes USD 0  

Trades:
ID 128b Code BPZ4 Date 2014-09-09 09:09:56 Quantity -0.500000 Price 1.61010 Value per block 100,631 (Allocated from: ID 128 Quantity -1)
ID 129b Code BPZ4 Date 2014-10-01 06:00:22 Quantity -0.500000 Price 1.61920 Value per block 101,200 (Allocated from: ID 129 Quantity -1)

CALCULATION: -(1*97668.75) - 2.46000 - 0 +(1*100916) - 2.47000 - 0  = 3,242 

********************************************************************************************************************************************

1: SELL 46000 BRWMl Stocks on 09/12/2014 at GBP 3.12460 each gives LOSS of GBP -18,473 equals GBP -18,473.26
 Commission GBP 29 and taxes GBP 0 on SELL
Trade details:ID 2021 Code BRWMl Date 2014-12-09 08:13:53 Quantity -46,000 Price 3.12460 Value per block 3.12460
Total allowable cost GBP 162,176   Total disposal proceeds GBP 143,702

Matches with:
PRO-RATA SECTION 104: Quantity 46000.000000 BRWMl allocated from total holding of 46,000, made up of 2 trades between 2014-11-03 and 2014-11-03
 At average value of GBP 3.50710 Commissions GBP 42.6700 Taxes GBP 806.630  

Trades:
ID 42 Code BRWMl Date 2014-11-03 04:05:57 Quantity 23,000 Price 3.51635 Value per block 3.51635
ID 43 Code BRWMl Date 2014-11-03 04:13:29 Quantity 23,000 Price 3.49785 Value per block 3.49785

CALCULATION: (46000*3.12460) - 29 - 0 -(46000*3.50710) - 42.6700 - 806.630  = -18,473 

********************************************************************************************************************************************

1: CLOSE SHORT 1 CDU4 Futures on 27/08/2014 at USD 92,030 each gives LOSS of USD -395 equals GBP -237.602
 Commission USD 2.47000 and taxes USD 0 on CLOSE SHORT
Trade details:ID 133 Code CDU4 Date 2014-08-27 20:32:12 Quantity 1 Price 0.920300 Value per block 92,030
Total allowable cost USD 2.47000   Total disposal proceeds USD -392.470

Matches with:
SUBSEQUENT 1 TRADE(S) Within 30 days between 2014-09-08 and 2014-09-08: Matches with OPEN SHORT of 1 CDU4 at of USD 91,640 each 
 Commissions USD 2.47000 Taxes USD 0  

Trades:
ID 136 Code CDU4 Date 2014-09-08 08:34:45 Quantity -1 Price 0.916400 Value per block 91,640

CALCULATION: -(1*92030) - 2.47000 - 0 +(1*91640) - 2.47000 - 0  = -395 

********************************************************************************************************************************************

2: CLOSE SHORT 1 CDU4 Futures on 09/09/2014 at USD 91,190 each gives LOSS of USD -195 equals GBP -117.279
 Commission USD 2.47000 and taxes USD 0 on CLOSE SHORT
Trade details:ID 134 Code CDU4 Date 2014-09-09 08:50:43 Quantity 1 Price 0.911900 Value per block 91,190
Total allowable cost USD 2.47000   Total disposal proceeds USD -192.470

Matches with:
PRO-RATA SECTION 104: Quantity 1.000000 CDU4 allocated from total holding of -1, made up of 1 trades between 2014-08-20 and 2014-08-20
 At average value of USD 91,000 Commissions USD 2.47000 Taxes USD 0  

Trades:
ID 135 Code CDU4 Date 2014-08-20 23:12:25 Quantity -1 Price 0.910000 Value per block 91,000

CALCULATION: -(1*91190) - 2.47000 - 0 +(1*91000) - 2.47000 - 0  = -195 

********************************************************************************************************************************************

1: CLOSE SHORT 1 CDZ4 Futures on 06/10/2014 at USD 89,230 each gives LOSS of USD -85 equals GBP -51.0892
 Commission USD 2.46000 and taxes USD 0 on CLOSE SHORT
Trade details:ID 137 Code CDZ4 Date 2014-10-06 10:17:27 Quantity 1 Price 0.892300 Value per block 89,230
Total allowable cost USD 2.46000   Total disposal proceeds USD -82.4600

Matches with:
SUBSEQUENT 1 TRADE(S) Within 30 days between 2014-10-30 and 2014-10-30: Matches with OPEN SHORT of 1 CDZ4 at of USD 89,150 each 
 Commissions USD 2.46000 Taxes USD 0  

Trades:
ID 145 Code CDZ4 Date 2014-10-30 02:11:53 Quantity -1 Price 0.891500 Value per block 89,150

CALCULATION: -(1*89230) - 2.46000 - 0 +(1*89150) - 2.46000 - 0  = -85 

********************************************************************************************************************************************

2: CLOSE SHORT 1 CDZ4 Futures on 28/10/2014 at USD 89,410 each gives LOSS of USD -1,365 equals GBP -821.158
 Commission USD 2.46000 and taxes USD 0 on CLOSE SHORT
Trade details:ID 138 Code CDZ4 Date 2014-10-28 11:16:54 Quantity 1 Price 0.894100 Value per block 89,410
Total allowable cost USD 2.46000   Total disposal proceeds USD -1,362.46

Matches with:
SUBSEQUENT 1 TRADE(S) Within 30 days between 2014-11-19 and 2014-11-19: Matches with OPEN SHORT of 1 CDZ4 at of USD 88,050 each 
 Commissions USD 2.46000 Taxes USD 0  

Trades:
ID 146 Code CDZ4 Date 2014-11-19 20:45:03 Quantity -1 Price 0.880500 Value per block 88,050

CALCULATION: -(1*89410) - 2.46000 - 0 +(1*88050) - 2.46000 - 0  = -1,365 

********************************************************************************************************************************************

3: CLOSE SHORT 1 CDZ4 Futures on 16/11/2014 at USD 88,550 each gives LOSS of USD -285 equals GBP -171.412
 Commission USD 2.46000 and taxes USD 0 on CLOSE SHORT
Trade details:ID 139 Code CDZ4 Date 2014-11-16 20:39:00 Quantity 1 Price 0.885500 Value per block 88,550
Total allowable cost USD 2.46000   Total disposal proceeds USD -282.460

Matches with:
SUBSEQUENT 1 TRADE(S) Within 30 days between 2014-11-21 and 2014-11-21: Matches with OPEN SHORT of 1 CDZ4 at of USD 88,270 each 
 Commissions USD 2.46000 Taxes USD 0  

Trades:
ID 147 Code CDZ4 Date 2014-11-21 04:17:30 Quantity -1 Price 0.882700 Value per block 88,270

CALCULATION: -(1*88550) - 2.46000 - 0 +(1*88270) - 2.46000 - 0  = -285 

********************************************************************************************************************************************

4: CLOSE SHORT 1 CDZ4 Futures on 21/11/2014 at USD 88,370 each gives LOSS of USD -705 equals GBP -424.091
 Commission USD 2.46000 and taxes USD 0 on CLOSE SHORT
Trade details:ID 140 Code CDZ4 Date 2014-11-21 01:14:03 Quantity 1 Price 0.883700 Value per block 88,370
Total allowable cost USD 2.46000   Total disposal proceeds USD -702.460

Matches with:
SUBSEQUENT 1 TRADE(S) Within 30 days between 2014-12-05 and 2014-12-05: Matches with OPEN SHORT of 1 CDZ4 at of USD 87,670 each 
 Commissions USD 2.46000 Taxes USD 0  

Trades:
ID 148 Code CDZ4 Date 2014-12-05 04:12:58 Quantity -1 Price 0.876700 Value per block 87,670

CALCULATION: -(1*88370) - 2.46000 - 0 +(1*87670) - 2.46000 - 0  = -705 

********************************************************************************************************************************************

5: CLOSE SHORT 1 CDZ4 Futures on 28/11/2014 at USD 87,760 each gives PROFIT of USD 2,433 equals GBP 1,463.47
 Commission USD 2.46000 and taxes USD 0 on CLOSE SHORT
Trade details:ID 141 Code CDZ4 Date 2014-11-28 06:33:29 Quantity 1 Price 0.877600 Value per block 87,760
Total allowable cost USD 2.47000   Total disposal proceeds USD 2,435.04

Matches with:
PRO-RATA SECTION 104: Quantity 1.000000 CDZ4 allocated from total holding of -2, made up of 2 trades between 2014-09-09 and 2014-09-28
 At average value of USD 90,197.50 Commissions USD 2.47000 Taxes USD 0  

Trades:
ID 143a Code CDZ4 Date 2014-09-09 08:50:43 Quantity -0.500000 Price 0.909950 Value per block 90,995 (Allocated from: ID 143 Quantity -1)
ID 144a Code CDZ4 Date 2014-09-28 21:43:08 Quantity -0.500000 Price 0.894000 Value per block 89,400 (Allocated from: ID 144 Quantity -1)

CALCULATION: -(1*87760) - 2.46000 - 0 +(1*90197.50) - 2.47000 - 0  = 2,433 

********************************************************************************************************************************************

6: CLOSE SHORT 1 CDZ4 Futures on 15/12/2014 at USD 86,410 each gives PROFIT of USD 3,783 equals GBP 2,275.65
 Commission USD 2.46000 and taxes USD 0 on CLOSE SHORT
Trade details:ID 142 Code CDZ4 Date 2014-12-15 04:45:22 Quantity 1 Price 0.864100 Value per block 86,410
Total allowable cost USD 2.47000   Total disposal proceeds USD 3,785.04

Matches with:
PRO-RATA SECTION 104: Quantity 1.000000 CDZ4 allocated from total holding of -2, made up of 2 trades between 2014-09-09 and 2014-09-28
 At average value of USD 90,197.50 Commissions USD 2.47000 Taxes USD 0  

Trades:
ID 143b Code CDZ4 Date 2014-09-09 08:50:43 Quantity -0.500000 Price 0.909950 Value per block 90,995 (Allocated from: ID 143 Quantity -1)
ID 144b Code CDZ4 Date 2014-09-28 21:43:08 Quantity -0.500000 Price 0.894000 Value per block 89,400 (Allocated from: ID 144 Quantity -1)

CALCULATION: -(1*86410) - 2.46000 - 0 +(1*90197.50) - 2.47000 - 0  = 3,783 

********************************************************************************************************************************************

1: SELL 20448 CGLl Stocks on 07/01/2015 at GBP 6.48213 each gives PROFIT of GBP 32,190 equals GBP 32,189.86
 Commission GBP 29 and taxes GBP 0 on SELL
Trade details:ID 2022 Code CGLl Date 2015-01-07 04:44:59 Quantity -20,448 Price 6.48213 Value per block 6.48213
Total allowable cost GBP 100,328   Total disposal proceeds GBP 132,518

Matches with:
PRO-RATA SECTION 104: Quantity 20448.000000 CGLl allocated from total holding of 20,448, made up of 2 trades between 2011-03-02 and 2014-11-03
 At average value of GBP 4.90479 Commissions GBP 33.6500 Taxes GBP 1  

Trades:
ID 2037 Code CGLl Date 2011-03-02 00:00:00 Quantity 5,448 Price 3.66802 Value per block 3.66802
ID 44 Code CGLl Date 2014-11-03 03:56:14 Quantity 15,000 Price 5.35398 Value per block 5.35399

CALCULATION: (20448*6.48213) - 29 - 0 -(20448*4.90479) - 33.6500 - 1  = 32,190 

********************************************************************************************************************************************

1: SELL 1 CLZ4 Futures on 30/04/2014 at USD 94,770 each gives LOSS of USD -685 equals GBP -411.890
 Commission USD 2.32000 and taxes USD 0 on SELL
Trade details:ID 152 Code CLZ4 Date 2014-04-30 13:24:56 Quantity -1 Price 94.7700 Value per block 94,770
Total allowable cost USD 2.32000   Total disposal proceeds USD -682.320

Matches with:
SUBSEQUENT 1 TRADE(S) Within 30 days between 2014-05-09 and 2014-05-09: Matches with BUY of 1 CLZ4 at of USD 95,450 each 
 Commissions USD 2.32000 Taxes USD 0  

Trades:
ID 150 Code CLZ4 Date 2014-05-09 08:48:22 Quantity 1 Price 95.4500 Value per block 95,450

CALCULATION: (1*94770) - 2.32000 - 0 -(1*95450) - 2.32000 - 0  = -685 

********************************************************************************************************************************************

2: SELL 1 CLZ4 Futures on 04/07/2014 at USD 101,070 each gives PROFIT of USD 2,810 equals GBP 1,690.76
 Commission USD 2.32000 and taxes USD 0 on SELL
Trade details:ID 153 Code CLZ4 Date 2014-07-04 10:50:36 Quantity -1 Price 101.070 Value per block 101,070
Total allowable cost USD 2.32000   Total disposal proceeds USD 2,812.68

Matches with:
PRO-RATA SECTION 104: Quantity 1.000000 CLZ4 allocated from total holding of 2, made up of 2 trades between 2014-04-11 and 2014-06-11
 At average value of USD 98,255 Commissions USD 2.32000 Taxes USD 0  

Trades:
ID 149a Code CLZ4 Date 2014-04-11 11:42:42 Quantity 0.500000 Price 96.8200 Value per block 96,820 (Allocated from: ID 149 Quantity 1)
ID 151a Code CLZ4 Date 2014-06-11 13:33:00 Quantity 0.500000 Price 99.6900 Value per block 99,690 (Allocated from: ID 151 Quantity 1)

CALCULATION: (1*101070) - 2.32000 - 0 -(1*98255) - 2.32000 - 0  = 2,810 

********************************************************************************************************************************************

3: SELL 1 CLZ4 Futures on 14/07/2014 at USD 98,210 each gives LOSS of USD -50 equals GBP -29.8642
 Commission USD 2.32000 and taxes USD 0 on SELL
Trade details:ID 154 Code CLZ4 Date 2014-07-14 07:25:18 Quantity -1 Price 98.2100 Value per block 98,210
Total allowable cost USD 2.32000   Total disposal proceeds USD -47.3200

Matches with:
PRO-RATA SECTION 104: Quantity 1.000000 CLZ4 allocated from total holding of 2, made up of 2 trades between 2014-04-11 and 2014-06-11
 At average value of USD 98,255 Commissions USD 2.32000 Taxes USD 0  

Trades:
ID 149b Code CLZ4 Date 2014-04-11 11:42:42 Quantity 0.500000 Price 96.8200 Value per block 96,820 (Allocated from: ID 149 Quantity 1)
ID 151b Code CLZ4 Date 2014-06-11 13:33:00 Quantity 0.500000 Price 99.6900 Value per block 99,690 (Allocated from: ID 151 Quantity 1)

CALCULATION: (1*98210) - 2.32000 - 0 -(1*98255) - 2.32000 - 0  = -50 

********************************************************************************************************************************************

1: CLOSE SHORT 1 CLZ5 Futures on 22/12/2014 at USD 60,660 each gives LOSS of USD -2,965 equals GBP -1,783.56
 Commission USD 2.31000 and taxes USD 0 on CLOSE SHORT
Trade details:ID 155 Code CLZ5 Date 2014-12-22 07:15:35 Quantity 1 Price 60.6600 Value per block 60,660
Total allowable cost USD 2.31000   Total disposal proceeds USD -2,962.31

Matches with:
SUBSEQUENT 1 TRADE(S) Within 30 days between 2015-01-05 and 2015-01-05: Matches with OPEN SHORT of 1 CLZ5 at of USD 57,700 each 
 Commissions USD 2.31000 Taxes USD 0  

Trades:
ID 159 Code CLZ5 Date 2015-01-05 07:38:23 Quantity -1 Price 57.7000 Value per block 57,700

CALCULATION: -(1*60660) - 2.31000 - 0 +(1*57700) - 2.31000 - 0  = -2,965 

********************************************************************************************************************************************

2: CLOSE SHORT 1 CLZ5 Futures on 03/02/2015 at USD 59,290 each gives PROFIT of USD 9,515 equals GBP 5,724.60
 Commission USD 2.31000 and taxes USD 0 on CLOSE SHORT
Trade details:ID 156 Code CLZ5 Date 2015-02-03 07:42:23 Quantity 1 Price 59.2900 Value per block 59,290
Total allowable cost USD 2.31000   Total disposal proceeds USD 9,517.69

Matches with:
PRO-RATA SECTION 104: Quantity 1.000000 CLZ5 allocated from total holding of -2, made up of 2 trades between 2014-11-06 and 2014-12-19
 At average value of USD 68,810 Commissions USD 2.31000 Taxes USD 0  

Trades:
ID 157a Code CLZ5 Date 2014-11-06 07:26:58 Quantity -0.500000 Price 78.6900 Value per block 78,690 (Allocated from: ID 157 Quantity -1)
ID 158a Code CLZ5 Date 2014-12-19 07:18:14 Quantity -0.500000 Price 58.9300 Value per block 58,930 (Allocated from: ID 158 Quantity -1)

CALCULATION: -(1*59290) - 2.31000 - 0 +(1*68810) - 2.31000 - 0  = 9,515 

********************************************************************************************************************************************

1: SELL 23000 CNAl Stocks on 04/12/2014 at GBP 2.85027 each gives LOSS of GBP -3,679 equals GBP -3,679.33
 Commission GBP 13.7800 and taxes GBP 0 on SELL
Trade details:ID 46 Code CNAl Date 2014-12-04 08:20:19 Quantity -23,000 Price 2.85027 Value per block 2.85027
Total allowable cost GBP 69,221.75   Total disposal proceeds GBP 65,542.42

Matches with:
PRO-RATA SECTION 104: Quantity 23000.000000 CNAl allocated from total holding of 23,000, made up of 1 trades between 2014-11-03 and 2014-11-03
 At average value of GBP 2.99400 Commissions GBP 15.4300 Taxes GBP 344.310  

Trades:
ID 45 Code CNAl Date 2014-11-03 04:01:44 Quantity 23,000 Price 2.99400 Value per block 2.99400

CALCULATION: (23000*2.85027) - 13.7800 - 0 -(23000*2.99400) - 15.4300 - 344.310  = -3,679 

********************************************************************************************************************************************

1: CLOSE SHORT 1 ECU4 Futures on 15/08/2014 at USD 167,400 each gives LOSS of USD -905 equals GBP -544.426
 Commission USD 2.47000 and taxes USD 0 on CLOSE SHORT
Trade details:ID 161 Code ECU4 Date 2014-08-15 08:45:10 Quantity 1 Price 1.33920 Value per block 167,400
Total allowable cost USD 2.47000   Total disposal proceeds USD -902.470

Matches with:
SUBSEQUENT 1 TRADE(S) Within 30 days between 2014-08-19 and 2014-08-19: Matches with OPEN SHORT of 1 ECU4 at of USD 166,500 each 
 Commissions USD 2.47000 Taxes USD 0  

Trades:
ID 164 Code ECU4 Date 2014-08-19 12:18:00 Quantity -1 Price 1.33200 Value per block 166,500

CALCULATION: -(1*167400) - 2.47000 - 0 +(1*166500) - 2.47000 - 0  = -905 

********************************************************************************************************************************************

2: CLOSE SHORT 1 ECU4 Futures on 09/09/2014 at USD 161,350 each gives PROFIT of USD 5,783 equals GBP 3,478.88
 Commission USD 2.47000 and taxes USD 0 on CLOSE SHORT
Trade details:ID 162 Code ECU4 Date 2014-09-09 08:54:18 Quantity 1 Price 1.29080 Value per block 161,350
Total allowable cost USD 2.47000   Total disposal proceeds USD 5,785.03

Matches with:
PRO-RATA SECTION 104: Quantity 1.000000 ECU4 allocated from total holding of -1, made up of 1 trades between 2014-08-11 and 2014-08-11
 At average value of USD 167,138 Commissions USD 2.47000 Taxes USD 0  

Trades:
ID 163 Code ECU4 Date 2014-08-11 21:30:34 Quantity -1 Price 1.33710 Value per block 167,138

CALCULATION: -(1*161350) - 2.47000 - 0 +(1*167138) - 2.47000 - 0  = 5,783 

********************************************************************************************************************************************

1: CLOSE SHORT 1 ECZ4 Futures on 02/10/2014 at USD 158,350 each gives PROFIT of USD 45 equals GBP 27.1208
 Commission USD 2.46000 and taxes USD 0 on CLOSE SHORT
Trade details:ID 165 Code ECZ4 Date 2014-10-02 20:46:59 Quantity 1 Price 1.26680 Value per block 158,350
Total allowable cost USD 2.46000   Total disposal proceeds USD 47.5400

Matches with:
SUBSEQUENT 1 TRADE(S) Within 30 days between 2014-10-10 and 2014-10-10: Matches with OPEN SHORT of 1 ECZ4 at of USD 158,400 each 
 Commissions USD 2.46000 Taxes USD 0  

Trades:
ID 174 Code ECZ4 Date 2014-10-10 05:56:34 Quantity -1 Price 1.26720 Value per block 158,400

CALCULATION: -(1*158350) - 2.46000 - 0 +(1*158400) - 2.46000 - 0  = 45 

********************************************************************************************************************************************

2: CLOSE SHORT 1 ECZ4 Futures on 09/10/2014 at USD 159,375 each gives LOSS of USD -1,280 equals GBP -770.020
 Commission USD 2.46000 and taxes USD 0 on CLOSE SHORT
Trade details:ID 166 Code ECZ4 Date 2014-10-09 01:23:02 Quantity 1 Price 1.27500 Value per block 159,375
Total allowable cost USD 2.46000   Total disposal proceeds USD -1,277.46

Matches with:
SUBSEQUENT 1 TRADE(S) Within 30 days between 2014-10-14 and 2014-10-14: Matches with OPEN SHORT of 1 ECZ4 at of USD 158,100 each 
 Commissions USD 2.46000 Taxes USD 0  

Trades:
ID 175 Code ECZ4 Date 2014-10-14 20:44:53 Quantity -1 Price 1.26480 Value per block 158,100

CALCULATION: -(1*159375) - 2.46000 - 0 +(1*158100) - 2.46000 - 0  = -1,280 

********************************************************************************************************************************************

3: CLOSE SHORT 1 ECZ4 Futures on 13/10/2014 at USD 159,200 each gives LOSS of USD -3,130 equals GBP -1,883.01
 Commission USD 2.46000 and taxes USD 0 on CLOSE SHORT
Trade details:ID 167 Code ECZ4 Date 2014-10-13 21:55:06 Quantity 1 Price 1.27360 Value per block 159,200
Total allowable cost USD 2.46000   Total disposal proceeds USD -3,127.46

Matches with:
SUBSEQUENT 1 TRADE(S) Within 30 days between 2014-11-03 and 2014-11-03: Matches with OPEN SHORT of 1 ECZ4 at of USD 156,075 each 
 Commissions USD 2.46000 Taxes USD 0  

Trades:
ID 176 Code ECZ4 Date 2014-11-03 00:50:01 Quantity -1 Price 1.24860 Value per block 156,075

CALCULATION: -(1*159200) - 2.46000 - 0 +(1*156075) - 2.46000 - 0  = -3,130 

********************************************************************************************************************************************

4: CLOSE SHORT 1 ECZ4 Futures on 15/10/2014 at USD 160,450 each gives LOSS of USD -5,630 equals GBP -3,387.05
 Commission USD 2.46000 and taxes USD 0 on CLOSE SHORT
Trade details:ID 168 Code ECZ4 Date 2014-10-15 20:49:51 Quantity 1 Price 1.28360 Value per block 160,450
Total allowable cost USD 2.46000   Total disposal proceeds USD -5,627.46

Matches with:
SUBSEQUENT 1 TRADE(S) Within 30 days between 2014-11-23 and 2014-11-23: Matches with OPEN SHORT of 1 ECZ4 at of USD 154,825 each 
 Commissions USD 2.46000 Taxes USD 0  

Trades:
ID 177 Code ECZ4 Date 2014-11-23 20:35:34 Quantity -1 Price 1.23860 Value per block 154,825

CALCULATION: -(1*160450) - 2.46000 - 0 +(1*154825) - 2.46000 - 0  = -5,630 

********************************************************************************************************************************************

5: CLOSE SHORT 1 ECZ4 Futures on 11/11/2014 at USD 155,750 each gives LOSS of USD -105 equals GBP -63.1215
 Commission USD 2.46000 and taxes USD 0 on CLOSE SHORT
Trade details:ID 169 Code ECZ4 Date 2014-11-11 20:34:02 Quantity 1 Price 1.24600 Value per block 155,750
Total allowable cost USD 2.46000   Total disposal proceeds USD -102.460

Matches with:
SUBSEQUENT 1 TRADE(S) Within 30 days between 2014-11-28 and 2014-11-28: Matches with OPEN SHORT of 1 ECZ4 at of USD 155,650 each 
 Commissions USD 2.46000 Taxes USD 0  

Trades:
ID 178 Code ECZ4 Date 2014-11-28 06:29:04 Quantity -1 Price 1.24520 Value per block 155,650

CALCULATION: -(1*155750) - 2.46000 - 0 +(1*155650) - 2.46000 - 0  = -105 

********************************************************************************************************************************************

6: CLOSE SHORT 1 ECZ4 Futures on 26/11/2014 at USD 156,275 each gives PROFIT of USD 3,767 equals GBP 2,266.25
 Commission USD 2.46000 and taxes USD 0 on CLOSE SHORT
Trade details:ID 170 Code ECZ4 Date 2014-11-26 20:36:51 Quantity 1 Price 1.25020 Value per block 156,275
Total allowable cost USD 2.47000   Total disposal proceeds USD 3,769.41

Matches with:
PRO-RATA SECTION 104: Quantity 1.000000 ECZ4 allocated from total holding of -2, made up of 2 trades between 2014-09-09 and 2014-09-28
 At average value of USD 160,047 Commissions USD 2.47000 Taxes USD 0  

Trades:
ID 172a Code ECZ4 Date 2014-09-09 08:54:18 Quantity -0.500000 Price 1.29175 Value per block 161,469 (Allocated from: ID 172 Quantity -1)
ID 173a Code ECZ4 Date 2014-09-28 20:37:22 Quantity -0.500000 Price 1.26900 Value per block 158,625 (Allocated from: ID 173 Quantity -1)

CALCULATION: -(1*156275) - 2.46000 - 0 +(1*160047) - 2.47000 - 0  = 3,767 

********************************************************************************************************************************************

7: CLOSE SHORT 1 ECZ4 Futures on 15/12/2014 at USD 155,288 each gives PROFIT of USD 4,754 equals GBP 2,860.35
 Commission USD 2.46000 and taxes USD 0 on CLOSE SHORT
Trade details:ID 171 Code ECZ4 Date 2014-12-15 00:00:00 Quantity 1 Price 1.24230 Value per block 155,288
Total allowable cost USD 2.47000   Total disposal proceeds USD 4,756.91

Matches with:
PRO-RATA SECTION 104: Quantity 1.000000 ECZ4 allocated from total holding of -2, made up of 2 trades between 2014-09-09 and 2014-09-28
 At average value of USD 160,047 Commissions USD 2.47000 Taxes USD 0  

Trades:
ID 172b Code ECZ4 Date 2014-09-09 08:54:18 Quantity -0.500000 Price 1.29175 Value per block 161,469 (Allocated from: ID 172 Quantity -1)
ID 173b Code ECZ4 Date 2014-09-28 20:37:22 Quantity -0.500000 Price 1.26900 Value per block 158,625 (Allocated from: ID 173 Quantity -1)

CALCULATION: -(1*155288) - 2.46000 - 0 +(1*160047) - 2.47000 - 0  = 4,754 

********************************************************************************************************************************************

1: SELL 1 ESH5 Futures on 19/12/2014 at USD 103,075 each gives LOSS of USD -1,042 equals GBP -626.595
 Commission USD 2.01000 and taxes USD 0 on SELL
Trade details:ID 181 Code ESH5 Date 2014-12-19 09:03:01 Quantity -1 Price 2,061.50 Value per block 103,075
Total allowable cost USD 2.01000   Total disposal proceeds USD -1,039.51

Matches with:
SUBSEQUENT 1 TRADE(S) Within 30 days between 2014-12-24 and 2014-12-24: Matches with BUY of 1 ESH5 at of USD 104,112 each 
 Commissions USD 2.01000 Taxes USD 0  

Trades:
ID 180 Code ESH5 Date 2014-12-24 11:38:07 Quantity 1 Price 2,082.25 Value per block 104,112

CALCULATION: (1*103075) - 2.01000 - 0 -(1*104112) - 2.01000 - 0  = -1,042 

********************************************************************************************************************************************

2: SELL 1 ESH5 Futures on 06/01/2015 at USD 99,875 each gives LOSS of USD -539 equals GBP -324.283
 Commission USD 2.01000 and taxes USD 0 on SELL
Trade details:ID 182 Code ESH5 Date 2015-01-06 11:58:57 Quantity -1 Price 1,997.50 Value per block 99,875
Total allowable cost USD 2.01000   Total disposal proceeds USD -537.010

Matches with:
PRO-RATA SECTION 104: Quantity 1.000000 ESH5 allocated from total holding of 2, made up of 1 trades between 2014-12-18 and 2014-12-18
 At average value of USD 100,410 Commissions USD 2.01000 Taxes USD 0  

Trades:
ID 179a Code ESH5 Date 2014-12-18 09:02:31 Quantity 1 Price 2,008.20 Value per block 100,410 (Allocated from: ID 179 Quantity 2)

CALCULATION: (1*99875) - 2.01000 - 0 -(1*100410) - 2.01000 - 0  = -539 

********************************************************************************************************************************************

1: SELL 1 ESM4 Futures on 13/06/2014 at USD 96,425 each gives PROFIT of USD 1,738 equals GBP 1,045.89
 Commission USD 2.02000 and taxes USD 0 on SELL
Trade details:ID 187 Code ESM4 Date 2014-06-13 10:12:51 Quantity -1 Price 1,928.50 Value per block 96,425
Total allowable cost USD 2.02000   Total disposal proceeds USD 1,740.48

Matches with:
PRO-RATA SECTION 104: Quantity 1.000000 ESM4 allocated from total holding of 5, made up of 4 trades between 2014-04-10 and 2014-06-09
 At average value of USD 94,682.50 Commissions USD 2.02000 Taxes USD 0  

Trades:
ID 183a Code ESM4 Date 2014-04-10 10:27:13 Quantity 0.400000 Price 1,863 Value per block 93,150 (Allocated from: ID 183 Quantity 2)
ID 184a Code ESM4 Date 2014-04-23 09:04:49 Quantity 0.200000 Price 1,872.50 Value per block 93,625 (Allocated from: ID 184 Quantity 1)
ID 185a Code ESM4 Date 2014-05-30 09:03:38 Quantity 0.200000 Price 1,916.25 Value per block 95,812.50 (Allocated from: ID 185 Quantity 1)
ID 186a Code ESM4 Date 2014-06-09 12:09:17 Quantity 0.200000 Price 1,953.50 Value per block 97,675 (Allocated from: ID 186 Quantity 1)

CALCULATION: (1*96425) - 2.02000 - 0 -(1*94682.50) - 2.02000 - 0  = 1,738 

********************************************************************************************************************************************

2: SELL 4 ESM4 Futures on 18/06/2014 at USD 97,162.50 each gives PROFIT of USD 9,904 equals GBP 5,958.31
 Commission USD 8.08000 and taxes USD 0 on SELL
Trade details:ID 188 Code ESM4 Date 2014-06-18 09:54:10 Quantity -4 Price 1,943.25 Value per block 97,162.50
Total allowable cost USD 8.08000   Total disposal proceeds USD 9,911.92

Matches with:
PRO-RATA SECTION 104: Quantity 4.000000 ESM4 allocated from total holding of 5, made up of 4 trades between 2014-04-10 and 2014-06-09
 At average value of USD 94,682.50 Commissions USD 8.08000 Taxes USD 0  

Trades:
ID 183b Code ESM4 Date 2014-04-10 10:27:13 Quantity 1.60000 Price 1,863 Value per block 93,150 (Allocated from: ID 183 Quantity 2)
ID 184b Code ESM4 Date 2014-04-23 09:04:49 Quantity 0.800000 Price 1,872.50 Value per block 93,625 (Allocated from: ID 184 Quantity 1)
ID 185b Code ESM4 Date 2014-05-30 09:03:38 Quantity 0.800000 Price 1,916.25 Value per block 95,812.50 (Allocated from: ID 185 Quantity 1)
ID 186b Code ESM4 Date 2014-06-09 12:09:17 Quantity 0.800000 Price 1,953.50 Value per block 97,675 (Allocated from: ID 186 Quantity 1)

CALCULATION: (4*97162.50) - 8.08000 - 0 -(4*94682.50) - 8.08000 - 0  = 9,904 

********************************************************************************************************************************************

1: SELL 4 ESU4 Futures on 18/06/2014 at USD 97,050 each gives PROFIT of USD 1,034 equals GBP 621.975
 Commission USD 8.08000 and taxes USD 0 on SELL
Trade details:ID 195 Code ESU4 Date 2014-06-18 14:36:14 Quantity -4 Price 1,941 Value per block 97,050
Total allowable cost USD 8.08000   Total disposal proceeds USD 1,041.92

Matches with:
SAME DAY TRADE(S) Matches with BUY of 4 ESU4 at average of USD 96,787.50 each 
 Commissions USD 8.08000 Taxes USD 0 

Trades:
ID 190 Code ESU4 Date 2014-06-18 09:54:15 Quantity 4 Price 1,935.75 Value per block 96,787.50

CALCULATION: (4*97050) - 8.08000 - 0 -(4*96787.50) - 8.08000 - 0  = 1,034 

********************************************************************************************************************************************

2: SELL 1 ESU4 Futures on 26/06/2014 at USD 97,112.50 each gives LOSS of USD -1,629 equals GBP -980.056
 Commission USD 2.02000 and taxes USD 0 on SELL
Trade details:ID 196 Code ESU4 Date 2014-06-26 12:28:23 Quantity -1 Price 1,942.25 Value per block 97,112.50
Total allowable cost USD 2.02000   Total disposal proceeds USD -1,627.02

Matches with:
SUBSEQUENT 1 TRADE(S) Within 30 days between 2014-08-19 and 2014-08-19: Matches with BUY of 1 ESU4 at of USD 98,737.50 each 
 Commissions USD 2.02000 Taxes USD 0  

Trades:
ID 192 Code ESU4 Date 2014-08-19 10:27:00 Quantity 1 Price 1,974.75 Value per block 98,737.50

CALCULATION: (1*97112.50) - 2.02000 - 0 -(1*98737.50) - 2.02000 - 0  = -1,629 

********************************************************************************************************************************************

3: SELL 2 ESU4 Futures on 07/08/2014 at USD 96,200 each gives LOSS of USD -7,558 equals GBP -4,547.06
 Commission USD 4.04000 and taxes USD 0 on SELL
Trade details:ID 197 Code ESU4 Date 2014-08-07 09:22:18 Quantity -2 Price 1,924 Value per block 96,200
Total allowable cost USD 4.04000   Total disposal proceeds USD -7,554.04

Matches with:
SUBSEQUENT 2 TRADE(S) Within 30 days between 2014-08-25 and 2014-09-03: Matches with BUY of 2 ESU4 at of USD 99,975 each 
 Commissions USD 4.04000 Taxes USD 0  

Trades:
ID 193 Code ESU4 Date 2014-08-25 13:01:49 Quantity 1 Price 1,994 Value per block 99,700
ID 194 Code ESU4 Date 2014-09-03 10:47:38 Quantity 1 Price 2,005 Value per block 100,250

CALCULATION: (2*96200) - 4.04000 - 0 -(2*99975) - 4.04000 - 0  = -7,558 

********************************************************************************************************************************************

4: SELL 5 ESU4 Futures on 16/09/2014 at USD 99,215 each gives PROFIT of USD 11,342 equals GBP 6,823.71
 Commission USD 10.1000 and taxes USD 0 on SELL
Trade details:ID 198 Code ESU4 Date 2014-09-16 09:04:35 Quantity -5 Price 1,984.30 Value per block 99,215
Total allowable cost USD 10.1000   Total disposal proceeds USD 11,352.40

Matches with:
PRO-RATA SECTION 104: Quantity 5.000000 ESU4 allocated from total holding of 5, made up of 2 trades between 2014-06-18 and 2014-06-20
 At average value of USD 96,942.50 Commissions USD 10.1000 Taxes USD 0  

Trades:
ID 189 Code ESU4 Date 2014-06-18 09:45:41 Quantity 4 Price 1,935.25 Value per block 96,762.50
ID 191 Code ESU4 Date 2014-06-20 12:22:26 Quantity 1 Price 1,953.25 Value per block 97,662.50

CALCULATION: (5*99215) - 10.1000 - 0 -(5*96942.50) - 10.1000 - 0  = 11,342 

********************************************************************************************************************************************

1: SELL 1 ESZ4 Futures on 23/09/2014 at USD 99,212.50 each gives LOSS of USD -1,642 equals GBP -987.571
 Commission USD 2.02000 and taxes USD 0 on SELL
Trade details:ID 203 Code ESZ4 Date 2014-09-23 09:57:21 Quantity -1 Price 1,984.25 Value per block 99,212.50
Total allowable cost USD 2.01000   Total disposal proceeds USD -1,639.52

Matches with:
SUBSEQUENT 1 TRADE(S) Within 30 days between 2014-11-06 and 2014-11-06: Matches with BUY of 1 ESZ4 at of USD 100,850 each 
 Commissions USD 2.01000 Taxes USD 0  

Trades:
ID 200a Code ESZ4 Date 2014-11-06 10:39:04 Quantity 1 Price 2,017 Value per block 100,850 (Allocated from: ID 200 Quantity 2)

CALCULATION: (1*99212.50) - 2.02000 - 0 -(1*100850) - 2.01000 - 0  = -1,642 

********************************************************************************************************************************************

2: SELL 1 ESZ4 Futures on 26/09/2014 at USD 98,300 each gives LOSS of USD -2,554 equals GBP -1,536.55
 Commission USD 2.02000 and taxes USD 0 on SELL
Trade details:ID 204 Code ESZ4 Date 2014-09-26 10:10:22 Quantity -1 Price 1,966 Value per block 98,300
Total allowable cost USD 2.01000   Total disposal proceeds USD -2,552.02

Matches with:
SUBSEQUENT 1 TRADE(S) Within 30 days between 2014-11-06 and 2014-11-06: Matches with BUY of 1 ESZ4 at of USD 100,850 each 
 Commissions USD 2.01000 Taxes USD 0  

Trades:
ID 200 Code ESZ4 Date 2014-11-06 10:39:04 Quantity 1 Price 2,017 Value per block 100,850

CALCULATION: (1*98300) - 2.02000 - 0 -(1*100850) - 2.01000 - 0  = -2,554 

********************************************************************************************************************************************

3: SELL 1 ESZ4 Futures on 02/10/2014 at USD 96,775 each gives LOSS of USD -5,492 equals GBP -3,303.79
 Commission USD 2.02000 and taxes USD 0 on SELL
Trade details:ID 205 Code ESZ4 Date 2014-10-02 09:12:38 Quantity -1 Price 1,935.50 Value per block 96,775
Total allowable cost USD 2.01000   Total disposal proceeds USD -5,489.52

Matches with:
SUBSEQUENT 1 TRADE(S) Within 30 days between 2014-11-18 and 2014-11-18: Matches with BUY of 1 ESZ4 at of USD 102,262 each 
 Commissions USD 2.01000 Taxes USD 0  

Trades:
ID 201 Code ESZ4 Date 2014-11-18 10:49:15 Quantity 1 Price 2,045.25 Value per block 102,262

CALCULATION: (1*96775) - 2.02000 - 0 -(1*102262) - 2.01000 - 0  = -5,492 

********************************************************************************************************************************************

4: SELL 1 ESZ4 Futures on 09/10/2014 at USD 96,812.50 each gives LOSS of USD -6,617 equals GBP -3,980.60
 Commission USD 2.01000 and taxes USD 0 on SELL
Trade details:ID 206 Code ESZ4 Date 2014-10-09 12:07:36 Quantity -1 Price 1,936.25 Value per block 96,812.50
Total allowable cost USD 2.01000   Total disposal proceeds USD -6,614.51

Matches with:
SUBSEQUENT 1 TRADE(S) Within 30 days between 2014-11-28 and 2014-11-28: Matches with BUY of 1 ESZ4 at of USD 103,425 each 
 Commissions USD 2.01000 Taxes USD 0  

Trades:
ID 202 Code ESZ4 Date 2014-11-28 09:52:13 Quantity 1 Price 2,068.50 Value per block 103,425

CALCULATION: (1*96812.50) - 2.01000 - 0 -(1*103425) - 2.01000 - 0  = -6,617 

********************************************************************************************************************************************

5: SELL 1 ESZ4 Futures on 09/12/2014 at USD 102,250 each gives PROFIT of USD 3,441 equals GBP 2,070.14
 Commission USD 2.01000 and taxes USD 0 on SELL
Trade details:ID 207 Code ESZ4 Date 2014-12-09 11:27:44 Quantity -1 Price 2,045 Value per block 102,250
Total allowable cost USD 2.02000   Total disposal proceeds USD 3,442.99

Matches with:
PRO-RATA SECTION 104: Quantity 1.000000 ESZ4 allocated from total holding of 5, made up of 1 trades between 2014-09-16 and 2014-09-16
 At average value of USD 98,805 Commissions USD 2.02000 Taxes USD 0  

Trades:
ID 199a Code ESZ4 Date 2014-09-16 09:04:35 Quantity 1 Price 1,976.10 Value per block 98,805 (Allocated from: ID 199 Quantity 5)

CALCULATION: (1*102250) - 2.01000 - 0 -(1*98805) - 2.02000 - 0  = 3,441 

********************************************************************************************************************************************

6: SELL 1 ESZ4 Futures on 12/12/2014 at USD 101,038 each gives PROFIT of USD 2,228 equals GBP 1,340.68
 Commission USD 2.01000 and taxes USD 0 on SELL
Trade details:ID 208 Code ESZ4 Date 2014-12-12 09:04:33 Quantity -1 Price 2,020.75 Value per block 101,038
Total allowable cost USD 2.02000   Total disposal proceeds USD 2,230.49

Matches with:
PRO-RATA SECTION 104: Quantity 1.000000 ESZ4 allocated from total holding of 5, made up of 1 trades between 2014-09-16 and 2014-09-16
 At average value of USD 98,805 Commissions USD 2.02000 Taxes USD 0  

Trades:
ID 199b Code ESZ4 Date 2014-09-16 09:04:35 Quantity 1 Price 1,976.10 Value per block 98,805 (Allocated from: ID 199 Quantity 5)

CALCULATION: (1*101038) - 2.01000 - 0 -(1*98805) - 2.02000 - 0  = 2,228 

********************************************************************************************************************************************

7: SELL 1 ESZ4 Futures on 12/12/2014 at USD 101,162 each gives PROFIT of USD 2,353 equals GBP 1,415.89
 Commission USD 2.01000 and taxes USD 0 on SELL
Trade details:ID 209 Code ESZ4 Date 2014-12-12 10:39:58 Quantity -1 Price 2,023.25 Value per block 101,162
Total allowable cost USD 2.02000   Total disposal proceeds USD 2,355.49

Matches with:
PRO-RATA SECTION 104: Quantity 1.000000 ESZ4 allocated from total holding of 5, made up of 1 trades between 2014-09-16 and 2014-09-16
 At average value of USD 98,805 Commissions USD 2.02000 Taxes USD 0  

Trades:
ID 199c Code ESZ4 Date 2014-09-16 09:04:35 Quantity 1 Price 1,976.10 Value per block 98,805 (Allocated from: ID 199 Quantity 5)

CALCULATION: (1*101162) - 2.01000 - 0 -(1*98805) - 2.02000 - 0  = 2,353 

********************************************************************************************************************************************

8: SELL 2 ESZ4 Futures on 18/12/2014 at USD 100,710 each gives PROFIT of USD 3,802 equals GBP 2,287.31
 Commission USD 4.02000 and taxes USD 0 on SELL
Trade details:ID 210 Code ESZ4 Date 2014-12-18 09:02:31 Quantity -2 Price 2,014.20 Value per block 100,710
Total allowable cost USD 4.04000   Total disposal proceeds USD 3,805.98

Matches with:
PRO-RATA SECTION 104: Quantity 2.000000 ESZ4 allocated from total holding of 5, made up of 1 trades between 2014-09-16 and 2014-09-16
 At average value of USD 98,805.00 Commissions USD 4.04000 Taxes USD 0  

Trades:
ID 199d Code ESZ4 Date 2014-09-16 09:04:35 Quantity 2 Price 1,976.10 Value per block 98,805.00 (Allocated from: ID 199 Quantity 5)

CALCULATION: (2*100710) - 4.02000 - 0 -(2*98805.00) - 4.04000 - 0  = 3,802 

********************************************************************************************************************************************

1: SELL 47000 EUR.GBP Forex on 27/08/2014 at GBP 0.796030 each gives PROFIT of GBP 13 equals GBP 13.1365
 Commission GBP 0.747300 and taxes GBP 0 on SELL
Trade details:ID 34:1 Code EUR.GBP Date 2014-08-27 15:45:47 Quantity -47,000 Price 0.796030 Value per block 0.796030
Total allowable cost GBP 1.15620   Total disposal proceeds GBP 14.2927

Matches with:
SUBSEQUENT 1 TRADE(S) Within 30 days between 2014-09-12 and 2014-09-12: Matches with BUY of 47000 EUR.GBP at of GBP 0.795710 each 
 Commissions GBP 1.15620 Taxes GBP 0  

Trades:
ID 31a Code EUR.GBP Date 2014-09-12 03:12:32 Quantity 47,000 Price 0.795710 Value per block 0.795710 (Allocated from: ID 31 Quantity 50,000)

CALCULATION: (47000*0.796030) - 0.747300 - 0 -(47000*0.795710) - 1.15620 - 0  = 13 

********************************************************************************************************************************************

2: CLOSE SHORT 3000 EUR.GBP Forex on 12/09/2014 at GBP 0.795710 each gives LOSS of GBP -40 equals GBP -39.7208
 Commission GBP 0.0738000 and taxes GBP 0 on CLOSE SHORT
Trade details:ID 31 Code EUR.GBP Date 2014-09-12 03:12:32 Quantity 3,000 Price 0.795710 Value per block 0.795710
Total allowable cost GBP 0.0470000   Total disposal proceeds GBP -39.6738

Matches with:
SUBSEQUENT 1 TRADE(S) Within 30 days between 2014-11-04 and 2014-11-04: Matches with OPEN SHORT of 3000 EUR.GBP at of GBP 0.782510 each 
 Commissions GBP 0.0470000 Taxes GBP 0  

Trades:
ID 35:1a Code EUR.GBP Date 2014-11-04 01:52:44 Quantity -3,000 Price 0.782510 Value per block 0.782510 (Allocated from: ID 35:1 Quantity -72,000)

CALCULATION: -(3000*0.795710) - 0.0738000 - 0 +(3000*0.782510) - 0.0470000 - 0  = -40 

********************************************************************************************************************************************

3: CLOSE SHORT 3000 EUR.GBP Forex on 04/11/2014 at GBP 0.782560 each gives LOSS of GBP 0 equals GBP -0.247000
 Commission GBP 0.0500000 and taxes GBP 0 on CLOSE SHORT
Trade details:ID 32:1 Code EUR.GBP Date 2014-11-04 01:51:17 Quantity 3,000 Price 0.782560 Value per block 0.782560
Total allowable cost GBP 0.0470000   Total disposal proceeds GBP -0.200000

Matches with:
SUBSEQUENT 1 TRADE(S) Within 30 days between 2014-11-04 and 2014-11-04: Matches with OPEN SHORT of 3000 EUR.GBP at of GBP 0.782510 each 
 Commissions GBP 0.0470000 Taxes GBP 0  

Trades:
ID 35:1b Code EUR.GBP Date 2014-11-04 01:52:44 Quantity -3,000 Price 0.782510 Value per block 0.782510 (Allocated from: ID 35:1 Quantity -72,000)

CALCULATION: -(3000*0.782560) - 0.0500000 - 0 +(3000*0.782510) - 0.0470000 - 0  = 0 

********************************************************************************************************************************************

4: SELL 66000 EUR.GBP Forex on 04/11/2014 at GBP 0.782510 each gives LOSS of GBP -5 equals GBP -5.43400
 Commission GBP 1.03400 and taxes GBP 0 on SELL
Trade details:ID 35:1 Code EUR.GBP Date 2014-11-04 01:52:44 Quantity -66,000 Price 0.782510 Value per block 0.782510
Total allowable cost GBP 1.10000   Total disposal proceeds GBP -4.33400

Matches with:
SAME DAY TRADE(S) Matches with BUY of 66000 EUR.GBP at average of GBP 0.782560 each 
 Commissions GBP 1.10000 Taxes GBP 0 

Trades:
ID 32:2a Code EUR.GBP Date 2014-11-04 01:51:18 Quantity 66,000 Price 0.782560 Value per block 0.782560 (Allocated from: ID 32:2 Quantity 72,000)

CALCULATION: (66000*0.782510) - 1.03400 - 0 -(66000*0.782560) - 1.10000 - 0  = -5 

********************************************************************************************************************************************

5: CLOSE SHORT 18200 EUR.GBP Forex on 07/01/2015 at GBP 0.782170 each gives PROFIT of GBP 23 equals GBP 23.0179
 Commission GBP 1.32000 and taxes GBP 0 on CLOSE SHORT
Trade details:ID 2015 Code EUR.GBP Date 2015-01-07 07:58:24 Quantity 18,200 Price 0.782170 Value per block 0.782170
Total allowable cost GBP 0.525310   Total disposal proceeds GBP 23.5432

Matches with:
PRO-RATA SECTION 104: Quantity 18200.000000 EUR.GBP allocated from total holding of -97,000, made up of 5 trades between 2014-06-06 and 2014-12-02
 At average value of GBP 0.783536 Commissions GBP 0.525310 Taxes GBP 0  

Trades:
ID 30a Code EUR.GBP Date 2014-06-06 14:43:25 Quantity 5,247.85 Price 0.811680 Value per block 0.811680 (Allocated from: ID 30 Quantity 47,000)
ID 34:2a Code EUR.GBP Date 2014-08-27 15:45:48 Quantity -5,917.79 Price 0.796030 Value per block 0.796030 (Allocated from: ID 34:2 Quantity -53,000)
ID 32:2b Code EUR.GBP Date 2014-11-04 01:51:18 Quantity 669.939 Price 0.782560 Value per block 0.782560 (Allocated from: ID 32:2 Quantity 72,000)
ID 35:2a Code EUR.GBP Date 2014-11-04 01:52:45 Quantity -8,709.20 Price 0.782510 Value per block 0.782510 (Allocated from: ID 35:2 Quantity -78,000)
ID 36a Code EUR.GBP Date 2014-12-02 03:07:24 Quantity -9,490.80 Price 0.792180 Value per block 0.792180 (Allocated from: ID 36 Quantity -85,000)

CALCULATION: -(18200*0.782170) - 1.32000 - 0 +(18200*0.783536) - 0.525310 - 0  = 23 

********************************************************************************************************************************************

6: CLOSE SHORT 16000 EUR.GBP Forex on 16/01/2015 at GBP 0.764020 each gives PROFIT of GBP 310 equals GBP 310.472
 Commission GBP 1.32000 and taxes GBP 0 on CLOSE SHORT
Trade details:ID 33 Code EUR.GBP Date 2015-01-16 08:46:25 Quantity 16,000 Price 0.764020 Value per block 0.764020
Total allowable cost GBP 0.461811   Total disposal proceeds GBP 310.934

Matches with:
PRO-RATA SECTION 104: Quantity 16000.000000 EUR.GBP allocated from total holding of -97,000, made up of 5 trades between 2014-06-06 and 2014-12-02
 At average value of GBP 0.783536 Commissions GBP 0.461811 Taxes GBP 0  

Trades:
ID 30b Code EUR.GBP Date 2014-06-06 14:43:25 Quantity 4,613.50 Price 0.811680 Value per block 0.811680 (Allocated from: ID 30 Quantity 47,000)
ID 34:2b Code EUR.GBP Date 2014-08-27 15:45:48 Quantity -5,202.45 Price 0.796030 Value per block 0.796030 (Allocated from: ID 34:2 Quantity -53,000)
ID 32:2c Code EUR.GBP Date 2014-11-04 01:51:18 Quantity 588.957 Price 0.782560 Value per block 0.782560 (Allocated from: ID 32:2 Quantity 72,000)
ID 35:2b Code EUR.GBP Date 2014-11-04 01:52:45 Quantity -7,656.44 Price 0.782510 Value per block 0.782510 (Allocated from: ID 35:2 Quantity -78,000)
ID 36b Code EUR.GBP Date 2014-12-02 03:07:24 Quantity -8,343.56 Price 0.792180 Value per block 0.792180 (Allocated from: ID 36 Quantity -85,000)

CALCULATION: -(16000*0.764020) - 1.32000 - 0 +(16000*0.783536) - 0.461811 - 0  = 310 

********************************************************************************************************************************************

1: CLOSE SHORT 125000 EUR.USD Forex on 17/12/2014 at USD 1.24772 each gives LOSS of USD -679 equals GBP -408.788
 Commission USD 1.98333 and taxes USD 0 on CLOSE SHORT
Trade details:ID 2:1 Code EUR.USD Date 2014-12-17 01:55:37 Quantity 125,000 Price 1.24772 Value per block 1.24772
Total allowable cost USD 0   Total disposal proceeds USD -679.483

Matches with:
PRO-RATA SECTION 104: Quantity 125000.000000 EUR.USD allocated from total holding of -125,000, made up of 1 trades between 2014-12-15 and 2014-12-15
 At average value of USD 1.24230 Commissions USD 0 Taxes USD 0  

Trades:
ID 3 Code EUR.USD Date 2014-12-15 00:00:00 Quantity -125,000 Price 1.24230 Value per block 1.24230

CALCULATION: -(125000*1.24772) - 1.98333 - 0 +(125000*1.24230) - 0 - 0  = -679 

********************************************************************************************************************************************

1: SELL 1 FBTP DEC 14 Futures on 09/09/2014 at EUR 130,190 each gives LOSS of EUR -324 equals GBP -267.368
 Commission EUR 2 and taxes EUR 0 on SELL
Trade details:ID 1308 Code FBTP DEC 14 Date 2014-09-09 02:43:16 Quantity -1 Price 130.190 Value per block 130,190
Total allowable cost EUR 2   Total disposal proceeds EUR -322

Matches with:
SUBSEQUENT 1 TRADE(S) Within 30 days between 2014-09-25 and 2014-09-25: Matches with BUY of 1 FBTP DEC 14 at of EUR 130,510 each 
 Commissions EUR 2 Taxes EUR 0  

Trades:
ID 1303 Code FBTP DEC 14 Date 2014-09-25 03:44:21 Quantity 1 Price 130.510 Value per block 130,510

CALCULATION: (1*130190) - 2 - 0 -(1*130510) - 2 - 0  = -324 

********************************************************************************************************************************************

2: SELL 1 FBTP DEC 14 Futures on 16/10/2014 at EUR 129,750 each gives PROFIT of EUR 1,926 equals GBP 1,589.33
 Commission EUR 2 and taxes EUR 0 on SELL
Trade details:ID 1309 Code FBTP DEC 14 Date 2014-10-16 02:52:03 Quantity -1 Price 129.750 Value per block 129,750
Total allowable cost EUR 2   Total disposal proceeds EUR 1,928

Matches with:
SUBSEQUENT 1 TRADE(S) Within 30 days between 2014-10-17 and 2014-10-17: Matches with BUY of 1 FBTP DEC 14 at of EUR 127,820 each 
 Commissions EUR 2 Taxes EUR 0  

Trades:
ID 1305 Code FBTP DEC 14 Date 2014-10-17 02:34:52 Quantity 1 Price 127.820 Value per block 127,820

CALCULATION: (1*129750) - 2 - 0 -(1*127820) - 2 - 0  = 1,926 

********************************************************************************************************************************************

3: SELL 2 FBTP DEC 14 Futures on 16/10/2014 at EUR 126,900 each gives LOSS of EUR -6,958 equals GBP -5,741.71
 Commission EUR 4 and taxes EUR 0 on SELL
Trade details:ID 1310 Code FBTP DEC 14 Date 2014-10-16 06:21:03 Quantity -2 Price 126.900 Value per block 126,900
Total allowable cost EUR 4   Total disposal proceeds EUR -6,954

Matches with:
SUBSEQUENT 2 TRADE(S) Within 30 days between 2014-10-31 and 2014-11-13: Matches with BUY of 2 FBTP DEC 14 at of EUR 130,375 each 
 Commissions EUR 4 Taxes EUR 0  

Trades:
ID 1306 Code FBTP DEC 14 Date 2014-10-31 04:46:06 Quantity 1 Price 130.070 Value per block 130,070
ID 1307 Code FBTP DEC 14 Date 2014-11-13 05:48:22 Quantity 1 Price 130.680 Value per block 130,680

CALCULATION: (2*126900) - 4 - 0 -(2*130375) - 4 - 0  = -6,958 

********************************************************************************************************************************************

4: SELL 1 FBTP DEC 14 Futures on 23/10/2014 at EUR 128,820 each gives LOSS of EUR -876 equals GBP -725.714
 Commission EUR 2 and taxes EUR 0 on SELL
Trade details:ID 1311 Code FBTP DEC 14 Date 2014-10-23 02:51:07 Quantity -1 Price 128.820 Value per block 128,820
Total allowable cost EUR 2   Total disposal proceeds EUR -874

Matches with:
PRO-RATA SECTION 104: Quantity 1.000000 FBTP DEC 14 allocated from total holding of 5, made up of 2 trades between 2014-09-02 and 2014-10-09
 At average value of EUR 129,692 Commissions EUR 2 Taxes EUR 0  

Trades:
ID 1302a Code FBTP DEC 14 Date 2014-09-02 03:04:15 Quantity 0.800000 Price 129.310 Value per block 129,310 (Allocated from: ID 1302 Quantity 4)
ID 1304a Code FBTP DEC 14 Date 2014-10-09 03:40:32 Quantity 0.200000 Price 131.220 Value per block 131,220 (Allocated from: ID 1304 Quantity 1)

CALCULATION: (1*128820) - 2 - 0 -(1*129692) - 2 - 0  = -876 

********************************************************************************************************************************************

5: SELL 1 FBTP DEC 14 Futures on 06/11/2014 at EUR 130,180 each gives PROFIT of EUR 484 equals GBP 400.869
 Commission EUR 2 and taxes EUR 0 on SELL
Trade details:ID 1312 Code FBTP DEC 14 Date 2014-11-06 04:46:04 Quantity -1 Price 130.180 Value per block 130,180
Total allowable cost EUR 2   Total disposal proceeds EUR 486

Matches with:
PRO-RATA SECTION 104: Quantity 1.000000 FBTP DEC 14 allocated from total holding of 5, made up of 2 trades between 2014-09-02 and 2014-10-09
 At average value of EUR 129,692 Commissions EUR 2 Taxes EUR 0  

Trades:
ID 1302b Code FBTP DEC 14 Date 2014-09-02 03:04:15 Quantity 0.800000 Price 129.310 Value per block 129,310 (Allocated from: ID 1302 Quantity 4)
ID 1304b Code FBTP DEC 14 Date 2014-10-09 03:40:32 Quantity 0.200000 Price 131.220 Value per block 131,220 (Allocated from: ID 1304 Quantity 1)

CALCULATION: (1*130180) - 2 - 0 -(1*129692) - 2 - 0  = 484 

********************************************************************************************************************************************

6: SELL 3 FBTP DEC 14 Futures on 03/12/2014 at EUR 134,240 each gives PROFIT of EUR 13,632 equals GBP 11,290.52
 Commission EUR 6 and taxes EUR 0 on SELL
Trade details:ID 1313 Code FBTP DEC 14 Date 2014-12-03 03:01:45 Quantity -3 Price 134.240 Value per block 134,240
Total allowable cost EUR 6.00000   Total disposal proceeds EUR 13,638

Matches with:
PRO-RATA SECTION 104: Quantity 3.000000 FBTP DEC 14 allocated from total holding of 5, made up of 2 trades between 2014-09-02 and 2014-10-09
 At average value of EUR 129,692 Commissions EUR 6.00000 Taxes EUR 0  

Trades:
ID 1302c Code FBTP DEC 14 Date 2014-09-02 03:04:15 Quantity 2.40000 Price 129.310 Value per block 129,310 (Allocated from: ID 1302 Quantity 4)
ID 1304c Code FBTP DEC 14 Date 2014-10-09 03:40:32 Quantity 0.600000 Price 131.220 Value per block 131,220 (Allocated from: ID 1304 Quantity 1)

CALCULATION: (3*134240) - 6 - 0 -(3*129692) - 6.00000 - 0  = 13,632 

********************************************************************************************************************************************

1: SELL 1 FBTP JUN 14 Futures on 24/04/2014 at EUR 123,510 each gives LOSS of EUR -594 equals GBP -490.879
 Commission EUR 2 and taxes EUR 0 on SELL
Trade details:ID 1317 Code FBTP JUN 14 Date 2014-04-24 07:59:52 Quantity -1 Price 123.510 Value per block 123,510
Total allowable cost EUR 2   Total disposal proceeds EUR -592

Matches with:
SUBSEQUENT 1 TRADE(S) Within 30 days between 2014-05-02 and 2014-05-02: Matches with BUY of 1 FBTP JUN 14 at of EUR 124,100 each 
 Commissions EUR 2 Taxes EUR 0  

Trades:
ID 1315 Code FBTP JUN 14 Date 2014-05-02 03:16:54 Quantity 1 Price 124.100 Value per block 124,100

CALCULATION: (1*123510) - 2 - 0 -(1*124100) - 2 - 0  = -594 

********************************************************************************************************************************************

2: SELL 1 FBTP JUN 14 Futures on 15/05/2014 at EUR 124,060 each gives LOSS of EUR -1,544 equals GBP -1,275.96
 Commission EUR 2 and taxes EUR 0 on SELL
Trade details:ID 1318 Code FBTP JUN 14 Date 2014-05-15 10:09:11 Quantity -1 Price 124.060 Value per block 124,060
Total allowable cost EUR 2   Total disposal proceeds EUR -1,542

Matches with:
SAME DAY TRADE(S) Matches with BUY of 1 FBTP JUN 14 at average of EUR 125,600 each 
 Commissions EUR 2 Taxes EUR 0 

Trades:
ID 1316 Code FBTP JUN 14 Date 2014-05-15 02:44:40 Quantity 1 Price 125.600 Value per block 125,600

CALCULATION: (1*124060) - 2 - 0 -(1*125600) - 2 - 0  = -1,544 

********************************************************************************************************************************************

3: SELL 1 FBTP JUN 14 Futures on 16/05/2014 at EUR 123,340 each gives PROFIT of EUR 206 equals GBP 169.942
 Commission EUR 2 and taxes EUR 0 on SELL
Trade details:ID 1319 Code FBTP JUN 14 Date 2014-05-16 02:44:15 Quantity -1 Price 123.340 Value per block 123,340
Total allowable cost EUR 2   Total disposal proceeds EUR 208

Matches with:
PRO-RATA SECTION 104: Quantity 1.000000 FBTP JUN 14 allocated from total holding of 3, made up of 1 trades between 2014-04-10 and 2014-04-10
 At average value of EUR 123,130 Commissions EUR 2 Taxes EUR 0  

Trades:
ID 1314a Code FBTP JUN 14 Date 2014-04-10 10:52:55 Quantity 1 Price 123.130 Value per block 123,130 (Allocated from: ID 1314 Quantity 3)

CALCULATION: (1*123340) - 2 - 0 -(1*123130) - 2 - 0  = 206 

********************************************************************************************************************************************

4: SELL 2 FBTP JUN 14 Futures on 02/06/2014 at EUR 125,150 each gives PROFIT of EUR 4,032 equals GBP 3,326.36
 Commission EUR 4 and taxes EUR 0 on SELL
Trade details:ID 1320 Code FBTP JUN 14 Date 2014-06-02 03:44:14 Quantity -2 Price 125.150 Value per block 125,150
Total allowable cost EUR 4   Total disposal proceeds EUR 4,036.00

Matches with:
PRO-RATA SECTION 104: Quantity 2.000000 FBTP JUN 14 allocated from total holding of 3, made up of 1 trades between 2014-04-10 and 2014-04-10
 At average value of EUR 123,130 Commissions EUR 4 Taxes EUR 0  

Trades:
ID 1314b Code FBTP JUN 14 Date 2014-04-10 10:52:55 Quantity 2 Price 123.130 Value per block 123,130 (Allocated from: ID 1314 Quantity 3)

CALCULATION: (2*125150) - 4 - 0 -(2*123130) - 4 - 0  = 4,032 

********************************************************************************************************************************************

1: SELL 1 FBTP MAR 15 Futures on 12/12/2014 at EUR 133,770 each gives LOSS of EUR -84 equals GBP -69.0697
 Commission EUR 2 and taxes EUR 0 on SELL
Trade details:ID 1324 Code FBTP MAR 15 Date 2014-12-12 05:59:26 Quantity -1 Price 133.770 Value per block 133,770
Total allowable cost EUR 2   Total disposal proceeds EUR -82

Matches with:
SUBSEQUENT 1 TRADE(S) Within 30 days between 2014-12-17 and 2014-12-17: Matches with BUY of 1 FBTP MAR 15 at of EUR 133,850 each 
 Commissions EUR 2 Taxes EUR 0  

Trades:
ID 1322 Code FBTP MAR 15 Date 2014-12-17 02:30:58 Quantity 1 Price 133.850 Value per block 133,850

CALCULATION: (1*133770) - 2 - 0 -(1*133850) - 2 - 0  = -84 

********************************************************************************************************************************************

2: SELL 1 FBTP MAR 15 Futures on 16/12/2014 at EUR 133,030 each gives LOSS of EUR -2,564 equals GBP -2,108.27
 Commission EUR 2 and taxes EUR 0 on SELL
Trade details:ID 1325 Code FBTP MAR 15 Date 2014-12-16 07:30:03 Quantity -1 Price 133.030 Value per block 133,030
Total allowable cost EUR 2   Total disposal proceeds EUR -2,562

Matches with:
SUBSEQUENT 1 TRADE(S) Within 30 days between 2015-01-07 and 2015-01-07: Matches with BUY of 1 FBTP MAR 15 at of EUR 135,590 each 
 Commissions EUR 2 Taxes EUR 0  

Trades:
ID 1323 Code FBTP MAR 15 Date 2015-01-07 02:35:54 Quantity 1 Price 135.590 Value per block 135,590

CALCULATION: (1*133030) - 2 - 0 -(1*135590) - 2 - 0  = -2,564 

********************************************************************************************************************************************

3: SELL 1 FBTP MAR 15 Futures on 06/01/2015 at EUR 135,680 each gives PROFIT of EUR 1,546 equals GBP 1,269.81
 Commission EUR 2 and taxes EUR 0 on SELL
Trade details:ID 1326 Code FBTP MAR 15 Date 2015-01-06 02:36:34 Quantity -1 Price 135.680 Value per block 135,680
Total allowable cost EUR 2   Total disposal proceeds EUR 1,548

Matches with:
PRO-RATA SECTION 104: Quantity 1.000000 FBTP MAR 15 allocated from total holding of 3, made up of 1 trades between 2014-12-03 and 2014-12-03
 At average value of EUR 134,130 Commissions EUR 2 Taxes EUR 0  

Trades:
ID 1321a Code FBTP MAR 15 Date 2014-12-03 03:08:11 Quantity 1 Price 134.130 Value per block 134,130 (Allocated from: ID 1321 Quantity 3)

CALCULATION: (1*135680) - 2 - 0 -(1*134130) - 2 - 0  = 1,546 

********************************************************************************************************************************************

1: SELL 1 FBTP SEP 14 Futures on 25/07/2014 at EUR 127,450 each gives LOSS of EUR -94 equals GBP -77.3813
 Commission EUR 2 and taxes EUR 0 on SELL
Trade details:ID 1334 Code FBTP SEP 14 Date 2014-07-25 05:45:53 Quantity -1 Price 127.450 Value per block 127,450
Total allowable cost EUR 2   Total disposal proceeds EUR -92

Matches with:
SUBSEQUENT 1 TRADE(S) Within 30 days between 2014-07-25 and 2014-07-25: Matches with BUY of 1 FBTP SEP 14 at of EUR 127,540 each 
 Commissions EUR 2 Taxes EUR 0  

Trades:
ID 1332 Code FBTP SEP 14 Date 2014-07-25 09:14:05 Quantity 1 Price 127.540 Value per block 127,540

CALCULATION: (1*127450) - 2 - 0 -(1*127540) - 2 - 0  = -94 

********************************************************************************************************************************************

2: SELL 1 FBTP SEP 14 Futures on 31/07/2014 at EUR 127,680 each gives LOSS of EUR -294 equals GBP -242.023
 Commission EUR 2 and taxes EUR 0 on SELL
Trade details:ID 1335 Code FBTP SEP 14 Date 2014-07-31 02:41:48 Quantity -1 Price 127.680 Value per block 127,680
Total allowable cost EUR 2   Total disposal proceeds EUR -292

Matches with:
SUBSEQUENT 1 TRADE(S) Within 30 days between 2014-08-14 and 2014-08-14: Matches with BUY of 1 FBTP SEP 14 at of EUR 127,970 each 
 Commissions EUR 2 Taxes EUR 0  

Trades:
ID 1333 Code FBTP SEP 14 Date 2014-08-14 02:37:05 Quantity 1 Price 127.970 Value per block 127,970

CALCULATION: (1*127680) - 2 - 0 -(1*127970) - 2 - 0  = -294 

********************************************************************************************************************************************

3: SELL 1 FBTP SEP 14 Futures on 07/08/2014 at EUR 126,650 each gives PROFIT of EUR 1,206 equals GBP 992.804
 Commission EUR 2 and taxes EUR 0 on SELL
Trade details:ID 1336 Code FBTP SEP 14 Date 2014-08-07 09:08:07 Quantity -1 Price 126.650 Value per block 126,650
Total allowable cost EUR 2   Total disposal proceeds EUR 1,208

Matches with:
PRO-RATA SECTION 104: Quantity 1.000000 FBTP SEP 14 allocated from total holding of 5, made up of 5 trades between 2014-06-02 and 2014-07-23
 At average value of EUR 125,440 Commissions EUR 2 Taxes EUR 0  

Trades:
ID 1327a Code FBTP SEP 14 Date 2014-06-02 04:13:27 Quantity 0.200000 Price 123.800 Value per block 123,800 (Allocated from: ID 1327 Quantity 1)
ID 1328a Code FBTP SEP 14 Date 2014-06-04 02:32:07 Quantity 0.200000 Price 123.410 Value per block 123,410 (Allocated from: ID 1328 Quantity 1)
ID 1329a Code FBTP SEP 14 Date 2014-06-30 02:46:11 Quantity 0.200000 Price 126.440 Value per block 126,440 (Allocated from: ID 1329 Quantity 1)
ID 1330a Code FBTP SEP 14 Date 2014-07-16 06:51:51 Quantity 0.200000 Price 126.520 Value per block 126,520 (Allocated from: ID 1330 Quantity 1)
ID 1331a Code FBTP SEP 14 Date 2014-07-23 05:48:12 Quantity 0.200000 Price 127.030 Value per block 127,030 (Allocated from: ID 1331 Quantity 1)

CALCULATION: (1*126650) - 2 - 0 -(1*125440) - 2 - 0  = 1,206 

********************************************************************************************************************************************

4: SELL 4 FBTP SEP 14 Futures on 02/09/2014 at EUR 130,550 each gives PROFIT of EUR 20,424 equals GBP 16,777.16
 Commission EUR 8 and taxes EUR 0 on SELL
Trade details:ID 1337 Code FBTP SEP 14 Date 2014-09-02 03:04:15 Quantity -4 Price 130.550 Value per block 130,550
Total allowable cost EUR 8   Total disposal proceeds EUR 20,432

Matches with:
PRO-RATA SECTION 104: Quantity 4.000000 FBTP SEP 14 allocated from total holding of 5, made up of 5 trades between 2014-06-02 and 2014-07-23
 At average value of EUR 125,440 Commissions EUR 8 Taxes EUR 0  

Trades:
ID 1327b Code FBTP SEP 14 Date 2014-06-02 04:13:27 Quantity 0.800000 Price 123.800 Value per block 123,800 (Allocated from: ID 1327 Quantity 1)
ID 1328b Code FBTP SEP 14 Date 2014-06-04 02:32:07 Quantity 0.800000 Price 123.410 Value per block 123,410 (Allocated from: ID 1328 Quantity 1)
ID 1329b Code FBTP SEP 14 Date 2014-06-30 02:46:11 Quantity 0.800000 Price 126.440 Value per block 126,440 (Allocated from: ID 1329 Quantity 1)
ID 1330b Code FBTP SEP 14 Date 2014-07-16 06:51:51 Quantity 0.800000 Price 126.520 Value per block 126,520 (Allocated from: ID 1330 Quantity 1)
ID 1331b Code FBTP SEP 14 Date 2014-07-23 05:48:12 Quantity 0.800000 Price 127.030 Value per block 127,030 (Allocated from: ID 1331 Quantity 1)

CALCULATION: (4*130550) - 8 - 0 -(4*125440) - 8 - 0  = 20,424 

********************************************************************************************************************************************

1: SELL 1 FCEF5 Futures on 18/12/2014 at EUR 41,710 each gives LOSS of EUR -74 equals GBP -60.7868
 Commission EUR 2 and taxes EUR 0 on SELL
Trade details:ID 1339 Code FCEF5 Date 2014-12-18 03:17:37 Quantity -1 Price 4,171 Value per block 41,710
Total allowable cost EUR 2   Total disposal proceeds EUR -72

Matches with:
SAME DAY TRADE(S) Matches with BUY of 1 FCEF5 at average of EUR 41,780 each 
 Commissions EUR 2 Taxes EUR 0 

Trades:
ID 1338a Code FCEF5 Date 2014-12-18 03:13:42 Quantity 1 Price 4,178 Value per block 41,780 (Allocated from: ID 1338 Quantity 2)

CALCULATION: (1*41710) - 2 - 0 -(1*41780) - 2 - 0  = -74 

********************************************************************************************************************************************

2: SELL 1 FCEF5 Futures on 13/01/2015 at EUR 42,945 each gives PROFIT of EUR 1,161 equals GBP 954.227
 Commission EUR 2 and taxes EUR 0 on SELL
Trade details:ID 1340 Code FCEF5 Date 2015-01-13 09:05:59 Quantity -1 Price 4,294.50 Value per block 42,945
Total allowable cost EUR 2   Total disposal proceeds EUR 1,163

Matches with:
PRO-RATA SECTION 104: Quantity 1.000000 FCEF5 allocated from total holding of 2, made up of 1 trades between 2014-12-18 and 2014-12-18
 At average value of EUR 41,780 Commissions EUR 2 Taxes EUR 0  

Trades:
ID 1338b Code FCEF5 Date 2014-12-18 03:13:42 Quantity 1 Price 4,178 Value per block 41,780 (Allocated from: ID 1338 Quantity 2)

CALCULATION: (1*42945) - 2 - 0 -(1*41780) - 2 - 0  = 1,161 

********************************************************************************************************************************************

1: SELL 1 FCEK4 Futures on 05/05/2014 at EUR 43,725 each gives LOSS of EUR -684 equals GBP -561.019
 Commission EUR 2 and taxes EUR 0 on SELL
Trade details:ID 1347 Code FCEK4 Date 2014-05-05 07:45:28 Quantity -1 Price 4,372.50 Value per block 43,725
Total allowable cost EUR 2   Total disposal proceeds EUR -682

Matches with:
SUBSEQUENT 1 TRADE(S) Within 30 days between 2014-05-06 and 2014-05-06: Matches with BUY of 1 FCEK4 at of EUR 44,405 each 
 Commissions EUR 2 Taxes EUR 0  

Trades:
ID 1346 Code FCEK4 Date 2014-05-06 03:02:14 Quantity 1 Price 4,440.50 Value per block 44,405

CALCULATION: (1*43725) - 2 - 0 -(1*44405) - 2 - 0  = -684 

********************************************************************************************************************************************

2: SELL 5 FCEK4 Futures on 14/05/2014 at EUR 44,970 each gives PROFIT of EUR 7,480 equals GBP 6,135.10
 Commission EUR 10 and taxes EUR 0 on SELL
Trade details:ID 1348 Code FCEK4 Date 2014-05-14 03:25:37 Quantity -5 Price 4,497 Value per block 44,970
Total allowable cost EUR 10   Total disposal proceeds EUR 7,490

Matches with:
PRO-RATA SECTION 104: Quantity 5.000000 FCEK4 allocated from total holding of 5, made up of 3 trades between 2014-04-16 and 2014-04-22
 At average value of EUR 43,470 Commissions EUR 10 Taxes EUR 0  

Trades:
ID 1343 Code FCEK4 Date 2014-04-16 03:07:37 Quantity 3 Price 4,339 Value per block 43,390
ID 1344 Code FCEK4 Date 2014-04-16 03:10:36 Quantity 1 Price 4,333.50 Value per block 43,335
ID 1345 Code FCEK4 Date 2014-04-22 03:08:30 Quantity 1 Price 4,384.50 Value per block 43,845

CALCULATION: (5*44970) - 10 - 0 -(5*43470) - 10 - 0  = 7,480 

********************************************************************************************************************************************

1: SELL 1 FCEM4 Futures on 13/06/2014 at EUR 45,125 each gives PROFIT of EUR 346 equals GBP 282.332
 Commission EUR 2 and taxes EUR 0 on SELL
Trade details:ID 1351 Code FCEM4 Date 2014-06-13 06:35:43 Quantity -1 Price 4,512.50 Value per block 45,125
Total allowable cost EUR 2.00000   Total disposal proceeds EUR 348.000

Matches with:
PRO-RATA SECTION 104: Quantity 1.000000 FCEM4 allocated from total holding of 6, made up of 2 trades between 2014-05-15 and 2014-06-09
 At average value of EUR 44,775 Commissions EUR 2.00000 Taxes EUR 0  

Trades:
ID 1349a Code FCEM4 Date 2014-05-15 03:04:42 Quantity 0.833333 Price 4,457.50 Value per block 44,575 (Allocated from: ID 1349 Quantity 5)
ID 1350a Code FCEM4 Date 2014-06-09 04:14:28 Quantity 0.166667 Price 4,577.50 Value per block 45,775 (Allocated from: ID 1350 Quantity 1)

CALCULATION: (1*45125) - 2 - 0 -(1*44775) - 2.00000 - 0  = 346 

********************************************************************************************************************************************

2: SELL 5 FCEM4 Futures on 18/06/2014 at EUR 45,425 each gives PROFIT of EUR 3,230 equals GBP 2,635.66
 Commission EUR 10 and taxes EUR 0 on SELL
Trade details:ID 1352 Code FCEM4 Date 2014-06-18 03:16:59 Quantity -5 Price 4,542.50 Value per block 45,425
Total allowable cost EUR 10   Total disposal proceeds EUR 3,240.00

Matches with:
PRO-RATA SECTION 104: Quantity 5.000000 FCEM4 allocated from total holding of 6, made up of 2 trades between 2014-05-15 and 2014-06-09
 At average value of EUR 44,775.00 Commissions EUR 10 Taxes EUR 0  

Trades:
ID 1349b Code FCEM4 Date 2014-05-15 03:04:42 Quantity 4.16667 Price 4,457.50 Value per block 44,575 (Allocated from: ID 1349 Quantity 5)
ID 1350b Code FCEM4 Date 2014-06-09 04:14:28 Quantity 0.833333 Price 4,577.50 Value per block 45,775 (Allocated from: ID 1350 Quantity 1)

CALCULATION: (5*45425) - 10 - 0 -(5*44775.00) - 10 - 0  = 3,230 

********************************************************************************************************************************************

1: SELL 1 FCEN4 Futures on 23/06/2014 at EUR 45,015 each gives PROFIT of EUR 431 equals GBP 351.438
 Commission EUR 2 and taxes EUR 0 on SELL
Trade details:ID 1358 Code FCEN4 Date 2014-06-23 05:07:53 Quantity -1 Price 4,501.50 Value per block 45,015
Total allowable cost EUR 2   Total disposal proceeds EUR 433

Matches with:
SUBSEQUENT 1 TRADE(S) Within 30 days between 2014-07-02 and 2014-07-02: Matches with BUY of 1 FCEN4 at of EUR 44,580 each 
 Commissions EUR 2 Taxes EUR 0  

Trades:
ID 1355 Code FCEN4 Date 2014-07-02 06:57:47 Quantity 1 Price 4,458 Value per block 44,580

CALCULATION: (1*45015) - 2 - 0 -(1*44580) - 2 - 0  = 431 

********************************************************************************************************************************************

2: SELL 1 FCEN4 Futures on 27/06/2014 at EUR 44,550 each gives LOSS of EUR -254 equals GBP -207.112
 Commission EUR 2 and taxes EUR 0 on SELL
Trade details:ID 1359 Code FCEN4 Date 2014-06-27 05:11:44 Quantity -1 Price 4,455 Value per block 44,550
Total allowable cost EUR 2   Total disposal proceeds EUR -252

Matches with:
SUBSEQUENT 1 TRADE(S) Within 30 days between 2014-07-04 and 2014-07-04: Matches with BUY of 1 FCEN4 at of EUR 44,800 each 
 Commissions EUR 2 Taxes EUR 0  

Trades:
ID 1356 Code FCEN4 Date 2014-07-04 06:12:09 Quantity 1 Price 4,480 Value per block 44,800

CALCULATION: (1*44550) - 2 - 0 -(1*44800) - 2 - 0  = -254 

********************************************************************************************************************************************

3: SELL 1 FCEN4 Futures on 02/07/2014 at EUR 44,430 each gives PROFIT of EUR 1,076 equals GBP 878.505
 Commission EUR 2 and taxes EUR 0 on SELL
Trade details:ID 1360 Code FCEN4 Date 2014-07-02 10:45:33 Quantity -1 Price 4,443 Value per block 44,430
Total allowable cost EUR 2   Total disposal proceeds EUR 1,078

Matches with:
SUBSEQUENT 1 TRADE(S) Within 30 days between 2014-07-15 and 2014-07-15: Matches with BUY of 1 FCEN4 at of EUR 43,350 each 
 Commissions EUR 2 Taxes EUR 0  

Trades:
ID 1357 Code FCEN4 Date 2014-07-15 05:02:23 Quantity 1 Price 4,335 Value per block 43,350

CALCULATION: (1*44430) - 2 - 0 -(1*43350) - 2 - 0  = 1,076 

********************************************************************************************************************************************

4: SELL 1 FCEN4 Futures on 08/07/2014 at EUR 43,840 each gives LOSS of EUR -1,503 equals GBP -1,227.26
 Commission EUR 2 and taxes EUR 0 on SELL
Trade details:ID 1361 Code FCEN4 Date 2014-07-08 04:59:23 Quantity -1 Price 4,384 Value per block 43,840
Total allowable cost EUR 2.00000   Total disposal proceeds EUR -1,501.17

Matches with:
PRO-RATA SECTION 104: Quantity 1.000000 FCEN4 allocated from total holding of 6, made up of 2 trades between 2014-06-18 and 2014-06-19
 At average value of EUR 45,339.17 Commissions EUR 2.00000 Taxes EUR 0  

Trades:
ID 1353a Code FCEN4 Date 2014-06-18 10:51:20 Quantity 0.833333 Price 4,529.50 Value per block 45,295 (Allocated from: ID 1353 Quantity 5)
ID 1354a Code FCEN4 Date 2014-06-19 11:25:09 Quantity 0.166667 Price 4,556 Value per block 45,560 (Allocated from: ID 1354 Quantity 1)

CALCULATION: (1*43840) - 2 - 0 -(1*45339.17) - 2.00000 - 0  = -1,503 

********************************************************************************************************************************************

5: SELL 1 FCEN4 Futures on 08/07/2014 at EUR 43,545 each gives LOSS of EUR -1,798 equals GBP -1,468.12
 Commission EUR 2 and taxes EUR 0 on SELL
Trade details:ID 1362 Code FCEN4 Date 2014-07-08 10:24:25 Quantity -1 Price 4,354.50 Value per block 43,545
Total allowable cost EUR 2.00000   Total disposal proceeds EUR -1,796.17

Matches with:
PRO-RATA SECTION 104: Quantity 1.000000 FCEN4 allocated from total holding of 6, made up of 2 trades between 2014-06-18 and 2014-06-19
 At average value of EUR 45,339.17 Commissions EUR 2.00000 Taxes EUR 0  

Trades:
ID 1353b Code FCEN4 Date 2014-06-18 10:51:20 Quantity 0.833333 Price 4,529.50 Value per block 45,295.00 (Allocated from: ID 1353 Quantity 5)
ID 1354b Code FCEN4 Date 2014-06-19 11:25:09 Quantity 0.166667 Price 4,556 Value per block 45,560.00 (Allocated from: ID 1354 Quantity 1)

CALCULATION: (1*43545) - 2 - 0 -(1*45339.17) - 2.00000 - 0  = -1,798 

********************************************************************************************************************************************

6: SELL 1 FCEN4 Futures on 10/07/2014 at EUR 42,925 each gives LOSS of EUR -2,418 equals GBP -1,974.32
 Commission EUR 2 and taxes EUR 0 on SELL
Trade details:ID 1363 Code FCEN4 Date 2014-07-10 08:25:39 Quantity -1 Price 4,292.50 Value per block 42,925
Total allowable cost EUR 2.00000   Total disposal proceeds EUR -2,416.17

Matches with:
PRO-RATA SECTION 104: Quantity 1.000000 FCEN4 allocated from total holding of 6, made up of 2 trades between 2014-06-18 and 2014-06-19
 At average value of EUR 45,339.17 Commissions EUR 2.00000 Taxes EUR 0  

Trades:
ID 1353c Code FCEN4 Date 2014-06-18 10:51:20 Quantity 0.833333 Price 4,529.50 Value per block 45,295 (Allocated from: ID 1353 Quantity 5)
ID 1354c Code FCEN4 Date 2014-06-19 11:25:09 Quantity 0.166667 Price 4,556 Value per block 45,560 (Allocated from: ID 1354 Quantity 1)

CALCULATION: (1*42925) - 2 - 0 -(1*45339.17) - 2.00000 - 0  = -2,418 

********************************************************************************************************************************************

7: SELL 3 FCEN4 Futures on 16/07/2014 at EUR 43,290 each gives LOSS of EUR -6,160 equals GBP -5,021.66
 Commission EUR 6 and taxes EUR 0 on SELL
Trade details:ID 1364 Code FCEN4 Date 2014-07-16 03:11:55 Quantity -3 Price 4,329 Value per block 43,290
Total allowable cost EUR 6.00000   Total disposal proceeds EUR -6,153.50

Matches with:
PRO-RATA SECTION 104: Quantity 3.000000 FCEN4 allocated from total holding of 6, made up of 2 trades between 2014-06-18 and 2014-06-19
 At average value of EUR 45,339.17 Commissions EUR 6.00000 Taxes EUR 0  

Trades:
ID 1353d Code FCEN4 Date 2014-06-18 10:51:20 Quantity 2.50000 Price 4,529.50 Value per block 45,295.00 (Allocated from: ID 1353 Quantity 5)
ID 1354d Code FCEN4 Date 2014-06-19 11:25:09 Quantity 0.500000 Price 4,556 Value per block 45,560.00 (Allocated from: ID 1354 Quantity 1)

CALCULATION: (3*43290) - 6 - 0 -(3*45339.17) - 6.00000 - 0  = -6,160 

********************************************************************************************************************************************

1: SELL 1 FCEQ4 Futures on 18/07/2014 at EUR 42,950 each gives LOSS of EUR -594 equals GBP -484.270
 Commission EUR 2 and taxes EUR 0 on SELL
Trade details:ID 1367 Code FCEQ4 Date 2014-07-18 03:10:35 Quantity -1 Price 4,295 Value per block 42,950
Total allowable cost EUR 2   Total disposal proceeds EUR -592

Matches with:
SUBSEQUENT 1 TRADE(S) Within 30 days between 2014-07-24 and 2014-07-24: Matches with BUY of 1 FCEQ4 at of EUR 43,540 each 
 Commissions EUR 2 Taxes EUR 0  

Trades:
ID 1366 Code FCEQ4 Date 2014-07-24 03:12:45 Quantity 1 Price 4,354 Value per block 43,540

CALCULATION: (1*42950) - 2 - 0 -(1*43540) - 2 - 0  = -594 

********************************************************************************************************************************************

2: SELL 1 FCEQ4 Futures on 31/07/2014 at EUR 43,265 each gives LOSS of EUR -39 equals GBP -31.7741
 Commission EUR 2 and taxes EUR 0 on SELL
Trade details:ID 1368 Code FCEQ4 Date 2014-07-31 03:21:18 Quantity -1 Price 4,326.50 Value per block 43,265
Total allowable cost EUR 2   Total disposal proceeds EUR -37

Matches with:
PRO-RATA SECTION 104: Quantity 1.000000 FCEQ4 allocated from total holding of 3, made up of 1 trades between 2014-07-16 and 2014-07-16
 At average value of EUR 43,300 Commissions EUR 2 Taxes EUR 0  

Trades:
ID 1365a Code FCEQ4 Date 2014-07-16 03:11:55 Quantity 1 Price 4,330 Value per block 43,300 (Allocated from: ID 1365 Quantity 3)

CALCULATION: (1*43265) - 2 - 0 -(1*43300) - 2 - 0  = -39 

********************************************************************************************************************************************

3: SELL 1 FCEQ4 Futures on 08/08/2014 at EUR 41,220 each gives LOSS of EUR -2,084 equals GBP -1,697.82
 Commission EUR 2 and taxes EUR 0 on SELL
Trade details:ID 1369 Code FCEQ4 Date 2014-08-08 03:12:30 Quantity -1 Price 4,122 Value per block 41,220
Total allowable cost EUR 2   Total disposal proceeds EUR -2,082.00

Matches with:
PRO-RATA SECTION 104: Quantity 1.000000 FCEQ4 allocated from total holding of 3, made up of 1 trades between 2014-07-16 and 2014-07-16
 At average value of EUR 43,300.00 Commissions EUR 2 Taxes EUR 0  

Trades:
ID 1365b Code FCEQ4 Date 2014-07-16 03:11:55 Quantity 1 Price 4,330 Value per block 43,300.00 (Allocated from: ID 1365 Quantity 3)

CALCULATION: (1*41220) - 2 - 0 -(1*43300.00) - 2 - 0  = -2,084 

********************************************************************************************************************************************

4: SELL 1 FCEQ4 Futures on 12/08/2014 at EUR 41,645 each gives LOSS of EUR -1,659 equals GBP -1,351.37
 Commission EUR 2 and taxes EUR 0 on SELL
Trade details:ID 1370 Code FCEQ4 Date 2014-08-12 11:33:58 Quantity -1 Price 4,164.50 Value per block 41,645
Total allowable cost EUR 2   Total disposal proceeds EUR -1,657.00

Matches with:
PRO-RATA SECTION 104: Quantity 1.000000 FCEQ4 allocated from total holding of 3, made up of 1 trades between 2014-07-16 and 2014-07-16
 At average value of EUR 43,300.00 Commissions EUR 2 Taxes EUR 0  

Trades:
ID 1365c Code FCEQ4 Date 2014-07-16 03:11:55 Quantity 1 Price 4,330 Value per block 43,300.00 (Allocated from: ID 1365 Quantity 3)

CALCULATION: (1*41645) - 2 - 0 -(1*43300.00) - 2 - 0  = -1,659 

********************************************************************************************************************************************

1: SELL 4 FCEU4 Futures on 16/09/2014 at EUR 44,215 each gives PROFIT of EUR 6,719 equals GBP 5,445.96
 Commission EUR 8 and taxes EUR 0 on SELL
Trade details:ID 1375 Code FCEU4 Date 2014-09-16 03:10:56 Quantity -4 Price 4,421.50 Value per block 44,215
Total allowable cost EUR 8   Total disposal proceeds EUR 6,727

Matches with:
PRO-RATA SECTION 104: Quantity 4.000000 FCEU4 allocated from total holding of 4, made up of 4 trades between 2014-08-12 and 2014-08-27
 At average value of EUR 42,531.25 Commissions EUR 8 Taxes EUR 0  

Trades:
ID 1371 Code FCEU4 Date 2014-08-12 11:33:58 Quantity 1 Price 4,165 Value per block 41,650
ID 1372 Code FCEU4 Date 2014-08-15 04:00:51 Quantity 1 Price 4,215.50 Value per block 42,155
ID 1373 Code FCEU4 Date 2014-08-20 04:02:18 Quantity 1 Price 4,245.50 Value per block 42,455
ID 1374 Code FCEU4 Date 2014-08-27 04:16:48 Quantity 1 Price 4,386.50 Value per block 43,865

CALCULATION: (4*44215) - 8 - 0 -(4*42531.25) - 8 - 0  = 6,719 

********************************************************************************************************************************************

1: SELL 2 FCEV4 Futures on 22/09/2014 at EUR 44,310 each gives LOSS of EUR -31 equals GBP -25.3821
 Commission EUR 4 and taxes EUR 0 on SELL
Trade details:ID 1380 Code FCEV4 Date 2014-09-22 03:13:35 Quantity -2 Price 4,431 Value per block 44,310
Total allowable cost EUR 4   Total disposal proceeds EUR -27.3333

Matches with:
SUBSEQUENT 1 TRADE(S) Within 30 days between 2014-09-22 and 2014-09-22: Matches with BUY of 1 FCEV4 at of EUR 44,410 each 
 Commissions EUR 2 Taxes EUR 0  

Trades:
ID 1379 Code FCEV4 Date 2014-09-22 05:32:05 Quantity 1 Price 4,441 Value per block 44,410
PRO-RATA SECTION 104: Quantity 1.000000 FCEV4 allocated from total holding of 6, made up of 3 trades between 2014-09-16 and 2014-09-19
 At average value of EUR 44,233.33 Commissions EUR 2.00000 Taxes EUR 0  

Trades:
ID 1376a Code FCEV4 Date 2014-09-16 03:10:56 Quantity 0.666667 Price 4,412.50 Value per block 44,125 (Allocated from: ID 1376 Quantity 4)
ID 1377a Code FCEV4 Date 2014-09-17 06:12:13 Quantity 0.166667 Price 4,431 Value per block 44,310 (Allocated from: ID 1377 Quantity 1)
ID 1378a Code FCEV4 Date 2014-09-19 09:47:51 Quantity 0.166667 Price 4,459 Value per block 44,590 (Allocated from: ID 1378 Quantity 1)

CALCULATION: (2*44310) - 4 - 0 -(1*44410) - 2 - 0 -(1*44233.33) - 2.00000 - 0  = -31 

********************************************************************************************************************************************

2: SELL 1 FCEV4 Futures on 23/09/2014 at EUR 43,705 each gives LOSS of EUR -532 equals GBP -432.895
 Commission EUR 2 and taxes EUR 0 on SELL
Trade details:ID 1381 Code FCEV4 Date 2014-09-23 05:13:43 Quantity -1 Price 4,370.50 Value per block 43,705
Total allowable cost EUR 2.00000   Total disposal proceeds EUR -530.333

Matches with:
PRO-RATA SECTION 104: Quantity 1.000000 FCEV4 allocated from total holding of 6, made up of 3 trades between 2014-09-16 and 2014-09-19
 At average value of EUR 44,233.33 Commissions EUR 2.00000 Taxes EUR 0  

Trades:
ID 1376b Code FCEV4 Date 2014-09-16 03:10:56 Quantity 0.666667 Price 4,412.50 Value per block 44,125 (Allocated from: ID 1376 Quantity 4)
ID 1377b Code FCEV4 Date 2014-09-17 06:12:13 Quantity 0.166667 Price 4,431 Value per block 44,310.00 (Allocated from: ID 1377 Quantity 1)
ID 1378b Code FCEV4 Date 2014-09-19 09:47:51 Quantity 0.166667 Price 4,459 Value per block 44,590 (Allocated from: ID 1378 Quantity 1)

CALCULATION: (1*43705) - 2 - 0 -(1*44233.33) - 2.00000 - 0  = -532 

********************************************************************************************************************************************

3: SELL 1 FCEV4 Futures on 25/09/2014 at EUR 43,500 each gives LOSS of EUR -737 equals GBP -599.997
 Commission EUR 2 and taxes EUR 0 on SELL
Trade details:ID 1382 Code FCEV4 Date 2014-09-25 11:58:22 Quantity -1 Price 4,350 Value per block 43,500
Total allowable cost EUR 2.00000   Total disposal proceeds EUR -735.333

Matches with:
PRO-RATA SECTION 104: Quantity 1.000000 FCEV4 allocated from total holding of 6, made up of 3 trades between 2014-09-16 and 2014-09-19
 At average value of EUR 44,233.33 Commissions EUR 2.00000 Taxes EUR 0  

Trades:
ID 1376c Code FCEV4 Date 2014-09-16 03:10:56 Quantity 0.666667 Price 4,412.50 Value per block 44,125 (Allocated from: ID 1376 Quantity 4)
ID 1377c Code FCEV4 Date 2014-09-17 06:12:13 Quantity 0.166667 Price 4,431 Value per block 44,310.00 (Allocated from: ID 1377 Quantity 1)
ID 1378c Code FCEV4 Date 2014-09-19 09:47:51 Quantity 0.166667 Price 4,459 Value per block 44,590 (Allocated from: ID 1378 Quantity 1)

CALCULATION: (1*43500) - 2 - 0 -(1*44233.33) - 2.00000 - 0  = -737 

********************************************************************************************************************************************

4: SELL 1 FCEV4 Futures on 29/09/2014 at EUR 43,735 each gives LOSS of EUR -502 equals GBP -408.766
 Commission EUR 2 and taxes EUR 0 on SELL
Trade details:ID 1383 Code FCEV4 Date 2014-09-29 04:07:14 Quantity -1 Price 4,373.50 Value per block 43,735
Total allowable cost EUR 2.00000   Total disposal proceeds EUR -500.333

Matches with:
PRO-RATA SECTION 104: Quantity 1.000000 FCEV4 allocated from total holding of 6, made up of 3 trades between 2014-09-16 and 2014-09-19
 At average value of EUR 44,233.33 Commissions EUR 2.00000 Taxes EUR 0  

Trades:
ID 1376d Code FCEV4 Date 2014-09-16 03:10:56 Quantity 0.666667 Price 4,412.50 Value per block 44,125.00 (Allocated from: ID 1376 Quantity 4)
ID 1377d Code FCEV4 Date 2014-09-17 06:12:13 Quantity 0.166667 Price 4,431 Value per block 44,310 (Allocated from: ID 1377 Quantity 1)
ID 1378d Code FCEV4 Date 2014-09-19 09:47:51 Quantity 0.166667 Price 4,459 Value per block 44,590.00 (Allocated from: ID 1378 Quantity 1)

CALCULATION: (1*43735) - 2 - 0 -(1*44233.33) - 2.00000 - 0  = -502 

********************************************************************************************************************************************

5: SELL 1 FCEV4 Futures on 08/10/2014 at EUR 41,835 each gives LOSS of EUR -2,402 equals GBP -1,954.89
 Commission EUR 2 and taxes EUR 0 on SELL
Trade details:ID 1384 Code FCEV4 Date 2014-10-08 03:08:33 Quantity -1 Price 4,183.50 Value per block 41,835
Total allowable cost EUR 2.00000   Total disposal proceeds EUR -2,400.33

Matches with:
PRO-RATA SECTION 104: Quantity 1.000000 FCEV4 allocated from total holding of 6, made up of 3 trades between 2014-09-16 and 2014-09-19
 At average value of EUR 44,233.33 Commissions EUR 2.00000 Taxes EUR 0  

Trades:
ID 1376e Code FCEV4 Date 2014-09-16 03:10:56 Quantity 0.666667 Price 4,412.50 Value per block 44,125.00 (Allocated from: ID 1376 Quantity 4)
ID 1377e Code FCEV4 Date 2014-09-17 06:12:13 Quantity 0.166667 Price 4,431 Value per block 44,310 (Allocated from: ID 1377 Quantity 1)
ID 1378e Code FCEV4 Date 2014-09-19 09:47:51 Quantity 0.166667 Price 4,459 Value per block 44,590.00 (Allocated from: ID 1378 Quantity 1)

CALCULATION: (1*41835) - 2 - 0 -(1*44233.33) - 2.00000 - 0  = -2,402 

********************************************************************************************************************************************

6: SELL 1 FCEV4 Futures on 14/10/2014 at EUR 40,755 each gives LOSS of EUR -3,482 equals GBP -2,833.74
 Commission EUR 2 and taxes EUR 0 on SELL
Trade details:ID 1385 Code FCEV4 Date 2014-10-14 09:15:29 Quantity -1 Price 4,075.50 Value per block 40,755
Total allowable cost EUR 2.00000   Total disposal proceeds EUR -3,480.33

Matches with:
PRO-RATA SECTION 104: Quantity 1.000000 FCEV4 allocated from total holding of 6, made up of 3 trades between 2014-09-16 and 2014-09-19
 At average value of EUR 44,233.33 Commissions EUR 2.00000 Taxes EUR 0  

Trades:
ID 1376f Code FCEV4 Date 2014-09-16 03:10:56 Quantity 0.666667 Price 4,412.50 Value per block 44,125.00 (Allocated from: ID 1376 Quantity 4)
ID 1377f Code FCEV4 Date 2014-09-17 06:12:13 Quantity 0.166667 Price 4,431 Value per block 44,310.00 (Allocated from: ID 1377 Quantity 1)
ID 1378f Code FCEV4 Date 2014-09-19 09:47:51 Quantity 0.166667 Price 4,459 Value per block 44,590.00 (Allocated from: ID 1378 Quantity 1)

CALCULATION: (1*40755) - 2 - 0 -(1*44233.33) - 2.00000 - 0  = -3,482 

********************************************************************************************************************************************

1: SELL 1 FCEX4 Futures on 15/10/2014 at EUR 39,870 each gives LOSS of EUR -934 equals GBP -760.043
 Commission EUR 2 and taxes EUR 0 on SELL
Trade details:ID 1391 Code FCEX4 Date 2014-10-15 10:09:19 Quantity -1 Price 3,987 Value per block 39,870
Total allowable cost EUR 2   Total disposal proceeds EUR -932

Matches with:
SUBSEQUENT 1 TRADE(S) Within 30 days between 2014-10-22 and 2014-10-22: Matches with BUY of 1 FCEX4 at of EUR 40,800 each 
 Commissions EUR 2 Taxes EUR 0  

Trades:
ID 1387 Code FCEX4 Date 2014-10-22 03:07:57 Quantity 1 Price 4,080 Value per block 40,800

CALCULATION: (1*39870) - 2 - 0 -(1*40800) - 2 - 0  = -934 

********************************************************************************************************************************************

2: SELL 4 FCEX4 Futures on 18/11/2014 at EUR 42,400 each gives PROFIT of EUR 2,814 equals GBP 2,289.89
 Commission EUR 8 and taxes EUR 0 on SELL
Trade details:ID 1392 Code FCEX4 Date 2014-11-18 03:54:00 Quantity -4 Price 4,240 Value per block 42,400
Total allowable cost EUR 8   Total disposal proceeds EUR 2,822

Matches with:
PRO-RATA SECTION 104: Quantity 4.000000 FCEX4 allocated from total holding of 4, made up of 4 trades between 2014-10-14 and 2014-11-14
 At average value of EUR 41,692.50 Commissions EUR 8 Taxes EUR 0  

Trades:
ID 1386 Code FCEX4 Date 2014-10-14 09:15:29 Quantity 1 Price 4,073.50 Value per block 40,735
ID 1388 Code FCEX4 Date 2014-10-31 07:05:55 Quantity 1 Price 4,217.50 Value per block 42,175
ID 1389 Code FCEX4 Date 2014-11-06 06:01:00 Quantity 1 Price 4,197 Value per block 41,970
ID 1390 Code FCEX4 Date 2014-11-14 06:05:33 Quantity 1 Price 4,189 Value per block 41,890

CALCULATION: (4*42400) - 8 - 0 -(4*41692.50) - 8 - 0  = 2,814 

********************************************************************************************************************************************

1: SELL 1 FCEZ4 Futures on 09/12/2014 at EUR 42,560 each gives PROFIT of EUR 266 equals GBP 216.314
 Commission EUR 2 and taxes EUR 0 on SELL
Trade details:ID 1394 Code FCEZ4 Date 2014-12-09 11:09:51 Quantity -1 Price 4,256 Value per block 42,560
Total allowable cost EUR 2   Total disposal proceeds EUR 268

Matches with:
PRO-RATA SECTION 104: Quantity 1.000000 FCEZ4 allocated from total holding of 4, made up of 1 trades between 2014-11-18 and 2014-11-18
 At average value of EUR 42,290 Commissions EUR 2 Taxes EUR 0  

Trades:
ID 1393a Code FCEZ4 Date 2014-11-18 03:54:00 Quantity 1 Price 4,229 Value per block 42,290 (Allocated from: ID 1393 Quantity 4)

CALCULATION: (1*42560) - 2 - 0 -(1*42290) - 2 - 0  = 266 

********************************************************************************************************************************************

2: SELL 1 FCEZ4 Futures on 12/12/2014 at EUR 41,530 each gives LOSS of EUR -764 equals GBP -621.293
 Commission EUR 2 and taxes EUR 0 on SELL
Trade details:ID 1395 Code FCEZ4 Date 2014-12-12 06:20:57 Quantity -1 Price 4,153 Value per block 41,530
Total allowable cost EUR 2   Total disposal proceeds EUR -762

Matches with:
PRO-RATA SECTION 104: Quantity 1.000000 FCEZ4 allocated from total holding of 4, made up of 1 trades between 2014-11-18 and 2014-11-18
 At average value of EUR 42,290 Commissions EUR 2 Taxes EUR 0  

Trades:
ID 1393b Code FCEZ4 Date 2014-11-18 03:54:00 Quantity 1 Price 4,229 Value per block 42,290 (Allocated from: ID 1393 Quantity 4)

CALCULATION: (1*41530) - 2 - 0 -(1*42290) - 2 - 0  = -764 

********************************************************************************************************************************************

3: SELL 2 FCEZ4 Futures on 18/12/2014 at EUR 41,750 each gives LOSS of EUR -1,088 equals GBP -884.310
 Commission EUR 4 and taxes EUR 0 on SELL
Trade details:ID 1396 Code FCEZ4 Date 2014-12-18 03:13:42 Quantity -2 Price 4,175 Value per block 41,750
Total allowable cost EUR 4   Total disposal proceeds EUR -1,084.00

Matches with:
PRO-RATA SECTION 104: Quantity 2.000000 FCEZ4 allocated from total holding of 4, made up of 1 trades between 2014-11-18 and 2014-11-18
 At average value of EUR 42,290.00 Commissions EUR 4 Taxes EUR 0  

Trades:
ID 1393c Code FCEZ4 Date 2014-11-18 03:54:00 Quantity 2 Price 4,229 Value per block 42,290.00 (Allocated from: ID 1393 Quantity 4)

CALCULATION: (2*41750) - 4 - 0 -(2*42290.00) - 4 - 0  = -1,088 

********************************************************************************************************************************************

1: SELL 1 FCF5 Futures on 19/11/2014 at USD 118,300 each gives PROFIT of USD 2,694 equals GBP 1,620.89
 Commission USD 2.89000 and taxes USD 0 on SELL
Trade details:ID 212 Code FCF5 Date 2014-11-19 11:18:05 Quantity -1 Price 2.36600 Value per block 118,300
Total allowable cost USD 2.89000   Total disposal proceeds USD 2,697.11

Matches with:
PRO-RATA SECTION 104: Quantity 1.000000 FCF5 allocated from total holding of 1, made up of 1 trades between 2014-10-21 and 2014-10-21
 At average value of USD 115,600 Commissions USD 2.89000 Taxes USD 0  

Trades:
ID 211 Code FCF5 Date 2014-10-21 11:15:10 Quantity 1 Price 2.31200 Value per block 115,600

CALCULATION: (1*118300) - 2.89000 - 0 -(1*115600) - 2.89000 - 0  = 2,694 

********************************************************************************************************************************************

1: SELL 1 FCH5 Futures on 25/11/2014 at USD 114,688 each gives LOSS of USD -2,850 equals GBP -1,714.32
 Commission USD 2.89000 and taxes USD 0 on SELL
Trade details:ID 215 Code FCH5 Date 2014-11-25 11:15:55 Quantity -1 Price 2.29375 Value per block 114,688
Total allowable cost USD 2.89000   Total disposal proceeds USD -2,846.64

Matches with:
PRO-RATA SECTION 104: Quantity 1.000000 FCH5 allocated from total holding of 2, made up of 2 trades between 2014-11-17 and 2014-11-24
 At average value of USD 117,531 Commissions USD 2.89000 Taxes USD 0  

Trades:
ID 213a Code FCH5 Date 2014-11-17 11:13:54 Quantity 0.500000 Price 2.35425 Value per block 117,712 (Allocated from: ID 213 Quantity 1)
ID 214a Code FCH5 Date 2014-11-24 11:11:08 Quantity 0.500000 Price 2.34700 Value per block 117,350 (Allocated from: ID 214 Quantity 1)

CALCULATION: (1*114688) - 2.89000 - 0 -(1*117531) - 2.89000 - 0  = -2,850 

********************************************************************************************************************************************

1: SELL 1 FCQ4 Futures on 02/05/2014 at USD 95,637.50 each gives PROFIT of USD 3,132 equals GBP 1,884.08
 Commission USD 2.90000 and taxes USD 0 on SELL
Trade details:ID 217 Code FCQ4 Date 2014-05-02 11:07:11 Quantity -1 Price 1.91275 Value per block 95,637.50
Total allowable cost USD 2.90000   Total disposal proceeds USD 3,134.60

Matches with:
PRO-RATA SECTION 104: Quantity 1.000000 FCQ4 allocated from total holding of 1, made up of 1 trades between 2014-04-25 and 2014-04-25
 At average value of USD 92,500 Commissions USD 2.90000 Taxes USD 0  

Trades:
ID 216 Code FCQ4 Date 2014-04-25 13:23:10 Quantity 1 Price 1.85000 Value per block 92,500

CALCULATION: (1*95637.50) - 2.90000 - 0 -(1*92500) - 2.90000 - 0  = 3,132 

********************************************************************************************************************************************

1: SELL 1 FCX4 Futures on 14/10/2014 at USD 118,700 each gives PROFIT of USD 7,994 equals GBP 4,809.44
 Commission USD 2.89000 and taxes USD 0 on SELL
Trade details:ID 219 Code FCX4 Date 2014-10-14 11:28:35 Quantity -1 Price 2.37400 Value per block 118,700
Total allowable cost USD 2.90000   Total disposal proceeds USD 7,997.11

Matches with:
PRO-RATA SECTION 104: Quantity 1.000000 FCX4 allocated from total holding of 1, made up of 1 trades between 2014-09-05 and 2014-09-05
 At average value of USD 110,700 Commissions USD 2.90000 Taxes USD 0  

Trades:
ID 218 Code FCX4 Date 2014-09-05 09:33:08 Quantity 1 Price 2.21400 Value per block 110,700

CALCULATION: (1*118700) - 2.89000 - 0 -(1*110700) - 2.90000 - 0  = 7,994 

********************************************************************************************************************************************

1: SELL 1 FDAX DEC 14 Futures on 26/09/2014 at EUR 237,075 each gives PROFIT of EUR 2,771 equals GBP 2,253.35
 Commission EUR 2 and taxes EUR 0 on SELL
Trade details:ID 1399 Code FDAX DEC 14 Date 2014-09-26 03:10:28 Quantity -1 Price 9,483 Value per block 237,075
Total allowable cost EUR 2   Total disposal proceeds EUR 2,773

Matches with:
SUBSEQUENT 1 TRADE(S) Within 30 days between 2014-11-11 and 2014-11-11: Matches with BUY of 1 FDAX DEC 14 at of EUR 234,300 each 
 Commissions EUR 2 Taxes EUR 0  

Trades:
ID 1398 Code FDAX DEC 14 Date 2014-11-11 06:35:13 Quantity 1 Price 9,372 Value per block 234,300

CALCULATION: (1*237075) - 2 - 0 -(1*234300) - 2 - 0  = 2,771 

********************************************************************************************************************************************

2: SELL 1 FDAX DEC 14 Futures on 12/12/2014 at EUR 243,550 each gives PROFIT of EUR 2,934 equals GBP 2,382.96
 Commission EUR 2 and taxes EUR 0 on SELL
Trade details:ID 1400 Code FDAX DEC 14 Date 2014-12-12 06:21:22 Quantity -1 Price 9,742 Value per block 243,550
Total allowable cost EUR 2   Total disposal proceeds EUR 2,935.50

Matches with:
PRO-RATA SECTION 104: Quantity 1.000000 FDAX DEC 14 allocated from total holding of 1, made up of 1 trades between 2014-09-16 and 2014-09-16
 At average value of EUR 240,612 Commissions EUR 2 Taxes EUR 0  

Trades:
ID 1397 Code FDAX DEC 14 Date 2014-09-16 08:09:18 Quantity 1 Price 9,624.50 Value per block 240,612

CALCULATION: (1*243550) - 2 - 0 -(1*240612) - 2 - 0  = 2,934 

********************************************************************************************************************************************

1: SELL 1 FDAX JUN 14 Futures on 18/06/2014 at EUR 248,238 each gives PROFIT of EUR 5,246 equals GBP 4,259.06
 Commission EUR 2 and taxes EUR 0 on SELL
Trade details:ID 1402 Code FDAX JUN 14 Date 2014-06-18 03:43:11 Quantity -1 Price 9,929.50 Value per block 248,238
Total allowable cost EUR 2   Total disposal proceeds EUR 5,248

Matches with:
PRO-RATA SECTION 104: Quantity 1.000000 FDAX JUN 14 allocated from total holding of 1, made up of 1 trades between 2014-05-23 and 2014-05-23
 At average value of EUR 242,988 Commissions EUR 2 Taxes EUR 0  

Trades:
ID 1401 Code FDAX JUN 14 Date 2014-05-23 03:21:53 Quantity 1 Price 9,719.50 Value per block 242,988

CALCULATION: (1*248238) - 2 - 0 -(1*242988) - 2 - 0  = 5,246 

********************************************************************************************************************************************

1: SELL 1 FDAX SEP 14 Futures on 10/07/2014 at EUR 241,700 each gives LOSS of EUR -2,492 equals GBP -2,007.79
 Commission EUR 2 and taxes EUR 0 on SELL
Trade details:ID 1408 Code FDAX SEP 14 Date 2014-07-10 08:28:34 Quantity -1 Price 9,668 Value per block 241,700
Total allowable cost EUR 2   Total disposal proceeds EUR -2,489.50

Matches with:
SUBSEQUENT 1 TRADE(S) Within 30 days between 2014-07-15 and 2014-07-15: Matches with BUY of 1 FDAX SEP 14 at of EUR 244,188 each 
 Commissions EUR 2 Taxes EUR 0  

Trades:
ID 1404 Code FDAX SEP 14 Date 2014-07-15 04:58:45 Quantity 1 Price 9,767.50 Value per block 244,188

CALCULATION: (1*241700) - 2 - 0 -(1*244188) - 2 - 0  = -2,492 

********************************************************************************************************************************************

2: SELL 1 FDAX SEP 14 Futures on 18/07/2014 at EUR 241,962 each gives LOSS of EUR -2,417 equals GBP -1,947.35
 Commission EUR 2 and taxes EUR 0 on SELL
Trade details:ID 1409 Code FDAX SEP 14 Date 2014-07-18 03:12:49 Quantity -1 Price 9,678.50 Value per block 241,962
Total allowable cost EUR 2   Total disposal proceeds EUR -2,414.50

Matches with:
SUBSEQUENT 1 TRADE(S) Within 30 days between 2014-07-25 and 2014-07-25: Matches with BUY of 1 FDAX SEP 14 at of EUR 244,375 each 
 Commissions EUR 2 Taxes EUR 0  

Trades:
ID 1405 Code FDAX SEP 14 Date 2014-07-25 03:24:06 Quantity 1 Price 9,775 Value per block 244,375

CALCULATION: (1*241962) - 2 - 0 -(1*244375) - 2 - 0  = -2,417 

********************************************************************************************************************************************

3: SELL 1 FDAX SEP 14 Futures on 29/07/2014 at EUR 240,600 each gives LOSS of EUR -792 equals GBP -637.836
 Commission EUR 2 and taxes EUR 0 on SELL
Trade details:ID 1410 Code FDAX SEP 14 Date 2014-07-29 03:04:27 Quantity -1 Price 9,624 Value per block 240,600
Total allowable cost EUR 2   Total disposal proceeds EUR -789.500

Matches with:
SUBSEQUENT 1 TRADE(S) Within 30 days between 2014-07-30 and 2014-07-30: Matches with BUY of 1 FDAX SEP 14 at of EUR 241,388 each 
 Commissions EUR 2 Taxes EUR 0  

Trades:
ID 1406 Code FDAX SEP 14 Date 2014-07-30 03:21:00 Quantity 1 Price 9,655.50 Value per block 241,388

CALCULATION: (1*240600) - 2 - 0 -(1*241388) - 2 - 0  = -792 

********************************************************************************************************************************************

4: SELL 1 FDAX SEP 14 Futures on 31/07/2014 at EUR 238,750 each gives LOSS of EUR -429 equals GBP -345.714
 Commission EUR 2 and taxes EUR 0 on SELL
Trade details:ID 1411 Code FDAX SEP 14 Date 2014-07-31 03:24:42 Quantity -1 Price 9,550 Value per block 238,750
Total allowable cost EUR 2   Total disposal proceeds EUR -427

Matches with:
SUBSEQUENT 1 TRADE(S) Within 30 days between 2014-09-02 and 2014-09-02: Matches with BUY of 1 FDAX SEP 14 at of EUR 239,175 each 
 Commissions EUR 2 Taxes EUR 0  

Trades:
ID 1407 Code FDAX SEP 14 Date 2014-09-02 06:42:37 Quantity 1 Price 9,567 Value per block 239,175

CALCULATION: (1*238750) - 2 - 0 -(1*239175) - 2 - 0  = -429 

********************************************************************************************************************************************

5: SELL 1 FDAX SEP 14 Futures on 16/09/2014 at EUR 240,538 each gives LOSS of EUR -7,967 equals GBP -6,419.84
 Commission EUR 2 and taxes EUR 0 on SELL
Trade details:ID 1412 Code FDAX SEP 14 Date 2014-09-16 08:09:18 Quantity -1 Price 9,621.50 Value per block 240,538
Total allowable cost EUR 2   Total disposal proceeds EUR -7,964.50

Matches with:
PRO-RATA SECTION 104: Quantity 1.000000 FDAX SEP 14 allocated from total holding of 1, made up of 1 trades between 2014-06-18 and 2014-06-18
 At average value of EUR 248,500 Commissions EUR 2 Taxes EUR 0  

Trades:
ID 1403 Code FDAX SEP 14 Date 2014-06-18 04:28:29 Quantity 1 Price 9,940 Value per block 248,500

CALCULATION: (1*240538) - 2 - 0 -(1*248500) - 2 - 0  = -7,967 

********************************************************************************************************************************************

1: CLOSE SHORT 9 FESX DEC 14 Futures on 18/12/2014 at EUR 31,080 each gives PROFIT of EUR 8,874 equals GBP 7,151.24
 Commission EUR 18 and taxes EUR 0 on CLOSE SHORT
Trade details:ID 1413 Code FESX DEC 14 Date 2014-12-18 03:00:54 Quantity 9 Price 3,108 Value per block 31,080
Total allowable cost EUR 18   Total disposal proceeds EUR 8,892

Matches with:
PRO-RATA SECTION 104: Quantity 9.000000 FESX DEC 14 allocated from total holding of -9, made up of 1 trades between 2014-09-16 and 2014-09-16
 At average value of EUR 32,070 Commissions EUR 18 Taxes EUR 0  

Trades:
ID 1414 Code FESX DEC 14 Date 2014-09-16 03:24:20 Quantity -9 Price 3,207 Value per block 32,070

CALCULATION: -(9*31080) - 18 - 0 +(9*32070) - 18 - 0  = 8,874 

********************************************************************************************************************************************

1: CLOSE SHORT 9 FESX JUN 14 Futures on 16/06/2014 at EUR 32,690 each gives LOSS of EUR -14,796 equals GBP -11,845.85
 Commission EUR 18 and taxes EUR 0 on CLOSE SHORT
Trade details:ID 1415 Code FESX JUN 14 Date 2014-06-16 09:26:26 Quantity 9 Price 3,269 Value per block 32,690
Total allowable cost EUR 18   Total disposal proceeds EUR -14,778

Matches with:
PRO-RATA SECTION 104: Quantity 9.000000 FESX JUN 14 allocated from total holding of -9, made up of 2 trades between 2014-03-31 and 2014-03-31
 At average value of EUR 31,050 Commissions EUR 18 Taxes EUR 0  

Trades:
ID 1416 Code FESX JUN 14 Date 2014-03-31 06:55:38 Quantity -3 Price 3,105 Value per block 31,050
ID 1417 Code FESX JUN 14 Date 2014-03-31 06:57:00 Quantity -6 Price 3,105 Value per block 31,050

CALCULATION: -(9*32690) - 18 - 0 +(9*31050) - 18 - 0  = -14,796 

********************************************************************************************************************************************

1: CLOSE SHORT 9 FESX SEP 14 Futures on 16/09/2014 at EUR 32,230 each gives PROFIT of EUR 3,924 equals GBP 3,131.24
 Commission EUR 18 and taxes EUR 0 on CLOSE SHORT
Trade details:ID 1419 Code FESX SEP 14 Date 2014-09-16 03:24:20 Quantity 9 Price 3,223 Value per block 32,230
Total allowable cost EUR 18   Total disposal proceeds EUR 3,942

Matches with:
PRO-RATA SECTION 104: Quantity 9.000000 FESX SEP 14 allocated from total holding of -9, made up of 1 trades between 2014-06-17 and 2014-06-17
 At average value of EUR 32,670 Commissions EUR 18 Taxes EUR 0  

Trades:
ID 1420 Code FESX SEP 14 Date 2014-06-17 02:19:27 Quantity -9 Price 3,267 Value per block 32,670

CALCULATION: -(9*32230) - 18 - 0 +(9*32670) - 18 - 0  = 3,924 

********************************************************************************************************************************************

1: SELL 1 FGBL DEC 14 Futures on 12/09/2014 at EUR 147,880 each gives LOSS of EUR -1,664 equals GBP -1,328.87
 Commission EUR 2 and taxes EUR 0 on SELL
Trade details:ID 1424 Code FGBL DEC 14 Date 2014-09-12 09:05:59 Quantity -1 Price 147.880 Value per block 147,880
Total allowable cost EUR 2   Total disposal proceeds EUR -1,662

Matches with:
SUBSEQUENT 1 TRADE(S) Within 30 days between 2014-09-26 and 2014-09-26: Matches with BUY of 1 FGBL DEC 14 at of EUR 149,540 each 
 Commissions EUR 2 Taxes EUR 0  

Trades:
ID 1422 Code FGBL DEC 14 Date 2014-09-26 02:39:06 Quantity 1 Price 149.540 Value per block 149,540

CALCULATION: (1*147880) - 2 - 0 -(1*149540) - 2 - 0  = -1,664 

********************************************************************************************************************************************

2: SELL 1 FGBL DEC 14 Futures on 15/09/2014 at EUR 147,900 each gives LOSS of EUR -2,634 equals GBP -2,103.51
 Commission EUR 2 and taxes EUR 0 on SELL
Trade details:ID 1425 Code FGBL DEC 14 Date 2014-09-15 02:39:31 Quantity -1 Price 147.900 Value per block 147,900
Total allowable cost EUR 2   Total disposal proceeds EUR -2,632

Matches with:
SUBSEQUENT 1 TRADE(S) Within 30 days between 2014-10-28 and 2014-10-28: Matches with BUY of 1 FGBL DEC 14 at of EUR 150,530 each 
 Commissions EUR 2 Taxes EUR 0  

Trades:
ID 1423 Code FGBL DEC 14 Date 2014-10-28 03:37:38 Quantity 1 Price 150.530 Value per block 150,530

CALCULATION: (1*147900) - 2 - 0 -(1*150530) - 2 - 0  = -2,634 

********************************************************************************************************************************************

3: SELL 1 FGBL DEC 14 Futures on 24/10/2014 at EUR 150,560 each gives PROFIT of EUR 896 equals GBP 715.545
 Commission EUR 2 and taxes EUR 0 on SELL
Trade details:ID 1426 Code FGBL DEC 14 Date 2014-10-24 03:48:14 Quantity -1 Price 150.560 Value per block 150,560
Total allowable cost EUR 2   Total disposal proceeds EUR 898

Matches with:
PRO-RATA SECTION 104: Quantity 1.000000 FGBL DEC 14 allocated from total holding of 3, made up of 1 trades between 2014-09-01 and 2014-09-01
 At average value of EUR 149,660 Commissions EUR 2 Taxes EUR 0  

Trades:
ID 1421a Code FGBL DEC 14 Date 2014-09-01 04:50:30 Quantity 1 Price 149.660 Value per block 149,660 (Allocated from: ID 1421 Quantity 3)

CALCULATION: (1*150560) - 2 - 0 -(1*149660) - 2 - 0  = 896 

********************************************************************************************************************************************

4: SELL 1 FGBL DEC 14 Futures on 06/11/2014 at EUR 151,170 each gives PROFIT of EUR 1,506 equals GBP 1,202.69
 Commission EUR 2 and taxes EUR 0 on SELL
Trade details:ID 1427 Code FGBL DEC 14 Date 2014-11-06 04:48:50 Quantity -1 Price 151.170 Value per block 151,170
Total allowable cost EUR 2   Total disposal proceeds EUR 1,508.00

Matches with:
PRO-RATA SECTION 104: Quantity 1.000000 FGBL DEC 14 allocated from total holding of 3, made up of 1 trades between 2014-09-01 and 2014-09-01
 At average value of EUR 149,660 Commissions EUR 2 Taxes EUR 0  

Trades:
ID 1421b Code FGBL DEC 14 Date 2014-09-01 04:50:30 Quantity 1 Price 149.660 Value per block 149,660 (Allocated from: ID 1421 Quantity 3)

CALCULATION: (1*151170) - 2 - 0 -(1*149660) - 2 - 0  = 1,506 

********************************************************************************************************************************************

5: SELL 1 FGBL DEC 14 Futures on 03/12/2014 at EUR 152,210 each gives PROFIT of EUR 2,546 equals GBP 2,033.23
 Commission EUR 2 and taxes EUR 0 on SELL
Trade details:ID 1428 Code FGBL DEC 14 Date 2014-12-03 02:40:01 Quantity -1 Price 152.210 Value per block 152,210
Total allowable cost EUR 2   Total disposal proceeds EUR 2,548.00

Matches with:
PRO-RATA SECTION 104: Quantity 1.000000 FGBL DEC 14 allocated from total holding of 3, made up of 1 trades between 2014-09-01 and 2014-09-01
 At average value of EUR 149,660 Commissions EUR 2 Taxes EUR 0  

Trades:
ID 1421c Code FGBL DEC 14 Date 2014-09-01 04:50:30 Quantity 1 Price 149.660 Value per block 149,660 (Allocated from: ID 1421 Quantity 3)

CALCULATION: (1*152210) - 2 - 0 -(1*149660) - 2 - 0  = 2,546 

********************************************************************************************************************************************

1: SELL 2 FGBL JUN 14 Futures on 02/06/2014 at EUR 146,880 each gives PROFIT of EUR 5,042 equals GBP 4,026.53
 Commission EUR 4 and taxes EUR 0 on SELL
Trade details:ID 1431 Code FGBL JUN 14 Date 2014-06-02 03:24:38 Quantity -2 Price 146.880 Value per block 146,880
Total allowable cost EUR 4   Total disposal proceeds EUR 5,046

Matches with:
PRO-RATA SECTION 104: Quantity 2.000000 FGBL JUN 14 allocated from total holding of 2, made up of 2 trades between 2014-04-11 and 2014-05-05
 At average value of EUR 144,355 Commissions EUR 4 Taxes EUR 0  

Trades:
ID 1429 Code FGBL JUN 14 Date 2014-04-11 03:11:42 Quantity 1 Price 143.840 Value per block 143,840
ID 1430 Code FGBL JUN 14 Date 2014-05-05 05:36:55 Quantity 1 Price 144.870 Value per block 144,870

CALCULATION: (2*146880) - 4 - 0 -(2*144355) - 4 - 0  = 5,042 

********************************************************************************************************************************************

1: SELL 1 FGBL MAR 15 Futures on 26/01/2015 at EUR 158,920 each gives PROFIT of EUR 4,451 equals GBP 3,558.03
 Commission EUR 2 and taxes EUR 0 on SELL
Trade details:ID 1434 Code FGBL MAR 15 Date 2015-01-26 02:39:10 Quantity -1 Price 158.920 Value per block 158,920
Total allowable cost EUR 2   Total disposal proceeds EUR 4,453

Matches with:
PRO-RATA SECTION 104: Quantity 1.000000 FGBL MAR 15 allocated from total holding of 2, made up of 2 trades between 2014-12-03 and 2015-01-02
 At average value of EUR 154,465 Commissions EUR 2 Taxes EUR 0  

Trades:
ID 1432a Code FGBL MAR 15 Date 2014-12-03 02:51:45 Quantity 0.500000 Price 153.080 Value per block 153,080 (Allocated from: ID 1432 Quantity 1)
ID 1433a Code FGBL MAR 15 Date 2015-01-02 02:32:12 Quantity 0.500000 Price 155.850 Value per block 155,850 (Allocated from: ID 1433 Quantity 1)

CALCULATION: (1*158920) - 2 - 0 -(1*154465) - 2 - 0  = 4,451 

********************************************************************************************************************************************

1: SELL 1 FGBL SEP 14 Futures on 02/07/2014 at EUR 146,740 each gives LOSS of EUR -434 equals GBP -346.988
 Commission EUR 2 and taxes EUR 0 on SELL
Trade details:ID 1441 Code FGBL SEP 14 Date 2014-07-02 10:26:25 Quantity -1 Price 146.740 Value per block 146,740
Total allowable cost EUR 2   Total disposal proceeds EUR -432

Matches with:
SAME DAY TRADE(S) Matches with BUY of 1 FGBL SEP 14 at average of EUR 147,170 each 
 Commissions EUR 2 Taxes EUR 0 

Trades:
ID 1436 Code FGBL SEP 14 Date 2014-07-02 05:57:44 Quantity 1 Price 147.170 Value per block 147,170

CALCULATION: (1*146740) - 2 - 0 -(1*147170) - 2 - 0  = -434 

********************************************************************************************************************************************

2: SELL 1 FGBL SEP 14 Futures on 10/07/2014 at EUR 147,740 each gives PROFIT of EUR 166 equals GBP 132.719
 Commission EUR 2 and taxes EUR 0 on SELL
Trade details:ID 1442 Code FGBL SEP 14 Date 2014-07-10 09:47:09 Quantity -1 Price 147.740 Value per block 147,740
Total allowable cost EUR 2   Total disposal proceeds EUR 168

Matches with:
SAME DAY TRADE(S) Matches with BUY of 1 FGBL SEP 14 at average of EUR 147,570 each 
 Commissions EUR 2 Taxes EUR 0 

Trades:
ID 1437 Code FGBL SEP 14 Date 2014-07-10 02:40:45 Quantity 1 Price 147.570 Value per block 147,570

CALCULATION: (1*147740) - 2 - 0 -(1*147570) - 2 - 0  = 166 

********************************************************************************************************************************************

3: SELL 1 FGBL SEP 14 Futures on 07/08/2014 at EUR 148,970 each gives LOSS of EUR -1,014 equals GBP -810.706
 Commission EUR 2 and taxes EUR 0 on SELL
Trade details:ID 1443 Code FGBL SEP 14 Date 2014-08-07 09:08:05 Quantity -1 Price 148.970 Value per block 148,970
Total allowable cost EUR 2   Total disposal proceeds EUR -1,012

Matches with:
SUBSEQUENT 1 TRADE(S) Within 30 days between 2014-08-14 and 2014-08-14: Matches with BUY of 1 FGBL SEP 14 at of EUR 149,980 each 
 Commissions EUR 2 Taxes EUR 0  

Trades:
ID 1439 Code FGBL SEP 14 Date 2014-08-14 02:40:38 Quantity 1 Price 149.980 Value per block 149,980

CALCULATION: (1*148970) - 2 - 0 -(1*149980) - 2 - 0  = -1,014 

********************************************************************************************************************************************

4: SELL 1 FGBL SEP 14 Futures on 29/08/2014 at EUR 151,370 each gives LOSS of EUR -314 equals GBP -250.880
 Commission EUR 2 and taxes EUR 0 on SELL
Trade details:ID 1444 Code FGBL SEP 14 Date 2014-08-29 06:16:05 Quantity -1 Price 151.370 Value per block 151,370
Total allowable cost EUR 2   Total disposal proceeds EUR -312

Matches with:
SAME DAY TRADE(S) Matches with BUY of 1 FGBL SEP 14 at average of EUR 151,680 each 
 Commissions EUR 2 Taxes EUR 0 

Trades:
ID 1440 Code FGBL SEP 14 Date 2014-08-29 02:43:00 Quantity 1 Price 151.680 Value per block 151,680

CALCULATION: (1*151370) - 2 - 0 -(1*151680) - 2 - 0  = -314 

********************************************************************************************************************************************

5: SELL 3 FGBL SEP 14 Futures on 01/09/2014 at EUR 151,580 each gives PROFIT of EUR 17,168 equals GBP 13,716.84
 Commission EUR 6 and taxes EUR 0 on SELL
Trade details:ID 1445 Code FGBL SEP 14 Date 2014-09-01 04:50:30 Quantity -3 Price 151.580 Value per block 151,580
Total allowable cost EUR 6   Total disposal proceeds EUR 17,174

Matches with:
PRO-RATA SECTION 104: Quantity 3.000000 FGBL SEP 14 allocated from total holding of 3, made up of 2 trades between 2014-06-03 and 2014-07-11
 At average value of EUR 145,853 Commissions EUR 6 Taxes EUR 0  

Trades:
ID 1435 Code FGBL SEP 14 Date 2014-06-03 08:57:21 Quantity 2 Price 144.970 Value per block 144,970
ID 1438 Code FGBL SEP 14 Date 2014-07-11 02:41:13 Quantity 1 Price 147.620 Value per block 147,620

CALCULATION: (3*151580) - 6 - 0 -(3*145853) - 6 - 0  = 17,168 

********************************************************************************************************************************************

1: SELL 1 FGBM DEC 14 Futures on 09/09/2014 at EUR 127,630 each gives LOSS of EUR -44 equals GBP -35.1972
 Commission EUR 2 and taxes EUR 0 on SELL
Trade details:ID 1454 Code FGBM DEC 14 Date 2014-09-09 02:38:09 Quantity -1 Price 127.630 Value per block 127,630
Total allowable cost EUR 2   Total disposal proceeds EUR -42

Matches with:
SUBSEQUENT 1 TRADE(S) Within 30 days between 2014-09-25 and 2014-09-25: Matches with BUY of 1 FGBM DEC 14 at of EUR 127,670 each 
 Commissions EUR 2 Taxes EUR 0  

Trades:
ID 1447 Code FGBM DEC 14 Date 2014-09-25 06:07:37 Quantity 1 Price 127.670 Value per block 127,670

CALCULATION: (1*127630) - 2 - 0 -(1*127670) - 2 - 0  = -44 

********************************************************************************************************************************************

2: SELL 1 FGBM DEC 14 Futures on 15/09/2014 at EUR 127,440 each gives LOSS of EUR -524 equals GBP -419.136
 Commission EUR 2 and taxes EUR 0 on SELL
Trade details:ID 1455 Code FGBM DEC 14 Date 2014-09-15 03:48:46 Quantity -1 Price 127.440 Value per block 127,440
Total allowable cost EUR 2   Total disposal proceeds EUR -522

Matches with:
SUBSEQUENT 1 TRADE(S) Within 30 days between 2014-10-01 and 2014-10-01: Matches with BUY of 1 FGBM DEC 14 at of EUR 127,960 each 
 Commissions EUR 2 Taxes EUR 0  

Trades:
ID 1448 Code FGBM DEC 14 Date 2014-10-01 02:41:21 Quantity 1 Price 127.960 Value per block 127,960

CALCULATION: (1*127440) - 2 - 0 -(1*127960) - 2 - 0  = -524 

********************************************************************************************************************************************

3: SELL 3 FGBM DEC 14 Futures on 19/09/2014 at EUR 127,330 each gives LOSS of EUR -2,132 equals GBP -1,705.34
 Commission EUR 6 and taxes EUR 0 on SELL
Trade details:ID 1456 Code FGBM DEC 14 Date 2014-09-19 04:42:02 Quantity -3 Price 127.330 Value per block 127,330
Total allowable cost EUR 6   Total disposal proceeds EUR -2,126

Matches with:
SUBSEQUENT 3 TRADE(S) Within 30 days between 2014-10-06 and 2014-11-03: Matches with BUY of 3 FGBM DEC 14 at of EUR 128,037 each 
 Commissions EUR 6 Taxes EUR 0  

Trades:
ID 1449 Code FGBM DEC 14 Date 2014-10-06 08:57:13 Quantity 1 Price 127.930 Value per block 127,930
ID 1450 Code FGBM DEC 14 Date 2014-10-15 03:46:28 Quantity 1 Price 128.060 Value per block 128,060
ID 1451 Code FGBM DEC 14 Date 2014-11-03 02:35:43 Quantity 1 Price 128.120 Value per block 128,120

CALCULATION: (3*127330) - 6 - 0 -(3*128037) - 6 - 0  = -2,132 

********************************************************************************************************************************************

4: SELL 2 FGBM DEC 14 Futures on 19/09/2014 at EUR 127,350 each gives LOSS of EUR -1,768 equals GBP -1,414.18
 Commission EUR 4 and taxes EUR 0 on SELL
Trade details:ID 1457 Code FGBM DEC 14 Date 2014-09-19 05:58:43 Quantity -2 Price 127.350 Value per block 127,350
Total allowable cost EUR 4   Total disposal proceeds EUR -1,764

Matches with:
SUBSEQUENT 2 TRADE(S) Within 30 days between 2014-11-12 and 2014-11-27: Matches with BUY of 2 FGBM DEC 14 at of EUR 128,230 each 
 Commissions EUR 4 Taxes EUR 0  

Trades:
ID 1452 Code FGBM DEC 14 Date 2014-11-12 05:55:00 Quantity 1 Price 128.190 Value per block 128,190
ID 1453 Code FGBM DEC 14 Date 2014-11-27 06:01:24 Quantity 1 Price 128.270 Value per block 128,270

CALCULATION: (2*127350) - 4 - 0 -(2*128230) - 4 - 0  = -1,768 

********************************************************************************************************************************************

5: SELL 1 FGBM DEC 14 Futures on 03/10/2014 at EUR 127,830 each gives PROFIT of EUR 226 equals GBP 180.773
 Commission EUR 2 and taxes EUR 0 on SELL
Trade details:ID 1458 Code FGBM DEC 14 Date 2014-10-03 03:40:34 Quantity -1 Price 127.830 Value per block 127,830
Total allowable cost EUR 2   Total disposal proceeds EUR 228

Matches with:
PRO-RATA SECTION 104: Quantity 1.000000 FGBM DEC 14 allocated from total holding of 9, made up of 1 trades between 2014-09-01 and 2014-09-01
 At average value of EUR 127,600 Commissions EUR 2 Taxes EUR 0  

Trades:
ID 1446a Code FGBM DEC 14 Date 2014-09-01 04:25:56 Quantity 1 Price 127.600 Value per block 127,600 (Allocated from: ID 1446 Quantity 9)

CALCULATION: (1*127830) - 2 - 0 -(1*127600) - 2 - 0  = 226 

********************************************************************************************************************************************

6: SELL 1 FGBM DEC 14 Futures on 20/10/2014 at EUR 127,870 each gives PROFIT of EUR 266 equals GBP 212.768
 Commission EUR 2 and taxes EUR 0 on SELL
Trade details:ID 1459 Code FGBM DEC 14 Date 2014-10-20 02:32:48 Quantity -1 Price 127.870 Value per block 127,870
Total allowable cost EUR 2   Total disposal proceeds EUR 268

Matches with:
PRO-RATA SECTION 104: Quantity 1.000000 FGBM DEC 14 allocated from total holding of 9, made up of 1 trades between 2014-09-01 and 2014-09-01
 At average value of EUR 127,600 Commissions EUR 2 Taxes EUR 0  

Trades:
ID 1446b Code FGBM DEC 14 Date 2014-09-01 04:25:56 Quantity 1 Price 127.600 Value per block 127,600 (Allocated from: ID 1446 Quantity 9)

CALCULATION: (1*127870) - 2 - 0 -(1*127600) - 2 - 0  = 266 

********************************************************************************************************************************************

7: SELL 1 FGBM DEC 14 Futures on 24/10/2014 at EUR 127,860 each gives PROFIT of EUR 256 equals GBP 204.769
 Commission EUR 2 and taxes EUR 0 on SELL
Trade details:ID 1460 Code FGBM DEC 14 Date 2014-10-24 02:42:21 Quantity -1 Price 127.860 Value per block 127,860
Total allowable cost EUR 2   Total disposal proceeds EUR 258

Matches with:
PRO-RATA SECTION 104: Quantity 1.000000 FGBM DEC 14 allocated from total holding of 9, made up of 1 trades between 2014-09-01 and 2014-09-01
 At average value of EUR 127,600 Commissions EUR 2 Taxes EUR 0  

Trades:
ID 1446c Code FGBM DEC 14 Date 2014-09-01 04:25:56 Quantity 1 Price 127.600 Value per block 127,600 (Allocated from: ID 1446 Quantity 9)

CALCULATION: (1*127860) - 2 - 0 -(1*127600) - 2 - 0  = 256 

********************************************************************************************************************************************

8: SELL 2 FGBM DEC 14 Futures on 06/11/2014 at EUR 128,130 each gives PROFIT of EUR 1,052 equals GBP 841.469
 Commission EUR 4 and taxes EUR 0 on SELL
Trade details:ID 1461 Code FGBM DEC 14 Date 2014-11-06 04:43:38 Quantity -2 Price 128.130 Value per block 128,130
Total allowable cost EUR 4   Total disposal proceeds EUR 1,056

Matches with:
PRO-RATA SECTION 104: Quantity 2.000000 FGBM DEC 14 allocated from total holding of 9, made up of 1 trades between 2014-09-01 and 2014-09-01
 At average value of EUR 127,600 Commissions EUR 4 Taxes EUR 0  

Trades:
ID 1446d Code FGBM DEC 14 Date 2014-09-01 04:25:56 Quantity 2 Price 127.600 Value per block 127,600 (Allocated from: ID 1446 Quantity 9)

CALCULATION: (2*128130) - 4 - 0 -(2*127600) - 4 - 0  = 1,052 

********************************************************************************************************************************************

9: SELL 1 FGBM DEC 14 Futures on 10/11/2014 at EUR 128,190 each gives PROFIT of EUR 586 equals GBP 468.727
 Commission EUR 2 and taxes EUR 0 on SELL
Trade details:ID 1462 Code FGBM DEC 14 Date 2014-11-10 02:36:04 Quantity -1 Price 128.190 Value per block 128,190
Total allowable cost EUR 2   Total disposal proceeds EUR 588.000

Matches with:
PRO-RATA SECTION 104: Quantity 1.000000 FGBM DEC 14 allocated from total holding of 9, made up of 1 trades between 2014-09-01 and 2014-09-01
 At average value of EUR 127,600 Commissions EUR 2 Taxes EUR 0  

Trades:
ID 1446e Code FGBM DEC 14 Date 2014-09-01 04:25:56 Quantity 1 Price 127.600 Value per block 127,600 (Allocated from: ID 1446 Quantity 9)

CALCULATION: (1*128190) - 2 - 0 -(1*127600) - 2 - 0  = 586 

********************************************************************************************************************************************

10: SELL 1 FGBM DEC 14 Futures on 12/11/2014 at EUR 128,150 each gives PROFIT of EUR 546 equals GBP 436.732
 Commission EUR 2 and taxes EUR 0 on SELL
Trade details:ID 1463 Code FGBM DEC 14 Date 2014-11-12 02:39:01 Quantity -1 Price 128.150 Value per block 128,150
Total allowable cost EUR 2   Total disposal proceeds EUR 548.000

Matches with:
PRO-RATA SECTION 104: Quantity 1.000000 FGBM DEC 14 allocated from total holding of 9, made up of 1 trades between 2014-09-01 and 2014-09-01
 At average value of EUR 127,600 Commissions EUR 2 Taxes EUR 0  

Trades:
ID 1446f Code FGBM DEC 14 Date 2014-09-01 04:25:56 Quantity 1 Price 127.600 Value per block 127,600 (Allocated from: ID 1446 Quantity 9)

CALCULATION: (1*128150) - 2 - 0 -(1*127600) - 2 - 0  = 546 

********************************************************************************************************************************************

11: SELL 2 FGBM DEC 14 Futures on 28/11/2014 at EUR 128,240 each gives PROFIT of EUR 1,272 equals GBP 1,017.44
 Commission EUR 4 and taxes EUR 0 on SELL
Trade details:ID 1464 Code FGBM DEC 14 Date 2014-11-28 06:47:00 Quantity -2 Price 128.240 Value per block 128,240
Total allowable cost EUR 4   Total disposal proceeds EUR 1,276.00

Matches with:
PRO-RATA SECTION 104: Quantity 2.000000 FGBM DEC 14 allocated from total holding of 9, made up of 1 trades between 2014-09-01 and 2014-09-01
 At average value of EUR 127,600 Commissions EUR 4 Taxes EUR 0  

Trades:
ID 1446g Code FGBM DEC 14 Date 2014-09-01 04:25:56 Quantity 2 Price 127.600 Value per block 127,600 (Allocated from: ID 1446 Quantity 9)

CALCULATION: (2*128240) - 4 - 0 -(2*127600) - 4 - 0  = 1,272 

********************************************************************************************************************************************

1: SELL 1 FGBM JUN 14 Futures on 17/04/2014 at EUR 125,760 each gives LOSS of EUR -234 equals GBP -186.633
 Commission EUR 2 and taxes EUR 0 on SELL
Trade details:ID 1468 Code FGBM JUN 14 Date 2014-04-17 02:31:43 Quantity -1 Price 125.760 Value per block 125,760
Total allowable cost EUR 2   Total disposal proceeds EUR -232

Matches with:
SUBSEQUENT 1 TRADE(S) Within 30 days between 2014-05-09 and 2014-05-09: Matches with BUY of 1 FGBM JUN 14 at of EUR 125,990 each 
 Commissions EUR 2 Taxes EUR 0  

Trades:
ID 1467 Code FGBM JUN 14 Date 2014-05-09 03:34:10 Quantity 1 Price 125.990 Value per block 125,990

CALCULATION: (1*125760) - 2 - 0 -(1*125990) - 2 - 0  = -234 

********************************************************************************************************************************************

2: SELL 3 FGBM JUN 14 Futures on 02/05/2014 at EUR 125,810 each gives PROFIT of EUR 843 equals GBP 672.357
 Commission EUR 6 and taxes EUR 0 on SELL
Trade details:ID 1469 Code FGBM JUN 14 Date 2014-05-02 02:35:59 Quantity -3 Price 125.810 Value per block 125,810
Total allowable cost EUR 6   Total disposal proceeds EUR 849

Matches with:
PRO-RATA SECTION 104: Quantity 3.000000 FGBM JUN 14 allocated from total holding of 4, made up of 2 trades between 2014-04-11 and 2014-04-15
 At average value of EUR 125,525 Commissions EUR 6 Taxes EUR 0  

Trades:
ID 1465a Code FGBM JUN 14 Date 2014-04-11 03:26:32 Quantity 2.25000 Price 125.490 Value per block 125,490 (Allocated from: ID 1465 Quantity 3)
ID 1466a Code FGBM JUN 14 Date 2014-04-15 04:41:55 Quantity 0.750000 Price 125.630 Value per block 125,630 (Allocated from: ID 1466 Quantity 1)

CALCULATION: (3*125810) - 6 - 0 -(3*125525) - 6 - 0  = 843 

********************************************************************************************************************************************

3: SELL 1 FGBM JUN 14 Futures on 02/06/2014 at EUR 126,840 each gives PROFIT of EUR 1,311 equals GBP 1,043.17
 Commission EUR 2 and taxes EUR 0 on SELL
Trade details:ID 1470 Code FGBM JUN 14 Date 2014-06-02 03:20:42 Quantity -1 Price 126.840 Value per block 126,840
Total allowable cost EUR 2   Total disposal proceeds EUR 1,313

Matches with:
PRO-RATA SECTION 104: Quantity 1.000000 FGBM JUN 14 allocated from total holding of 4, made up of 2 trades between 2014-04-11 and 2014-04-15
 At average value of EUR 125,525 Commissions EUR 2 Taxes EUR 0  

Trades:
ID 1465b Code FGBM JUN 14 Date 2014-04-11 03:26:32 Quantity 0.750000 Price 125.490 Value per block 125,490 (Allocated from: ID 1465 Quantity 3)
ID 1466b Code FGBM JUN 14 Date 2014-04-15 04:41:55 Quantity 0.250000 Price 125.630 Value per block 125,630 (Allocated from: ID 1466 Quantity 1)

CALCULATION: (1*126840) - 2 - 0 -(1*125525) - 2 - 0  = 1,311 

********************************************************************************************************************************************

1: SELL 1 FGBM MAR 15 Futures on 02/12/2014 at EUR 129,370 each gives LOSS of EUR -414 equals GBP -328.639
 Commission EUR 2 and taxes EUR 0 on SELL
Trade details:ID 1477 Code FGBM MAR 15 Date 2014-12-02 02:50:08 Quantity -1 Price 129.370 Value per block 129,370
Total allowable cost EUR 2   Total disposal proceeds EUR -412

Matches with:
SUBSEQUENT 1 TRADE(S) Within 30 days between 2014-12-12 and 2014-12-12: Matches with BUY of 1 FGBM MAR 15 at of EUR 129,780 each 
 Commissions EUR 2 Taxes EUR 0  

Trades:
ID 1472 Code FGBM MAR 15 Date 2014-12-12 04:40:17 Quantity 1 Price 129.780 Value per block 129,780

CALCULATION: (1*129370) - 2 - 0 -(1*129780) - 2 - 0  = -414 

********************************************************************************************************************************************

2: SELL 1 FGBM MAR 15 Futures on 21/01/2015 at EUR 130,260 each gives LOSS of EUR -664 equals GBP -527.173
 Commission EUR 2 and taxes EUR 0 on SELL
Trade details:ID 1478 Code FGBM MAR 15 Date 2015-01-21 05:47:21 Quantity -1 Price 130.260 Value per block 130,260
Total allowable cost EUR 2   Total disposal proceeds EUR -662

Matches with:
SUBSEQUENT 1 TRADE(S) Within 30 days between 2015-02-05 and 2015-02-05: Matches with BUY of 1 FGBM MAR 15 at of EUR 130,920 each 
 Commissions EUR 2 Taxes EUR 0  

Trades:
ID 1476 Code FGBM MAR 15 Date 2015-02-05 02:33:03 Quantity 1 Price 130.920 Value per block 130,920

CALCULATION: (1*130260) - 2 - 0 -(1*130920) - 2 - 0  = -664 

********************************************************************************************************************************************

3: SELL 1 FGBM MAR 15 Futures on 26/01/2015 at EUR 130,470 each gives PROFIT of EUR 189 equals GBP 149.941
 Commission EUR 2 and taxes EUR 0 on SELL
Trade details:ID 1479 Code FGBM MAR 15 Date 2015-01-26 08:04:45 Quantity -1 Price 130.470 Value per block 130,470
Total allowable cost EUR 2.00000   Total disposal proceeds EUR 190.857

Matches with:
PRO-RATA SECTION 104: Quantity 1.000000 FGBM MAR 15 allocated from total holding of 7, made up of 4 trades between 2014-12-01 and 2015-01-16
 At average value of EUR 130,277 Commissions EUR 2.00000 Taxes EUR 0  

Trades:
ID 1471a Code FGBM MAR 15 Date 2014-12-01 07:44:11 Quantity 0.142857 Price 129.570 Value per block 129,570 (Allocated from: ID 1471 Quantity 1)
ID 1473a Code FGBM MAR 15 Date 2015-01-13 02:36:30 Quantity 0.571429 Price 130.360 Value per block 130,360 (Allocated from: ID 1473 Quantity 4)
ID 1474a Code FGBM MAR 15 Date 2015-01-13 05:42:08 Quantity 0.142857 Price 130.340 Value per block 130,340 (Allocated from: ID 1474 Quantity 1)
ID 1475a Code FGBM MAR 15 Date 2015-01-16 02:38:19 Quantity 0.142857 Price 130.590 Value per block 130,590 (Allocated from: ID 1475 Quantity 1)

CALCULATION: (1*130470) - 2 - 0 -(1*130277) - 2.00000 - 0  = 189 

********************************************************************************************************************************************

4: SELL 1 FGBM MAR 15 Futures on 29/01/2015 at EUR 130,690 each gives PROFIT of EUR 409 equals GBP 324.607
 Commission EUR 2 and taxes EUR 0 on SELL
Trade details:ID 1480 Code FGBM MAR 15 Date 2015-01-29 04:36:09 Quantity -1 Price 130.690 Value per block 130,690
Total allowable cost EUR 2.00000   Total disposal proceeds EUR 410.857

Matches with:
PRO-RATA SECTION 104: Quantity 1.000000 FGBM MAR 15 allocated from total holding of 7, made up of 4 trades between 2014-12-01 and 2015-01-16
 At average value of EUR 130,277 Commissions EUR 2.00000 Taxes EUR 0  

Trades:
ID 1471b Code FGBM MAR 15 Date 2014-12-01 07:44:11 Quantity 0.142857 Price 129.570 Value per block 129,570 (Allocated from: ID 1471 Quantity 1)
ID 1473b Code FGBM MAR 15 Date 2015-01-13 02:36:30 Quantity 0.571429 Price 130.360 Value per block 130,360 (Allocated from: ID 1473 Quantity 4)
ID 1474b Code FGBM MAR 15 Date 2015-01-13 05:42:08 Quantity 0.142857 Price 130.340 Value per block 130,340 (Allocated from: ID 1474 Quantity 1)
ID 1475b Code FGBM MAR 15 Date 2015-01-16 02:38:19 Quantity 0.142857 Price 130.590 Value per block 130,590 (Allocated from: ID 1475 Quantity 1)

CALCULATION: (1*130690) - 2 - 0 -(1*130277) - 2.00000 - 0  = 409 

********************************************************************************************************************************************

1: SELL 1 FGBM SEP 14 Futures on 18/06/2014 at EUR 127,560 each gives LOSS of EUR -154 equals GBP -122.404
 Commission EUR 2 and taxes EUR 0 on SELL
Trade details:ID 1494 Code FGBM SEP 14 Date 2014-06-18 03:47:02 Quantity -1 Price 127.560 Value per block 127,560
Total allowable cost EUR 2   Total disposal proceeds EUR -152

Matches with:
SUBSEQUENT 1 TRADE(S) Within 30 days between 2014-06-18 and 2014-06-18: Matches with BUY of 1 FGBM SEP 14 at of EUR 127,710 each 
 Commissions EUR 2 Taxes EUR 0  

Trades:
ID 1486 Code FGBM SEP 14 Date 2014-06-18 09:43:12 Quantity 1 Price 127.710 Value per block 127,710

CALCULATION: (1*127560) - 2 - 0 -(1*127710) - 2 - 0  = -154 

********************************************************************************************************************************************

2: SELL 1 FGBM SEP 14 Futures on 03/07/2014 at EUR 127,990 each gives LOSS of EUR -284 equals GBP -225.808
 Commission EUR 2 and taxes EUR 0 on SELL
Trade details:ID 1495 Code FGBM SEP 14 Date 2014-07-03 02:45:28 Quantity -1 Price 127.990 Value per block 127,990
Total allowable cost EUR 2   Total disposal proceeds EUR -282

Matches with:
SUBSEQUENT 1 TRADE(S) Within 30 days between 2014-07-08 and 2014-07-08: Matches with BUY of 1 FGBM SEP 14 at of EUR 128,270 each 
 Commissions EUR 2 Taxes EUR 0  

Trades:
ID 1488 Code FGBM SEP 14 Date 2014-07-08 08:06:36 Quantity 1 Price 128.270 Value per block 128,270

CALCULATION: (1*127990) - 2 - 0 -(1*128270) - 2 - 0  = -284 

********************************************************************************************************************************************

3: SELL 1 FGBM SEP 14 Futures on 31/07/2014 at EUR 128,310 each gives LOSS of EUR -444 equals GBP -353.024
 Commission EUR 2 and taxes EUR 0 on SELL
Trade details:ID 1496 Code FGBM SEP 14 Date 2014-07-31 02:37:24 Quantity -1 Price 128.310 Value per block 128,310
Total allowable cost EUR 2   Total disposal proceeds EUR -442

Matches with:
SUBSEQUENT 1 TRADE(S) Within 30 days between 2014-08-11 and 2014-08-11: Matches with BUY of 1 FGBM SEP 14 at of EUR 128,750 each 
 Commissions EUR 2 Taxes EUR 0  

Trades:
ID 1491 Code FGBM SEP 14 Date 2014-08-11 09:49:41 Quantity 1 Price 128.750 Value per block 128,750

CALCULATION: (1*128310) - 2 - 0 -(1*128750) - 2 - 0  = -444 

********************************************************************************************************************************************

4: SELL 1 FGBM SEP 14 Futures on 08/08/2014 at EUR 128,780 each gives LOSS of EUR -164 equals GBP -130.396
 Commission EUR 2 and taxes EUR 0 on SELL
Trade details:ID 1497 Code FGBM SEP 14 Date 2014-08-08 05:53:15 Quantity -1 Price 128.780 Value per block 128,780
Total allowable cost EUR 2   Total disposal proceeds EUR -162

Matches with:
SUBSEQUENT 1 TRADE(S) Within 30 days between 2014-08-15 and 2014-08-15: Matches with BUY of 1 FGBM SEP 14 at of EUR 128,940 each 
 Commissions EUR 2 Taxes EUR 0  

Trades:
ID 1492 Code FGBM SEP 14 Date 2014-08-15 02:37:49 Quantity 1 Price 128.940 Value per block 128,940

CALCULATION: (1*128780) - 2 - 0 -(1*128940) - 2 - 0  = -164 

********************************************************************************************************************************************

5: SELL 9 FGBM SEP 14 Futures on 01/09/2014 at EUR 129,300 each gives PROFIT of EUR 11,144 equals GBP 8,860.61
 Commission EUR 18 and taxes EUR 0 on SELL
Trade details:ID 1498 Code FGBM SEP 14 Date 2014-09-01 04:25:56 Quantity -9 Price 129.300 Value per block 129,300
Total allowable cost EUR 18   Total disposal proceeds EUR 11,162

Matches with:
PRO-RATA SECTION 104: Quantity 9.000000 FGBM SEP 14 allocated from total holding of 9, made up of 9 trades between 2014-06-02 and 2014-08-26
 At average value of EUR 128,058 Commissions EUR 18 Taxes EUR 0  

Trades:
ID 1481 Code FGBM SEP 14 Date 2014-06-02 03:21:18 Quantity 1 Price 127.660 Value per block 127,660
ID 1482 Code FGBM SEP 14 Date 2014-06-12 02:53:59 Quantity 1 Price 127.630 Value per block 127,630
ID 1483 Code FGBM SEP 14 Date 2014-06-12 07:57:09 Quantity 1 Price 127.740 Value per block 127,740
ID 1484 Code FGBM SEP 14 Date 2014-06-13 06:09:19 Quantity 1 Price 127.800 Value per block 127,800
ID 1485 Code FGBM SEP 14 Date 2014-06-17 07:43:20 Quantity 1 Price 127.740 Value per block 127,740
ID 1487 Code FGBM SEP 14 Date 2014-06-30 02:40:03 Quantity 1 Price 127.960 Value per block 127,960
ID 1489 Code FGBM SEP 14 Date 2014-07-15 08:05:42 Quantity 1 Price 128.390 Value per block 128,390
ID 1490 Code FGBM SEP 14 Date 2014-07-29 04:44:14 Quantity 1 Price 128.440 Value per block 128,440
ID 1493 Code FGBM SEP 14 Date 2014-08-26 03:45:10 Quantity 1 Price 129.160 Value per block 129,160

CALCULATION: (9*129300) - 18 - 0 -(9*128058) - 18 - 0  = 11,144 

********************************************************************************************************************************************

1: SELL 1 FGBS DEC 14 Futures on 02/09/2014 at EUR 110,925 each gives LOSS of EUR -19 equals GBP -15.0380
 Commission EUR 2 and taxes EUR 0 on SELL
Trade details:ID 1534 Code FGBS DEC 14 Date 2014-09-02 09:26:43 Quantity -1 Price 110.925 Value per block 110,925
Total allowable cost EUR 2   Total disposal proceeds EUR -17

Matches with:
SAME DAY TRADE(S) Matches with BUY of 1 FGBS DEC 14 at average of EUR 110,940 each 
 Commissions EUR 2 Taxes EUR 0 

Trades:
ID 1500a Code FGBS DEC 14 Date 2014-09-02 02:48:32 Quantity 1 Price 110.940 Value per block 110,940 (Allocated from: ID 1500 Quantity 2)

CALCULATION: (1*110925) - 2 - 0 -(1*110940) - 2 - 0  = -19 

********************************************************************************************************************************************

2: SELL 1 FGBS DEC 14 Futures on 02/09/2014 at EUR 110,925 each gives LOSS of EUR -19 equals GBP -15.0431
 Commission EUR 2 and taxes EUR 0 on SELL
Trade details:ID 1535 Code FGBS DEC 14 Date 2014-09-02 11:19:52 Quantity -1 Price 110.925 Value per block 110,925
Total allowable cost EUR 2   Total disposal proceeds EUR -17

Matches with:
SAME DAY TRADE(S) Matches with BUY of 1 FGBS DEC 14 at average of EUR 110,940 each 
 Commissions EUR 2 Taxes EUR 0 

Trades:
ID 1500 Code FGBS DEC 14 Date 2014-09-02 02:48:32 Quantity 1 Price 110.940 Value per block 110,940

CALCULATION: (1*110925) - 2 - 0 -(1*110940) - 2 - 0  = -19 

********************************************************************************************************************************************

3: SELL 3 FGBS DEC 14 Futures on 03/09/2014 at EUR 110,915 each gives LOSS of EUR -247 equals GBP -195.485
 Commission EUR 6 and taxes EUR 0 on SELL
Trade details:ID 1536 Code FGBS DEC 14 Date 2014-09-03 02:52:01 Quantity -3 Price 110.915 Value per block 110,915
Total allowable cost EUR 6   Total disposal proceeds EUR -241

Matches with:
SUBSEQUENT 2 TRADE(S) Within 30 days between 2014-09-08 and 2014-09-09: Matches with BUY of 3 FGBS DEC 14 at of EUR 110,993 each 
 Commissions EUR 6 Taxes EUR 0  

Trades:
ID 1501 Code FGBS DEC 14 Date 2014-09-08 02:49:22 Quantity 1 Price 110.990 Value per block 110,990
ID 1502a Code FGBS DEC 14 Date 2014-09-09 06:12:56 Quantity 2 Price 110.995 Value per block 110,995 (Allocated from: ID 1502 Quantity 3)

CALCULATION: (3*110915) - 6 - 0 -(3*110993) - 6 - 0  = -247 

********************************************************************************************************************************************

4: SELL 5 FGBS DEC 14 Futures on 04/09/2014 at EUR 111,020 each gives PROFIT of EUR 190 equals GBP 150.319
 Commission EUR 10 and taxes EUR 0 on SELL
Trade details:ID 1537 Code FGBS DEC 14 Date 2014-09-04 08:31:29 Quantity -5 Price 111.020 Value per block 111,020
Total allowable cost EUR 10   Total disposal proceeds EUR 200

Matches with:
SUBSEQUENT 5 TRADE(S) Within 30 days between 2014-09-09 and 2014-09-23: Matches with BUY of 5 FGBS DEC 14 at of EUR 110,978 each 
 Commissions EUR 10 Taxes EUR 0  

Trades:
ID 1502 Code FGBS DEC 14 Date 2014-09-09 06:12:56 Quantity 1 Price 110.995 Value per block 110,995
ID 1503 Code FGBS DEC 14 Date 2014-09-18 10:36:51 Quantity 1 Price 110.945 Value per block 110,945
ID 1504 Code FGBS DEC 14 Date 2014-09-19 07:47:05 Quantity 1 Price 110.980 Value per block 110,980
ID 1505 Code FGBS DEC 14 Date 2014-09-19 09:34:52 Quantity 1 Price 110.985 Value per block 110,985
ID 1506a Code FGBS DEC 14 Date 2014-09-23 02:53:38 Quantity 1 Price 110.985 Value per block 110,985 (Allocated from: ID 1506 Quantity 2)

CALCULATION: (5*111020) - 10 - 0 -(5*110978) - 10 - 0  = 190 

********************************************************************************************************************************************

5: SELL 4 FGBS DEC 14 Futures on 09/09/2014 at EUR 110,995 each gives PROFIT of EUR 44 equals GBP 34.7922
 Commission EUR 8 and taxes EUR 0 on SELL
Trade details:ID 1538 Code FGBS DEC 14 Date 2014-09-09 02:48:57 Quantity -4 Price 110.995 Value per block 110,995
Total allowable cost EUR 8   Total disposal proceeds EUR 52

Matches with:
SUBSEQUENT 4 TRADE(S) Within 30 days between 2014-09-23 and 2014-09-26: Matches with BUY of 4 FGBS DEC 14 at of EUR 110,980 each 
 Commissions EUR 8 Taxes EUR 0  

Trades:
ID 1506 Code FGBS DEC 14 Date 2014-09-23 02:53:38 Quantity 1 Price 110.985 Value per block 110,985
ID 1507 Code FGBS DEC 14 Date 2014-09-25 03:55:06 Quantity 1 Price 110.965 Value per block 110,965
ID 1508 Code FGBS DEC 14 Date 2014-09-26 02:47:29 Quantity 1 Price 110.980 Value per block 110,980
ID 1509 Code FGBS DEC 14 Date 2014-09-26 07:09:52 Quantity 1 Price 110.990 Value per block 110,990

CALCULATION: (4*110995) - 8 - 0 -(4*110980) - 8 - 0  = 44 

********************************************************************************************************************************************

6: SELL 1 FGBS DEC 14 Futures on 10/09/2014 at EUR 110,970 each gives LOSS of EUR -14 equals GBP -11.0887
 Commission EUR 2 and taxes EUR 0 on SELL
Trade details:ID 1539 Code FGBS DEC 14 Date 2014-09-10 04:05:45 Quantity -1 Price 110.970 Value per block 110,970
Total allowable cost EUR 2   Total disposal proceeds EUR -12

Matches with:
SUBSEQUENT 1 TRADE(S) Within 30 days between 2014-09-29 and 2014-09-29: Matches with BUY of 1 FGBS DEC 14 at of EUR 110,980 each 
 Commissions EUR 2 Taxes EUR 0  

Trades:
ID 1510 Code FGBS DEC 14 Date 2014-09-29 02:48:41 Quantity 1 Price 110.980 Value per block 110,980

CALCULATION: (1*110970) - 2 - 0 -(1*110980) - 2 - 0  = -14 

********************************************************************************************************************************************

7: SELL 1 FGBS DEC 14 Futures on 10/09/2014 at EUR 110,970 each gives LOSS of EUR -14 equals GBP -11.0878
 Commission EUR 2 and taxes EUR 0 on SELL
Trade details:ID 1540 Code FGBS DEC 14 Date 2014-09-10 06:27:34 Quantity -1 Price 110.970 Value per block 110,970
Total allowable cost EUR 2   Total disposal proceeds EUR -12

Matches with:
SUBSEQUENT 1 TRADE(S) Within 30 days between 2014-09-30 and 2014-09-30: Matches with BUY of 1 FGBS DEC 14 at of EUR 110,980 each 
 Commissions EUR 2 Taxes EUR 0  

Trades:
ID 1511 Code FGBS DEC 14 Date 2014-09-30 02:48:39 Quantity 1 Price 110.980 Value per block 110,980

CALCULATION: (1*110970) - 2 - 0 -(1*110980) - 2 - 0  = -14 

********************************************************************************************************************************************

8: SELL 1 FGBS DEC 14 Futures on 15/09/2014 at EUR 110,960 each gives LOSS of EUR -44 equals GBP -34.8316
 Commission EUR 2 and taxes EUR 0 on SELL
Trade details:ID 1541 Code FGBS DEC 14 Date 2014-09-15 02:51:40 Quantity -1 Price 110.960 Value per block 110,960
Total allowable cost EUR 2   Total disposal proceeds EUR -42

Matches with:
SUBSEQUENT 1 TRADE(S) Within 30 days between 2014-09-30 and 2014-09-30: Matches with BUY of 1 FGBS DEC 14 at of EUR 111,000 each 
 Commissions EUR 2 Taxes EUR 0  

Trades:
ID 1512 Code FGBS DEC 14 Date 2014-09-30 07:06:45 Quantity 1 Price 111 Value per block 111,000

CALCULATION: (1*110960) - 2 - 0 -(1*111000) - 2 - 0  = -44 

********************************************************************************************************************************************

9: SELL 1 FGBS DEC 14 Futures on 23/09/2014 at EUR 110,945 each gives LOSS of EUR -74 equals GBP -58.5754
 Commission EUR 2 and taxes EUR 0 on SELL
Trade details:ID 1542 Code FGBS DEC 14 Date 2014-09-23 11:24:47 Quantity -1 Price 110.945 Value per block 110,945
Total allowable cost EUR 2   Total disposal proceeds EUR -72

Matches with:
SUBSEQUENT 1 TRADE(S) Within 30 days between 2014-10-01 and 2014-10-01: Matches with BUY of 1 FGBS DEC 14 at of EUR 111,015 each 
 Commissions EUR 2 Taxes EUR 0  

Trades:
ID 1513 Code FGBS DEC 14 Date 2014-10-01 02:51:06 Quantity 1 Price 111.015 Value per block 111,015

CALCULATION: (1*110945) - 2 - 0 -(1*111015) - 2 - 0  = -74 

********************************************************************************************************************************************

10: SELL 2 FGBS DEC 14 Futures on 13/10/2014 at EUR 110,930 each gives LOSS of EUR -58 equals GBP -45.9001
 Commission EUR 4 and taxes EUR 0 on SELL
Trade details:ID 1543 Code FGBS DEC 14 Date 2014-10-13 03:54:02 Quantity -2 Price 110.930 Value per block 110,930
Total allowable cost EUR 4   Total disposal proceeds EUR -54

Matches with:
SUBSEQUENT 2 TRADE(S) Within 30 days between 2014-10-14 and 2014-10-15: Matches with BUY of 2 FGBS DEC 14 at of EUR 110,955 each 
 Commissions EUR 4 Taxes EUR 0  

Trades:
ID 1518 Code FGBS DEC 14 Date 2014-10-14 08:48:17 Quantity 1 Price 110.955 Value per block 110,955
ID 1519 Code FGBS DEC 14 Date 2014-10-15 02:49:29 Quantity 1 Price 110.955 Value per block 110,955

CALCULATION: (2*110930) - 4 - 0 -(2*110955) - 4 - 0  = -58 

********************************************************************************************************************************************

11: SELL 1 FGBS DEC 14 Futures on 17/10/2014 at EUR 110,940 each gives LOSS of EUR -44 equals GBP -34.9050
 Commission EUR 2 and taxes EUR 0 on SELL
Trade details:ID 1544 Code FGBS DEC 14 Date 2014-10-17 02:53:35 Quantity -1 Price 110.940 Value per block 110,940
Total allowable cost EUR 2   Total disposal proceeds EUR -42

Matches with:
SUBSEQUENT 1 TRADE(S) Within 30 days between 2014-10-21 and 2014-10-21: Matches with BUY of 1 FGBS DEC 14 at of EUR 110,980 each 
 Commissions EUR 2 Taxes EUR 0  

Trades:
ID 1523a Code FGBS DEC 14 Date 2014-10-21 02:46:43 Quantity 1 Price 110.980 Value per block 110,980 (Allocated from: ID 1523 Quantity 3)

CALCULATION: (1*110940) - 2 - 0 -(1*110980) - 2 - 0  = -44 

********************************************************************************************************************************************

12: SELL 1 FGBS DEC 14 Futures on 17/10/2014 at EUR 110,945 each gives LOSS of EUR -39 equals GBP -30.9377
 Commission EUR 2 and taxes EUR 0 on SELL
Trade details:ID 1545 Code FGBS DEC 14 Date 2014-10-17 06:35:42 Quantity -1 Price 110.945 Value per block 110,945
Total allowable cost EUR 2   Total disposal proceeds EUR -37

Matches with:
SUBSEQUENT 1 TRADE(S) Within 30 days between 2014-10-21 and 2014-10-21: Matches with BUY of 1 FGBS DEC 14 at of EUR 110,980 each 
 Commissions EUR 2 Taxes EUR 0  

Trades:
ID 1523b Code FGBS DEC 14 Date 2014-10-21 02:46:43 Quantity 1 Price 110.980 Value per block 110,980 (Allocated from: ID 1523 Quantity 3)

CALCULATION: (1*110945) - 2 - 0 -(1*110980) - 2 - 0  = -39 

********************************************************************************************************************************************

13: SELL 1 FGBS DEC 14 Futures on 21/10/2014 at EUR 110,960 each gives LOSS of EUR -24 equals GBP -19.0360
 Commission EUR 2 and taxes EUR 0 on SELL
Trade details:ID 1546 Code FGBS DEC 14 Date 2014-10-21 07:09:43 Quantity -1 Price 110.960 Value per block 110,960
Total allowable cost EUR 2   Total disposal proceeds EUR -22

Matches with:
SAME DAY TRADE(S) Matches with BUY of 1 FGBS DEC 14 at average of EUR 110,980 each 
 Commissions EUR 2 Taxes EUR 0 

Trades:
ID 1523 Code FGBS DEC 14 Date 2014-10-21 02:46:43 Quantity 1 Price 110.980 Value per block 110,980

CALCULATION: (1*110960) - 2 - 0 -(1*110980) - 2 - 0  = -24 

********************************************************************************************************************************************

14: SELL 1 FGBS DEC 14 Futures on 22/10/2014 at EUR 110,925 each gives LOSS of EUR -19 equals GBP -15.0715
 Commission EUR 2 and taxes EUR 0 on SELL
Trade details:ID 1547 Code FGBS DEC 14 Date 2014-10-22 02:36:20 Quantity -1 Price 110.925 Value per block 110,925
Total allowable cost EUR 2   Total disposal proceeds EUR -17

Matches with:
SUBSEQUENT 1 TRADE(S) Within 30 days between 2014-10-27 and 2014-10-27: Matches with BUY of 1 FGBS DEC 14 at of EUR 110,940 each 
 Commissions EUR 2 Taxes EUR 0  

Trades:
ID 1524 Code FGBS DEC 14 Date 2014-10-27 04:52:53 Quantity 1 Price 110.940 Value per block 110,940

CALCULATION: (1*110925) - 2 - 0 -(1*110940) - 2 - 0  = -19 

********************************************************************************************************************************************

15: SELL 6 FGBS DEC 14 Futures on 22/10/2014 at EUR 110,930 each gives LOSS of EUR -164 equals GBP -130.108
 Commission EUR 12 and taxes EUR 0 on SELL
Trade details:ID 1548 Code FGBS DEC 14 Date 2014-10-22 02:50:39 Quantity -6 Price 110.930 Value per block 110,930
Total allowable cost EUR 12   Total disposal proceeds EUR -152

Matches with:
SUBSEQUENT 5 TRADE(S) Within 30 days between 2014-10-27 and 2014-11-03: Matches with BUY of 6 FGBS DEC 14 at of EUR 110,953 each 
 Commissions EUR 12 Taxes EUR 0  

Trades:
ID 1525 Code FGBS DEC 14 Date 2014-10-27 06:14:15 Quantity 2 Price 110.945 Value per block 110,945
ID 1526 Code FGBS DEC 14 Date 2014-10-28 03:50:35 Quantity 1 Price 110.945 Value per block 110,945
ID 1527 Code FGBS DEC 14 Date 2014-10-28 05:55:15 Quantity 1 Price 110.945 Value per block 110,945
ID 1528 Code FGBS DEC 14 Date 2014-10-31 04:59:51 Quantity 1 Price 110.955 Value per block 110,955
ID 1529a Code FGBS DEC 14 Date 2014-11-03 02:49:50 Quantity 1 Price 110.985 Value per block 110,985 (Allocated from: ID 1529 Quantity 3)

CALCULATION: (6*110930) - 12 - 0 -(6*110953) - 12 - 0  = -164 

********************************************************************************************************************************************

16: SELL 1 FGBS DEC 14 Futures on 30/10/2014 at EUR 110,955 each gives LOSS of EUR -34 equals GBP -26.9745
 Commission EUR 2 and taxes EUR 0 on SELL
Trade details:ID 1549 Code FGBS DEC 14 Date 2014-10-30 08:08:55 Quantity -1 Price 110.955 Value per block 110,955
Total allowable cost EUR 2   Total disposal proceeds EUR -32

Matches with:
SUBSEQUENT 1 TRADE(S) Within 30 days between 2014-11-03 and 2014-11-03: Matches with BUY of 1 FGBS DEC 14 at of EUR 110,985 each 
 Commissions EUR 2 Taxes EUR 0  

Trades:
ID 1529b Code FGBS DEC 14 Date 2014-11-03 02:49:50 Quantity 1 Price 110.985 Value per block 110,985 (Allocated from: ID 1529 Quantity 3)

CALCULATION: (1*110955) - 2 - 0 -(1*110985) - 2 - 0  = -34 

********************************************************************************************************************************************

17: SELL 9 FGBS DEC 14 Futures on 06/11/2014 at EUR 110,975 each gives PROFIT of EUR 195 equals GBP 154.736
 Commission EUR 18 and taxes EUR 0 on SELL
Trade details:ID 1550 Code FGBS DEC 14 Date 2014-11-06 05:00:10 Quantity -9 Price 110.975 Value per block 110,975
Total allowable cost EUR 18.0000   Total disposal proceeds EUR 213

Matches with:
SAME DAY TRADE(S) Matches with BUY of 1 FGBS DEC 14 at average of EUR 110,985 each 
 Commissions EUR 2 Taxes EUR 0 

Trades:
ID 1531 Code FGBS DEC 14 Date 2014-11-06 02:52:40 Quantity 1 Price 110.985 Value per block 110,985
SUBSEQUENT 2 TRADE(S) Within 30 days between 2014-11-14 and 2014-11-27: Matches with BUY of 2 FGBS DEC 14 at of EUR 110,935 each 
 Commissions EUR 4 Taxes EUR 0  

Trades:
ID 1532 Code FGBS DEC 14 Date 2014-11-14 02:51:17 Quantity 1 Price 110.950 Value per block 110,950
ID 1533 Code FGBS DEC 14 Date 2014-11-27 05:22:12 Quantity 1 Price 110.920 Value per block 110,920
PRO-RATA SECTION 104: Quantity 6.000000 FGBS DEC 14 allocated from total holding of 32, made up of 10 trades between 2014-09-01 and 2014-11-05
 At average value of EUR 110,948 Commissions EUR 12.0000 Taxes EUR 0  

Trades:
ID 1499a Code FGBS DEC 14 Date 2014-09-01 05:03:43 Quantity 4 Price 110.930 Value per block 110,930 (Allocated from: ID 1499 Quantity 20)
ID 1514a Code FGBS DEC 14 Date 2014-10-02 02:59:41 Quantity 0.200000 Price 111.015 Value per block 111,015 (Allocated from: ID 1514 Quantity 1)
ID 1515a Code FGBS DEC 14 Date 2014-10-06 06:03:36 Quantity 0.200000 Price 110.985 Value per block 110,985 (Allocated from: ID 1515 Quantity 1)
ID 1516a Code FGBS DEC 14 Date 2014-10-09 02:51:50 Quantity 0.400000 Price 110.985 Value per block 110,985 (Allocated from: ID 1516 Quantity 2)
ID 1517a Code FGBS DEC 14 Date 2014-10-09 08:44:47 Quantity 0.200000 Price 110.975 Value per block 110,975 (Allocated from: ID 1517 Quantity 1)
ID 1520a Code FGBS DEC 14 Date 2014-10-15 07:49:30 Quantity 0.200000 Price 110.970 Value per block 110,970 (Allocated from: ID 1520 Quantity 1)
ID 1521a Code FGBS DEC 14 Date 2014-10-15 09:20:57 Quantity 0.200000 Price 110.980 Value per block 110,980 (Allocated from: ID 1521 Quantity 1)
ID 1522a Code FGBS DEC 14 Date 2014-10-16 07:56:03 Quantity 0.200000 Price 110.995 Value per block 110,995 (Allocated from: ID 1522 Quantity 1)
ID 1529c Code FGBS DEC 14 Date 2014-11-03 02:49:50 Quantity 0.200000 Price 110.985 Value per block 110,985 (Allocated from: ID 1529 Quantity 3)
ID 1530a Code FGBS DEC 14 Date 2014-11-05 08:00:37 Quantity 0.200000 Price 110.970 Value per block 110,970 (Allocated from: ID 1530 Quantity 1)

CALCULATION: (9*110975) - 18 - 0 -(1*110985) - 2 - 0 -(2*110935) - 4 - 0 -(6*110948) - 12.0000 - 0  = 195 

********************************************************************************************************************************************

18: SELL 1 FGBS DEC 14 Futures on 10/11/2014 at EUR 110,980 each gives PROFIT of EUR 28 equals GBP 22.0839
 Commission EUR 2 and taxes EUR 0 on SELL
Trade details:ID 1551 Code FGBS DEC 14 Date 2014-11-10 02:32:54 Quantity -1 Price 110.980 Value per block 110,980
Total allowable cost EUR 2.00000   Total disposal proceeds EUR 29.8333

Matches with:
PRO-RATA SECTION 104: Quantity 1.000000 FGBS DEC 14 allocated from total holding of 32, made up of 10 trades between 2014-09-01 and 2014-11-05
 At average value of EUR 110,948 Commissions EUR 2.00000 Taxes EUR 0  

Trades:
ID 1499b Code FGBS DEC 14 Date 2014-09-01 05:03:43 Quantity 0.666667 Price 110.930 Value per block 110,930 (Allocated from: ID 1499 Quantity 20)
ID 1514b Code FGBS DEC 14 Date 2014-10-02 02:59:41 Quantity 0.0333333 Price 111.015 Value per block 111,015 (Allocated from: ID 1514 Quantity 1)
ID 1515b Code FGBS DEC 14 Date 2014-10-06 06:03:36 Quantity 0.0333333 Price 110.985 Value per block 110,985 (Allocated from: ID 1515 Quantity 1)
ID 1516b Code FGBS DEC 14 Date 2014-10-09 02:51:50 Quantity 0.0666667 Price 110.985 Value per block 110,985 (Allocated from: ID 1516 Quantity 2)
ID 1517b Code FGBS DEC 14 Date 2014-10-09 08:44:47 Quantity 0.0333333 Price 110.975 Value per block 110,975 (Allocated from: ID 1517 Quantity 1)
ID 1520b Code FGBS DEC 14 Date 2014-10-15 07:49:30 Quantity 0.0333333 Price 110.970 Value per block 110,970 (Allocated from: ID 1520 Quantity 1)
ID 1521b Code FGBS DEC 14 Date 2014-10-15 09:20:57 Quantity 0.0333333 Price 110.980 Value per block 110,980 (Allocated from: ID 1521 Quantity 1)
ID 1522b Code FGBS DEC 14 Date 2014-10-16 07:56:03 Quantity 0.0333333 Price 110.995 Value per block 110,995 (Allocated from: ID 1522 Quantity 1)
ID 1529d Code FGBS DEC 14 Date 2014-11-03 02:49:50 Quantity 0.0333333 Price 110.985 Value per block 110,985 (Allocated from: ID 1529 Quantity 3)
ID 1530b Code FGBS DEC 14 Date 2014-11-05 08:00:37 Quantity 0.0333333 Price 110.970 Value per block 110,970 (Allocated from: ID 1530 Quantity 1)

CALCULATION: (1*110980) - 2 - 0 -(1*110948) - 2.00000 - 0  = 28 

********************************************************************************************************************************************

19: SELL 2 FGBS DEC 14 Futures on 11/11/2014 at EUR 110,955 each gives PROFIT of EUR 6 equals GBP 4.49322
 Commission EUR 4 and taxes EUR 0 on SELL
Trade details:ID 1552 Code FGBS DEC 14 Date 2014-11-11 02:50:43 Quantity -2 Price 110.955 Value per block 110,955
Total allowable cost EUR 4   Total disposal proceeds EUR 9.66667

Matches with:
PRO-RATA SECTION 104: Quantity 2.000000 FGBS DEC 14 allocated from total holding of 32, made up of 10 trades between 2014-09-01 and 2014-11-05
 At average value of EUR 110,948 Commissions EUR 4 Taxes EUR 0  

Trades:
ID 1499c Code FGBS DEC 14 Date 2014-09-01 05:03:43 Quantity 1.33333 Price 110.930 Value per block 110,930 (Allocated from: ID 1499 Quantity 20)
ID 1514c Code FGBS DEC 14 Date 2014-10-02 02:59:41 Quantity 0.0666667 Price 111.015 Value per block 111,015 (Allocated from: ID 1514 Quantity 1)
ID 1515c Code FGBS DEC 14 Date 2014-10-06 06:03:36 Quantity 0.0666667 Price 110.985 Value per block 110,985 (Allocated from: ID 1515 Quantity 1)
ID 1516c Code FGBS DEC 14 Date 2014-10-09 02:51:50 Quantity 0.133333 Price 110.985 Value per block 110,985 (Allocated from: ID 1516 Quantity 2)
ID 1517c Code FGBS DEC 14 Date 2014-10-09 08:44:47 Quantity 0.0666667 Price 110.975 Value per block 110,975 (Allocated from: ID 1517 Quantity 1)
ID 1520c Code FGBS DEC 14 Date 2014-10-15 07:49:30 Quantity 0.0666667 Price 110.970 Value per block 110,970 (Allocated from: ID 1520 Quantity 1)
ID 1521c Code FGBS DEC 14 Date 2014-10-15 09:20:57 Quantity 0.0666667 Price 110.980 Value per block 110,980 (Allocated from: ID 1521 Quantity 1)
ID 1522c Code FGBS DEC 14 Date 2014-10-16 07:56:03 Quantity 0.0666667 Price 110.995 Value per block 110,995 (Allocated from: ID 1522 Quantity 1)
ID 1529e Code FGBS DEC 14 Date 2014-11-03 02:49:50 Quantity 0.0666667 Price 110.985 Value per block 110,985 (Allocated from: ID 1529 Quantity 3)
ID 1530c Code FGBS DEC 14 Date 2014-11-05 08:00:37 Quantity 0.0666667 Price 110.970 Value per block 110,970 (Allocated from: ID 1530 Quantity 1)

CALCULATION: (2*110955) - 4 - 0 -(2*110948) - 4 - 0  = 6 

********************************************************************************************************************************************

20: SELL 2 FGBS DEC 14 Futures on 12/11/2014 at EUR 110,960 each gives PROFIT of EUR 16 equals GBP 12.4281
 Commission EUR 4 and taxes EUR 0 on SELL
Trade details:ID 1553 Code FGBS DEC 14 Date 2014-11-12 02:50:30 Quantity -2 Price 110.960 Value per block 110,960
Total allowable cost EUR 4.00000   Total disposal proceeds EUR 19.6667

Matches with:
PRO-RATA SECTION 104: Quantity 2.000000 FGBS DEC 14 allocated from total holding of 32, made up of 10 trades between 2014-09-01 and 2014-11-05
 At average value of EUR 110,948 Commissions EUR 4.00000 Taxes EUR 0  

Trades:
ID 1499d Code FGBS DEC 14 Date 2014-09-01 05:03:43 Quantity 1.33333 Price 110.930 Value per block 110,930 (Allocated from: ID 1499 Quantity 20)
ID 1514d Code FGBS DEC 14 Date 2014-10-02 02:59:41 Quantity 0.0666667 Price 111.015 Value per block 111,015 (Allocated from: ID 1514 Quantity 1)
ID 1515d Code FGBS DEC 14 Date 2014-10-06 06:03:36 Quantity 0.0666667 Price 110.985 Value per block 110,985 (Allocated from: ID 1515 Quantity 1)
ID 1516d Code FGBS DEC 14 Date 2014-10-09 02:51:50 Quantity 0.133333 Price 110.985 Value per block 110,985 (Allocated from: ID 1516 Quantity 2)
ID 1517d Code FGBS DEC 14 Date 2014-10-09 08:44:47 Quantity 0.0666667 Price 110.975 Value per block 110,975 (Allocated from: ID 1517 Quantity 1)
ID 1520d Code FGBS DEC 14 Date 2014-10-15 07:49:30 Quantity 0.0666667 Price 110.970 Value per block 110,970 (Allocated from: ID 1520 Quantity 1)
ID 1521d Code FGBS DEC 14 Date 2014-10-15 09:20:57 Quantity 0.0666667 Price 110.980 Value per block 110,980 (Allocated from: ID 1521 Quantity 1)
ID 1522d Code FGBS DEC 14 Date 2014-10-16 07:56:03 Quantity 0.0666667 Price 110.995 Value per block 110,995 (Allocated from: ID 1522 Quantity 1)
ID 1529f Code FGBS DEC 14 Date 2014-11-03 02:49:50 Quantity 0.0666667 Price 110.985 Value per block 110,985 (Allocated from: ID 1529 Quantity 3)
ID 1530d Code FGBS DEC 14 Date 2014-11-05 08:00:37 Quantity 0.0666667 Price 110.970 Value per block 110,970 (Allocated from: ID 1530 Quantity 1)

CALCULATION: (2*110960) - 4 - 0 -(2*110948) - 4.00000 - 0  = 16 

********************************************************************************************************************************************

21: SELL 1 FGBS DEC 14 Futures on 18/11/2014 at EUR 110,935 each gives LOSS of EUR -17 equals GBP -13.6232
 Commission EUR 2 and taxes EUR 0 on SELL
Trade details:ID 1554 Code FGBS DEC 14 Date 2014-11-18 02:51:44 Quantity -1 Price 110.935 Value per block 110,935
Total allowable cost EUR 2   Total disposal proceeds EUR -15.1667

Matches with:
PRO-RATA SECTION 104: Quantity 1.000000 FGBS DEC 14 allocated from total holding of 32, made up of 10 trades between 2014-09-01 and 2014-11-05
 At average value of EUR 110,948 Commissions EUR 2 Taxes EUR 0  

Trades:
ID 1499e Code FGBS DEC 14 Date 2014-09-01 05:03:43 Quantity 0.666667 Price 110.930 Value per block 110,930 (Allocated from: ID 1499 Quantity 20)
ID 1514e Code FGBS DEC 14 Date 2014-10-02 02:59:41 Quantity 0.0333333 Price 111.015 Value per block 111,015 (Allocated from: ID 1514 Quantity 1)
ID 1515e Code FGBS DEC 14 Date 2014-10-06 06:03:36 Quantity 0.0333333 Price 110.985 Value per block 110,985 (Allocated from: ID 1515 Quantity 1)
ID 1516e Code FGBS DEC 14 Date 2014-10-09 02:51:50 Quantity 0.0666667 Price 110.985 Value per block 110,985 (Allocated from: ID 1516 Quantity 2)
ID 1517e Code FGBS DEC 14 Date 2014-10-09 08:44:47 Quantity 0.0333333 Price 110.975 Value per block 110,975 (Allocated from: ID 1517 Quantity 1)
ID 1520e Code FGBS DEC 14 Date 2014-10-15 07:49:30 Quantity 0.0333333 Price 110.970 Value per block 110,970 (Allocated from: ID 1520 Quantity 1)
ID 1521e Code FGBS DEC 14 Date 2014-10-15 09:20:57 Quantity 0.0333333 Price 110.980 Value per block 110,980 (Allocated from: ID 1521 Quantity 1)
ID 1522e Code FGBS DEC 14 Date 2014-10-16 07:56:03 Quantity 0.0333333 Price 110.995 Value per block 110,995 (Allocated from: ID 1522 Quantity 1)
ID 1529g Code FGBS DEC 14 Date 2014-11-03 02:49:50 Quantity 0.0333333 Price 110.985 Value per block 110,985 (Allocated from: ID 1529 Quantity 3)
ID 1530e Code FGBS DEC 14 Date 2014-11-05 08:00:37 Quantity 0.0333333 Price 110.970 Value per block 110,970 (Allocated from: ID 1530 Quantity 1)

CALCULATION: (1*110935) - 2 - 0 -(1*110948) - 2 - 0  = -17 

********************************************************************************************************************************************

22: SELL 4 FGBS DEC 14 Futures on 19/11/2014 at EUR 110,900 each gives LOSS of EUR -209 equals GBP -166.356
 Commission EUR 8 and taxes EUR 0 on SELL
Trade details:ID 1555 Code FGBS DEC 14 Date 2014-11-19 02:51:08 Quantity -4 Price 110.900 Value per block 110,900
Total allowable cost EUR 8.00000   Total disposal proceeds EUR -200.667

Matches with:
PRO-RATA SECTION 104: Quantity 4.000000 FGBS DEC 14 allocated from total holding of 32, made up of 10 trades between 2014-09-01 and 2014-11-05
 At average value of EUR 110,948 Commissions EUR 8.00000 Taxes EUR 0  

Trades:
ID 1499f Code FGBS DEC 14 Date 2014-09-01 05:03:43 Quantity 2.66667 Price 110.930 Value per block 110,930 (Allocated from: ID 1499 Quantity 20)
ID 1514f Code FGBS DEC 14 Date 2014-10-02 02:59:41 Quantity 0.133333 Price 111.015 Value per block 111,015 (Allocated from: ID 1514 Quantity 1)
ID 1515f Code FGBS DEC 14 Date 2014-10-06 06:03:36 Quantity 0.133333 Price 110.985 Value per block 110,985 (Allocated from: ID 1515 Quantity 1)
ID 1516f Code FGBS DEC 14 Date 2014-10-09 02:51:50 Quantity 0.266667 Price 110.985 Value per block 110,985 (Allocated from: ID 1516 Quantity 2)
ID 1517f Code FGBS DEC 14 Date 2014-10-09 08:44:47 Quantity 0.133333 Price 110.975 Value per block 110,975 (Allocated from: ID 1517 Quantity 1)
ID 1520f Code FGBS DEC 14 Date 2014-10-15 07:49:30 Quantity 0.133333 Price 110.970 Value per block 110,970 (Allocated from: ID 1520 Quantity 1)
ID 1521f Code FGBS DEC 14 Date 2014-10-15 09:20:57 Quantity 0.133333 Price 110.980 Value per block 110,980 (Allocated from: ID 1521 Quantity 1)
ID 1522f Code FGBS DEC 14 Date 2014-10-16 07:56:03 Quantity 0.133333 Price 110.995 Value per block 110,995 (Allocated from: ID 1522 Quantity 1)
ID 1529h Code FGBS DEC 14 Date 2014-11-03 02:49:50 Quantity 0.133333 Price 110.985 Value per block 110,985 (Allocated from: ID 1529 Quantity 3)
ID 1530f Code FGBS DEC 14 Date 2014-11-05 08:00:37 Quantity 0.133333 Price 110.970 Value per block 110,970 (Allocated from: ID 1530 Quantity 1)

CALCULATION: (4*110900) - 8 - 0 -(4*110948) - 8.00000 - 0  = -209 

********************************************************************************************************************************************

23: SELL 1 FGBS DEC 14 Futures on 19/11/2014 at EUR 110,870 each gives LOSS of EUR -82 equals GBP -65.5096
 Commission EUR 2 and taxes EUR 0 on SELL
Trade details:ID 1556 Code FGBS DEC 14 Date 2014-11-19 05:13:11 Quantity -1 Price 110.870 Value per block 110,870
Total allowable cost EUR 2.00000   Total disposal proceeds EUR -80.1667

Matches with:
PRO-RATA SECTION 104: Quantity 1.000000 FGBS DEC 14 allocated from total holding of 32, made up of 10 trades between 2014-09-01 and 2014-11-05
 At average value of EUR 110,948 Commissions EUR 2.00000 Taxes EUR 0  

Trades:
ID 1499g Code FGBS DEC 14 Date 2014-09-01 05:03:43 Quantity 0.666667 Price 110.930 Value per block 110,930 (Allocated from: ID 1499 Quantity 20)
ID 1514g Code FGBS DEC 14 Date 2014-10-02 02:59:41 Quantity 0.0333333 Price 111.015 Value per block 111,015 (Allocated from: ID 1514 Quantity 1)
ID 1515g Code FGBS DEC 14 Date 2014-10-06 06:03:36 Quantity 0.0333333 Price 110.985 Value per block 110,985 (Allocated from: ID 1515 Quantity 1)
ID 1516g Code FGBS DEC 14 Date 2014-10-09 02:51:50 Quantity 0.0666667 Price 110.985 Value per block 110,985 (Allocated from: ID 1516 Quantity 2)
ID 1517g Code FGBS DEC 14 Date 2014-10-09 08:44:47 Quantity 0.0333333 Price 110.975 Value per block 110,975 (Allocated from: ID 1517 Quantity 1)
ID 1520g Code FGBS DEC 14 Date 2014-10-15 07:49:30 Quantity 0.0333333 Price 110.970 Value per block 110,970 (Allocated from: ID 1520 Quantity 1)
ID 1521g Code FGBS DEC 14 Date 2014-10-15 09:20:57 Quantity 0.0333333 Price 110.980 Value per block 110,980 (Allocated from: ID 1521 Quantity 1)
ID 1522g Code FGBS DEC 14 Date 2014-10-16 07:56:03 Quantity 0.0333333 Price 110.995 Value per block 110,995 (Allocated from: ID 1522 Quantity 1)
ID 1529i Code FGBS DEC 14 Date 2014-11-03 02:49:50 Quantity 0.0333333 Price 110.985 Value per block 110,985 (Allocated from: ID 1529 Quantity 3)
ID 1530g Code FGBS DEC 14 Date 2014-11-05 08:00:37 Quantity 0.0333333 Price 110.970 Value per block 110,970 (Allocated from: ID 1530 Quantity 1)

CALCULATION: (1*110870) - 2 - 0 -(1*110948) - 2.00000 - 0  = -82 

********************************************************************************************************************************************

24: SELL 2 FGBS DEC 14 Futures on 19/11/2014 at EUR 110,870 each gives LOSS of EUR -164 equals GBP -131.217
 Commission EUR 4 and taxes EUR 0 on SELL
Trade details:ID 1557 Code FGBS DEC 14 Date 2014-11-19 09:47:05 Quantity -2 Price 110.870 Value per block 110,870
Total allowable cost EUR 4.00000   Total disposal proceeds EUR -160.333

Matches with:
PRO-RATA SECTION 104: Quantity 2.000000 FGBS DEC 14 allocated from total holding of 32, made up of 10 trades between 2014-09-01 and 2014-11-05
 At average value of EUR 110,948 Commissions EUR 4.00000 Taxes EUR 0  

Trades:
ID 1499h Code FGBS DEC 14 Date 2014-09-01 05:03:43 Quantity 1.33333 Price 110.930 Value per block 110,930 (Allocated from: ID 1499 Quantity 20)
ID 1514h Code FGBS DEC 14 Date 2014-10-02 02:59:41 Quantity 0.0666667 Price 111.015 Value per block 111,015 (Allocated from: ID 1514 Quantity 1)
ID 1515h Code FGBS DEC 14 Date 2014-10-06 06:03:36 Quantity 0.0666667 Price 110.985 Value per block 110,985 (Allocated from: ID 1515 Quantity 1)
ID 1516h Code FGBS DEC 14 Date 2014-10-09 02:51:50 Quantity 0.133333 Price 110.985 Value per block 110,985 (Allocated from: ID 1516 Quantity 2)
ID 1517h Code FGBS DEC 14 Date 2014-10-09 08:44:47 Quantity 0.0666667 Price 110.975 Value per block 110,975 (Allocated from: ID 1517 Quantity 1)
ID 1520h Code FGBS DEC 14 Date 2014-10-15 07:49:30 Quantity 0.0666667 Price 110.970 Value per block 110,970 (Allocated from: ID 1520 Quantity 1)
ID 1521h Code FGBS DEC 14 Date 2014-10-15 09:20:57 Quantity 0.0666667 Price 110.980 Value per block 110,980 (Allocated from: ID 1521 Quantity 1)
ID 1522h Code FGBS DEC 14 Date 2014-10-16 07:56:03 Quantity 0.0666667 Price 110.995 Value per block 110,995 (Allocated from: ID 1522 Quantity 1)
ID 1529j Code FGBS DEC 14 Date 2014-11-03 02:49:50 Quantity 0.0666667 Price 110.985 Value per block 110,985 (Allocated from: ID 1529 Quantity 3)
ID 1530h Code FGBS DEC 14 Date 2014-11-05 08:00:37 Quantity 0.0666667 Price 110.970 Value per block 110,970 (Allocated from: ID 1530 Quantity 1)

CALCULATION: (2*110870) - 4 - 0 -(2*110948) - 4.00000 - 0  = -164 

********************************************************************************************************************************************

25: SELL 1 FGBS DEC 14 Futures on 21/11/2014 at EUR 110,895 each gives LOSS of EUR -57 equals GBP -45.6440
 Commission EUR 2 and taxes EUR 0 on SELL
Trade details:ID 1558 Code FGBS DEC 14 Date 2014-11-21 04:00:11 Quantity -1 Price 110.895 Value per block 110,895
Total allowable cost EUR 2.00000   Total disposal proceeds EUR -55.1667

Matches with:
PRO-RATA SECTION 104: Quantity 1.000000 FGBS DEC 14 allocated from total holding of 32, made up of 10 trades between 2014-09-01 and 2014-11-05
 At average value of EUR 110,948 Commissions EUR 2.00000 Taxes EUR 0  

Trades:
ID 1499i Code FGBS DEC 14 Date 2014-09-01 05:03:43 Quantity 0.666667 Price 110.930 Value per block 110,930 (Allocated from: ID 1499 Quantity 20)
ID 1514i Code FGBS DEC 14 Date 2014-10-02 02:59:41 Quantity 0.0333333 Price 111.015 Value per block 111,015 (Allocated from: ID 1514 Quantity 1)
ID 1515i Code FGBS DEC 14 Date 2014-10-06 06:03:36 Quantity 0.0333333 Price 110.985 Value per block 110,985 (Allocated from: ID 1515 Quantity 1)
ID 1516i Code FGBS DEC 14 Date 2014-10-09 02:51:50 Quantity 0.0666667 Price 110.985 Value per block 110,985 (Allocated from: ID 1516 Quantity 2)
ID 1517i Code FGBS DEC 14 Date 2014-10-09 08:44:47 Quantity 0.0333333 Price 110.975 Value per block 110,975 (Allocated from: ID 1517 Quantity 1)
ID 1520i Code FGBS DEC 14 Date 2014-10-15 07:49:30 Quantity 0.0333333 Price 110.970 Value per block 110,970 (Allocated from: ID 1520 Quantity 1)
ID 1521i Code FGBS DEC 14 Date 2014-10-15 09:20:57 Quantity 0.0333333 Price 110.980 Value per block 110,980 (Allocated from: ID 1521 Quantity 1)
ID 1522i Code FGBS DEC 14 Date 2014-10-16 07:56:03 Quantity 0.0333333 Price 110.995 Value per block 110,995 (Allocated from: ID 1522 Quantity 1)
ID 1529k Code FGBS DEC 14 Date 2014-11-03 02:49:50 Quantity 0.0333333 Price 110.985 Value per block 110,985 (Allocated from: ID 1529 Quantity 3)
ID 1530i Code FGBS DEC 14 Date 2014-11-05 08:00:37 Quantity 0.0333333 Price 110.970 Value per block 110,970 (Allocated from: ID 1530 Quantity 1)

CALCULATION: (1*110895) - 2 - 0 -(1*110948) - 2.00000 - 0  = -57 

********************************************************************************************************************************************

26: SELL 8 FGBS DEC 14 Futures on 28/11/2014 at EUR 110,900 each gives LOSS of EUR -417 equals GBP -333.209
 Commission EUR 16 and taxes EUR 0 on SELL
Trade details:ID 1559 Code FGBS DEC 14 Date 2014-11-28 07:03:14 Quantity -8 Price 110.900 Value per block 110,900
Total allowable cost EUR 16.0000   Total disposal proceeds EUR -401.333

Matches with:
PRO-RATA SECTION 104: Quantity 8.000000 FGBS DEC 14 allocated from total holding of 32, made up of 10 trades between 2014-09-01 and 2014-11-05
 At average value of EUR 110,948 Commissions EUR 16.0000 Taxes EUR 0  

Trades:
ID 1499j Code FGBS DEC 14 Date 2014-09-01 05:03:43 Quantity 5.33333 Price 110.930 Value per block 110,930 (Allocated from: ID 1499 Quantity 20)
ID 1514j Code FGBS DEC 14 Date 2014-10-02 02:59:41 Quantity 0.266667 Price 111.015 Value per block 111,015 (Allocated from: ID 1514 Quantity 1)
ID 1515j Code FGBS DEC 14 Date 2014-10-06 06:03:36 Quantity 0.266667 Price 110.985 Value per block 110,985 (Allocated from: ID 1515 Quantity 1)
ID 1516j Code FGBS DEC 14 Date 2014-10-09 02:51:50 Quantity 0.533333 Price 110.985 Value per block 110,985 (Allocated from: ID 1516 Quantity 2)
ID 1517j Code FGBS DEC 14 Date 2014-10-09 08:44:47 Quantity 0.266667 Price 110.975 Value per block 110,975 (Allocated from: ID 1517 Quantity 1)
ID 1520j Code FGBS DEC 14 Date 2014-10-15 07:49:30 Quantity 0.266667 Price 110.970 Value per block 110,970 (Allocated from: ID 1520 Quantity 1)
ID 1521j Code FGBS DEC 14 Date 2014-10-15 09:20:57 Quantity 0.266667 Price 110.980 Value per block 110,980 (Allocated from: ID 1521 Quantity 1)
ID 1522j Code FGBS DEC 14 Date 2014-10-16 07:56:03 Quantity 0.266667 Price 110.995 Value per block 110,995 (Allocated from: ID 1522 Quantity 1)
ID 1529l Code FGBS DEC 14 Date 2014-11-03 02:49:50 Quantity 0.266667 Price 110.985 Value per block 110,985 (Allocated from: ID 1529 Quantity 3)
ID 1530j Code FGBS DEC 14 Date 2014-11-05 08:00:37 Quantity 0.266667 Price 110.970 Value per block 110,970 (Allocated from: ID 1530 Quantity 1)

CALCULATION: (8*110900) - 16 - 0 -(8*110948) - 16.0000 - 0  = -417 

********************************************************************************************************************************************

27: SELL 2 FGBS DEC 14 Futures on 03/12/2014 at EUR 110,885 each gives LOSS of EUR -134 equals GBP -107.260
 Commission EUR 4 and taxes EUR 0 on SELL
Trade details:ID 1560 Code FGBS DEC 14 Date 2014-12-03 02:48:17 Quantity -2 Price 110.885 Value per block 110,885
Total allowable cost EUR 4.00000   Total disposal proceeds EUR -130.333

Matches with:
PRO-RATA SECTION 104: Quantity 2.000000 FGBS DEC 14 allocated from total holding of 32, made up of 10 trades between 2014-09-01 and 2014-11-05
 At average value of EUR 110,948 Commissions EUR 4.00000 Taxes EUR 0  

Trades:
ID 1499k Code FGBS DEC 14 Date 2014-09-01 05:03:43 Quantity 1.33333 Price 110.930 Value per block 110,930 (Allocated from: ID 1499 Quantity 20)
ID 1514k Code FGBS DEC 14 Date 2014-10-02 02:59:41 Quantity 0.0666667 Price 111.015 Value per block 111,015 (Allocated from: ID 1514 Quantity 1)
ID 1515k Code FGBS DEC 14 Date 2014-10-06 06:03:36 Quantity 0.0666667 Price 110.985 Value per block 110,985 (Allocated from: ID 1515 Quantity 1)
ID 1516k Code FGBS DEC 14 Date 2014-10-09 02:51:50 Quantity 0.133333 Price 110.985 Value per block 110,985 (Allocated from: ID 1516 Quantity 2)
ID 1517k Code FGBS DEC 14 Date 2014-10-09 08:44:47 Quantity 0.0666667 Price 110.975 Value per block 110,975 (Allocated from: ID 1517 Quantity 1)
ID 1520k Code FGBS DEC 14 Date 2014-10-15 07:49:30 Quantity 0.0666667 Price 110.970 Value per block 110,970 (Allocated from: ID 1520 Quantity 1)
ID 1521k Code FGBS DEC 14 Date 2014-10-15 09:20:57 Quantity 0.0666667 Price 110.980 Value per block 110,980 (Allocated from: ID 1521 Quantity 1)
ID 1522k Code FGBS DEC 14 Date 2014-10-16 07:56:03 Quantity 0.0666667 Price 110.995 Value per block 110,995 (Allocated from: ID 1522 Quantity 1)
ID 1529m Code FGBS DEC 14 Date 2014-11-03 02:49:50 Quantity 0.0666667 Price 110.985 Value per block 110,985 (Allocated from: ID 1529 Quantity 3)
ID 1530k Code FGBS DEC 14 Date 2014-11-05 08:00:37 Quantity 0.0666667 Price 110.970 Value per block 110,970 (Allocated from: ID 1530 Quantity 1)

CALCULATION: (2*110885) - 4 - 0 -(2*110948) - 4.00000 - 0  = -134 

********************************************************************************************************************************************

1: SELL 1 FGBS JUN 14 Futures on 17/04/2014 at EUR 110,430 each gives LOSS of EUR -59 equals GBP -47.1845
 Commission EUR 2 and taxes EUR 0 on SELL
Trade details:ID 1572 Code FGBS JUN 14 Date 2014-04-17 08:10:20 Quantity -1 Price 110.430 Value per block 110,430
Total allowable cost EUR 2   Total disposal proceeds EUR -57

Matches with:
SUBSEQUENT 1 TRADE(S) Within 30 days between 2014-05-02 and 2014-05-02: Matches with BUY of 1 FGBS JUN 14 at of EUR 110,485 each 
 Commissions EUR 2 Taxes EUR 0  

Trades:
ID 1563 Code FGBS JUN 14 Date 2014-05-02 03:37:28 Quantity 1 Price 110.485 Value per block 110,485

CALCULATION: (1*110430) - 2 - 0 -(1*110485) - 2 - 0  = -59 

********************************************************************************************************************************************

2: SELL 1 FGBS JUN 14 Futures on 22/04/2014 at EUR 110,415 each gives LOSS of EUR -89 equals GBP -71.1798
 Commission EUR 2 and taxes EUR 0 on SELL
Trade details:ID 1573 Code FGBS JUN 14 Date 2014-04-22 03:03:27 Quantity -1 Price 110.415 Value per block 110,415
Total allowable cost EUR 2   Total disposal proceeds EUR -87

Matches with:
SUBSEQUENT 1 TRADE(S) Within 30 days between 2014-05-05 and 2014-05-05: Matches with BUY of 1 FGBS JUN 14 at of EUR 110,500 each 
 Commissions EUR 2 Taxes EUR 0  

Trades:
ID 1564 Code FGBS JUN 14 Date 2014-05-05 05:37:58 Quantity 1 Price 110.500 Value per block 110,500

CALCULATION: (1*110415) - 2 - 0 -(1*110500) - 2 - 0  = -89 

********************************************************************************************************************************************

3: SELL 2 FGBS JUN 14 Futures on 22/04/2014 at EUR 110,400 each gives LOSS of EUR -248 equals GBP -198.348
 Commission EUR 4 and taxes EUR 0 on SELL
Trade details:ID 1574 Code FGBS JUN 14 Date 2014-04-22 04:07:01 Quantity -2 Price 110.400 Value per block 110,400
Total allowable cost EUR 4   Total disposal proceeds EUR -244

Matches with:
SUBSEQUENT 2 TRADE(S) Within 30 days between 2014-05-05 and 2014-05-09: Matches with BUY of 2 FGBS JUN 14 at of EUR 110,520 each 
 Commissions EUR 4 Taxes EUR 0  

Trades:
ID 1565 Code FGBS JUN 14 Date 2014-05-05 07:03:02 Quantity 1 Price 110.505 Value per block 110,505
ID 1566 Code FGBS JUN 14 Date 2014-05-09 02:32:29 Quantity 1 Price 110.535 Value per block 110,535

CALCULATION: (2*110400) - 4 - 0 -(2*110520) - 4 - 0  = -248 

********************************************************************************************************************************************

4: SELL 1 FGBS JUN 14 Futures on 24/04/2014 at EUR 110,370 each gives LOSS of EUR -194 equals GBP -155.162
 Commission EUR 2 and taxes EUR 0 on SELL
Trade details:ID 1575 Code FGBS JUN 14 Date 2014-04-24 02:48:06 Quantity -1 Price 110.370 Value per block 110,370
Total allowable cost EUR 2   Total disposal proceeds EUR -192

Matches with:
SUBSEQUENT 1 TRADE(S) Within 30 days between 2014-05-15 and 2014-05-15: Matches with BUY of 1 FGBS JUN 14 at of EUR 110,560 each 
 Commissions EUR 2 Taxes EUR 0  

Trades:
ID 1567a Code FGBS JUN 14 Date 2014-05-15 02:56:54 Quantity 1 Price 110.560 Value per block 110,560 (Allocated from: ID 1567 Quantity 2)

CALCULATION: (1*110370) - 2 - 0 -(1*110560) - 2 - 0  = -194 

********************************************************************************************************************************************

5: SELL 2 FGBS JUN 14 Futures on 09/05/2014 at EUR 110,515 each gives LOSS of EUR -133 equals GBP -106.671
 Commission EUR 4 and taxes EUR 0 on SELL
Trade details:ID 1576 Code FGBS JUN 14 Date 2014-05-09 03:48:53 Quantity -2 Price 110.515 Value per block 110,515
Total allowable cost EUR 4   Total disposal proceeds EUR -129

Matches with:
SUBSEQUENT 2 TRADE(S) Within 30 days between 2014-05-15 and 2014-05-16: Matches with BUY of 2 FGBS JUN 14 at of EUR 110,578 each 
 Commissions EUR 4 Taxes EUR 0  

Trades:
ID 1567 Code FGBS JUN 14 Date 2014-05-15 02:56:54 Quantity 1 Price 110.560 Value per block 110,560
ID 1568 Code FGBS JUN 14 Date 2014-05-16 02:54:31 Quantity 1 Price 110.595 Value per block 110,595

CALCULATION: (2*110515) - 4 - 0 -(2*110578) - 4 - 0  = -133 

********************************************************************************************************************************************

6: SELL 16 FGBS JUN 14 Futures on 02/06/2014 at EUR 110,650 each gives PROFIT of EUR 3,041 equals GBP 2,439.60
 Commission EUR 32 and taxes EUR 0 on SELL
Trade details:ID 1577 Code FGBS JUN 14 Date 2014-06-02 03:22:14 Quantity -16 Price 110.650 Value per block 110,650
Total allowable cost EUR 32   Total disposal proceeds EUR 3,073

Matches with:
PRO-RATA SECTION 104: Quantity 16.000000 FGBS JUN 14 allocated from total holding of 16, made up of 5 trades between 2014-04-11 and 2014-05-21
 At average value of EUR 110,456 Commissions EUR 32 Taxes EUR 0  

Trades:
ID 1561 Code FGBS JUN 14 Date 2014-04-11 03:13:34 Quantity 12 Price 110.420 Value per block 110,420
ID 1562 Code FGBS JUN 14 Date 2014-04-15 02:48:00 Quantity 1 Price 110.445 Value per block 110,445
ID 1569 Code FGBS JUN 14 Date 2014-05-19 03:06:29 Quantity 1 Price 110.585 Value per block 110,585
ID 1570 Code FGBS JUN 14 Date 2014-05-19 04:50:34 Quantity 1 Price 110.600 Value per block 110,600
ID 1571 Code FGBS JUN 14 Date 2014-05-21 03:22:36 Quantity 1 Price 110.625 Value per block 110,625

CALCULATION: (16*110650) - 32 - 0 -(16*110456) - 32 - 0  = 3,041 

********************************************************************************************************************************************

1: SELL 1 FGBS MAR 15 Futures on 09/01/2015 at EUR 111,110 each gives PROFIT of EUR 6 equals GBP 4.77075
 Commission EUR 2 and taxes EUR 0 on SELL
Trade details:ID 1601 Code FGBS MAR 15 Date 2015-01-09 11:03:55 Quantity -1 Price 111.110 Value per block 111,110
Total allowable cost EUR 2   Total disposal proceeds EUR 8

Matches with:
SUBSEQUENT 1 TRADE(S) Within 30 days between 2015-01-12 and 2015-01-12: Matches with BUY of 1 FGBS MAR 15 at of EUR 111,100 each 
 Commissions EUR 2 Taxes EUR 0  

Trades:
ID 1595 Code FGBS MAR 15 Date 2015-01-12 02:49:03 Quantity 1 Price 111.100 Value per block 111,100

CALCULATION: (1*111110) - 2 - 0 -(1*111100) - 2 - 0  = 6 

********************************************************************************************************************************************

2: SELL 1 FGBS MAR 15 Futures on 15/01/2015 at EUR 111,140 each gives LOSS of EUR -44 equals GBP -34.9978
 Commission EUR 2 and taxes EUR 0 on SELL
Trade details:ID 1602 Code FGBS MAR 15 Date 2015-01-15 06:03:46 Quantity -1 Price 111.140 Value per block 111,140
Total allowable cost EUR 2   Total disposal proceeds EUR -42

Matches with:
SUBSEQUENT 1 TRADE(S) Within 30 days between 2015-01-19 and 2015-01-19: Matches with BUY of 1 FGBS MAR 15 at of EUR 111,180 each 
 Commissions EUR 2 Taxes EUR 0  

Trades:
ID 1599 Code FGBS MAR 15 Date 2015-01-19 02:44:26 Quantity 1 Price 111.180 Value per block 111,180

CALCULATION: (1*111140) - 2 - 0 -(1*111180) - 2 - 0  = -44 

********************************************************************************************************************************************

3: SELL 5 FGBS MAR 15 Futures on 15/01/2015 at EUR 111,155 each gives PROFIT of EUR 278 equals GBP 221.104
 Commission EUR 10 and taxes EUR 0 on SELL
Trade details:ID 1603 Code FGBS MAR 15 Date 2015-01-15 07:01:43 Quantity -5 Price 111.155 Value per block 111,155
Total allowable cost EUR 10.0000   Total disposal proceeds EUR 288

Matches with:
SUBSEQUENT 1 TRADE(S) Within 30 days between 2015-01-20 and 2015-01-20: Matches with BUY of 1 FGBS MAR 15 at of EUR 111,190 each 
 Commissions EUR 2 Taxes EUR 0  

Trades:
ID 1600 Code FGBS MAR 15 Date 2015-01-20 02:47:49 Quantity 1 Price 111.190 Value per block 111,190
PRO-RATA SECTION 104: Quantity 4.000000 FGBS MAR 15 allocated from total holding of 40, made up of 20 trades between 2014-12-04 and 2015-01-14
 At average value of EUR 111,072 Commissions EUR 8.00000 Taxes EUR 0  

Trades:
ID 1578a Code FGBS MAR 15 Date 2014-12-04 06:17:54 Quantity 0.100000 Price 110.935 Value per block 110,935 (Allocated from: ID 1578 Quantity 1)
ID 1579a Code FGBS MAR 15 Date 2014-12-09 02:52:01 Quantity 0.100000 Price 110.940 Value per block 110,940 (Allocated from: ID 1579 Quantity 1)
ID 1580a Code FGBS MAR 15 Date 2014-12-09 10:55:37 Quantity 0.100000 Price 110.945 Value per block 110,945 (Allocated from: ID 1580 Quantity 1)
ID 1581a Code FGBS MAR 15 Date 2014-12-10 02:48:22 Quantity 0.100000 Price 110.935 Value per block 110,935 (Allocated from: ID 1581 Quantity 1)
ID 1582a Code FGBS MAR 15 Date 2014-12-11 07:35:17 Quantity 0.100000 Price 110.935 Value per block 110,935 (Allocated from: ID 1582 Quantity 1)
ID 1583a Code FGBS MAR 15 Date 2014-12-12 04:44:08 Quantity 0.100000 Price 110.950 Value per block 110,950 (Allocated from: ID 1583 Quantity 1)
ID 1584a Code FGBS MAR 15 Date 2014-12-17 02:48:40 Quantity 0.100000 Price 111.025 Value per block 111,025 (Allocated from: ID 1584 Quantity 1)
ID 1585a Code FGBS MAR 15 Date 2014-12-18 06:01:52 Quantity 0.100000 Price 111.045 Value per block 111,045 (Allocated from: ID 1585 Quantity 1)
ID 1586a Code FGBS MAR 15 Date 2014-12-22 02:47:05 Quantity 0.200000 Price 111.075 Value per block 111,075 (Allocated from: ID 1586 Quantity 2)
ID 1587a Code FGBS MAR 15 Date 2014-12-23 02:48:19 Quantity 0.100000 Price 111.070 Value per block 111,070 (Allocated from: ID 1587 Quantity 1)
ID 1588a Code FGBS MAR 15 Date 2014-12-29 07:39:55 Quantity 0.100000 Price 111.080 Value per block 111,080 (Allocated from: ID 1588 Quantity 1)
ID 1589a Code FGBS MAR 15 Date 2014-12-30 02:49:07 Quantity 0.100000 Price 111.095 Value per block 111,095 (Allocated from: ID 1589 Quantity 1)
ID 1590a Code FGBS MAR 15 Date 2015-01-02 03:49:31 Quantity 0.100000 Price 111.100 Value per block 111,100 (Allocated from: ID 1590 Quantity 1)
ID 1591a Code FGBS MAR 15 Date 2015-01-05 02:48:10 Quantity 0.100000 Price 111.100 Value per block 111,100 (Allocated from: ID 1591 Quantity 1)
ID 1592a Code FGBS MAR 15 Date 2015-01-06 02:48:39 Quantity 0.200000 Price 111.095 Value per block 111,095 (Allocated from: ID 1592 Quantity 2)
ID 1593a Code FGBS MAR 15 Date 2015-01-07 02:47:59 Quantity 0.200000 Price 111.095 Value per block 111,095 (Allocated from: ID 1593 Quantity 2)
ID 1594a Code FGBS MAR 15 Date 2015-01-08 02:50:55 Quantity 0.100000 Price 111.095 Value per block 111,095 (Allocated from: ID 1594 Quantity 1)
ID 1596a Code FGBS MAR 15 Date 2015-01-12 09:17:46 Quantity 0.200000 Price 111.100 Value per block 111,100 (Allocated from: ID 1596 Quantity 2)
ID 1597a Code FGBS MAR 15 Date 2015-01-13 02:49:32 Quantity 0.100000 Price 111.105 Value per block 111,105 (Allocated from: ID 1597 Quantity 1)
ID 1598a Code FGBS MAR 15 Date 2015-01-14 02:48:37 Quantity 1.70000 Price 111.105 Value per block 111,105 (Allocated from: ID 1598 Quantity 17)

CALCULATION: (5*111155) - 10 - 0 -(1*111190) - 2 - 0 -(4*111072) - 8.00000 - 0  = 278 

********************************************************************************************************************************************

4: SELL 1 FGBS MAR 15 Futures on 20/01/2015 at EUR 111,165 each gives PROFIT of EUR 89 equals GBP 70.7403
 Commission EUR 2 and taxes EUR 0 on SELL
Trade details:ID 1604 Code FGBS MAR 15 Date 2015-01-20 09:26:47 Quantity -1 Price 111.165 Value per block 111,165
Total allowable cost EUR 2   Total disposal proceeds EUR 91.2500

Matches with:
PRO-RATA SECTION 104: Quantity 1.000000 FGBS MAR 15 allocated from total holding of 40, made up of 20 trades between 2014-12-04 and 2015-01-14
 At average value of EUR 111,072 Commissions EUR 2 Taxes EUR 0  

Trades:
ID 1578b Code FGBS MAR 15 Date 2014-12-04 06:17:54 Quantity 0.0250000 Price 110.935 Value per block 110,935 (Allocated from: ID 1578 Quantity 1)
ID 1579b Code FGBS MAR 15 Date 2014-12-09 02:52:01 Quantity 0.0250000 Price 110.940 Value per block 110,940 (Allocated from: ID 1579 Quantity 1)
ID 1580b Code FGBS MAR 15 Date 2014-12-09 10:55:37 Quantity 0.0250000 Price 110.945 Value per block 110,945 (Allocated from: ID 1580 Quantity 1)
ID 1581b Code FGBS MAR 15 Date 2014-12-10 02:48:22 Quantity 0.0250000 Price 110.935 Value per block 110,935 (Allocated from: ID 1581 Quantity 1)
ID 1582b Code FGBS MAR 15 Date 2014-12-11 07:35:17 Quantity 0.0250000 Price 110.935 Value per block 110,935 (Allocated from: ID 1582 Quantity 1)
ID 1583b Code FGBS MAR 15 Date 2014-12-12 04:44:08 Quantity 0.0250000 Price 110.950 Value per block 110,950 (Allocated from: ID 1583 Quantity 1)
ID 1584b Code FGBS MAR 15 Date 2014-12-17 02:48:40 Quantity 0.0250000 Price 111.025 Value per block 111,025 (Allocated from: ID 1584 Quantity 1)
ID 1585b Code FGBS MAR 15 Date 2014-12-18 06:01:52 Quantity 0.0250000 Price 111.045 Value per block 111,045 (Allocated from: ID 1585 Quantity 1)
ID 1586b Code FGBS MAR 15 Date 2014-12-22 02:47:05 Quantity 0.0500000 Price 111.075 Value per block 111,075 (Allocated from: ID 1586 Quantity 2)
ID 1587b Code FGBS MAR 15 Date 2014-12-23 02:48:19 Quantity 0.0250000 Price 111.070 Value per block 111,070 (Allocated from: ID 1587 Quantity 1)
ID 1588b Code FGBS MAR 15 Date 2014-12-29 07:39:55 Quantity 0.0250000 Price 111.080 Value per block 111,080 (Allocated from: ID 1588 Quantity 1)
ID 1589b Code FGBS MAR 15 Date 2014-12-30 02:49:07 Quantity 0.0250000 Price 111.095 Value per block 111,095 (Allocated from: ID 1589 Quantity 1)
ID 1590b Code FGBS MAR 15 Date 2015-01-02 03:49:31 Quantity 0.0250000 Price 111.100 Value per block 111,100 (Allocated from: ID 1590 Quantity 1)
ID 1591b Code FGBS MAR 15 Date 2015-01-05 02:48:10 Quantity 0.0250000 Price 111.100 Value per block 111,100 (Allocated from: ID 1591 Quantity 1)
ID 1592b Code FGBS MAR 15 Date 2015-01-06 02:48:39 Quantity 0.0500000 Price 111.095 Value per block 111,095 (Allocated from: ID 1592 Quantity 2)
ID 1593b Code FGBS MAR 15 Date 2015-01-07 02:47:59 Quantity 0.0500000 Price 111.095 Value per block 111,095 (Allocated from: ID 1593 Quantity 2)
ID 1594b Code FGBS MAR 15 Date 2015-01-08 02:50:55 Quantity 0.0250000 Price 111.095 Value per block 111,095 (Allocated from: ID 1594 Quantity 1)
ID 1596b Code FGBS MAR 15 Date 2015-01-12 09:17:46 Quantity 0.0500000 Price 111.100 Value per block 111,100 (Allocated from: ID 1596 Quantity 2)
ID 1597b Code FGBS MAR 15 Date 2015-01-13 02:49:32 Quantity 0.0250000 Price 111.105 Value per block 111,105 (Allocated from: ID 1597 Quantity 1)
ID 1598b Code FGBS MAR 15 Date 2015-01-14 02:48:37 Quantity 0.425000 Price 111.105 Value per block 111,105 (Allocated from: ID 1598 Quantity 17)

CALCULATION: (1*111165) - 2 - 0 -(1*111072) - 2 - 0  = 89 

********************************************************************************************************************************************

5: SELL 1 FGBS MAR 15 Futures on 21/01/2015 at EUR 111,175 each gives PROFIT of EUR 99 equals GBP 78.6675
 Commission EUR 2 and taxes EUR 0 on SELL
Trade details:ID 1605 Code FGBS MAR 15 Date 2015-01-21 11:20:21 Quantity -1 Price 111.175 Value per block 111,175
Total allowable cost EUR 2   Total disposal proceeds EUR 101.250

Matches with:
PRO-RATA SECTION 104: Quantity 1.000000 FGBS MAR 15 allocated from total holding of 40, made up of 20 trades between 2014-12-04 and 2015-01-14
 At average value of EUR 111,072 Commissions EUR 2 Taxes EUR 0  

Trades:
ID 1578c Code FGBS MAR 15 Date 2014-12-04 06:17:54 Quantity 0.0250000 Price 110.935 Value per block 110,935 (Allocated from: ID 1578 Quantity 1)
ID 1579c Code FGBS MAR 15 Date 2014-12-09 02:52:01 Quantity 0.0250000 Price 110.940 Value per block 110,940 (Allocated from: ID 1579 Quantity 1)
ID 1580c Code FGBS MAR 15 Date 2014-12-09 10:55:37 Quantity 0.0250000 Price 110.945 Value per block 110,945 (Allocated from: ID 1580 Quantity 1)
ID 1581c Code FGBS MAR 15 Date 2014-12-10 02:48:22 Quantity 0.0250000 Price 110.935 Value per block 110,935 (Allocated from: ID 1581 Quantity 1)
ID 1582c Code FGBS MAR 15 Date 2014-12-11 07:35:17 Quantity 0.0250000 Price 110.935 Value per block 110,935 (Allocated from: ID 1582 Quantity 1)
ID 1583c Code FGBS MAR 15 Date 2014-12-12 04:44:08 Quantity 0.0250000 Price 110.950 Value per block 110,950 (Allocated from: ID 1583 Quantity 1)
ID 1584c Code FGBS MAR 15 Date 2014-12-17 02:48:40 Quantity 0.0250000 Price 111.025 Value per block 111,025 (Allocated from: ID 1584 Quantity 1)
ID 1585c Code FGBS MAR 15 Date 2014-12-18 06:01:52 Quantity 0.0250000 Price 111.045 Value per block 111,045 (Allocated from: ID 1585 Quantity 1)
ID 1586c Code FGBS MAR 15 Date 2014-12-22 02:47:05 Quantity 0.0500000 Price 111.075 Value per block 111,075 (Allocated from: ID 1586 Quantity 2)
ID 1587c Code FGBS MAR 15 Date 2014-12-23 02:48:19 Quantity 0.0250000 Price 111.070 Value per block 111,070 (Allocated from: ID 1587 Quantity 1)
ID 1588c Code FGBS MAR 15 Date 2014-12-29 07:39:55 Quantity 0.0250000 Price 111.080 Value per block 111,080 (Allocated from: ID 1588 Quantity 1)
ID 1589c Code FGBS MAR 15 Date 2014-12-30 02:49:07 Quantity 0.0250000 Price 111.095 Value per block 111,095 (Allocated from: ID 1589 Quantity 1)
ID 1590c Code FGBS MAR 15 Date 2015-01-02 03:49:31 Quantity 0.0250000 Price 111.100 Value per block 111,100 (Allocated from: ID 1590 Quantity 1)
ID 1591c Code FGBS MAR 15 Date 2015-01-05 02:48:10 Quantity 0.0250000 Price 111.100 Value per block 111,100 (Allocated from: ID 1591 Quantity 1)
ID 1592c Code FGBS MAR 15 Date 2015-01-06 02:48:39 Quantity 0.0500000 Price 111.095 Value per block 111,095 (Allocated from: ID 1592 Quantity 2)
ID 1593c Code FGBS MAR 15 Date 2015-01-07 02:47:59 Quantity 0.0500000 Price 111.095 Value per block 111,095 (Allocated from: ID 1593 Quantity 2)
ID 1594c Code FGBS MAR 15 Date 2015-01-08 02:50:55 Quantity 0.0250000 Price 111.095 Value per block 111,095 (Allocated from: ID 1594 Quantity 1)
ID 1596c Code FGBS MAR 15 Date 2015-01-12 09:17:46 Quantity 0.0500000 Price 111.100 Value per block 111,100 (Allocated from: ID 1596 Quantity 2)
ID 1597c Code FGBS MAR 15 Date 2015-01-13 02:49:32 Quantity 0.0250000 Price 111.105 Value per block 111,105 (Allocated from: ID 1597 Quantity 1)
ID 1598c Code FGBS MAR 15 Date 2015-01-14 02:48:37 Quantity 0.425000 Price 111.105 Value per block 111,105 (Allocated from: ID 1598 Quantity 17)

CALCULATION: (1*111175) - 2 - 0 -(1*111072) - 2 - 0  = 99 

********************************************************************************************************************************************

6: SELL 1 FGBS MAR 15 Futures on 22/01/2015 at EUR 111,210 each gives PROFIT of EUR 134 equals GBP 106.413
 Commission EUR 2 and taxes EUR 0 on SELL
Trade details:ID 1606 Code FGBS MAR 15 Date 2015-01-22 09:51:30 Quantity -1 Price 111.210 Value per block 111,210
Total allowable cost EUR 2   Total disposal proceeds EUR 136.250

Matches with:
PRO-RATA SECTION 104: Quantity 1.000000 FGBS MAR 15 allocated from total holding of 40, made up of 20 trades between 2014-12-04 and 2015-01-14
 At average value of EUR 111,072 Commissions EUR 2 Taxes EUR 0  

Trades:
ID 1578d Code FGBS MAR 15 Date 2014-12-04 06:17:54 Quantity 0.0250000 Price 110.935 Value per block 110,935 (Allocated from: ID 1578 Quantity 1)
ID 1579d Code FGBS MAR 15 Date 2014-12-09 02:52:01 Quantity 0.0250000 Price 110.940 Value per block 110,940 (Allocated from: ID 1579 Quantity 1)
ID 1580d Code FGBS MAR 15 Date 2014-12-09 10:55:37 Quantity 0.0250000 Price 110.945 Value per block 110,945 (Allocated from: ID 1580 Quantity 1)
ID 1581d Code FGBS MAR 15 Date 2014-12-10 02:48:22 Quantity 0.0250000 Price 110.935 Value per block 110,935 (Allocated from: ID 1581 Quantity 1)
ID 1582d Code FGBS MAR 15 Date 2014-12-11 07:35:17 Quantity 0.0250000 Price 110.935 Value per block 110,935 (Allocated from: ID 1582 Quantity 1)
ID 1583d Code FGBS MAR 15 Date 2014-12-12 04:44:08 Quantity 0.0250000 Price 110.950 Value per block 110,950 (Allocated from: ID 1583 Quantity 1)
ID 1584d Code FGBS MAR 15 Date 2014-12-17 02:48:40 Quantity 0.0250000 Price 111.025 Value per block 111,025 (Allocated from: ID 1584 Quantity 1)
ID 1585d Code FGBS MAR 15 Date 2014-12-18 06:01:52 Quantity 0.0250000 Price 111.045 Value per block 111,045 (Allocated from: ID 1585 Quantity 1)
ID 1586d Code FGBS MAR 15 Date 2014-12-22 02:47:05 Quantity 0.0500000 Price 111.075 Value per block 111,075 (Allocated from: ID 1586 Quantity 2)
ID 1587d Code FGBS MAR 15 Date 2014-12-23 02:48:19 Quantity 0.0250000 Price 111.070 Value per block 111,070 (Allocated from: ID 1587 Quantity 1)
ID 1588d Code FGBS MAR 15 Date 2014-12-29 07:39:55 Quantity 0.0250000 Price 111.080 Value per block 111,080 (Allocated from: ID 1588 Quantity 1)
ID 1589d Code FGBS MAR 15 Date 2014-12-30 02:49:07 Quantity 0.0250000 Price 111.095 Value per block 111,095 (Allocated from: ID 1589 Quantity 1)
ID 1590d Code FGBS MAR 15 Date 2015-01-02 03:49:31 Quantity 0.0250000 Price 111.100 Value per block 111,100 (Allocated from: ID 1590 Quantity 1)
ID 1591d Code FGBS MAR 15 Date 2015-01-05 02:48:10 Quantity 0.0250000 Price 111.100 Value per block 111,100 (Allocated from: ID 1591 Quantity 1)
ID 1592d Code FGBS MAR 15 Date 2015-01-06 02:48:39 Quantity 0.0500000 Price 111.095 Value per block 111,095 (Allocated from: ID 1592 Quantity 2)
ID 1593d Code FGBS MAR 15 Date 2015-01-07 02:47:59 Quantity 0.0500000 Price 111.095 Value per block 111,095 (Allocated from: ID 1593 Quantity 2)
ID 1594d Code FGBS MAR 15 Date 2015-01-08 02:50:55 Quantity 0.0250000 Price 111.095 Value per block 111,095 (Allocated from: ID 1594 Quantity 1)
ID 1596d Code FGBS MAR 15 Date 2015-01-12 09:17:46 Quantity 0.0500000 Price 111.100 Value per block 111,100 (Allocated from: ID 1596 Quantity 2)
ID 1597d Code FGBS MAR 15 Date 2015-01-13 02:49:32 Quantity 0.0250000 Price 111.105 Value per block 111,105 (Allocated from: ID 1597 Quantity 1)
ID 1598d Code FGBS MAR 15 Date 2015-01-14 02:48:37 Quantity 0.425000 Price 111.105 Value per block 111,105 (Allocated from: ID 1598 Quantity 17)

CALCULATION: (1*111210) - 2 - 0 -(1*111072) - 2 - 0  = 134 

********************************************************************************************************************************************

7: SELL 2 FGBS MAR 15 Futures on 26/01/2015 at EUR 111,195 each gives PROFIT of EUR 238 equals GBP 189.044
 Commission EUR 4 and taxes EUR 0 on SELL
Trade details:ID 1607 Code FGBS MAR 15 Date 2015-01-26 02:36:14 Quantity -2 Price 111.195 Value per block 111,195
Total allowable cost EUR 4.00000   Total disposal proceeds EUR 242.500

Matches with:
PRO-RATA SECTION 104: Quantity 2.000000 FGBS MAR 15 allocated from total holding of 40, made up of 20 trades between 2014-12-04 and 2015-01-14
 At average value of EUR 111,072 Commissions EUR 4.00000 Taxes EUR 0  

Trades:
ID 1578e Code FGBS MAR 15 Date 2014-12-04 06:17:54 Quantity 0.0500000 Price 110.935 Value per block 110,935 (Allocated from: ID 1578 Quantity 1)
ID 1579e Code FGBS MAR 15 Date 2014-12-09 02:52:01 Quantity 0.0500000 Price 110.940 Value per block 110,940 (Allocated from: ID 1579 Quantity 1)
ID 1580e Code FGBS MAR 15 Date 2014-12-09 10:55:37 Quantity 0.0500000 Price 110.945 Value per block 110,945 (Allocated from: ID 1580 Quantity 1)
ID 1581e Code FGBS MAR 15 Date 2014-12-10 02:48:22 Quantity 0.0500000 Price 110.935 Value per block 110,935 (Allocated from: ID 1581 Quantity 1)
ID 1582e Code FGBS MAR 15 Date 2014-12-11 07:35:17 Quantity 0.0500000 Price 110.935 Value per block 110,935 (Allocated from: ID 1582 Quantity 1)
ID 1583e Code FGBS MAR 15 Date 2014-12-12 04:44:08 Quantity 0.0500000 Price 110.950 Value per block 110,950 (Allocated from: ID 1583 Quantity 1)
ID 1584e Code FGBS MAR 15 Date 2014-12-17 02:48:40 Quantity 0.0500000 Price 111.025 Value per block 111,025 (Allocated from: ID 1584 Quantity 1)
ID 1585e Code FGBS MAR 15 Date 2014-12-18 06:01:52 Quantity 0.0500000 Price 111.045 Value per block 111,045 (Allocated from: ID 1585 Quantity 1)
ID 1586e Code FGBS MAR 15 Date 2014-12-22 02:47:05 Quantity 0.100000 Price 111.075 Value per block 111,075 (Allocated from: ID 1586 Quantity 2)
ID 1587e Code FGBS MAR 15 Date 2014-12-23 02:48:19 Quantity 0.0500000 Price 111.070 Value per block 111,070 (Allocated from: ID 1587 Quantity 1)
ID 1588e Code FGBS MAR 15 Date 2014-12-29 07:39:55 Quantity 0.0500000 Price 111.080 Value per block 111,080 (Allocated from: ID 1588 Quantity 1)
ID 1589e Code FGBS MAR 15 Date 2014-12-30 02:49:07 Quantity 0.0500000 Price 111.095 Value per block 111,095 (Allocated from: ID 1589 Quantity 1)
ID 1590e Code FGBS MAR 15 Date 2015-01-02 03:49:31 Quantity 0.0500000 Price 111.100 Value per block 111,100 (Allocated from: ID 1590 Quantity 1)
ID 1591e Code FGBS MAR 15 Date 2015-01-05 02:48:10 Quantity 0.0500000 Price 111.100 Value per block 111,100 (Allocated from: ID 1591 Quantity 1)
ID 1592e Code FGBS MAR 15 Date 2015-01-06 02:48:39 Quantity 0.100000 Price 111.095 Value per block 111,095 (Allocated from: ID 1592 Quantity 2)
ID 1593e Code FGBS MAR 15 Date 2015-01-07 02:47:59 Quantity 0.100000 Price 111.095 Value per block 111,095 (Allocated from: ID 1593 Quantity 2)
ID 1594e Code FGBS MAR 15 Date 2015-01-08 02:50:55 Quantity 0.0500000 Price 111.095 Value per block 111,095 (Allocated from: ID 1594 Quantity 1)
ID 1596e Code FGBS MAR 15 Date 2015-01-12 09:17:46 Quantity 0.100000 Price 111.100 Value per block 111,100 (Allocated from: ID 1596 Quantity 2)
ID 1597e Code FGBS MAR 15 Date 2015-01-13 02:49:32 Quantity 0.0500000 Price 111.105 Value per block 111,105 (Allocated from: ID 1597 Quantity 1)
ID 1598e Code FGBS MAR 15 Date 2015-01-14 02:48:37 Quantity 0.850000 Price 111.105 Value per block 111,105 (Allocated from: ID 1598 Quantity 17)

CALCULATION: (2*111195) - 4 - 0 -(2*111072) - 4.00000 - 0  = 238 

********************************************************************************************************************************************

8: SELL 1 FGBS MAR 15 Futures on 26/01/2015 at EUR 111,195 each gives PROFIT of EUR 119 equals GBP 94.5218
 Commission EUR 2 and taxes EUR 0 on SELL
Trade details:ID 1608 Code FGBS MAR 15 Date 2015-01-26 02:48:33 Quantity -1 Price 111.195 Value per block 111,195
Total allowable cost EUR 2.00000   Total disposal proceeds EUR 121.250

Matches with:
PRO-RATA SECTION 104: Quantity 1.000000 FGBS MAR 15 allocated from total holding of 40, made up of 20 trades between 2014-12-04 and 2015-01-14
 At average value of EUR 111,072 Commissions EUR 2.00000 Taxes EUR 0  

Trades:
ID 1578f Code FGBS MAR 15 Date 2014-12-04 06:17:54 Quantity 0.0250000 Price 110.935 Value per block 110,935 (Allocated from: ID 1578 Quantity 1)
ID 1579f Code FGBS MAR 15 Date 2014-12-09 02:52:01 Quantity 0.0250000 Price 110.940 Value per block 110,940 (Allocated from: ID 1579 Quantity 1)
ID 1580f Code FGBS MAR 15 Date 2014-12-09 10:55:37 Quantity 0.0250000 Price 110.945 Value per block 110,945 (Allocated from: ID 1580 Quantity 1)
ID 1581f Code FGBS MAR 15 Date 2014-12-10 02:48:22 Quantity 0.0250000 Price 110.935 Value per block 110,935 (Allocated from: ID 1581 Quantity 1)
ID 1582f Code FGBS MAR 15 Date 2014-12-11 07:35:17 Quantity 0.0250000 Price 110.935 Value per block 110,935 (Allocated from: ID 1582 Quantity 1)
ID 1583f Code FGBS MAR 15 Date 2014-12-12 04:44:08 Quantity 0.0250000 Price 110.950 Value per block 110,950 (Allocated from: ID 1583 Quantity 1)
ID 1584f Code FGBS MAR 15 Date 2014-12-17 02:48:40 Quantity 0.0250000 Price 111.025 Value per block 111,025 (Allocated from: ID 1584 Quantity 1)
ID 1585f Code FGBS MAR 15 Date 2014-12-18 06:01:52 Quantity 0.0250000 Price 111.045 Value per block 111,045 (Allocated from: ID 1585 Quantity 1)
ID 1586f Code FGBS MAR 15 Date 2014-12-22 02:47:05 Quantity 0.0500000 Price 111.075 Value per block 111,075 (Allocated from: ID 1586 Quantity 2)
ID 1587f Code FGBS MAR 15 Date 2014-12-23 02:48:19 Quantity 0.0250000 Price 111.070 Value per block 111,070 (Allocated from: ID 1587 Quantity 1)
ID 1588f Code FGBS MAR 15 Date 2014-12-29 07:39:55 Quantity 0.0250000 Price 111.080 Value per block 111,080 (Allocated from: ID 1588 Quantity 1)
ID 1589f Code FGBS MAR 15 Date 2014-12-30 02:49:07 Quantity 0.0250000 Price 111.095 Value per block 111,095 (Allocated from: ID 1589 Quantity 1)
ID 1590f Code FGBS MAR 15 Date 2015-01-02 03:49:31 Quantity 0.0250000 Price 111.100 Value per block 111,100 (Allocated from: ID 1590 Quantity 1)
ID 1591f Code FGBS MAR 15 Date 2015-01-05 02:48:10 Quantity 0.0250000 Price 111.100 Value per block 111,100 (Allocated from: ID 1591 Quantity 1)
ID 1592f Code FGBS MAR 15 Date 2015-01-06 02:48:39 Quantity 0.0500000 Price 111.095 Value per block 111,095 (Allocated from: ID 1592 Quantity 2)
ID 1593f Code FGBS MAR 15 Date 2015-01-07 02:47:59 Quantity 0.0500000 Price 111.095 Value per block 111,095 (Allocated from: ID 1593 Quantity 2)
ID 1594f Code FGBS MAR 15 Date 2015-01-08 02:50:55 Quantity 0.0250000 Price 111.095 Value per block 111,095 (Allocated from: ID 1594 Quantity 1)
ID 1596f Code FGBS MAR 15 Date 2015-01-12 09:17:46 Quantity 0.0500000 Price 111.100 Value per block 111,100 (Allocated from: ID 1596 Quantity 2)
ID 1597f Code FGBS MAR 15 Date 2015-01-13 02:49:32 Quantity 0.0250000 Price 111.105 Value per block 111,105 (Allocated from: ID 1597 Quantity 1)
ID 1598f Code FGBS MAR 15 Date 2015-01-14 02:48:37 Quantity 0.425000 Price 111.105 Value per block 111,105 (Allocated from: ID 1598 Quantity 17)

CALCULATION: (1*111195) - 2 - 0 -(1*111072) - 2.00000 - 0  = 119 

********************************************************************************************************************************************

9: SELL 1 FGBS MAR 15 Futures on 26/01/2015 at EUR 111,175 each gives PROFIT of EUR 99 equals GBP 78.6675
 Commission EUR 2 and taxes EUR 0 on SELL
Trade details:ID 1609 Code FGBS MAR 15 Date 2015-01-26 07:01:34 Quantity -1 Price 111.175 Value per block 111,175
Total allowable cost EUR 2.00000   Total disposal proceeds EUR 101.250

Matches with:
PRO-RATA SECTION 104: Quantity 1.000000 FGBS MAR 15 allocated from total holding of 40, made up of 20 trades between 2014-12-04 and 2015-01-14
 At average value of EUR 111,072 Commissions EUR 2.00000 Taxes EUR 0  

Trades:
ID 1578g Code FGBS MAR 15 Date 2014-12-04 06:17:54 Quantity 0.0250000 Price 110.935 Value per block 110,935 (Allocated from: ID 1578 Quantity 1)
ID 1579g Code FGBS MAR 15 Date 2014-12-09 02:52:01 Quantity 0.0250000 Price 110.940 Value per block 110,940 (Allocated from: ID 1579 Quantity 1)
ID 1580g Code FGBS MAR 15 Date 2014-12-09 10:55:37 Quantity 0.0250000 Price 110.945 Value per block 110,945 (Allocated from: ID 1580 Quantity 1)
ID 1581g Code FGBS MAR 15 Date 2014-12-10 02:48:22 Quantity 0.0250000 Price 110.935 Value per block 110,935 (Allocated from: ID 1581 Quantity 1)
ID 1582g Code FGBS MAR 15 Date 2014-12-11 07:35:17 Quantity 0.0250000 Price 110.935 Value per block 110,935 (Allocated from: ID 1582 Quantity 1)
ID 1583g Code FGBS MAR 15 Date 2014-12-12 04:44:08 Quantity 0.0250000 Price 110.950 Value per block 110,950 (Allocated from: ID 1583 Quantity 1)
ID 1584g Code FGBS MAR 15 Date 2014-12-17 02:48:40 Quantity 0.0250000 Price 111.025 Value per block 111,025 (Allocated from: ID 1584 Quantity 1)
ID 1585g Code FGBS MAR 15 Date 2014-12-18 06:01:52 Quantity 0.0250000 Price 111.045 Value per block 111,045 (Allocated from: ID 1585 Quantity 1)
ID 1586g Code FGBS MAR 15 Date 2014-12-22 02:47:05 Quantity 0.0500000 Price 111.075 Value per block 111,075 (Allocated from: ID 1586 Quantity 2)
ID 1587g Code FGBS MAR 15 Date 2014-12-23 02:48:19 Quantity 0.0250000 Price 111.070 Value per block 111,070 (Allocated from: ID 1587 Quantity 1)
ID 1588g Code FGBS MAR 15 Date 2014-12-29 07:39:55 Quantity 0.0250000 Price 111.080 Value per block 111,080 (Allocated from: ID 1588 Quantity 1)
ID 1589g Code FGBS MAR 15 Date 2014-12-30 02:49:07 Quantity 0.0250000 Price 111.095 Value per block 111,095 (Allocated from: ID 1589 Quantity 1)
ID 1590g Code FGBS MAR 15 Date 2015-01-02 03:49:31 Quantity 0.0250000 Price 111.100 Value per block 111,100 (Allocated from: ID 1590 Quantity 1)
ID 1591g Code FGBS MAR 15 Date 2015-01-05 02:48:10 Quantity 0.0250000 Price 111.100 Value per block 111,100 (Allocated from: ID 1591 Quantity 1)
ID 1592g Code FGBS MAR 15 Date 2015-01-06 02:48:39 Quantity 0.0500000 Price 111.095 Value per block 111,095 (Allocated from: ID 1592 Quantity 2)
ID 1593g Code FGBS MAR 15 Date 2015-01-07 02:47:59 Quantity 0.0500000 Price 111.095 Value per block 111,095 (Allocated from: ID 1593 Quantity 2)
ID 1594g Code FGBS MAR 15 Date 2015-01-08 02:50:55 Quantity 0.0250000 Price 111.095 Value per block 111,095 (Allocated from: ID 1594 Quantity 1)
ID 1596g Code FGBS MAR 15 Date 2015-01-12 09:17:46 Quantity 0.0500000 Price 111.100 Value per block 111,100 (Allocated from: ID 1596 Quantity 2)
ID 1597g Code FGBS MAR 15 Date 2015-01-13 02:49:32 Quantity 0.0250000 Price 111.105 Value per block 111,105 (Allocated from: ID 1597 Quantity 1)
ID 1598g Code FGBS MAR 15 Date 2015-01-14 02:48:37 Quantity 0.425000 Price 111.105 Value per block 111,105 (Allocated from: ID 1598 Quantity 17)

CALCULATION: (1*111175) - 2 - 0 -(1*111072) - 2.00000 - 0  = 99 

********************************************************************************************************************************************

10: SELL 1 FGBS MAR 15 Futures on 26/01/2015 at EUR 111,165 each gives PROFIT of EUR 89 equals GBP 70.5674
 Commission EUR 2 and taxes EUR 0 on SELL
Trade details:ID 1610 Code FGBS MAR 15 Date 2015-01-26 08:16:01 Quantity -1 Price 111.165 Value per block 111,165
Total allowable cost EUR 2.00000   Total disposal proceeds EUR 91.2500

Matches with:
PRO-RATA SECTION 104: Quantity 1.000000 FGBS MAR 15 allocated from total holding of 40, made up of 20 trades between 2014-12-04 and 2015-01-14
 At average value of EUR 111,072 Commissions EUR 2.00000 Taxes EUR 0  

Trades:
ID 1578h Code FGBS MAR 15 Date 2014-12-04 06:17:54 Quantity 0.0250000 Price 110.935 Value per block 110,935 (Allocated from: ID 1578 Quantity 1)
ID 1579h Code FGBS MAR 15 Date 2014-12-09 02:52:01 Quantity 0.0250000 Price 110.940 Value per block 110,940 (Allocated from: ID 1579 Quantity 1)
ID 1580h Code FGBS MAR 15 Date 2014-12-09 10:55:37 Quantity 0.0250000 Price 110.945 Value per block 110,945 (Allocated from: ID 1580 Quantity 1)
ID 1581h Code FGBS MAR 15 Date 2014-12-10 02:48:22 Quantity 0.0250000 Price 110.935 Value per block 110,935 (Allocated from: ID 1581 Quantity 1)
ID 1582h Code FGBS MAR 15 Date 2014-12-11 07:35:17 Quantity 0.0250000 Price 110.935 Value per block 110,935 (Allocated from: ID 1582 Quantity 1)
ID 1583h Code FGBS MAR 15 Date 2014-12-12 04:44:08 Quantity 0.0250000 Price 110.950 Value per block 110,950 (Allocated from: ID 1583 Quantity 1)
ID 1584h Code FGBS MAR 15 Date 2014-12-17 02:48:40 Quantity 0.0250000 Price 111.025 Value per block 111,025 (Allocated from: ID 1584 Quantity 1)
ID 1585h Code FGBS MAR 15 Date 2014-12-18 06:01:52 Quantity 0.0250000 Price 111.045 Value per block 111,045 (Allocated from: ID 1585 Quantity 1)
ID 1586h Code FGBS MAR 15 Date 2014-12-22 02:47:05 Quantity 0.0500000 Price 111.075 Value per block 111,075 (Allocated from: ID 1586 Quantity 2)
ID 1587h Code FGBS MAR 15 Date 2014-12-23 02:48:19 Quantity 0.0250000 Price 111.070 Value per block 111,070 (Allocated from: ID 1587 Quantity 1)
ID 1588h Code FGBS MAR 15 Date 2014-12-29 07:39:55 Quantity 0.0250000 Price 111.080 Value per block 111,080 (Allocated from: ID 1588 Quantity 1)
ID 1589h Code FGBS MAR 15 Date 2014-12-30 02:49:07 Quantity 0.0250000 Price 111.095 Value per block 111,095 (Allocated from: ID 1589 Quantity 1)
ID 1590h Code FGBS MAR 15 Date 2015-01-02 03:49:31 Quantity 0.0250000 Price 111.100 Value per block 111,100 (Allocated from: ID 1590 Quantity 1)
ID 1591h Code FGBS MAR 15 Date 2015-01-05 02:48:10 Quantity 0.0250000 Price 111.100 Value per block 111,100 (Allocated from: ID 1591 Quantity 1)
ID 1592h Code FGBS MAR 15 Date 2015-01-06 02:48:39 Quantity 0.0500000 Price 111.095 Value per block 111,095 (Allocated from: ID 1592 Quantity 2)
ID 1593h Code FGBS MAR 15 Date 2015-01-07 02:47:59 Quantity 0.0500000 Price 111.095 Value per block 111,095 (Allocated from: ID 1593 Quantity 2)
ID 1594h Code FGBS MAR 15 Date 2015-01-08 02:50:55 Quantity 0.0250000 Price 111.095 Value per block 111,095 (Allocated from: ID 1594 Quantity 1)
ID 1596h Code FGBS MAR 15 Date 2015-01-12 09:17:46 Quantity 0.0500000 Price 111.100 Value per block 111,100 (Allocated from: ID 1596 Quantity 2)
ID 1597h Code FGBS MAR 15 Date 2015-01-13 02:49:32 Quantity 0.0250000 Price 111.105 Value per block 111,105 (Allocated from: ID 1597 Quantity 1)
ID 1598h Code FGBS MAR 15 Date 2015-01-14 02:48:37 Quantity 0.425000 Price 111.105 Value per block 111,105 (Allocated from: ID 1598 Quantity 17)

CALCULATION: (1*111165) - 2 - 0 -(1*111072) - 2.00000 - 0  = 89 

********************************************************************************************************************************************

11: SELL 1 FGBS MAR 15 Futures on 27/01/2015 at EUR 111,170 each gives PROFIT of EUR 94 equals GBP 74.5215
 Commission EUR 2 and taxes EUR 0 on SELL
Trade details:ID 1611 Code FGBS MAR 15 Date 2015-01-27 09:24:47 Quantity -1 Price 111.170 Value per block 111,170
Total allowable cost EUR 2.00000   Total disposal proceeds EUR 96.2500

Matches with:
PRO-RATA SECTION 104: Quantity 1.000000 FGBS MAR 15 allocated from total holding of 40, made up of 20 trades between 2014-12-04 and 2015-01-14
 At average value of EUR 111,072 Commissions EUR 2.00000 Taxes EUR 0  

Trades:
ID 1578i Code FGBS MAR 15 Date 2014-12-04 06:17:54 Quantity 0.0250000 Price 110.935 Value per block 110,935 (Allocated from: ID 1578 Quantity 1)
ID 1579i Code FGBS MAR 15 Date 2014-12-09 02:52:01 Quantity 0.0250000 Price 110.940 Value per block 110,940 (Allocated from: ID 1579 Quantity 1)
ID 1580i Code FGBS MAR 15 Date 2014-12-09 10:55:37 Quantity 0.0250000 Price 110.945 Value per block 110,945 (Allocated from: ID 1580 Quantity 1)
ID 1581i Code FGBS MAR 15 Date 2014-12-10 02:48:22 Quantity 0.0250000 Price 110.935 Value per block 110,935 (Allocated from: ID 1581 Quantity 1)
ID 1582i Code FGBS MAR 15 Date 2014-12-11 07:35:17 Quantity 0.0250000 Price 110.935 Value per block 110,935 (Allocated from: ID 1582 Quantity 1)
ID 1583i Code FGBS MAR 15 Date 2014-12-12 04:44:08 Quantity 0.0250000 Price 110.950 Value per block 110,950 (Allocated from: ID 1583 Quantity 1)
ID 1584i Code FGBS MAR 15 Date 2014-12-17 02:48:40 Quantity 0.0250000 Price 111.025 Value per block 111,025 (Allocated from: ID 1584 Quantity 1)
ID 1585i Code FGBS MAR 15 Date 2014-12-18 06:01:52 Quantity 0.0250000 Price 111.045 Value per block 111,045 (Allocated from: ID 1585 Quantity 1)
ID 1586i Code FGBS MAR 15 Date 2014-12-22 02:47:05 Quantity 0.0500000 Price 111.075 Value per block 111,075 (Allocated from: ID 1586 Quantity 2)
ID 1587i Code FGBS MAR 15 Date 2014-12-23 02:48:19 Quantity 0.0250000 Price 111.070 Value per block 111,070 (Allocated from: ID 1587 Quantity 1)
ID 1588i Code FGBS MAR 15 Date 2014-12-29 07:39:55 Quantity 0.0250000 Price 111.080 Value per block 111,080 (Allocated from: ID 1588 Quantity 1)
ID 1589i Code FGBS MAR 15 Date 2014-12-30 02:49:07 Quantity 0.0250000 Price 111.095 Value per block 111,095 (Allocated from: ID 1589 Quantity 1)
ID 1590i Code FGBS MAR 15 Date 2015-01-02 03:49:31 Quantity 0.0250000 Price 111.100 Value per block 111,100 (Allocated from: ID 1590 Quantity 1)
ID 1591i Code FGBS MAR 15 Date 2015-01-05 02:48:10 Quantity 0.0250000 Price 111.100 Value per block 111,100 (Allocated from: ID 1591 Quantity 1)
ID 1592i Code FGBS MAR 15 Date 2015-01-06 02:48:39 Quantity 0.0500000 Price 111.095 Value per block 111,095 (Allocated from: ID 1592 Quantity 2)
ID 1593i Code FGBS MAR 15 Date 2015-01-07 02:47:59 Quantity 0.0500000 Price 111.095 Value per block 111,095 (Allocated from: ID 1593 Quantity 2)
ID 1594i Code FGBS MAR 15 Date 2015-01-08 02:50:55 Quantity 0.0250000 Price 111.095 Value per block 111,095 (Allocated from: ID 1594 Quantity 1)
ID 1596i Code FGBS MAR 15 Date 2015-01-12 09:17:46 Quantity 0.0500000 Price 111.100 Value per block 111,100 (Allocated from: ID 1596 Quantity 2)
ID 1597i Code FGBS MAR 15 Date 2015-01-13 02:49:32 Quantity 0.0250000 Price 111.105 Value per block 111,105 (Allocated from: ID 1597 Quantity 1)
ID 1598i Code FGBS MAR 15 Date 2015-01-14 02:48:37 Quantity 0.425000 Price 111.105 Value per block 111,105 (Allocated from: ID 1598 Quantity 17)

CALCULATION: (1*111170) - 2 - 0 -(1*111072) - 2.00000 - 0  = 94 

********************************************************************************************************************************************

12: SELL 3 FGBS MAR 15 Futures on 29/01/2015 at EUR 111,220 each gives PROFIT of EUR 433 equals GBP 342.188
 Commission EUR 6 and taxes EUR 0 on SELL
Trade details:ID 1612 Code FGBS MAR 15 Date 2015-01-29 02:46:22 Quantity -3 Price 111.220 Value per block 111,220
Total allowable cost EUR 6.00000   Total disposal proceeds EUR 438.750

Matches with:
PRO-RATA SECTION 104: Quantity 3.000000 FGBS MAR 15 allocated from total holding of 40, made up of 20 trades between 2014-12-04 and 2015-01-14
 At average value of EUR 111,072 Commissions EUR 6.00000 Taxes EUR 0  

Trades:
ID 1578j Code FGBS MAR 15 Date 2014-12-04 06:17:54 Quantity 0.0750000 Price 110.935 Value per block 110,935 (Allocated from: ID 1578 Quantity 1)
ID 1579j Code FGBS MAR 15 Date 2014-12-09 02:52:01 Quantity 0.0750000 Price 110.940 Value per block 110,940 (Allocated from: ID 1579 Quantity 1)
ID 1580j Code FGBS MAR 15 Date 2014-12-09 10:55:37 Quantity 0.0750000 Price 110.945 Value per block 110,945 (Allocated from: ID 1580 Quantity 1)
ID 1581j Code FGBS MAR 15 Date 2014-12-10 02:48:22 Quantity 0.0750000 Price 110.935 Value per block 110,935 (Allocated from: ID 1581 Quantity 1)
ID 1582j Code FGBS MAR 15 Date 2014-12-11 07:35:17 Quantity 0.0750000 Price 110.935 Value per block 110,935 (Allocated from: ID 1582 Quantity 1)
ID 1583j Code FGBS MAR 15 Date 2014-12-12 04:44:08 Quantity 0.0750000 Price 110.950 Value per block 110,950 (Allocated from: ID 1583 Quantity 1)
ID 1584j Code FGBS MAR 15 Date 2014-12-17 02:48:40 Quantity 0.0750000 Price 111.025 Value per block 111,025 (Allocated from: ID 1584 Quantity 1)
ID 1585j Code FGBS MAR 15 Date 2014-12-18 06:01:52 Quantity 0.0750000 Price 111.045 Value per block 111,045 (Allocated from: ID 1585 Quantity 1)
ID 1586j Code FGBS MAR 15 Date 2014-12-22 02:47:05 Quantity 0.150000 Price 111.075 Value per block 111,075 (Allocated from: ID 1586 Quantity 2)
ID 1587j Code FGBS MAR 15 Date 2014-12-23 02:48:19 Quantity 0.0750000 Price 111.070 Value per block 111,070 (Allocated from: ID 1587 Quantity 1)
ID 1588j Code FGBS MAR 15 Date 2014-12-29 07:39:55 Quantity 0.0750000 Price 111.080 Value per block 111,080 (Allocated from: ID 1588 Quantity 1)
ID 1589j Code FGBS MAR 15 Date 2014-12-30 02:49:07 Quantity 0.0750000 Price 111.095 Value per block 111,095 (Allocated from: ID 1589 Quantity 1)
ID 1590j Code FGBS MAR 15 Date 2015-01-02 03:49:31 Quantity 0.0750000 Price 111.100 Value per block 111,100 (Allocated from: ID 1590 Quantity 1)
ID 1591j Code FGBS MAR 15 Date 2015-01-05 02:48:10 Quantity 0.0750000 Price 111.100 Value per block 111,100 (Allocated from: ID 1591 Quantity 1)
ID 1592j Code FGBS MAR 15 Date 2015-01-06 02:48:39 Quantity 0.150000 Price 111.095 Value per block 111,095 (Allocated from: ID 1592 Quantity 2)
ID 1593j Code FGBS MAR 15 Date 2015-01-07 02:47:59 Quantity 0.150000 Price 111.095 Value per block 111,095 (Allocated from: ID 1593 Quantity 2)
ID 1594j Code FGBS MAR 15 Date 2015-01-08 02:50:55 Quantity 0.0750000 Price 111.095 Value per block 111,095 (Allocated from: ID 1594 Quantity 1)
ID 1596j Code FGBS MAR 15 Date 2015-01-12 09:17:46 Quantity 0.150000 Price 111.100 Value per block 111,100 (Allocated from: ID 1596 Quantity 2)
ID 1597j Code FGBS MAR 15 Date 2015-01-13 02:49:32 Quantity 0.0750000 Price 111.105 Value per block 111,105 (Allocated from: ID 1597 Quantity 1)
ID 1598j Code FGBS MAR 15 Date 2015-01-14 02:48:37 Quantity 1.27500 Price 111.105 Value per block 111,105 (Allocated from: ID 1598 Quantity 17)

CALCULATION: (3*111220) - 6 - 0 -(3*111072) - 6.00000 - 0  = 433 

********************************************************************************************************************************************

13: SELL 1 FGBS MAR 15 Futures on 03/02/2015 at EUR 111,260 each gives PROFIT of EUR 184 equals GBP 145.696
 Commission EUR 2 and taxes EUR 0 on SELL
Trade details:ID 1613 Code FGBS MAR 15 Date 2015-02-03 11:02:43 Quantity -1 Price 111.260 Value per block 111,260
Total allowable cost EUR 2.00000   Total disposal proceeds EUR 186.250

Matches with:
PRO-RATA SECTION 104: Quantity 1.000000 FGBS MAR 15 allocated from total holding of 40, made up of 20 trades between 2014-12-04 and 2015-01-14
 At average value of EUR 111,072 Commissions EUR 2.00000 Taxes EUR 0  

Trades:
ID 1578k Code FGBS MAR 15 Date 2014-12-04 06:17:54 Quantity 0.0250000 Price 110.935 Value per block 110,935 (Allocated from: ID 1578 Quantity 1)
ID 1579k Code FGBS MAR 15 Date 2014-12-09 02:52:01 Quantity 0.0250000 Price 110.940 Value per block 110,940 (Allocated from: ID 1579 Quantity 1)
ID 1580k Code FGBS MAR 15 Date 2014-12-09 10:55:37 Quantity 0.0250000 Price 110.945 Value per block 110,945 (Allocated from: ID 1580 Quantity 1)
ID 1581k Code FGBS MAR 15 Date 2014-12-10 02:48:22 Quantity 0.0250000 Price 110.935 Value per block 110,935 (Allocated from: ID 1581 Quantity 1)
ID 1582k Code FGBS MAR 15 Date 2014-12-11 07:35:17 Quantity 0.0250000 Price 110.935 Value per block 110,935 (Allocated from: ID 1582 Quantity 1)
ID 1583k Code FGBS MAR 15 Date 2014-12-12 04:44:08 Quantity 0.0250000 Price 110.950 Value per block 110,950 (Allocated from: ID 1583 Quantity 1)
ID 1584k Code FGBS MAR 15 Date 2014-12-17 02:48:40 Quantity 0.0250000 Price 111.025 Value per block 111,025 (Allocated from: ID 1584 Quantity 1)
ID 1585k Code FGBS MAR 15 Date 2014-12-18 06:01:52 Quantity 0.0250000 Price 111.045 Value per block 111,045 (Allocated from: ID 1585 Quantity 1)
ID 1586k Code FGBS MAR 15 Date 2014-12-22 02:47:05 Quantity 0.0500000 Price 111.075 Value per block 111,075 (Allocated from: ID 1586 Quantity 2)
ID 1587k Code FGBS MAR 15 Date 2014-12-23 02:48:19 Quantity 0.0250000 Price 111.070 Value per block 111,070 (Allocated from: ID 1587 Quantity 1)
ID 1588k Code FGBS MAR 15 Date 2014-12-29 07:39:55 Quantity 0.0250000 Price 111.080 Value per block 111,080 (Allocated from: ID 1588 Quantity 1)
ID 1589k Code FGBS MAR 15 Date 2014-12-30 02:49:07 Quantity 0.0250000 Price 111.095 Value per block 111,095 (Allocated from: ID 1589 Quantity 1)
ID 1590k Code FGBS MAR 15 Date 2015-01-02 03:49:31 Quantity 0.0250000 Price 111.100 Value per block 111,100 (Allocated from: ID 1590 Quantity 1)
ID 1591k Code FGBS MAR 15 Date 2015-01-05 02:48:10 Quantity 0.0250000 Price 111.100 Value per block 111,100 (Allocated from: ID 1591 Quantity 1)
ID 1592k Code FGBS MAR 15 Date 2015-01-06 02:48:39 Quantity 0.0500000 Price 111.095 Value per block 111,095 (Allocated from: ID 1592 Quantity 2)
ID 1593k Code FGBS MAR 15 Date 2015-01-07 02:47:59 Quantity 0.0500000 Price 111.095 Value per block 111,095 (Allocated from: ID 1593 Quantity 2)
ID 1594k Code FGBS MAR 15 Date 2015-01-08 02:50:55 Quantity 0.0250000 Price 111.095 Value per block 111,095 (Allocated from: ID 1594 Quantity 1)
ID 1596k Code FGBS MAR 15 Date 2015-01-12 09:17:46 Quantity 0.0500000 Price 111.100 Value per block 111,100 (Allocated from: ID 1596 Quantity 2)
ID 1597k Code FGBS MAR 15 Date 2015-01-13 02:49:32 Quantity 0.0250000 Price 111.105 Value per block 111,105 (Allocated from: ID 1597 Quantity 1)
ID 1598k Code FGBS MAR 15 Date 2015-01-14 02:48:37 Quantity 0.425000 Price 111.105 Value per block 111,105 (Allocated from: ID 1598 Quantity 17)

CALCULATION: (1*111260) - 2 - 0 -(1*111072) - 2.00000 - 0  = 184 

********************************************************************************************************************************************

1: SELL 1 FGBS SEP 14 Futures on 11/06/2014 at EUR 110,595 each gives LOSS of EUR -49 equals GBP -39.1043
 Commission EUR 2 and taxes EUR 0 on SELL
Trade details:ID 1638 Code FGBS SEP 14 Date 2014-06-11 03:13:02 Quantity -1 Price 110.595 Value per block 110,595
Total allowable cost EUR 2   Total disposal proceeds EUR -47

Matches with:
SUBSEQUENT 1 TRADE(S) Within 30 days between 2014-06-17 and 2014-06-17: Matches with BUY of 1 FGBS SEP 14 at of EUR 110,640 each 
 Commissions EUR 2 Taxes EUR 0  

Trades:
ID 1617 Code FGBS SEP 14 Date 2014-06-17 09:07:11 Quantity 1 Price 110.640 Value per block 110,640

CALCULATION: (1*110595) - 2 - 0 -(1*110640) - 2 - 0  = -49 

********************************************************************************************************************************************

2: SELL 2 FGBS SEP 14 Futures on 13/06/2014 at EUR 110,650 each gives LOSS of EUR -8 equals GBP -6.36225
 Commission EUR 4 and taxes EUR 0 on SELL
Trade details:ID 1639 Code FGBS SEP 14 Date 2014-06-13 04:47:34 Quantity -2 Price 110.650 Value per block 110,650
Total allowable cost EUR 4   Total disposal proceeds EUR -4

Matches with:
SUBSEQUENT 2 TRADE(S) Within 30 days between 2014-06-19 and 2014-06-23: Matches with BUY of 2 FGBS SEP 14 at of EUR 110,650 each 
 Commissions EUR 4 Taxes EUR 0  

Trades:
ID 1618 Code FGBS SEP 14 Date 2014-06-19 11:13:28 Quantity 1 Price 110.655 Value per block 110,655
ID 1619 Code FGBS SEP 14 Date 2014-06-23 05:49:16 Quantity 1 Price 110.645 Value per block 110,645

CALCULATION: (2*110650) - 4 - 0 -(2*110650) - 4 - 0  = -8 

********************************************************************************************************************************************

3: SELL 1 FGBS SEP 14 Futures on 13/06/2014 at EUR 110,655 each gives PROFIT of EUR 11 equals GBP 8.79419
 Commission EUR 2 and taxes EUR 0 on SELL
Trade details:ID 1640 Code FGBS SEP 14 Date 2014-06-13 06:24:59 Quantity -1 Price 110.655 Value per block 110,655
Total allowable cost EUR 2   Total disposal proceeds EUR 13

Matches with:
SUBSEQUENT 1 TRADE(S) Within 30 days between 2014-06-24 and 2014-06-24: Matches with BUY of 1 FGBS SEP 14 at of EUR 110,640 each 
 Commissions EUR 2 Taxes EUR 0  

Trades:
ID 1620 Code FGBS SEP 14 Date 2014-06-24 06:22:55 Quantity 1 Price 110.640 Value per block 110,640

CALCULATION: (1*110655) - 2 - 0 -(1*110640) - 2 - 0  = 11 

********************************************************************************************************************************************

4: SELL 1 FGBS SEP 14 Futures on 18/06/2014 at EUR 110,620 each gives LOSS of EUR -24 equals GBP -19.1128
 Commission EUR 2 and taxes EUR 0 on SELL
Trade details:ID 1641 Code FGBS SEP 14 Date 2014-06-18 03:45:13 Quantity -1 Price 110.620 Value per block 110,620
Total allowable cost EUR 2   Total disposal proceeds EUR -22

Matches with:
SUBSEQUENT 1 TRADE(S) Within 30 days between 2014-06-24 and 2014-06-24: Matches with BUY of 1 FGBS SEP 14 at of EUR 110,640 each 
 Commissions EUR 2 Taxes EUR 0  

Trades:
ID 1621 Code FGBS SEP 14 Date 2014-06-24 06:29:57 Quantity 1 Price 110.640 Value per block 110,640

CALCULATION: (1*110620) - 2 - 0 -(1*110640) - 2 - 0  = -24 

********************************************************************************************************************************************

5: SELL 1 FGBS SEP 14 Futures on 20/06/2014 at EUR 110,635 each gives LOSS of EUR -29 equals GBP -23.1043
 Commission EUR 2 and taxes EUR 0 on SELL
Trade details:ID 1642 Code FGBS SEP 14 Date 2014-06-20 10:22:05 Quantity -1 Price 110.635 Value per block 110,635
Total allowable cost EUR 2   Total disposal proceeds EUR -27

Matches with:
SUBSEQUENT 1 TRADE(S) Within 30 days between 2014-06-26 and 2014-06-26: Matches with BUY of 1 FGBS SEP 14 at of EUR 110,660 each 
 Commissions EUR 2 Taxes EUR 0  

Trades:
ID 1622 Code FGBS SEP 14 Date 2014-06-26 05:42:51 Quantity 1 Price 110.660 Value per block 110,660

CALCULATION: (1*110635) - 2 - 0 -(1*110660) - 2 - 0  = -29 

********************************************************************************************************************************************

6: SELL 2 FGBS SEP 14 Futures on 02/07/2014 at EUR 110,665 each gives LOSS of EUR -48 equals GBP -38.2441
 Commission EUR 4 and taxes EUR 0 on SELL
Trade details:ID 1643 Code FGBS SEP 14 Date 2014-07-02 10:32:02 Quantity -2 Price 110.665 Value per block 110,665
Total allowable cost EUR 4   Total disposal proceeds EUR -44

Matches with:
SAME DAY TRADE(S) Matches with BUY of 2 FGBS SEP 14 at average of EUR 110,685 each 
 Commissions EUR 4 Taxes EUR 0 

Trades:
ID 1626a Code FGBS SEP 14 Date 2014-07-02 06:32:42 Quantity 2 Price 110.685 Value per block 110,685 (Allocated from: ID 1626 Quantity 4)

CALCULATION: (2*110665) - 4 - 0 -(2*110685) - 4 - 0  = -48 

********************************************************************************************************************************************

7: SELL 3 FGBS SEP 14 Futures on 03/07/2014 at EUR 110,660 each gives LOSS of EUR -82 equals GBP -65.3288
 Commission EUR 6 and taxes EUR 0 on SELL
Trade details:ID 1644 Code FGBS SEP 14 Date 2014-07-03 02:52:51 Quantity -3 Price 110.660 Value per block 110,660
Total allowable cost EUR 6   Total disposal proceeds EUR -76

Matches with:
SUBSEQUENT 2 TRADE(S) Within 30 days between 2014-07-07 and 2014-07-09: Matches with BUY of 3 FGBS SEP 14 at of EUR 110,683 each 
 Commissions EUR 6 Taxes EUR 0  

Trades:
ID 1627 Code FGBS SEP 14 Date 2014-07-07 05:20:59 Quantity 2 Price 110.680 Value per block 110,680
ID 1628a Code FGBS SEP 14 Date 2014-07-09 02:52:15 Quantity 1 Price 110.690 Value per block 110,690 (Allocated from: ID 1628 Quantity 4)

CALCULATION: (3*110660) - 6 - 0 -(3*110683) - 6 - 0  = -82 

********************************************************************************************************************************************

8: SELL 1 FGBS SEP 14 Futures on 03/07/2014 at EUR 110,665 each gives LOSS of EUR -29 equals GBP -23.1044
 Commission EUR 2 and taxes EUR 0 on SELL
Trade details:ID 1645 Code FGBS SEP 14 Date 2014-07-03 06:46:50 Quantity -1 Price 110.665 Value per block 110,665
Total allowable cost EUR 2   Total disposal proceeds EUR -27

Matches with:
SUBSEQUENT 1 TRADE(S) Within 30 days between 2014-07-09 and 2014-07-09: Matches with BUY of 1 FGBS SEP 14 at of EUR 110,690 each 
 Commissions EUR 2 Taxes EUR 0  

Trades:
ID 1628b Code FGBS SEP 14 Date 2014-07-09 02:52:15 Quantity 1 Price 110.690 Value per block 110,690 (Allocated from: ID 1628 Quantity 4)

CALCULATION: (1*110665) - 2 - 0 -(1*110690) - 2 - 0  = -29 

********************************************************************************************************************************************

9: SELL 2 FGBS SEP 14 Futures on 14/07/2014 at EUR 110,670 each gives PROFIT of EUR 7 equals GBP 5.57410
 Commission EUR 4 and taxes EUR 0 on SELL
Trade details:ID 1646 Code FGBS SEP 14 Date 2014-07-14 03:20:28 Quantity -2 Price 110.670 Value per block 110,670
Total allowable cost EUR 4   Total disposal proceeds EUR 11

Matches with:
SUBSEQUENT 2 TRADE(S) Within 30 days between 2014-07-29 and 2014-07-29: Matches with BUY of 2 FGBS SEP 14 at of EUR 110,662 each 
 Commissions EUR 4 Taxes EUR 0  

Trades:
ID 1630 Code FGBS SEP 14 Date 2014-07-29 06:17:31 Quantity 1 Price 110.660 Value per block 110,660
ID 1631 Code FGBS SEP 14 Date 2014-07-29 09:21:17 Quantity 1 Price 110.665 Value per block 110,665

CALCULATION: (2*110670) - 4 - 0 -(2*110662) - 4 - 0  = 7 

********************************************************************************************************************************************

10: SELL 1 FGBS SEP 14 Futures on 14/07/2014 at EUR 110,675 each gives PROFIT of EUR 6 equals GBP 4.77921
 Commission EUR 2 and taxes EUR 0 on SELL
Trade details:ID 1647 Code FGBS SEP 14 Date 2014-07-14 06:18:44 Quantity -1 Price 110.675 Value per block 110,675
Total allowable cost EUR 2   Total disposal proceeds EUR 8

Matches with:
SUBSEQUENT 1 TRADE(S) Within 30 days between 2014-07-30 and 2014-07-30: Matches with BUY of 1 FGBS SEP 14 at of EUR 110,665 each 
 Commissions EUR 2 Taxes EUR 0  

Trades:
ID 1632 Code FGBS SEP 14 Date 2014-07-30 06:13:20 Quantity 1 Price 110.665 Value per block 110,665

CALCULATION: (1*110675) - 2 - 0 -(1*110665) - 2 - 0  = 6 

********************************************************************************************************************************************

11: SELL 1 FGBS SEP 14 Futures on 18/07/2014 at EUR 110,675 each gives LOSS of EUR -69 equals GBP -54.9857
 Commission EUR 2 and taxes EUR 0 on SELL
Trade details:ID 1648 Code FGBS SEP 14 Date 2014-07-18 06:10:15 Quantity -1 Price 110.675 Value per block 110,675
Total allowable cost EUR 2   Total disposal proceeds EUR -67

Matches with:
SUBSEQUENT 1 TRADE(S) Within 30 days between 2014-08-14 and 2014-08-14: Matches with BUY of 1 FGBS SEP 14 at of EUR 110,740 each 
 Commissions EUR 2 Taxes EUR 0  

Trades:
ID 1633 Code FGBS SEP 14 Date 2014-08-14 02:51:53 Quantity 1 Price 110.740 Value per block 110,740

CALCULATION: (1*110675) - 2 - 0 -(1*110740) - 2 - 0  = -69 

********************************************************************************************************************************************

12: SELL 1 FGBS SEP 14 Futures on 25/07/2014 at EUR 110,650 each gives LOSS of EUR -79 equals GBP -62.9603
 Commission EUR 2 and taxes EUR 0 on SELL
Trade details:ID 1649 Code FGBS SEP 14 Date 2014-07-25 02:39:29 Quantity -1 Price 110.650 Value per block 110,650
Total allowable cost EUR 2   Total disposal proceeds EUR -77

Matches with:
SUBSEQUENT 1 TRADE(S) Within 30 days between 2014-08-15 and 2014-08-15: Matches with BUY of 1 FGBS SEP 14 at of EUR 110,725 each 
 Commissions EUR 2 Taxes EUR 0  

Trades:
ID 1634 Code FGBS SEP 14 Date 2014-08-15 08:28:01 Quantity 1 Price 110.725 Value per block 110,725

CALCULATION: (1*110650) - 2 - 0 -(1*110725) - 2 - 0  = -79 

********************************************************************************************************************************************

13: SELL 1 FGBS SEP 14 Futures on 25/07/2014 at EUR 110,650 each gives LOSS of EUR -84 equals GBP -66.9446
 Commission EUR 2 and taxes EUR 0 on SELL
Trade details:ID 1650 Code FGBS SEP 14 Date 2014-07-25 02:54:51 Quantity -1 Price 110.650 Value per block 110,650
Total allowable cost EUR 2   Total disposal proceeds EUR -82

Matches with:
SUBSEQUENT 1 TRADE(S) Within 30 days between 2014-08-18 and 2014-08-18: Matches with BUY of 1 FGBS SEP 14 at of EUR 110,730 each 
 Commissions EUR 2 Taxes EUR 0  

Trades:
ID 1635 Code FGBS SEP 14 Date 2014-08-18 06:21:01 Quantity 1 Price 110.730 Value per block 110,730

CALCULATION: (1*110650) - 2 - 0 -(1*110730) - 2 - 0  = -84 

********************************************************************************************************************************************

14: SELL 3 FGBS SEP 14 Futures on 31/07/2014 at EUR 110,650 each gives LOSS of EUR -293 equals GBP -233.690
 Commission EUR 6 and taxes EUR 0 on SELL
Trade details:ID 1651 Code FGBS SEP 14 Date 2014-07-31 02:55:31 Quantity -3 Price 110.650 Value per block 110,650
Total allowable cost EUR 6.00000   Total disposal proceeds EUR -287.250

Matches with:
SUBSEQUENT 2 TRADE(S) Within 30 days between 2014-08-26 and 2014-08-29: Matches with BUY of 2 FGBS SEP 14 at of EUR 110,798 each 
 Commissions EUR 4 Taxes EUR 0  

Trades:
ID 1636 Code FGBS SEP 14 Date 2014-08-26 03:59:56 Quantity 1 Price 110.810 Value per block 110,810
ID 1637 Code FGBS SEP 14 Date 2014-08-29 02:53:16 Quantity 1 Price 110.785 Value per block 110,785
PRO-RATA SECTION 104: Quantity 1.000000 FGBS SEP 14 allocated from total holding of 28, made up of 9 trades between 2014-06-02 and 2014-07-10
 At average value of EUR 110,636 Commissions EUR 2.00000 Taxes EUR 0  

Trades:
ID 1614a Code FGBS SEP 14 Date 2014-06-02 03:32:40 Quantity 0.166667 Price 110.630 Value per block 110,630 (Allocated from: ID 1614 Quantity 4)
ID 1615a Code FGBS SEP 14 Date 2014-06-03 09:12:34 Quantity 0.416667 Price 110.600 Value per block 110,600 (Allocated from: ID 1615 Quantity 10)
ID 1616a Code FGBS SEP 14 Date 2014-06-06 08:18:22 Quantity 0.0416667 Price 110.640 Value per block 110,640 (Allocated from: ID 1616 Quantity 1)
ID 1623a Code FGBS SEP 14 Date 2014-06-30 02:51:30 Quantity 0.0416667 Price 110.640 Value per block 110,640 (Allocated from: ID 1623 Quantity 1)
ID 1624a Code FGBS SEP 14 Date 2014-06-30 11:02:26 Quantity 0.0416667 Price 110.665 Value per block 110,665 (Allocated from: ID 1624 Quantity 1)
ID 1625a Code FGBS SEP 14 Date 2014-07-02 06:03:16 Quantity 0.0416667 Price 110.685 Value per block 110,685 (Allocated from: ID 1625 Quantity 1)
ID 1626b Code FGBS SEP 14 Date 2014-07-02 06:32:42 Quantity 0.0833333 Price 110.685 Value per block 110,685 (Allocated from: ID 1626 Quantity 4)
ID 1628c Code FGBS SEP 14 Date 2014-07-09 02:52:15 Quantity 0.0833333 Price 110.690 Value per block 110,690 (Allocated from: ID 1628 Quantity 4)
ID 1629a Code FGBS SEP 14 Date 2014-07-10 02:53:45 Quantity 0.0833333 Price 110.685 Value per block 110,685 (Allocated from: ID 1629 Quantity 2)

CALCULATION: (3*110650) - 6 - 0 -(2*110798) - 4 - 0 -(1*110636) - 2.00000 - 0  = -293 

********************************************************************************************************************************************

15: SELL 1 FGBS SEP 14 Futures on 07/08/2014 at EUR 110,700 each gives PROFIT of EUR 60 equals GBP 47.6207
 Commission EUR 2 and taxes EUR 0 on SELL
Trade details:ID 1652 Code FGBS SEP 14 Date 2014-08-07 10:23:01 Quantity -1 Price 110.700 Value per block 110,700
Total allowable cost EUR 2.00000   Total disposal proceeds EUR 61.7500

Matches with:
PRO-RATA SECTION 104: Quantity 1.000000 FGBS SEP 14 allocated from total holding of 28, made up of 9 trades between 2014-06-02 and 2014-07-10
 At average value of EUR 110,636 Commissions EUR 2.00000 Taxes EUR 0  

Trades:
ID 1614b Code FGBS SEP 14 Date 2014-06-02 03:32:40 Quantity 0.166667 Price 110.630 Value per block 110,630 (Allocated from: ID 1614 Quantity 4)
ID 1615b Code FGBS SEP 14 Date 2014-06-03 09:12:34 Quantity 0.416667 Price 110.600 Value per block 110,600 (Allocated from: ID 1615 Quantity 10)
ID 1616b Code FGBS SEP 14 Date 2014-06-06 08:18:22 Quantity 0.0416667 Price 110.640 Value per block 110,640 (Allocated from: ID 1616 Quantity 1)
ID 1623b Code FGBS SEP 14 Date 2014-06-30 02:51:30 Quantity 0.0416667 Price 110.640 Value per block 110,640 (Allocated from: ID 1623 Quantity 1)
ID 1624b Code FGBS SEP 14 Date 2014-06-30 11:02:26 Quantity 0.0416667 Price 110.665 Value per block 110,665 (Allocated from: ID 1624 Quantity 1)
ID 1625b Code FGBS SEP 14 Date 2014-07-02 06:03:16 Quantity 0.0416667 Price 110.685 Value per block 110,685 (Allocated from: ID 1625 Quantity 1)
ID 1626c Code FGBS SEP 14 Date 2014-07-02 06:32:42 Quantity 0.0833333 Price 110.685 Value per block 110,685 (Allocated from: ID 1626 Quantity 4)
ID 1628d Code FGBS SEP 14 Date 2014-07-09 02:52:15 Quantity 0.0833333 Price 110.690 Value per block 110,690 (Allocated from: ID 1628 Quantity 4)
ID 1629b Code FGBS SEP 14 Date 2014-07-10 02:53:45 Quantity 0.0833333 Price 110.685 Value per block 110,685 (Allocated from: ID 1629 Quantity 2)

CALCULATION: (1*110700) - 2 - 0 -(1*110636) - 2.00000 - 0  = 60 

********************************************************************************************************************************************

16: SELL 1 FGBS SEP 14 Futures on 08/08/2014 at EUR 110,725 each gives PROFIT of EUR 85 equals GBP 67.5424
 Commission EUR 2 and taxes EUR 0 on SELL
Trade details:ID 1653 Code FGBS SEP 14 Date 2014-08-08 02:48:34 Quantity -1 Price 110.725 Value per block 110,725
Total allowable cost EUR 2   Total disposal proceeds EUR 86.7500

Matches with:
PRO-RATA SECTION 104: Quantity 1.000000 FGBS SEP 14 allocated from total holding of 28, made up of 9 trades between 2014-06-02 and 2014-07-10
 At average value of EUR 110,636 Commissions EUR 2 Taxes EUR 0  

Trades:
ID 1614c Code FGBS SEP 14 Date 2014-06-02 03:32:40 Quantity 0.166667 Price 110.630 Value per block 110,630 (Allocated from: ID 1614 Quantity 4)
ID 1615c Code FGBS SEP 14 Date 2014-06-03 09:12:34 Quantity 0.416667 Price 110.600 Value per block 110,600 (Allocated from: ID 1615 Quantity 10)
ID 1616c Code FGBS SEP 14 Date 2014-06-06 08:18:22 Quantity 0.0416667 Price 110.640 Value per block 110,640 (Allocated from: ID 1616 Quantity 1)
ID 1623c Code FGBS SEP 14 Date 2014-06-30 02:51:30 Quantity 0.0416667 Price 110.640 Value per block 110,640 (Allocated from: ID 1623 Quantity 1)
ID 1624c Code FGBS SEP 14 Date 2014-06-30 11:02:26 Quantity 0.0416667 Price 110.665 Value per block 110,665 (Allocated from: ID 1624 Quantity 1)
ID 1625c Code FGBS SEP 14 Date 2014-07-02 06:03:16 Quantity 0.0416667 Price 110.685 Value per block 110,685 (Allocated from: ID 1625 Quantity 1)
ID 1626d Code FGBS SEP 14 Date 2014-07-02 06:32:42 Quantity 0.0833333 Price 110.685 Value per block 110,685 (Allocated from: ID 1626 Quantity 4)
ID 1628e Code FGBS SEP 14 Date 2014-07-09 02:52:15 Quantity 0.0833333 Price 110.690 Value per block 110,690 (Allocated from: ID 1628 Quantity 4)
ID 1629c Code FGBS SEP 14 Date 2014-07-10 02:53:45 Quantity 0.0833333 Price 110.685 Value per block 110,685 (Allocated from: ID 1629 Quantity 2)

CALCULATION: (1*110725) - 2 - 0 -(1*110636) - 2 - 0  = 85 

********************************************************************************************************************************************

17: SELL 1 FGBS SEP 14 Futures on 08/08/2014 at EUR 110,710 each gives PROFIT of EUR 70 equals GBP 55.5894
 Commission EUR 2 and taxes EUR 0 on SELL
Trade details:ID 1654 Code FGBS SEP 14 Date 2014-08-08 06:02:52 Quantity -1 Price 110.710 Value per block 110,710
Total allowable cost EUR 2   Total disposal proceeds EUR 71.7500

Matches with:
PRO-RATA SECTION 104: Quantity 1.000000 FGBS SEP 14 allocated from total holding of 28, made up of 9 trades between 2014-06-02 and 2014-07-10
 At average value of EUR 110,636 Commissions EUR 2 Taxes EUR 0  

Trades:
ID 1614d Code FGBS SEP 14 Date 2014-06-02 03:32:40 Quantity 0.166667 Price 110.630 Value per block 110,630 (Allocated from: ID 1614 Quantity 4)
ID 1615d Code FGBS SEP 14 Date 2014-06-03 09:12:34 Quantity 0.416667 Price 110.600 Value per block 110,600 (Allocated from: ID 1615 Quantity 10)
ID 1616d Code FGBS SEP 14 Date 2014-06-06 08:18:22 Quantity 0.0416667 Price 110.640 Value per block 110,640 (Allocated from: ID 1616 Quantity 1)
ID 1623d Code FGBS SEP 14 Date 2014-06-30 02:51:30 Quantity 0.0416667 Price 110.640 Value per block 110,640 (Allocated from: ID 1623 Quantity 1)
ID 1624d Code FGBS SEP 14 Date 2014-06-30 11:02:26 Quantity 0.0416667 Price 110.665 Value per block 110,665 (Allocated from: ID 1624 Quantity 1)
ID 1625d Code FGBS SEP 14 Date 2014-07-02 06:03:16 Quantity 0.0416667 Price 110.685 Value per block 110,685 (Allocated from: ID 1625 Quantity 1)
ID 1626e Code FGBS SEP 14 Date 2014-07-02 06:32:42 Quantity 0.0833333 Price 110.685 Value per block 110,685 (Allocated from: ID 1626 Quantity 4)
ID 1628f Code FGBS SEP 14 Date 2014-07-09 02:52:15 Quantity 0.0833333 Price 110.690 Value per block 110,690 (Allocated from: ID 1628 Quantity 4)
ID 1629d Code FGBS SEP 14 Date 2014-07-10 02:53:45 Quantity 0.0833333 Price 110.685 Value per block 110,685 (Allocated from: ID 1629 Quantity 2)

CALCULATION: (1*110710) - 2 - 0 -(1*110636) - 2 - 0  = 70 

********************************************************************************************************************************************

18: SELL 20 FGBS SEP 14 Futures on 01/09/2014 at EUR 110,805 each gives PROFIT of EUR 3,295 equals GBP 2,625.83
 Commission EUR 40 and taxes EUR 0 on SELL
Trade details:ID 1655 Code FGBS SEP 14 Date 2014-09-01 05:03:43 Quantity -20 Price 110.805 Value per block 110,805
Total allowable cost EUR 40.0000   Total disposal proceeds EUR 3,335.00

Matches with:
PRO-RATA SECTION 104: Quantity 20.000000 FGBS SEP 14 allocated from total holding of 28, made up of 9 trades between 2014-06-02 and 2014-07-10
 At average value of EUR 110,636 Commissions EUR 40.0000 Taxes EUR 0  

Trades:
ID 1614e Code FGBS SEP 14 Date 2014-06-02 03:32:40 Quantity 3.33333 Price 110.630 Value per block 110,630 (Allocated from: ID 1614 Quantity 4)
ID 1615e Code FGBS SEP 14 Date 2014-06-03 09:12:34 Quantity 8.33333 Price 110.600 Value per block 110,600 (Allocated from: ID 1615 Quantity 10)
ID 1616e Code FGBS SEP 14 Date 2014-06-06 08:18:22 Quantity 0.833333 Price 110.640 Value per block 110,640 (Allocated from: ID 1616 Quantity 1)
ID 1623e Code FGBS SEP 14 Date 2014-06-30 02:51:30 Quantity 0.833333 Price 110.640 Value per block 110,640 (Allocated from: ID 1623 Quantity 1)
ID 1624e Code FGBS SEP 14 Date 2014-06-30 11:02:26 Quantity 0.833333 Price 110.665 Value per block 110,665 (Allocated from: ID 1624 Quantity 1)
ID 1625e Code FGBS SEP 14 Date 2014-07-02 06:03:16 Quantity 0.833333 Price 110.685 Value per block 110,685 (Allocated from: ID 1625 Quantity 1)
ID 1626f Code FGBS SEP 14 Date 2014-07-02 06:32:42 Quantity 1.66667 Price 110.685 Value per block 110,685 (Allocated from: ID 1626 Quantity 4)
ID 1628g Code FGBS SEP 14 Date 2014-07-09 02:52:15 Quantity 1.66667 Price 110.690 Value per block 110,690 (Allocated from: ID 1628 Quantity 4)
ID 1629e Code FGBS SEP 14 Date 2014-07-10 02:53:45 Quantity 1.66667 Price 110.685 Value per block 110,685 (Allocated from: ID 1629 Quantity 2)

CALCULATION: (20*110805) - 40 - 0 -(20*110636) - 40.0000 - 0  = 3,295 

********************************************************************************************************************************************

1: SELL 1 FGBX DEC 14 Futures on 03/12/2014 at EUR 149,140 each gives PROFIT of EUR 5,756 equals GBP 4,586.76
 Commission EUR 2 and taxes EUR 0 on SELL
Trade details:ID 1657 Code FGBX DEC 14 Date 2014-12-03 03:03:32 Quantity -1 Price 149.140 Value per block 149,140
Total allowable cost EUR 2   Total disposal proceeds EUR 5,758

Matches with:
PRO-RATA SECTION 104: Quantity 1.000000 FGBX DEC 14 allocated from total holding of 1, made up of 1 trades between 2014-09-02 and 2014-09-02
 At average value of EUR 143,380 Commissions EUR 2 Taxes EUR 0  

Trades:
ID 1656 Code FGBX DEC 14 Date 2014-09-02 04:17:47 Quantity 1 Price 143.380 Value per block 143,380

CALCULATION: (1*149140) - 2 - 0 -(1*143380) - 2 - 0  = 5,756 

********************************************************************************************************************************************

1: SELL 1 FGBX JUN 14 Futures on 23/04/2014 at EUR 129,740 each gives LOSS of EUR -804 equals GBP -640.680
 Commission EUR 2 and taxes EUR 0 on SELL
Trade details:ID 1660 Code FGBX JUN 14 Date 2014-04-23 02:39:06 Quantity -1 Price 129.740 Value per block 129,740
Total allowable cost EUR 2   Total disposal proceeds EUR -802

Matches with:
SUBSEQUENT 1 TRADE(S) Within 30 days between 2014-04-30 and 2014-04-30: Matches with BUY of 1 FGBX JUN 14 at of EUR 130,540 each 
 Commissions EUR 2 Taxes EUR 0  

Trades:
ID 1659 Code FGBX JUN 14 Date 2014-04-30 04:15:51 Quantity 1 Price 130.540 Value per block 130,540

CALCULATION: (1*129740) - 2 - 0 -(1*130540) - 2 - 0  = -804 

********************************************************************************************************************************************

2: SELL 1 FGBX JUN 14 Futures on 02/06/2014 at EUR 133,800 each gives PROFIT of EUR 4,476 equals GBP 3,566.77
 Commission EUR 2 and taxes EUR 0 on SELL
Trade details:ID 1661 Code FGBX JUN 14 Date 2014-06-02 03:50:24 Quantity -1 Price 133.800 Value per block 133,800
Total allowable cost EUR 2   Total disposal proceeds EUR 4,478

Matches with:
PRO-RATA SECTION 104: Quantity 1.000000 FGBX JUN 14 allocated from total holding of 1, made up of 1 trades between 2014-04-11 and 2014-04-11
 At average value of EUR 129,320 Commissions EUR 2 Taxes EUR 0  

Trades:
ID 1658 Code FGBX JUN 14 Date 2014-04-11 03:44:42 Quantity 1 Price 129.320 Value per block 129,320

CALCULATION: (1*133800) - 2 - 0 -(1*129320) - 2 - 0  = 4,476 

********************************************************************************************************************************************

1: SELL 1 FGBX MAR 15 Futures on 15/12/2014 at EUR 152,520 each gives PROFIT of EUR 4,356 equals GBP 3,474.26
 Commission EUR 2 and taxes EUR 0 on SELL
Trade details:ID 1663 Code FGBX MAR 15 Date 2014-12-15 04:15:52 Quantity -1 Price 152.520 Value per block 152,520
Total allowable cost EUR 2   Total disposal proceeds EUR 4,358

Matches with:
PRO-RATA SECTION 104: Quantity 1.000000 FGBX MAR 15 allocated from total holding of 1, made up of 1 trades between 2014-12-03 and 2014-12-03
 At average value of EUR 148,160 Commissions EUR 2 Taxes EUR 0  

Trades:
ID 1662 Code FGBX MAR 15 Date 2014-12-03 04:13:05 Quantity 1 Price 148.160 Value per block 148,160

CALCULATION: (1*152520) - 2 - 0 -(1*148160) - 2 - 0  = 4,356 

********************************************************************************************************************************************

1: SELL 1 FGBX SEP 14 Futures on 25/07/2014 at EUR 136,940 each gives LOSS of EUR -1,744 equals GBP -1,390.98
 Commission EUR 2 and taxes EUR 0 on SELL
Trade details:ID 1667 Code FGBX SEP 14 Date 2014-07-25 02:49:05 Quantity -1 Price 136.940 Value per block 136,940
Total allowable cost EUR 2   Total disposal proceeds EUR -1,742

Matches with:
SUBSEQUENT 1 TRADE(S) Within 30 days between 2014-07-29 and 2014-07-29: Matches with BUY of 1 FGBX SEP 14 at of EUR 138,680 each 
 Commissions EUR 2 Taxes EUR 0  

Trades:
ID 1666 Code FGBX SEP 14 Date 2014-07-29 03:50:16 Quantity 1 Price 138.680 Value per block 138,680

CALCULATION: (1*136940) - 2 - 0 -(1*138680) - 2 - 0  = -1,744 

********************************************************************************************************************************************

2: SELL 1 FGBX SEP 14 Futures on 30/07/2014 at EUR 138,160 each gives PROFIT of EUR 3,156 equals GBP 2,517.16
 Commission EUR 2 and taxes EUR 0 on SELL
Trade details:ID 1668 Code FGBX SEP 14 Date 2014-07-30 10:29:45 Quantity -1 Price 138.160 Value per block 138,160
Total allowable cost EUR 2   Total disposal proceeds EUR 3,158

Matches with:
PRO-RATA SECTION 104: Quantity 1.000000 FGBX SEP 14 allocated from total holding of 2, made up of 2 trades between 2014-06-02 and 2014-07-17
 At average value of EUR 135,000 Commissions EUR 2 Taxes EUR 0  

Trades:
ID 1664a Code FGBX SEP 14 Date 2014-06-02 04:28:51 Quantity 0.500000 Price 132.980 Value per block 132,980 (Allocated from: ID 1664 Quantity 1)
ID 1665a Code FGBX SEP 14 Date 2014-07-17 06:21:17 Quantity 0.500000 Price 137.020 Value per block 137,020 (Allocated from: ID 1665 Quantity 1)

CALCULATION: (1*138160) - 2 - 0 -(1*135000) - 2 - 0  = 3,156 

********************************************************************************************************************************************

3: SELL 1 FGBX SEP 14 Futures on 02/09/2014 at EUR 144,380 each gives PROFIT of EUR 9,376 equals GBP 7,478.11
 Commission EUR 2 and taxes EUR 0 on SELL
Trade details:ID 1669 Code FGBX SEP 14 Date 2014-09-02 04:17:47 Quantity -1 Price 144.380 Value per block 144,380
Total allowable cost EUR 2   Total disposal proceeds EUR 9,378

Matches with:
PRO-RATA SECTION 104: Quantity 1.000000 FGBX SEP 14 allocated from total holding of 2, made up of 2 trades between 2014-06-02 and 2014-07-17
 At average value of EUR 135,000 Commissions EUR 2 Taxes EUR 0  

Trades:
ID 1664b Code FGBX SEP 14 Date 2014-06-02 04:28:51 Quantity 0.500000 Price 132.980 Value per block 132,980 (Allocated from: ID 1664 Quantity 1)
ID 1665b Code FGBX SEP 14 Date 2014-07-17 06:21:17 Quantity 0.500000 Price 137.020 Value per block 137,020 (Allocated from: ID 1665 Quantity 1)

CALCULATION: (1*144380) - 2 - 0 -(1*135000) - 2 - 0  = 9,376 

********************************************************************************************************************************************

1: SELL 1 FOAT DEC 14 Futures on 04/09/2014 at EUR 143,960 each gives PROFIT of EUR 586 equals GBP 461.965
 Commission EUR 2 and taxes EUR 0 on SELL
Trade details:ID 1681 Code FOAT DEC 14 Date 2014-09-04 08:28:29 Quantity -1 Price 143.960 Value per block 143,960
Total allowable cost EUR 2   Total disposal proceeds EUR 588

Matches with:
SUBSEQUENT 1 TRADE(S) Within 30 days between 2014-09-04 and 2014-09-04: Matches with BUY of 1 FOAT DEC 14 at of EUR 143,370 each 
 Commissions EUR 2 Taxes EUR 0  

Trades:
ID 1671 Code FOAT DEC 14 Date 2014-09-04 10:38:20 Quantity 1 Price 143.370 Value per block 143,370

CALCULATION: (1*143960) - 2 - 0 -(1*143370) - 2 - 0  = 586 

********************************************************************************************************************************************

2: SELL 1 FOAT DEC 14 Futures on 09/09/2014 at EUR 143,200 each gives PROFIT of EUR 346 equals GBP 272.767
 Commission EUR 2 and taxes EUR 0 on SELL
Trade details:ID 1682 Code FOAT DEC 14 Date 2014-09-09 02:46:49 Quantity -1 Price 143.200 Value per block 143,200
Total allowable cost EUR 2   Total disposal proceeds EUR 348

Matches with:
SUBSEQUENT 1 TRADE(S) Within 30 days between 2014-09-11 and 2014-09-11: Matches with BUY of 1 FOAT DEC 14 at of EUR 142,850 each 
 Commissions EUR 2 Taxes EUR 0  

Trades:
ID 1672 Code FOAT DEC 14 Date 2014-09-11 06:06:14 Quantity 1 Price 142.850 Value per block 142,850

CALCULATION: (1*143200) - 2 - 0 -(1*142850) - 2 - 0  = 346 

********************************************************************************************************************************************

3: SELL 1 FOAT DEC 14 Futures on 10/09/2014 at EUR 142,450 each gives LOSS of EUR -694 equals GBP -547.130
 Commission EUR 2 and taxes EUR 0 on SELL
Trade details:ID 1683 Code FOAT DEC 14 Date 2014-09-10 05:01:01 Quantity -1 Price 142.450 Value per block 142,450
Total allowable cost EUR 2   Total disposal proceeds EUR -692

Matches with:
SUBSEQUENT 1 TRADE(S) Within 30 days between 2014-09-23 and 2014-09-23: Matches with BUY of 1 FOAT DEC 14 at of EUR 143,140 each 
 Commissions EUR 2 Taxes EUR 0  

Trades:
ID 1673 Code FOAT DEC 14 Date 2014-09-23 02:47:19 Quantity 1 Price 143.140 Value per block 143,140

CALCULATION: (1*142450) - 2 - 0 -(1*143140) - 2 - 0  = -694 

********************************************************************************************************************************************

4: SELL 1 FOAT DEC 14 Futures on 12/09/2014 at EUR 141,800 each gives LOSS of EUR -1,604 equals GBP -1,264.54
 Commission EUR 2 and taxes EUR 0 on SELL
Trade details:ID 1684 Code FOAT DEC 14 Date 2014-09-12 09:09:49 Quantity -1 Price 141.800 Value per block 141,800
Total allowable cost EUR 2   Total disposal proceeds EUR -1,602

Matches with:
SUBSEQUENT 1 TRADE(S) Within 30 days between 2014-09-29 and 2014-09-29: Matches with BUY of 1 FOAT DEC 14 at of EUR 143,400 each 
 Commissions EUR 2 Taxes EUR 0  

Trades:
ID 1674 Code FOAT DEC 14 Date 2014-09-29 02:48:36 Quantity 1 Price 143.400 Value per block 143,400

CALCULATION: (1*141800) - 2 - 0 -(1*143400) - 2 - 0  = -1,604 

********************************************************************************************************************************************

5: SELL 1 FOAT DEC 14 Futures on 07/10/2014 at EUR 143,730 each gives LOSS of EUR -274 equals GBP -216.018
 Commission EUR 2 and taxes EUR 0 on SELL
Trade details:ID 1685 Code FOAT DEC 14 Date 2014-10-07 06:21:29 Quantity -1 Price 143.730 Value per block 143,730
Total allowable cost EUR 2   Total disposal proceeds EUR -272

Matches with:
SUBSEQUENT 1 TRADE(S) Within 30 days between 2014-10-08 and 2014-10-08: Matches with BUY of 1 FOAT DEC 14 at of EUR 144,000 each 
 Commissions EUR 2 Taxes EUR 0  

Trades:
ID 1676 Code FOAT DEC 14 Date 2014-10-08 06:18:46 Quantity 1 Price 144 Value per block 144,000

CALCULATION: (1*143730) - 2 - 0 -(1*144000) - 2 - 0  = -274 

********************************************************************************************************************************************

6: SELL 1 FOAT DEC 14 Futures on 16/10/2014 at EUR 144,310 each gives PROFIT of EUR 286 equals GBP 224.986
 Commission EUR 2 and taxes EUR 0 on SELL
Trade details:ID 1686 Code FOAT DEC 14 Date 2014-10-16 06:32:10 Quantity -1 Price 144.310 Value per block 144,310
Total allowable cost EUR 2   Total disposal proceeds EUR 288

Matches with:
SUBSEQUENT 1 TRADE(S) Within 30 days between 2014-10-29 and 2014-10-29: Matches with BUY of 1 FOAT DEC 14 at of EUR 144,020 each 
 Commissions EUR 2 Taxes EUR 0  

Trades:
ID 1677 Code FOAT DEC 14 Date 2014-10-29 04:51:14 Quantity 1 Price 144.020 Value per block 144,020

CALCULATION: (1*144310) - 2 - 0 -(1*144020) - 2 - 0  = 286 

********************************************************************************************************************************************

7: SELL 1 FOAT DEC 14 Futures on 16/10/2014 at EUR 144,380 each gives LOSS of EUR -1,234 equals GBP -970.793
 Commission EUR 2 and taxes EUR 0 on SELL
Trade details:ID 1687 Code FOAT DEC 14 Date 2014-10-16 07:52:19 Quantity -1 Price 144.380 Value per block 144,380
Total allowable cost EUR 2   Total disposal proceeds EUR -1,232

Matches with:
SUBSEQUENT 1 TRADE(S) Within 30 days between 2014-11-17 and 2014-11-17: Matches with BUY of 1 FOAT DEC 14 at of EUR 145,610 each 
 Commissions EUR 2 Taxes EUR 0  

Trades:
ID 1678 Code FOAT DEC 14 Date 2014-11-17 02:43:36 Quantity 1 Price 145.610 Value per block 145,610

CALCULATION: (1*144380) - 2 - 0 -(1*145610) - 2 - 0  = -1,234 

********************************************************************************************************************************************

8: SELL 1 FOAT DEC 14 Futures on 17/10/2014 at EUR 143,660 each gives LOSS of EUR -2,334 equals GBP -1,836.16
 Commission EUR 2 and taxes EUR 0 on SELL
Trade details:ID 1688 Code FOAT DEC 14 Date 2014-10-17 02:46:25 Quantity -1 Price 143.660 Value per block 143,660
Total allowable cost EUR 2   Total disposal proceeds EUR -2,332

Matches with:
SUBSEQUENT 1 TRADE(S) Within 30 days between 2014-11-25 and 2014-11-25: Matches with BUY of 1 FOAT DEC 14 at of EUR 145,990 each 
 Commissions EUR 2 Taxes EUR 0  

Trades:
ID 1679 Code FOAT DEC 14 Date 2014-11-25 02:42:32 Quantity 1 Price 145.990 Value per block 145,990

CALCULATION: (1*143660) - 2 - 0 -(1*145990) - 2 - 0  = -2,334 

********************************************************************************************************************************************

9: SELL 1 FOAT DEC 14 Futures on 19/11/2014 at EUR 145,050 each gives LOSS of EUR -2,194 equals GBP -1,726.02
 Commission EUR 2 and taxes EUR 0 on SELL
Trade details:ID 1689 Code FOAT DEC 14 Date 2014-11-19 07:49:05 Quantity -1 Price 145.050 Value per block 145,050
Total allowable cost EUR 2   Total disposal proceeds EUR -2,192

Matches with:
SUBSEQUENT 1 TRADE(S) Within 30 days between 2014-11-28 and 2014-11-28: Matches with BUY of 1 FOAT DEC 14 at of EUR 147,240 each 
 Commissions EUR 2 Taxes EUR 0  

Trades:
ID 1680 Code FOAT DEC 14 Date 2014-11-28 11:11:24 Quantity 1 Price 147.240 Value per block 147,240

CALCULATION: (1*145050) - 2 - 0 -(1*147240) - 2 - 0  = -2,194 

********************************************************************************************************************************************

10: SELL 1 FOAT DEC 14 Futures on 28/11/2014 at EUR 147,270 each gives PROFIT of EUR 4,192 equals GBP 3,297.59
 Commission EUR 2 and taxes EUR 0 on SELL
Trade details:ID 1690 Code FOAT DEC 14 Date 2014-11-28 05:54:24 Quantity -1 Price 147.270 Value per block 147,270
Total allowable cost EUR 2   Total disposal proceeds EUR 4,193.71

Matches with:
PRO-RATA SECTION 104: Quantity 1.000000 FOAT DEC 14 allocated from total holding of 7, made up of 2 trades between 2014-09-03 and 2014-10-06
 At average value of EUR 143,074 Commissions EUR 2 Taxes EUR 0  

Trades:
ID 1670a Code FOAT DEC 14 Date 2014-09-03 04:27:00 Quantity 0.857143 Price 142.920 Value per block 142,920 (Allocated from: ID 1670 Quantity 6)
ID 1675a Code FOAT DEC 14 Date 2014-10-06 09:08:26 Quantity 0.142857 Price 144 Value per block 144,000 (Allocated from: ID 1675 Quantity 1)

CALCULATION: (1*147270) - 2 - 0 -(1*143074) - 2 - 0  = 4,192 

********************************************************************************************************************************************

11: SELL 6 FOAT DEC 14 Futures on 03/12/2014 at EUR 146,770 each gives PROFIT of EUR 22,150 equals GBP 17,425.46
 Commission EUR 12 and taxes EUR 0 on SELL
Trade details:ID 1691 Code FOAT DEC 14 Date 2014-12-03 03:04:28 Quantity -6 Price 146.770 Value per block 146,770
Total allowable cost EUR 12   Total disposal proceeds EUR 22,162.29

Matches with:
PRO-RATA SECTION 104: Quantity 6.000000 FOAT DEC 14 allocated from total holding of 7, made up of 2 trades between 2014-09-03 and 2014-10-06
 At average value of EUR 143,074 Commissions EUR 12 Taxes EUR 0  

Trades:
ID 1670b Code FOAT DEC 14 Date 2014-09-03 04:27:00 Quantity 5.14286 Price 142.920 Value per block 142,920 (Allocated from: ID 1670 Quantity 6)
ID 1675b Code FOAT DEC 14 Date 2014-10-06 09:08:26 Quantity 0.857143 Price 144 Value per block 144,000 (Allocated from: ID 1675 Quantity 1)

CALCULATION: (6*146770) - 12 - 0 -(6*143074) - 12 - 0  = 22,150 

********************************************************************************************************************************************

1: SELL 4 FOAT JUN 14 Futures on 02/06/2014 at EUR 140,240 each gives PROFIT of EUR 12,104 equals GBP 9,509.94
 Commission EUR 8 and taxes EUR 0 on SELL
Trade details:ID 1694 Code FOAT JUN 14 Date 2014-06-02 03:31:30 Quantity -4 Price 140.240 Value per block 140,240
Total allowable cost EUR 8   Total disposal proceeds EUR 12,112

Matches with:
PRO-RATA SECTION 104: Quantity 4.000000 FOAT JUN 14 allocated from total holding of 4, made up of 2 trades between 2014-04-10 and 2014-05-13
 At average value of EUR 137,210 Commissions EUR 8 Taxes EUR 0  

Trades:
ID 1692 Code FOAT JUN 14 Date 2014-04-10 10:26:07 Quantity 3 Price 136.840 Value per block 136,840
ID 1693 Code FOAT JUN 14 Date 2014-05-13 03:00:58 Quantity 1 Price 138.320 Value per block 138,320

CALCULATION: (4*140240) - 8 - 0 -(4*137210) - 8 - 0  = 12,104 

********************************************************************************************************************************************

1: SELL 2 FOAT MAR 15 Futures on 12/12/2014 at EUR 146,170 each gives PROFIT of EUR 2,140 equals GBP 1,677.79
 Commission EUR 4 and taxes EUR 0 on SELL
Trade details:ID 1697 Code FOAT MAR 15 Date 2014-12-12 06:05:20 Quantity -2 Price 146.170 Value per block 146,170
Total allowable cost EUR 4   Total disposal proceeds EUR 2,144

Matches with:
PRO-RATA SECTION 104: Quantity 2.000000 FOAT MAR 15 allocated from total holding of 5, made up of 2 trades between 2014-12-03 and 2014-12-04
 At average value of EUR 145,096 Commissions EUR 4 Taxes EUR 0  

Trades:
ID 1695a Code FOAT MAR 15 Date 2014-12-03 03:12:43 Quantity 1.20000 Price 145.120 Value per block 145,120 (Allocated from: ID 1695 Quantity 3)
ID 1696a Code FOAT MAR 15 Date 2014-12-04 02:38:43 Quantity 0.800000 Price 145.060 Value per block 145,060 (Allocated from: ID 1696 Quantity 2)

CALCULATION: (2*146170) - 4 - 0 -(2*145096) - 4 - 0  = 2,140 

********************************************************************************************************************************************

2: SELL 2 FOAT MAR 15 Futures on 12/01/2015 at EUR 147,610 each gives PROFIT of EUR 5,020 equals GBP 3,935.75
 Commission EUR 4 and taxes EUR 0 on SELL
Trade details:ID 1698 Code FOAT MAR 15 Date 2015-01-12 02:45:33 Quantity -2 Price 147.610 Value per block 147,610
Total allowable cost EUR 4.00000   Total disposal proceeds EUR 5,024

Matches with:
PRO-RATA SECTION 104: Quantity 2.000000 FOAT MAR 15 allocated from total holding of 5, made up of 2 trades between 2014-12-03 and 2014-12-04
 At average value of EUR 145,096 Commissions EUR 4.00000 Taxes EUR 0  

Trades:
ID 1695b Code FOAT MAR 15 Date 2014-12-03 03:12:43 Quantity 1.20000 Price 145.120 Value per block 145,120 (Allocated from: ID 1695 Quantity 3)
ID 1696b Code FOAT MAR 15 Date 2014-12-04 02:38:43 Quantity 0.800000 Price 145.060 Value per block 145,060 (Allocated from: ID 1696 Quantity 2)

CALCULATION: (2*147610) - 4 - 0 -(2*145096) - 4.00000 - 0  = 5,020 

********************************************************************************************************************************************

3: SELL 1 FOAT MAR 15 Futures on 28/01/2015 at EUR 148,910 each gives PROFIT of EUR 3,810 equals GBP 2,987.09
 Commission EUR 2 and taxes EUR 0 on SELL
Trade details:ID 1699 Code FOAT MAR 15 Date 2015-01-28 02:40:14 Quantity -1 Price 148.910 Value per block 148,910
Total allowable cost EUR 2   Total disposal proceeds EUR 3,812.00

Matches with:
PRO-RATA SECTION 104: Quantity 1.000000 FOAT MAR 15 allocated from total holding of 5, made up of 2 trades between 2014-12-03 and 2014-12-04
 At average value of EUR 145,096 Commissions EUR 2 Taxes EUR 0  

Trades:
ID 1695c Code FOAT MAR 15 Date 2014-12-03 03:12:43 Quantity 0.600000 Price 145.120 Value per block 145,120 (Allocated from: ID 1695 Quantity 3)
ID 1696c Code FOAT MAR 15 Date 2014-12-04 02:38:43 Quantity 0.400000 Price 145.060 Value per block 145,060 (Allocated from: ID 1696 Quantity 2)

CALCULATION: (1*148910) - 2 - 0 -(1*145096) - 2 - 0  = 3,810 

********************************************************************************************************************************************

1: SELL 1 FOAT SEP 14 Futures on 11/06/2014 at EUR 138,340 each gives LOSS of EUR -364 equals GBP -284.264
 Commission EUR 2 and taxes EUR 0 on SELL
Trade details:ID 1711 Code FOAT SEP 14 Date 2014-06-11 03:02:58 Quantity -1 Price 138.340 Value per block 138,340
Total allowable cost EUR 2   Total disposal proceeds EUR -362

Matches with:
SUBSEQUENT 1 TRADE(S) Within 30 days between 2014-06-17 and 2014-06-17: Matches with BUY of 1 FOAT SEP 14 at of EUR 138,700 each 
 Commissions EUR 2 Taxes EUR 0  

Trades:
ID 1702 Code FOAT SEP 14 Date 2014-06-17 07:46:33 Quantity 1 Price 138.700 Value per block 138,700

CALCULATION: (1*138340) - 2 - 0 -(1*138700) - 2 - 0  = -364 

********************************************************************************************************************************************

2: SELL 1 FOAT SEP 14 Futures on 18/06/2014 at EUR 138,440 each gives LOSS of EUR -284 equals GBP -221.790
 Commission EUR 2 and taxes EUR 0 on SELL
Trade details:ID 1712 Code FOAT SEP 14 Date 2014-06-18 03:51:17 Quantity -1 Price 138.440 Value per block 138,440
Total allowable cost EUR 2   Total disposal proceeds EUR -282

Matches with:
SUBSEQUENT 1 TRADE(S) Within 30 days between 2014-06-18 and 2014-06-18: Matches with BUY of 1 FOAT SEP 14 at of EUR 138,720 each 
 Commissions EUR 2 Taxes EUR 0  

Trades:
ID 1703 Code FOAT SEP 14 Date 2014-06-18 09:43:44 Quantity 1 Price 138.720 Value per block 138,720

CALCULATION: (1*138440) - 2 - 0 -(1*138720) - 2 - 0  = -284 

********************************************************************************************************************************************

3: SELL 1 FOAT SEP 14 Futures on 03/07/2014 at EUR 139,930 each gives LOSS of EUR -1,294 equals GBP -1,010.55
 Commission EUR 2 and taxes EUR 0 on SELL
Trade details:ID 1713 Code FOAT SEP 14 Date 2014-07-03 02:34:01 Quantity -1 Price 139.930 Value per block 139,930
Total allowable cost EUR 2   Total disposal proceeds EUR -1,292

Matches with:
SUBSEQUENT 1 TRADE(S) Within 30 days between 2014-07-10 and 2014-07-10: Matches with BUY of 1 FOAT SEP 14 at of EUR 141,220 each 
 Commissions EUR 2 Taxes EUR 0  

Trades:
ID 1705 Code FOAT SEP 14 Date 2014-07-10 02:45:48 Quantity 1 Price 141.220 Value per block 141,220

CALCULATION: (1*139930) - 2 - 0 -(1*141220) - 2 - 0  = -1,294 

********************************************************************************************************************************************

4: SELL 1 FOAT SEP 14 Futures on 10/07/2014 at EUR 141,410 each gives PROFIT of EUR 376 equals GBP 293.633
 Commission EUR 2 and taxes EUR 0 on SELL
Trade details:ID 1714 Code FOAT SEP 14 Date 2014-07-10 06:02:16 Quantity -1 Price 141.410 Value per block 141,410
Total allowable cost EUR 2   Total disposal proceeds EUR 378

Matches with:
SUBSEQUENT 1 TRADE(S) Within 30 days between 2014-07-11 and 2014-07-11: Matches with BUY of 1 FOAT SEP 14 at of EUR 141,030 each 
 Commissions EUR 2 Taxes EUR 0  

Trades:
ID 1706 Code FOAT SEP 14 Date 2014-07-11 02:45:48 Quantity 1 Price 141.030 Value per block 141,030

CALCULATION: (1*141410) - 2 - 0 -(1*141030) - 2 - 0  = 376 

********************************************************************************************************************************************

5: SELL 1 FOAT SEP 14 Futures on 31/07/2014 at EUR 141,990 each gives LOSS of EUR -1,364 equals GBP -1,064.21
 Commission EUR 2 and taxes EUR 0 on SELL
Trade details:ID 1715 Code FOAT SEP 14 Date 2014-07-31 02:47:45 Quantity -1 Price 141.990 Value per block 141,990
Total allowable cost EUR 2   Total disposal proceeds EUR -1,362

Matches with:
SUBSEQUENT 1 TRADE(S) Within 30 days between 2014-08-13 and 2014-08-13: Matches with BUY of 1 FOAT SEP 14 at of EUR 143,350 each 
 Commissions EUR 2 Taxes EUR 0  

Trades:
ID 1708 Code FOAT SEP 14 Date 2014-08-13 09:54:21 Quantity 1 Price 143.350 Value per block 143,350

CALCULATION: (1*141990) - 2 - 0 -(1*143350) - 2 - 0  = -1,364 

********************************************************************************************************************************************

6: SELL 1 FOAT SEP 14 Futures on 18/08/2014 at EUR 143,760 each gives LOSS of EUR -1,214 equals GBP -947.174
 Commission EUR 2 and taxes EUR 0 on SELL
Trade details:ID 1716 Code FOAT SEP 14 Date 2014-08-18 08:07:46 Quantity -1 Price 143.760 Value per block 143,760
Total allowable cost EUR 2   Total disposal proceeds EUR -1,212

Matches with:
SUBSEQUENT 1 TRADE(S) Within 30 days between 2014-08-26 and 2014-08-26: Matches with BUY of 1 FOAT SEP 14 at of EUR 144,970 each 
 Commissions EUR 2 Taxes EUR 0  

Trades:
ID 1709 Code FOAT SEP 14 Date 2014-08-26 02:32:50 Quantity 1 Price 144.970 Value per block 144,970

CALCULATION: (1*143760) - 2 - 0 -(1*144970) - 2 - 0  = -1,214 

********************************************************************************************************************************************

7: SELL 1 FOAT SEP 14 Futures on 29/08/2014 at EUR 145,430 each gives LOSS of EUR -324 equals GBP -252.395
 Commission EUR 2 and taxes EUR 0 on SELL
Trade details:ID 1717 Code FOAT SEP 14 Date 2014-08-29 06:18:30 Quantity -1 Price 145.430 Value per block 145,430
Total allowable cost EUR 2   Total disposal proceeds EUR -322

Matches with:
SAME DAY TRADE(S) Matches with BUY of 1 FOAT SEP 14 at average of EUR 145,750 each 
 Commissions EUR 2 Taxes EUR 0 

Trades:
ID 1710 Code FOAT SEP 14 Date 2014-08-29 02:46:21 Quantity 1 Price 145.750 Value per block 145,750

CALCULATION: (1*145430) - 2 - 0 -(1*145750) - 2 - 0  = -324 

********************************************************************************************************************************************

8: SELL 6 FOAT SEP 14 Futures on 03/09/2014 at EUR 144,630 each gives PROFIT of EUR 34,366 equals GBP 26,770.54
 Commission EUR 12 and taxes EUR 0 on SELL
Trade details:ID 1718 Code FOAT SEP 14 Date 2014-09-03 04:27:00 Quantity -6 Price 144.630 Value per block 144,630
Total allowable cost EUR 12   Total disposal proceeds EUR 34,378

Matches with:
PRO-RATA SECTION 104: Quantity 6.000000 FOAT SEP 14 allocated from total holding of 6, made up of 4 trades between 2014-06-04 and 2014-07-16
 At average value of EUR 138,898 Commissions EUR 12 Taxes EUR 0  

Trades:
ID 1700 Code FOAT SEP 14 Date 2014-06-04 03:35:22 Quantity 3 Price 137.950 Value per block 137,950
ID 1701 Code FOAT SEP 14 Date 2014-06-05 02:36:50 Quantity 1 Price 137.660 Value per block 137,660
ID 1704 Code FOAT SEP 14 Date 2014-07-02 06:13:31 Quantity 1 Price 140.610 Value per block 140,610
ID 1707 Code FOAT SEP 14 Date 2014-07-16 02:49:19 Quantity 1 Price 141.270 Value per block 141,270

CALCULATION: (6*144630) - 12 - 0 -(6*138898) - 12 - 0  = 34,366 

********************************************************************************************************************************************

1: SELL 1 FSMI DEC 14 Futures on 26/09/2014 at CHF 87,360 each gives LOSS of CHF -258 equals GBP -168.045
 Commission CHF 4 and taxes CHF 0 on SELL
Trade details:ID 1108 Code FSMI DEC 14 Date 2014-09-26 03:20:55 Quantity -1 Price 8,736 Value per block 87,360
Total allowable cost CHF 4   Total disposal proceeds CHF -254

Matches with:
SUBSEQUENT 1 TRADE(S) Within 30 days between 2014-09-26 and 2014-09-26: Matches with BUY of 1 FSMI DEC 14 at of CHF 87,610 each 
 Commissions CHF 4 Taxes CHF 0  

Trades:
ID 1100 Code FSMI DEC 14 Date 2014-09-26 06:15:58 Quantity 1 Price 8,761 Value per block 87,610

CALCULATION: (1*87360) - 4 - 0 -(1*87610) - 4 - 0  = -258 

********************************************************************************************************************************************

2: SELL 1 FSMI DEC 14 Futures on 29/09/2014 at CHF 87,490 each gives LOSS of CHF -678 equals GBP -441.319
 Commission CHF 4 and taxes CHF 0 on SELL
Trade details:ID 1109 Code FSMI DEC 14 Date 2014-09-29 10:01:36 Quantity -1 Price 8,749 Value per block 87,490
Total allowable cost CHF 4   Total disposal proceeds CHF -674

Matches with:
SUBSEQUENT 1 TRADE(S) Within 30 days between 2014-09-30 and 2014-09-30: Matches with BUY of 1 FSMI DEC 14 at of CHF 88,160 each 
 Commissions CHF 4 Taxes CHF 0  

Trades:
ID 1101 Code FSMI DEC 14 Date 2014-09-30 07:16:37 Quantity 1 Price 8,816 Value per block 88,160

CALCULATION: (1*87490) - 4 - 0 -(1*88160) - 4 - 0  = -678 

********************************************************************************************************************************************

3: SELL 1 FSMI DEC 14 Futures on 02/10/2014 at CHF 87,500 each gives PROFIT of CHF 1,752 equals GBP 1,144.13
 Commission CHF 4 and taxes CHF 0 on SELL
Trade details:ID 1110 Code FSMI DEC 14 Date 2014-10-02 03:20:29 Quantity -1 Price 8,750 Value per block 87,500
Total allowable cost CHF 4   Total disposal proceeds CHF 1,756

Matches with:
SUBSEQUENT 1 TRADE(S) Within 30 days between 2014-10-09 and 2014-10-09: Matches with BUY of 1 FSMI DEC 14 at of CHF 85,740 each 
 Commissions CHF 4 Taxes CHF 0  

Trades:
ID 1102 Code FSMI DEC 14 Date 2014-10-09 03:25:58 Quantity 1 Price 8,574 Value per block 85,740

CALCULATION: (1*87500) - 4 - 0 -(1*85740) - 4 - 0  = 1,752 

********************************************************************************************************************************************

4: SELL 1 FSMI DEC 14 Futures on 07/10/2014 at CHF 86,250 each gives PROFIT of CHF 4,572 equals GBP 3,015.49
 Commission CHF 4 and taxes CHF 0 on SELL
Trade details:ID 1111 Code FSMI DEC 14 Date 2014-10-07 04:25:18 Quantity -1 Price 8,625 Value per block 86,250
Total allowable cost CHF 4   Total disposal proceeds CHF 4,576

Matches with:
SUBSEQUENT 1 TRADE(S) Within 30 days between 2014-10-17 and 2014-10-17: Matches with BUY of 1 FSMI DEC 14 at of CHF 81,670 each 
 Commissions CHF 4 Taxes CHF 0  

Trades:
ID 1103 Code FSMI DEC 14 Date 2014-10-17 06:43:33 Quantity 1 Price 8,167 Value per block 81,670

CALCULATION: (1*86250) - 4 - 0 -(1*81670) - 4 - 0  = 4,572 

********************************************************************************************************************************************

5: SELL 1 FSMI DEC 14 Futures on 08/10/2014 at CHF 84,890 each gives LOSS of CHF -2,938 equals GBP -1,937.34
 Commission CHF 4 and taxes CHF 0 on SELL
Trade details:ID 1112 Code FSMI DEC 14 Date 2014-10-08 05:47:08 Quantity -1 Price 8,489 Value per block 84,890
Total allowable cost CHF 4   Total disposal proceeds CHF -2,934

Matches with:
SUBSEQUENT 1 TRADE(S) Within 30 days between 2014-10-31 and 2014-10-31: Matches with BUY of 1 FSMI DEC 14 at of CHF 87,820 each 
 Commissions CHF 4 Taxes CHF 0  

Trades:
ID 1104 Code FSMI DEC 14 Date 2014-10-31 04:22:47 Quantity 1 Price 8,782 Value per block 87,820

CALCULATION: (1*84890) - 4 - 0 -(1*87820) - 4 - 0  = -2,938 

********************************************************************************************************************************************

6: SELL 1 FSMI DEC 14 Futures on 09/10/2014 at CHF 85,100 each gives LOSS of CHF -3,138 equals GBP -2,066.97
 Commission CHF 4 and taxes CHF 0 on SELL
Trade details:ID 1113 Code FSMI DEC 14 Date 2014-10-09 10:31:29 Quantity -1 Price 8,510 Value per block 85,100
Total allowable cost CHF 4   Total disposal proceeds CHF -3,134

Matches with:
SUBSEQUENT 1 TRADE(S) Within 30 days between 2014-11-06 and 2014-11-06: Matches with BUY of 1 FSMI DEC 14 at of CHF 88,230 each 
 Commissions CHF 4 Taxes CHF 0  

Trades:
ID 1105 Code FSMI DEC 14 Date 2014-11-06 04:25:16 Quantity 1 Price 8,823 Value per block 88,230

CALCULATION: (1*85100) - 4 - 0 -(1*88230) - 4 - 0  = -3,138 

********************************************************************************************************************************************

7: SELL 1 FSMI DEC 14 Futures on 14/10/2014 at CHF 83,110 each gives LOSS of CHF -6,508 equals GBP -4,296.66
 Commission CHF 4 and taxes CHF 0 on SELL
Trade details:ID 1114 Code FSMI DEC 14 Date 2014-10-14 03:20:29 Quantity -1 Price 8,311 Value per block 83,110
Total allowable cost CHF 4   Total disposal proceeds CHF -6,504

Matches with:
SUBSEQUENT 1 TRADE(S) Within 30 days between 2014-11-18 and 2014-11-18: Matches with BUY of 1 FSMI DEC 14 at of CHF 89,610 each 
 Commissions CHF 4 Taxes CHF 0  

Trades:
ID 1106 Code FSMI DEC 14 Date 2014-11-18 03:22:43 Quantity 1 Price 8,961 Value per block 89,610

CALCULATION: (1*83110) - 4 - 0 -(1*89610) - 4 - 0  = -6,508 

********************************************************************************************************************************************

8: SELL 1 FSMI DEC 14 Futures on 17/10/2014 at CHF 80,610 each gives LOSS of CHF -10,058 equals GBP -6,622.85
 Commission CHF 4 and taxes CHF 0 on SELL
Trade details:ID 1115 Code FSMI DEC 14 Date 2014-10-17 03:23:56 Quantity -1 Price 8,061 Value per block 80,610
Total allowable cost CHF 4   Total disposal proceeds CHF -10,054

Matches with:
SUBSEQUENT 1 TRADE(S) Within 30 days between 2014-11-26 and 2014-11-26: Matches with BUY of 1 FSMI DEC 14 at of CHF 90,660 each 
 Commissions CHF 4 Taxes CHF 0  

Trades:
ID 1107 Code FSMI DEC 14 Date 2014-11-26 06:06:48 Quantity 1 Price 9,066 Value per block 90,660

CALCULATION: (1*80610) - 4 - 0 -(1*90660) - 4 - 0  = -10,058 

********************************************************************************************************************************************

9: SELL 1 FSMI DEC 14 Futures on 09/12/2014 at CHF 90,380 each gives PROFIT of CHF 2,368 equals GBP 1,559.25
 Commission CHF 4 and taxes CHF 0 on SELL
Trade details:ID 1116 Code FSMI DEC 14 Date 2014-12-09 11:20:37 Quantity -1 Price 9,038 Value per block 90,380
Total allowable cost CHF 4   Total disposal proceeds CHF 2,372

Matches with:
PRO-RATA SECTION 104: Quantity 1.000000 FSMI DEC 14 allocated from total holding of 5, made up of 3 trades between 2014-09-16 and 2014-09-25
 At average value of CHF 88,004 Commissions CHF 4 Taxes CHF 0  

Trades:
ID 1097a Code FSMI DEC 14 Date 2014-09-16 03:08:16 Quantity 0.600000 Price 8,787 Value per block 87,870.00 (Allocated from: ID 1097 Quantity 3)
ID 1098a Code FSMI DEC 14 Date 2014-09-17 03:20:33 Quantity 0.200000 Price 8,813 Value per block 88,130 (Allocated from: ID 1098 Quantity 1)
ID 1099a Code FSMI DEC 14 Date 2014-09-25 05:44:16 Quantity 0.200000 Price 8,828 Value per block 88,280 (Allocated from: ID 1099 Quantity 1)

CALCULATION: (1*90380) - 4 - 0 -(1*88004) - 4 - 0  = 2,368 

********************************************************************************************************************************************

10: SELL 2 FSMI DEC 14 Futures on 12/12/2014 at CHF 89,400 each gives PROFIT of CHF 2,776 equals GBP 1,830.41
 Commission CHF 8 and taxes CHF 0 on SELL
Trade details:ID 1117 Code FSMI DEC 14 Date 2014-12-12 06:29:02 Quantity -2 Price 8,940 Value per block 89,400
Total allowable cost CHF 8   Total disposal proceeds CHF 2,784

Matches with:
PRO-RATA SECTION 104: Quantity 2.000000 FSMI DEC 14 allocated from total holding of 5, made up of 3 trades between 2014-09-16 and 2014-09-25
 At average value of CHF 88,004 Commissions CHF 8 Taxes CHF 0  

Trades:
ID 1097b Code FSMI DEC 14 Date 2014-09-16 03:08:16 Quantity 1.20000 Price 8,787 Value per block 87,870.00 (Allocated from: ID 1097 Quantity 3)
ID 1098b Code FSMI DEC 14 Date 2014-09-17 03:20:33 Quantity 0.400000 Price 8,813 Value per block 88,130 (Allocated from: ID 1098 Quantity 1)
ID 1099b Code FSMI DEC 14 Date 2014-09-25 05:44:16 Quantity 0.400000 Price 8,828 Value per block 88,280 (Allocated from: ID 1099 Quantity 1)

CALCULATION: (2*89400) - 8 - 0 -(2*88004) - 8 - 0  = 2,776 

********************************************************************************************************************************************

11: SELL 2 FSMI DEC 14 Futures on 18/12/2014 at CHF 88,950 each gives PROFIT of CHF 1,876 equals GBP 1,217.86
 Commission CHF 8 and taxes CHF 0 on SELL
Trade details:ID 1118 Code FSMI DEC 14 Date 2014-12-18 03:02:39 Quantity -2 Price 8,895 Value per block 88,950
Total allowable cost CHF 8   Total disposal proceeds CHF 1,884

Matches with:
PRO-RATA SECTION 104: Quantity 2.000000 FSMI DEC 14 allocated from total holding of 5, made up of 3 trades between 2014-09-16 and 2014-09-25
 At average value of CHF 88,004 Commissions CHF 8 Taxes CHF 0  

Trades:
ID 1097c Code FSMI DEC 14 Date 2014-09-16 03:08:16 Quantity 1.20000 Price 8,787 Value per block 87,870.00 (Allocated from: ID 1097 Quantity 3)
ID 1098c Code FSMI DEC 14 Date 2014-09-17 03:20:33 Quantity 0.400000 Price 8,813 Value per block 88,130 (Allocated from: ID 1098 Quantity 1)
ID 1099c Code FSMI DEC 14 Date 2014-09-25 05:44:16 Quantity 0.400000 Price 8,828 Value per block 88,280 (Allocated from: ID 1099 Quantity 1)

CALCULATION: (2*88950) - 8 - 0 -(2*88004) - 8 - 0  = 1,876 

********************************************************************************************************************************************

1: SELL 1 FSMI JUN 14 Futures on 05/05/2014 at CHF 83,440 each gives LOSS of CHF -888 equals GBP -573.385
 Commission CHF 4 and taxes CHF 0 on SELL
Trade details:ID 1123 Code FSMI JUN 14 Date 2014-05-05 05:39:53 Quantity -1 Price 8,344 Value per block 83,440
Total allowable cost CHF 4   Total disposal proceeds CHF -884

Matches with:
SUBSEQUENT 1 TRADE(S) Within 30 days between 2014-05-09 and 2014-05-09: Matches with BUY of 1 FSMI JUN 14 at of CHF 84,320 each 
 Commissions CHF 4 Taxes CHF 0  

Trades:
ID 1121 Code FSMI JUN 14 Date 2014-05-09 04:05:23 Quantity 1 Price 8,432 Value per block 84,320

CALCULATION: (1*83440) - 4 - 0 -(1*84320) - 4 - 0  = -888 

********************************************************************************************************************************************

2: SELL 1 FSMI JUN 14 Futures on 13/06/2014 at CHF 86,060 each gives PROFIT of CHF 2,107 equals GBP 1,364.25
 Commission CHF 4 and taxes CHF 0 on SELL
Trade details:ID 1124 Code FSMI JUN 14 Date 2014-06-13 06:50:27 Quantity -1 Price 8,606 Value per block 86,060
Total allowable cost CHF 4   Total disposal proceeds CHF 2,111

Matches with:
PRO-RATA SECTION 104: Quantity 1.000000 FSMI JUN 14 allocated from total holding of 4, made up of 3 trades between 2014-04-11 and 2014-06-06
 At average value of CHF 83,945 Commissions CHF 4 Taxes CHF 0  

Trades:
ID 1119a Code FSMI JUN 14 Date 2014-04-11 03:16:27 Quantity 0.500000 Price 8,262 Value per block 82,620 (Allocated from: ID 1119 Quantity 2)
ID 1120a Code FSMI JUN 14 Date 2014-04-23 03:19:06 Quantity 0.250000 Price 8,427 Value per block 84,270 (Allocated from: ID 1120 Quantity 1)
ID 1122a Code FSMI JUN 14 Date 2014-06-06 08:13:43 Quantity 0.250000 Price 8,627 Value per block 86,270 (Allocated from: ID 1122 Quantity 1)

CALCULATION: (1*86060) - 4 - 0 -(1*83945) - 4 - 0  = 2,107 

********************************************************************************************************************************************

3: SELL 3 FSMI JUN 14 Futures on 18/06/2014 at CHF 86,850 each gives PROFIT of CHF 8,691 equals GBP 5,632.09
 Commission CHF 12 and taxes CHF 0 on SELL
Trade details:ID 1125 Code FSMI JUN 14 Date 2014-06-18 03:25:09 Quantity -3 Price 8,685 Value per block 86,850
Total allowable cost CHF 12   Total disposal proceeds CHF 8,703

Matches with:
PRO-RATA SECTION 104: Quantity 3.000000 FSMI JUN 14 allocated from total holding of 4, made up of 3 trades between 2014-04-11 and 2014-06-06
 At average value of CHF 83,945 Commissions CHF 12 Taxes CHF 0  

Trades:
ID 1119b Code FSMI JUN 14 Date 2014-04-11 03:16:27 Quantity 1.50000 Price 8,262 Value per block 82,620 (Allocated from: ID 1119 Quantity 2)
ID 1120b Code FSMI JUN 14 Date 2014-04-23 03:19:06 Quantity 0.750000 Price 8,427 Value per block 84,270 (Allocated from: ID 1120 Quantity 1)
ID 1122b Code FSMI JUN 14 Date 2014-06-06 08:13:43 Quantity 0.750000 Price 8,627 Value per block 86,270 (Allocated from: ID 1122 Quantity 1)

CALCULATION: (3*86850) - 12 - 0 -(3*83945) - 12 - 0  = 8,691 

********************************************************************************************************************************************

1: SELL 1 FSMI MAR 15 Futures on 19/12/2014 at CHF 89,680 each gives PROFIT of CHF 62 equals GBP 40.3799
 Commission CHF 4 and taxes CHF 0 on SELL
Trade details:ID 1128 Code FSMI MAR 15 Date 2014-12-19 03:18:50 Quantity -1 Price 8,968 Value per block 89,680
Total allowable cost CHF 4   Total disposal proceeds CHF 66

Matches with:
SUBSEQUENT 1 TRADE(S) Within 30 days between 2014-12-22 and 2014-12-22: Matches with BUY of 1 FSMI MAR 15 at of CHF 89,610 each 
 Commissions CHF 4 Taxes CHF 0  

Trades:
ID 1127 Code FSMI MAR 15 Date 2014-12-22 04:20:20 Quantity 1 Price 8,961 Value per block 89,610

CALCULATION: (1*89680) - 4 - 0 -(1*89610) - 4 - 0  = 62 

********************************************************************************************************************************************

2: SELL 1 FSMI MAR 15 Futures on 15/01/2015 at CHF 83,460 each gives LOSS of CHF -4,758 equals GBP -3,147.76
 Commission CHF 4 and taxes CHF 0 on SELL
Trade details:ID 1129 Code FSMI MAR 15 Date 2015-01-15 05:42:55 Quantity -1 Price 8,346 Value per block 83,460
Total allowable cost CHF 4   Total disposal proceeds CHF -4,754

Matches with:
PRO-RATA SECTION 104: Quantity 1.000000 FSMI MAR 15 allocated from total holding of 2, made up of 1 trades between 2014-12-18 and 2014-12-18
 At average value of CHF 88,210 Commissions CHF 4 Taxes CHF 0  

Trades:
ID 1126a Code FSMI MAR 15 Date 2014-12-18 03:02:39 Quantity 1 Price 8,821 Value per block 88,210 (Allocated from: ID 1126 Quantity 2)

CALCULATION: (1*83460) - 4 - 0 -(1*88210) - 4 - 0  = -4,758 

********************************************************************************************************************************************

3: SELL 1 FSMI MAR 15 Futures on 15/01/2015 at CHF 82,420 each gives LOSS of CHF -5,798 equals GBP -3,835.81
 Commission CHF 4 and taxes CHF 0 on SELL
Trade details:ID 1130 Code FSMI MAR 15 Date 2015-01-15 07:42:50 Quantity -1 Price 8,242 Value per block 82,420
Total allowable cost CHF 4   Total disposal proceeds CHF -5,794

Matches with:
PRO-RATA SECTION 104: Quantity 1.000000 FSMI MAR 15 allocated from total holding of 2, made up of 1 trades between 2014-12-18 and 2014-12-18
 At average value of CHF 88,210 Commissions CHF 4 Taxes CHF 0  

Trades:
ID 1126b Code FSMI MAR 15 Date 2014-12-18 03:02:39 Quantity 1 Price 8,821 Value per block 88,210 (Allocated from: ID 1126 Quantity 2)

CALCULATION: (1*82420) - 4 - 0 -(1*88210) - 4 - 0  = -5,798 

********************************************************************************************************************************************

1: SELL 1 FSMI SEP 14 Futures on 27/06/2014 at CHF 85,410 each gives LOSS of CHF -848 equals GBP -558.012
 Commission CHF 4 and taxes CHF 0 on SELL
Trade details:ID 1139 Code FSMI SEP 14 Date 2014-06-27 05:12:36 Quantity -1 Price 8,541 Value per block 85,410
Total allowable cost CHF 4   Total disposal proceeds CHF -844

Matches with:
SUBSEQUENT 1 TRADE(S) Within 30 days between 2014-07-02 and 2014-07-02: Matches with BUY of 1 FSMI SEP 14 at of CHF 86,250 each 
 Commissions CHF 4 Taxes CHF 0  

Trades:
ID 1133 Code FSMI SEP 14 Date 2014-07-02 07:55:57 Quantity 1 Price 8,625 Value per block 86,250

CALCULATION: (1*85410) - 4 - 0 -(1*86250) - 4 - 0  = -848 

********************************************************************************************************************************************

2: SELL 1 FSMI SEP 14 Futures on 08/07/2014 at CHF 85,580 each gives LOSS of CHF -408 equals GBP -269.863
 Commission CHF 4 and taxes CHF 0 on SELL
Trade details:ID 1140 Code FSMI SEP 14 Date 2014-07-08 10:33:31 Quantity -1 Price 8,558 Value per block 85,580
Total allowable cost CHF 4   Total disposal proceeds CHF -404

Matches with:
SUBSEQUENT 1 TRADE(S) Within 30 days between 2014-07-15 and 2014-07-15: Matches with BUY of 1 FSMI SEP 14 at of CHF 85,980 each 
 Commissions CHF 4 Taxes CHF 0  

Trades:
ID 1134 Code FSMI SEP 14 Date 2014-07-15 04:59:28 Quantity 1 Price 8,598 Value per block 85,980

CALCULATION: (1*85580) - 4 - 0 -(1*85980) - 4 - 0  = -408 

********************************************************************************************************************************************

3: SELL 1 FSMI SEP 14 Futures on 10/07/2014 at CHF 84,660 each gives LOSS of CHF -1,348 equals GBP -891.549
 Commission CHF 4 and taxes CHF 0 on SELL
Trade details:ID 1141 Code FSMI SEP 14 Date 2014-07-10 06:35:25 Quantity -1 Price 8,466 Value per block 84,660
Total allowable cost CHF 4   Total disposal proceeds CHF -1,344

Matches with:
SUBSEQUENT 1 TRADE(S) Within 30 days between 2014-07-23 and 2014-07-23: Matches with BUY of 1 FSMI SEP 14 at of CHF 86,000 each 
 Commissions CHF 4 Taxes CHF 0  

Trades:
ID 1135 Code FSMI SEP 14 Date 2014-07-23 05:37:40 Quantity 1 Price 8,600 Value per block 86,000

CALCULATION: (1*84660) - 4 - 0 -(1*86000) - 4 - 0  = -1,348 

********************************************************************************************************************************************

4: SELL 1 FSMI SEP 14 Futures on 18/07/2014 at CHF 85,000 each gives PROFIT of CHF 392 equals GBP 257.808
 Commission CHF 4 and taxes CHF 0 on SELL
Trade details:ID 1142 Code FSMI SEP 14 Date 2014-07-18 03:20:09 Quantity -1 Price 8,500 Value per block 85,000
Total allowable cost CHF 4   Total disposal proceeds CHF 396

Matches with:
SUBSEQUENT 1 TRADE(S) Within 30 days between 2014-08-15 and 2014-08-15: Matches with BUY of 1 FSMI SEP 14 at of CHF 84,600 each 
 Commissions CHF 4 Taxes CHF 0  

Trades:
ID 1136 Code FSMI SEP 14 Date 2014-08-15 04:13:33 Quantity 1 Price 8,460 Value per block 84,600

CALCULATION: (1*85000) - 4 - 0 -(1*84600) - 4 - 0  = 392 

********************************************************************************************************************************************

5: SELL 1 FSMI SEP 14 Futures on 31/07/2014 at CHF 84,400 each gives LOSS of CHF -1,638 equals GBP -1,068.09
 Commission CHF 4 and taxes CHF 0 on SELL
Trade details:ID 1143 Code FSMI SEP 14 Date 2014-07-31 06:48:30 Quantity -1 Price 8,440 Value per block 84,400
Total allowable cost CHF 4   Total disposal proceeds CHF -1,634

Matches with:
SUBSEQUENT 1 TRADE(S) Within 30 days between 2014-08-26 and 2014-08-26: Matches with BUY of 1 FSMI SEP 14 at of CHF 86,030 each 
 Commissions CHF 4 Taxes CHF 0  

Trades:
ID 1137 Code FSMI SEP 14 Date 2014-08-26 03:02:50 Quantity 1 Price 8,603 Value per block 86,030

CALCULATION: (1*84400) - 4 - 0 -(1*86030) - 4 - 0  = -1,638 

********************************************************************************************************************************************

6: SELL 1 FSMI SEP 14 Futures on 08/08/2014 at CHF 82,250 each gives LOSS of CHF -5,828 equals GBP -3,770.72
 Commission CHF 4 and taxes CHF 0 on SELL
Trade details:ID 1144 Code FSMI SEP 14 Date 2014-08-08 03:24:22 Quantity -1 Price 8,225 Value per block 82,250
Total allowable cost CHF 4   Total disposal proceeds CHF -5,824

Matches with:
SUBSEQUENT 1 TRADE(S) Within 30 days between 2014-09-08 and 2014-09-08: Matches with BUY of 1 FSMI SEP 14 at of CHF 88,070 each 
 Commissions CHF 4 Taxes CHF 0  

Trades:
ID 1138 Code FSMI SEP 14 Date 2014-09-08 10:43:07 Quantity 1 Price 8,807 Value per block 88,070

CALCULATION: (1*82250) - 4 - 0 -(1*88070) - 4 - 0  = -5,828 

********************************************************************************************************************************************

7: SELL 1 FSMI SEP 14 Futures on 12/09/2014 at CHF 87,850 each gives PROFIT of CHF 1,040 equals GBP 672.528
 Commission CHF 4 and taxes CHF 0 on SELL
Trade details:ID 1145 Code FSMI SEP 14 Date 2014-09-12 05:41:47 Quantity -1 Price 8,785 Value per block 87,850
Total allowable cost CHF 4   Total disposal proceeds CHF 1,043.50

Matches with:
PRO-RATA SECTION 104: Quantity 1.000000 FSMI SEP 14 allocated from total holding of 4, made up of 2 trades between 2014-06-18 and 2014-06-19
 At average value of CHF 86,802.50 Commissions CHF 4 Taxes CHF 0  

Trades:
ID 1131a Code FSMI SEP 14 Date 2014-06-18 03:23:23 Quantity 0.750000 Price 8,679 Value per block 86,790 (Allocated from: ID 1131 Quantity 3)
ID 1132a Code FSMI SEP 14 Date 2014-06-19 03:03:25 Quantity 0.250000 Price 8,684 Value per block 86,840 (Allocated from: ID 1132 Quantity 1)

CALCULATION: (1*87850) - 4 - 0 -(1*86802.50) - 4 - 0  = 1,040 

********************************************************************************************************************************************

8: SELL 3 FSMI SEP 14 Futures on 16/09/2014 at CHF 87,900 each gives PROFIT of CHF 3,269 equals GBP 2,192.47
 Commission CHF 12 and taxes CHF 0 on SELL
Trade details:ID 1146 Code FSMI SEP 14 Date 2014-09-16 03:08:16 Quantity -3 Price 8,790 Value per block 87,900
Total allowable cost CHF 12   Total disposal proceeds CHF 3,280.50

Matches with:
PRO-RATA SECTION 104: Quantity 3.000000 FSMI SEP 14 allocated from total holding of 4, made up of 2 trades between 2014-06-18 and 2014-06-19
 At average value of CHF 86,802.50 Commissions CHF 12 Taxes CHF 0  

Trades:
ID 1131b Code FSMI SEP 14 Date 2014-06-18 03:23:23 Quantity 2.25000 Price 8,679 Value per block 86,790 (Allocated from: ID 1131 Quantity 3)
ID 1132b Code FSMI SEP 14 Date 2014-06-19 03:03:25 Quantity 0.750000 Price 8,684 Value per block 86,840 (Allocated from: ID 1132 Quantity 1)

CALCULATION: (3*87900) - 12 - 0 -(3*86802.50) - 12 - 0  = 3,269 

********************************************************************************************************************************************

1: SELL 1 FTIF5 Futures on 14/01/2015 at EUR 83,560 each gives PROFIT of EUR 3,484 equals GBP 2,714.29
 Commission EUR 2.80000 and taxes EUR 0 on SELL
Trade details:ID 1720 Code FTIF5 Date 2015-01-14 03:24:56 Quantity -1 Price 417.800 Value per block 83,560
Total allowable cost EUR 2.80000   Total disposal proceeds EUR 3,487.20

Matches with:
PRO-RATA SECTION 104: Quantity 1.000000 FTIF5 allocated from total holding of 1, made up of 1 trades between 2014-12-17 and 2014-12-17
 At average value of EUR 80,070 Commissions EUR 2.80000 Taxes EUR 0  

Trades:
ID 1719 Code FTIF5 Date 2014-12-17 03:59:08 Quantity 1 Price 400.350 Value per block 80,070

CALCULATION: (1*83560) - 2.80000 - 0 -(1*80070) - 2.80000 - 0  = 3,484 

********************************************************************************************************************************************

1: SELL 10 FTIG5 Futures on 14/01/2015 at EUR 83,630 each gives PROFIT of EUR 2,344 equals GBP 1,838.75
 Commission EUR 28 and taxes EUR 0 on SELL
Trade details:ID 1732 Code FTIG5 Date 2015-01-14 04:14:53 Quantity -10 Price 418.150 Value per block 83,630
Total allowable cost EUR 28.0000   Total disposal proceeds EUR 2,372

Matches with:
SAME DAY TRADE(S) Matches with BUY of 10 FTIG5 at average of EUR 83,390 each 
 Commissions EUR 28.0000 Taxes EUR 0 

Trades:
ID 1731 Code FTIG5 Date 2015-01-14 03:22:50 Quantity 1 Price 416.150 Value per block 83,230
ID 1730 Code FTIG5 Date 2015-01-14 03:20:24 Quantity 1 Price 416.050 Value per block 83,210
ID 1729 Code FTIG5 Date 2015-01-14 03:18:04 Quantity 1 Price 416.500 Value per block 83,300
ID 1728 Code FTIG5 Date 2015-01-14 03:16:08 Quantity 1 Price 416.900 Value per block 83,380
ID 1727 Code FTIG5 Date 2015-01-14 03:14:10 Quantity 1 Price 417.300 Value per block 83,460
ID 1726 Code FTIG5 Date 2015-01-14 03:12:01 Quantity 1 Price 417.350 Value per block 83,470
ID 1725 Code FTIG5 Date 2015-01-14 03:09:36 Quantity 1 Price 417.850 Value per block 83,570
ID 1724 Code FTIG5 Date 2015-01-14 03:07:43 Quantity 1 Price 416.900 Value per block 83,380
ID 1723 Code FTIG5 Date 2015-01-14 03:05:52 Quantity 1 Price 417.450 Value per block 83,490
ID 1722 Code FTIG5 Date 2015-01-14 03:03:45 Quantity 1 Price 417.050 Value per block 83,410

CALCULATION: (10*83630) - 28 - 0 -(10*83390) - 28.0000 - 0  = 2,344 

********************************************************************************************************************************************

1: SELL 1 FTIK4 Futures on 28/04/2014 at EUR 77,870 each gives LOSS of EUR -112 equals GBP -88.0639
 Commission EUR 2.80000 and taxes EUR 0 on SELL
Trade details:ID 1735 Code FTIK4 Date 2014-04-28 03:26:39 Quantity -1 Price 389.350 Value per block 77,870
Total allowable cost EUR 2.80000   Total disposal proceeds EUR -109.467

Matches with:
PRO-RATA SECTION 104: Quantity 1.000000 FTIK4 allocated from total holding of 3, made up of 2 trades between 2014-04-16 and 2014-04-22
 At average value of EUR 77,976.67 Commissions EUR 2.80000 Taxes EUR 0  

Trades:
ID 1733a Code FTIK4 Date 2014-04-16 03:08:41 Quantity 0.666667 Price 388.900 Value per block 77,780 (Allocated from: ID 1733 Quantity 2)
ID 1734a Code FTIK4 Date 2014-04-22 04:11:34 Quantity 0.333333 Price 391.850 Value per block 78,370 (Allocated from: ID 1734 Quantity 1)

CALCULATION: (1*77870) - 2.80000 - 0 -(1*77976.67) - 2.80000 - 0  = -112 

********************************************************************************************************************************************

2: SELL 2 FTIK4 Futures on 14/05/2014 at EUR 80,720 each gives PROFIT of EUR 5,475 equals GBP 4,295.05
 Commission EUR 5.60000 and taxes EUR 0 on SELL
Trade details:ID 1736 Code FTIK4 Date 2014-05-14 03:27:55 Quantity -2 Price 403.600 Value per block 80,720
Total allowable cost EUR 5.60000   Total disposal proceeds EUR 5,481.07

Matches with:
PRO-RATA SECTION 104: Quantity 2.000000 FTIK4 allocated from total holding of 3, made up of 2 trades between 2014-04-16 and 2014-04-22
 At average value of EUR 77,976.67 Commissions EUR 5.60000 Taxes EUR 0  

Trades:
ID 1733b Code FTIK4 Date 2014-04-16 03:08:41 Quantity 1.33333 Price 388.900 Value per block 77,780 (Allocated from: ID 1733 Quantity 2)
ID 1734b Code FTIK4 Date 2014-04-22 04:11:34 Quantity 0.666667 Price 391.850 Value per block 78,370 (Allocated from: ID 1734 Quantity 1)

CALCULATION: (2*80720) - 5.60000 - 0 -(2*77976.67) - 5.60000 - 0  = 5,475 

********************************************************************************************************************************************

1: SELL 3 FTIM4 Futures on 18/06/2014 at EUR 83,116.67 each gives PROFIT of EUR 6,593 equals GBP 5,178.91
 Commission EUR 8.40000 and taxes EUR 0 on SELL
Trade details:ID 1739 Code FTIM4 Date 2014-06-18 03:16:43 Quantity -3 Price 415.583 Value per block 83,116.67
Total allowable cost EUR 8.40000   Total disposal proceeds EUR 6,601.60

Matches with:
PRO-RATA SECTION 104: Quantity 3.000000 FTIM4 allocated from total holding of 3, made up of 2 trades between 2014-05-14 and 2014-05-27
 At average value of EUR 80,913.33 Commissions EUR 8.40000 Taxes EUR 0  

Trades:
ID 1737 Code FTIM4 Date 2014-05-14 03:28:31 Quantity 2 Price 403.400 Value per block 80,680
ID 1738 Code FTIM4 Date 2014-05-27 03:21:19 Quantity 1 Price 406.900 Value per block 81,380

CALCULATION: (3*83116.67) - 8.40000 - 0 -(3*80913.33) - 8.40000 - 0  = 6,593 

********************************************************************************************************************************************

1: SELL 1 FTIN4 Futures on 03/07/2014 at EUR 83,250 each gives PROFIT of EUR 1,974 equals GBP 1,554.97
 Commission EUR 2.80000 and taxes EUR 0 on SELL
Trade details:ID 1745 Code FTIN4 Date 2014-07-03 03:03:20 Quantity -1 Price 416.250 Value per block 83,250
Total allowable cost EUR 2.80000   Total disposal proceeds EUR 1,977.20

Matches with:
SUBSEQUENT 1 TRADE(S) Within 30 days between 2014-07-15 and 2014-07-15: Matches with BUY of 1 FTIN4 at of EUR 81,270 each 
 Commissions EUR 2.80000 Taxes EUR 0  

Trades:
ID 1744 Code FTIN4 Date 2014-07-15 04:58:20 Quantity 1 Price 406.350 Value per block 81,270

CALCULATION: (1*83250) - 2.80000 - 0 -(1*81270) - 2.80000 - 0  = 1,974 

********************************************************************************************************************************************

2: SELL 1 FTIN4 Futures on 09/07/2014 at EUR 82,120 each gives LOSS of EUR -1,438 equals GBP -1,132.20
 Commission EUR 2.80000 and taxes EUR 0 on SELL
Trade details:ID 1746 Code FTIN4 Date 2014-07-09 03:03:24 Quantity -1 Price 410.600 Value per block 82,120
Total allowable cost EUR 2.80000   Total disposal proceeds EUR -1,434.80

Matches with:
PRO-RATA SECTION 104: Quantity 1.000000 FTIN4 allocated from total holding of 5, made up of 4 trades between 2014-06-19 and 2014-07-02
 At average value of EUR 83,552 Commissions EUR 2.80000 Taxes EUR 0  

Trades:
ID 1740a Code FTIN4 Date 2014-06-19 03:08:05 Quantity 0.400000 Price 418.150 Value per block 83,630 (Allocated from: ID 1740 Quantity 2)
ID 1741a Code FTIN4 Date 2014-06-19 10:02:13 Quantity 0.200000 Price 418.950 Value per block 83,790 (Allocated from: ID 1741 Quantity 1)
ID 1742a Code FTIN4 Date 2014-07-02 05:54:54 Quantity 0.200000 Price 416.850 Value per block 83,370 (Allocated from: ID 1742 Quantity 1)
ID 1743a Code FTIN4 Date 2014-07-02 06:42:08 Quantity 0.200000 Price 416.700 Value per block 83,340 (Allocated from: ID 1743 Quantity 1)

CALCULATION: (1*82120) - 2.80000 - 0 -(1*83552) - 2.80000 - 0  = -1,438 

********************************************************************************************************************************************

3: SELL 1 FTIN4 Futures on 10/07/2014 at EUR 80,790 each gives LOSS of EUR -2,768 equals GBP -2,179.67
 Commission EUR 2.80000 and taxes EUR 0 on SELL
Trade details:ID 1747 Code FTIN4 Date 2014-07-10 06:24:23 Quantity -1 Price 403.950 Value per block 80,790
Total allowable cost EUR 2.80000   Total disposal proceeds EUR -2,764.80

Matches with:
PRO-RATA SECTION 104: Quantity 1.000000 FTIN4 allocated from total holding of 5, made up of 4 trades between 2014-06-19 and 2014-07-02
 At average value of EUR 83,552 Commissions EUR 2.80000 Taxes EUR 0  

Trades:
ID 1740b Code FTIN4 Date 2014-06-19 03:08:05 Quantity 0.400000 Price 418.150 Value per block 83,630 (Allocated from: ID 1740 Quantity 2)
ID 1741b Code FTIN4 Date 2014-06-19 10:02:13 Quantity 0.200000 Price 418.950 Value per block 83,790 (Allocated from: ID 1741 Quantity 1)
ID 1742b Code FTIN4 Date 2014-07-02 05:54:54 Quantity 0.200000 Price 416.850 Value per block 83,370 (Allocated from: ID 1742 Quantity 1)
ID 1743b Code FTIN4 Date 2014-07-02 06:42:08 Quantity 0.200000 Price 416.700 Value per block 83,340 (Allocated from: ID 1743 Quantity 1)

CALCULATION: (1*80790) - 2.80000 - 0 -(1*83552) - 2.80000 - 0  = -2,768 

********************************************************************************************************************************************

4: SELL 3 FTIN4 Futures on 16/07/2014 at EUR 81,170 each gives LOSS of EUR -7,163 equals GBP -5,641.18
 Commission EUR 8.40000 and taxes EUR 0 on SELL
Trade details:ID 1748 Code FTIN4 Date 2014-07-16 03:11:06 Quantity -3 Price 405.850 Value per block 81,170
Total allowable cost EUR 8.40000   Total disposal proceeds EUR -7,154.40

Matches with:
PRO-RATA SECTION 104: Quantity 3.000000 FTIN4 allocated from total holding of 5, made up of 4 trades between 2014-06-19 and 2014-07-02
 At average value of EUR 83,552.00 Commissions EUR 8.40000 Taxes EUR 0  

Trades:
ID 1740c Code FTIN4 Date 2014-06-19 03:08:05 Quantity 1.20000 Price 418.150 Value per block 83,630.00 (Allocated from: ID 1740 Quantity 2)
ID 1741c Code FTIN4 Date 2014-06-19 10:02:13 Quantity 0.600000 Price 418.950 Value per block 83,790.00 (Allocated from: ID 1741 Quantity 1)
ID 1742c Code FTIN4 Date 2014-07-02 05:54:54 Quantity 0.600000 Price 416.850 Value per block 83,370.00 (Allocated from: ID 1742 Quantity 1)
ID 1743c Code FTIN4 Date 2014-07-02 06:42:08 Quantity 0.600000 Price 416.700 Value per block 83,340.00 (Allocated from: ID 1743 Quantity 1)

CALCULATION: (3*81170) - 8.40000 - 0 -(3*83552.00) - 8.40000 - 0  = -7,163 

********************************************************************************************************************************************

1: SELL 1 FTIQ4 Futures on 18/07/2014 at EUR 80,150 each gives LOSS of EUR -726 equals GBP -570.537
 Commission EUR 2.80000 and taxes EUR 0 on SELL
Trade details:ID 1750 Code FTIQ4 Date 2014-07-18 03:08:46 Quantity -1 Price 400.750 Value per block 80,150
Total allowable cost EUR 2.80000   Total disposal proceeds EUR -722.800

Matches with:
PRO-RATA SECTION 104: Quantity 1.000000 FTIQ4 allocated from total holding of 3, made up of 1 trades between 2014-07-16 and 2014-07-16
 At average value of EUR 80,870 Commissions EUR 2.80000 Taxes EUR 0  

Trades:
ID 1749a Code FTIQ4 Date 2014-07-16 03:11:06 Quantity 1 Price 404.350 Value per block 80,870 (Allocated from: ID 1749 Quantity 3)

CALCULATION: (1*80150) - 2.80000 - 0 -(1*80870) - 2.80000 - 0  = -726 

********************************************************************************************************************************************

2: SELL 1 FTIQ4 Futures on 08/08/2014 at EUR 77,910 each gives LOSS of EUR -2,966 equals GBP -2,333.87
 Commission EUR 2.80000 and taxes EUR 0 on SELL
Trade details:ID 1751 Code FTIQ4 Date 2014-08-08 03:10:28 Quantity -1 Price 389.550 Value per block 77,910
Total allowable cost EUR 2.80000   Total disposal proceeds EUR -2,962.80

Matches with:
PRO-RATA SECTION 104: Quantity 1.000000 FTIQ4 allocated from total holding of 3, made up of 1 trades between 2014-07-16 and 2014-07-16
 At average value of EUR 80,870.00 Commissions EUR 2.80000 Taxes EUR 0  

Trades:
ID 1749b Code FTIQ4 Date 2014-07-16 03:11:06 Quantity 1 Price 404.350 Value per block 80,870.00 (Allocated from: ID 1749 Quantity 3)

CALCULATION: (1*77910) - 2.80000 - 0 -(1*80870.00) - 2.80000 - 0  = -2,966 

********************************************************************************************************************************************

3: SELL 1 FTIQ4 Futures on 12/08/2014 at EUR 78,770 each gives LOSS of EUR -2,106 equals GBP -1,657.07
 Commission EUR 2.80000 and taxes EUR 0 on SELL
Trade details:ID 1752 Code FTIQ4 Date 2014-08-12 09:05:55 Quantity -1 Price 393.850 Value per block 78,770
Total allowable cost EUR 2.80000   Total disposal proceeds EUR -2,102.80

Matches with:
PRO-RATA SECTION 104: Quantity 1.000000 FTIQ4 allocated from total holding of 3, made up of 1 trades between 2014-07-16 and 2014-07-16
 At average value of EUR 80,870.00 Commissions EUR 2.80000 Taxes EUR 0  

Trades:
ID 1749c Code FTIQ4 Date 2014-07-16 03:11:06 Quantity 1 Price 404.350 Value per block 80,870.00 (Allocated from: ID 1749 Quantity 3)

CALCULATION: (1*78770) - 2.80000 - 0 -(1*80870.00) - 2.80000 - 0  = -2,106 

********************************************************************************************************************************************

1: SELL 3 FTIU4 Futures on 16/09/2014 at EUR 83,320 each gives PROFIT of EUR 7,493 equals GBP 5,897.01
 Commission EUR 8.40000 and taxes EUR 0 on SELL
Trade details:ID 1756 Code FTIU4 Date 2014-09-16 03:36:20 Quantity -3 Price 416.600 Value per block 83,320
Total allowable cost EUR 8.40000   Total disposal proceeds EUR 7,501.60

Matches with:
PRO-RATA SECTION 104: Quantity 3.000000 FTIU4 allocated from total holding of 3, made up of 3 trades between 2014-08-12 and 2014-09-04
 At average value of EUR 80,816.67 Commissions EUR 8.40000 Taxes EUR 0  

Trades:
ID 1753 Code FTIU4 Date 2014-08-12 09:05:55 Quantity 1 Price 393.650 Value per block 78,730
ID 1754 Code FTIU4 Date 2014-08-19 04:55:02 Quantity 1 Price 401.700 Value per block 80,340
ID 1755 Code FTIU4 Date 2014-09-04 03:06:51 Quantity 1 Price 416.900 Value per block 83,380

CALCULATION: (3*83320) - 8.40000 - 0 -(3*80816.67) - 8.40000 - 0  = 7,493 

********************************************************************************************************************************************

1: SELL 1 FTIV4 Futures on 17/09/2014 at EUR 83,770 each gives LOSS of EUR -6 equals GBP -4.41876
 Commission EUR 2.80000 and taxes EUR 0 on SELL
Trade details:ID 1761 Code FTIV4 Date 2014-09-17 03:02:58 Quantity -1 Price 418.850 Value per block 83,770
Total allowable cost EUR 2.80000   Total disposal proceeds EUR -2.80000

Matches with:
SUBSEQUENT 1 TRADE(S) Within 30 days between 2014-09-17 and 2014-09-17: Matches with BUY of 1 FTIV4 at of EUR 83,770 each 
 Commissions EUR 2.80000 Taxes EUR 0  

Trades:
ID 1758 Code FTIV4 Date 2014-09-17 03:05:44 Quantity 1 Price 418.850 Value per block 83,770

CALCULATION: (1*83770) - 2.80000 - 0 -(1*83770) - 2.80000 - 0  = -6 

********************************************************************************************************************************************

2: SELL 1 FTIV4 Futures on 22/09/2014 at EUR 84,500 each gives LOSS of EUR -46 equals GBP -36.0647
 Commission EUR 2.80000 and taxes EUR 0 on SELL
Trade details:ID 1762 Code FTIV4 Date 2014-09-22 03:11:01 Quantity -1 Price 422.500 Value per block 84,500
Total allowable cost EUR 2.80000   Total disposal proceeds EUR -42.8000

Matches with:
SUBSEQUENT 1 TRADE(S) Within 30 days between 2014-09-22 and 2014-09-22: Matches with BUY of 1 FTIV4 at of EUR 84,540 each 
 Commissions EUR 2.80000 Taxes EUR 0  

Trades:
ID 1759 Code FTIV4 Date 2014-09-22 05:29:44 Quantity 1 Price 422.700 Value per block 84,540

CALCULATION: (1*84500) - 2.80000 - 0 -(1*84540) - 2.80000 - 0  = -46 

********************************************************************************************************************************************

3: SELL 1 FTIV4 Futures on 23/09/2014 at EUR 83,810 each gives LOSS of EUR -676 equals GBP -534.488
 Commission EUR 2.80000 and taxes EUR 0 on SELL
Trade details:ID 1763 Code FTIV4 Date 2014-09-23 09:40:35 Quantity -1 Price 419.050 Value per block 83,810
Total allowable cost EUR 2.80000   Total disposal proceeds EUR -672.800

Matches with:
SUBSEQUENT 1 TRADE(S) Within 30 days between 2014-09-25 and 2014-09-25: Matches with BUY of 1 FTIV4 at of EUR 84,480 each 
 Commissions EUR 2.80000 Taxes EUR 0  

Trades:
ID 1760 Code FTIV4 Date 2014-09-25 05:09:07 Quantity 1 Price 422.400 Value per block 84,480

CALCULATION: (1*83810) - 2.80000 - 0 -(1*84480) - 2.80000 - 0  = -676 

********************************************************************************************************************************************

4: SELL 1 FTIV4 Futures on 25/09/2014 at EUR 83,770 each gives PROFIT of EUR 444 equals GBP 351.598
 Commission EUR 2.80000 and taxes EUR 0 on SELL
Trade details:ID 1764 Code FTIV4 Date 2014-09-25 10:14:29 Quantity -1 Price 418.850 Value per block 83,770
Total allowable cost EUR 2.80000   Total disposal proceeds EUR 447.200

Matches with:
PRO-RATA SECTION 104: Quantity 1.000000 FTIV4 allocated from total holding of 3, made up of 1 trades between 2014-09-16 and 2014-09-16
 At average value of EUR 83,320 Commissions EUR 2.80000 Taxes EUR 0  

Trades:
ID 1757a Code FTIV4 Date 2014-09-16 03:36:20 Quantity 1 Price 416.600 Value per block 83,320 (Allocated from: ID 1757 Quantity 3)

CALCULATION: (1*83770) - 2.80000 - 0 -(1*83320) - 2.80000 - 0  = 444 

********************************************************************************************************************************************

5: SELL 1 FTIV4 Futures on 10/10/2014 at EUR 79,090 each gives LOSS of EUR -4,236 equals GBP -3,350.97
 Commission EUR 2.80000 and taxes EUR 0 on SELL
Trade details:ID 1765 Code FTIV4 Date 2014-10-10 06:27:53 Quantity -1 Price 395.450 Value per block 79,090
Total allowable cost EUR 2.80000   Total disposal proceeds EUR -4,232.80

Matches with:
PRO-RATA SECTION 104: Quantity 1.000000 FTIV4 allocated from total holding of 3, made up of 1 trades between 2014-09-16 and 2014-09-16
 At average value of EUR 83,320.00 Commissions EUR 2.80000 Taxes EUR 0  

Trades:
ID 1757b Code FTIV4 Date 2014-09-16 03:36:20 Quantity 1 Price 416.600 Value per block 83,320.00 (Allocated from: ID 1757 Quantity 3)

CALCULATION: (1*79090) - 2.80000 - 0 -(1*83320.00) - 2.80000 - 0  = -4,236 

********************************************************************************************************************************************

6: SELL 1 FTIV4 Futures on 14/10/2014 at EUR 78,270 each gives LOSS of EUR -5,056 equals GBP -3,999.71
 Commission EUR 2.80000 and taxes EUR 0 on SELL
Trade details:ID 1766 Code FTIV4 Date 2014-10-14 09:14:33 Quantity -1 Price 391.350 Value per block 78,270
Total allowable cost EUR 2.80000   Total disposal proceeds EUR -5,052.80

Matches with:
PRO-RATA SECTION 104: Quantity 1.000000 FTIV4 allocated from total holding of 3, made up of 1 trades between 2014-09-16 and 2014-09-16
 At average value of EUR 83,320.00 Commissions EUR 2.80000 Taxes EUR 0  

Trades:
ID 1757c Code FTIV4 Date 2014-09-16 03:36:20 Quantity 1 Price 416.600 Value per block 83,320.00 (Allocated from: ID 1757 Quantity 3)

CALCULATION: (1*78270) - 2.80000 - 0 -(1*83320.00) - 2.80000 - 0  = -5,056 

********************************************************************************************************************************************

1: SELL 1 FTIX4 Futures on 16/10/2014 at EUR 74,070 each gives LOSS of EUR -4,716 equals GBP -3,752.50
 Commission EUR 2.80000 and taxes EUR 0 on SELL
Trade details:ID 1770 Code FTIX4 Date 2014-10-16 06:48:49 Quantity -1 Price 370.350 Value per block 74,070
Total allowable cost EUR 2.80000   Total disposal proceeds EUR -4,712.80

Matches with:
SUBSEQUENT 1 TRADE(S) Within 30 days between 2014-10-22 and 2014-10-22: Matches with BUY of 1 FTIX4 at of EUR 78,780 each 
 Commissions EUR 2.80000 Taxes EUR 0  

Trades:
ID 1768 Code FTIX4 Date 2014-10-22 03:05:10 Quantity 1 Price 393.900 Value per block 78,780

CALCULATION: (1*74070) - 2.80000 - 0 -(1*78780) - 2.80000 - 0  = -4,716 

********************************************************************************************************************************************

2: SELL 2 FTIX4 Futures on 18/11/2014 at EUR 83,470 each gives PROFIT of EUR 7,089 equals GBP 5,641.02
 Commission EUR 5.60000 and taxes EUR 0 on SELL
Trade details:ID 1771 Code FTIX4 Date 2014-11-18 06:45:19 Quantity -2 Price 417.350 Value per block 83,470
Total allowable cost EUR 5.60000   Total disposal proceeds EUR 7,094.40

Matches with:
PRO-RATA SECTION 104: Quantity 2.000000 FTIX4 allocated from total holding of 2, made up of 2 trades between 2014-10-14 and 2014-11-06
 At average value of EUR 79,920 Commissions EUR 5.60000 Taxes EUR 0  

Trades:
ID 1767 Code FTIX4 Date 2014-10-14 09:14:33 Quantity 1 Price 390.100 Value per block 78,020
ID 1769 Code FTIX4 Date 2014-11-06 05:58:53 Quantity 1 Price 409.100 Value per block 81,820

CALCULATION: (2*83470) - 5.60000 - 0 -(2*79920) - 5.60000 - 0  = 7,089 

********************************************************************************************************************************************

1: SELL 1 FTIZ4 Futures on 12/12/2014 at EUR 82,150 each gives LOSS of EUR -1,336 equals GBP -1,062.82
 Commission EUR 2.80000 and taxes EUR 0 on SELL
Trade details:ID 1773 Code FTIZ4 Date 2014-12-12 06:18:07 Quantity -1 Price 410.750 Value per block 82,150
Total allowable cost EUR 2.80000   Total disposal proceeds EUR -1,332.80

Matches with:
PRO-RATA SECTION 104: Quantity 1.000000 FTIZ4 allocated from total holding of 2, made up of 1 trades between 2014-11-18 and 2014-11-18
 At average value of EUR 83,480 Commissions EUR 2.80000 Taxes EUR 0  

Trades:
ID 1772a Code FTIZ4 Date 2014-11-18 06:45:19 Quantity 1 Price 417.400 Value per block 83,480 (Allocated from: ID 1772 Quantity 2)

CALCULATION: (1*82150) - 2.80000 - 0 -(1*83480) - 2.80000 - 0  = -1,336 

********************************************************************************************************************************************

2: SELL 1 FTIZ4 Futures on 17/12/2014 at EUR 80,020 each gives LOSS of EUR -3,466 equals GBP -2,757.80
 Commission EUR 2.80000 and taxes EUR 0 on SELL
Trade details:ID 1774 Code FTIZ4 Date 2014-12-17 03:59:08 Quantity -1 Price 400.100 Value per block 80,020
Total allowable cost EUR 2.80000   Total disposal proceeds EUR -3,462.80

Matches with:
PRO-RATA SECTION 104: Quantity 1.000000 FTIZ4 allocated from total holding of 2, made up of 1 trades between 2014-11-18 and 2014-11-18
 At average value of EUR 83,480 Commissions EUR 2.80000 Taxes EUR 0  

Trades:
ID 1772b Code FTIZ4 Date 2014-11-18 06:45:19 Quantity 1 Price 417.400 Value per block 83,480 (Allocated from: ID 1772 Quantity 2)

CALCULATION: (1*80020) - 2.80000 - 0 -(1*83480) - 2.80000 - 0  = -3,466 

********************************************************************************************************************************************

1: SELL 4 FV   JUN 14 Futures on 27/05/2014 at USD 120,273 each gives PROFIT of USD 1,527 equals GBP 918.848
 Commission USD 5.88000 and taxes USD 0 on SELL
Trade details:ID 223 Code FV   JUN 14 Date 2014-05-27 09:08:07 Quantity -4 Price 120.273 Value per block 120,273
Total allowable cost USD 5.88000   Total disposal proceeds USD 1,533.18

Matches with:
PRO-RATA SECTION 104: Quantity 4.000000 FV   JUN 14 allocated from total holding of 4, made up of 3 trades between 2014-04-10 and 2014-05-19
 At average value of USD 119,889 Commissions USD 5.88000 Taxes USD 0  

Trades:
ID 220 Code FV   JUN 14 Date 2014-04-10 13:25:02 Quantity 2 Price 119.859 Value per block 119,859
ID 221 Code FV   JUN 14 Date 2014-05-05 12:09:24 Quantity 1 Price 119.477 Value per block 119,477
ID 222 Code FV   JUN 14 Date 2014-05-19 10:46:11 Quantity 1 Price 120.359 Value per block 120,359

CALCULATION: (4*120273) - 5.88000 - 0 -(4*119889) - 5.88000 - 0  = 1,527 

********************************************************************************************************************************************

1: SELL 1 FV   MAR 15 Futures on 03/12/2014 at USD 119,055 each gives LOSS of USD -1,229 equals GBP -739.675
 Commission USD 1.46000 and taxes USD 0 on SELL
Trade details:ID 228 Code FV   MAR 15 Date 2014-12-03 09:05:39 Quantity -1 Price 119.055 Value per block 119,055
Total allowable cost USD 1.46000   Total disposal proceeds USD -1,228.02

Matches with:
SUBSEQUENT 1 TRADE(S) Within 30 days between 2015-01-13 and 2015-01-13: Matches with BUY of 1 FV   MAR 15 at of USD 120,281 each 
 Commissions USD 1.46000 Taxes USD 0  

Trades:
ID 227 Code FV   MAR 15 Date 2015-01-13 12:20:14 Quantity 1 Price 120.281 Value per block 120,281

CALCULATION: (1*119055) - 1.46000 - 0 -(1*120281) - 1.46000 - 0  = -1,229 

********************************************************************************************************************************************

2: SELL 1 FV   MAR 15 Futures on 05/12/2014 at USD 118,625 each gives LOSS of USD -401 equals GBP -241.464
 Commission USD 1.46000 and taxes USD 0 on SELL
Trade details:ID 229 Code FV   MAR 15 Date 2014-12-05 10:31:06 Quantity -1 Price 118.625 Value per block 118,625
Total allowable cost USD 1.46000   Total disposal proceeds USD -399.898

Matches with:
PRO-RATA SECTION 104: Quantity 1.000000 FV   MAR 15 allocated from total holding of 6, made up of 3 trades between 2014-11-21 and 2014-11-27
 At average value of USD 119,023 Commissions USD 1.46000 Taxes USD 0  

Trades:
ID 224a Code FV   MAR 15 Date 2014-11-21 10:21:16 Quantity 0.166667 Price 118.836 Value per block 118,836 (Allocated from: ID 224 Quantity 1)
ID 225a Code FV   MAR 15 Date 2014-11-25 09:42:33 Quantity 0.666667 Price 118.984 Value per block 118,984 (Allocated from: ID 225 Quantity 4)
ID 226a Code FV   MAR 15 Date 2014-11-27 10:05:54 Quantity 0.166667 Price 119.367 Value per block 119,367 (Allocated from: ID 226 Quantity 1)

CALCULATION: (1*118625) - 1.46000 - 0 -(1*119023) - 1.46000 - 0  = -401 

********************************************************************************************************************************************

3: SELL 1 FV   MAR 15 Futures on 05/12/2014 at USD 118,562 each gives LOSS of USD -464 equals GBP -279.065
 Commission USD 1.46000 and taxes USD 0 on SELL
Trade details:ID 230 Code FV   MAR 15 Date 2014-12-05 12:11:49 Quantity -1 Price 118.562 Value per block 118,562
Total allowable cost USD 1.46000   Total disposal proceeds USD -462.398

Matches with:
PRO-RATA SECTION 104: Quantity 1.000000 FV   MAR 15 allocated from total holding of 6, made up of 3 trades between 2014-11-21 and 2014-11-27
 At average value of USD 119,023 Commissions USD 1.46000 Taxes USD 0  

Trades:
ID 224b Code FV   MAR 15 Date 2014-11-21 10:21:16 Quantity 0.166667 Price 118.836 Value per block 118,836 (Allocated from: ID 224 Quantity 1)
ID 225b Code FV   MAR 15 Date 2014-11-25 09:42:33 Quantity 0.666667 Price 118.984 Value per block 118,984 (Allocated from: ID 225 Quantity 4)
ID 226b Code FV   MAR 15 Date 2014-11-27 10:05:54 Quantity 0.166667 Price 119.367 Value per block 119,367 (Allocated from: ID 226 Quantity 1)

CALCULATION: (1*118562) - 1.46000 - 0 -(1*119023) - 1.46000 - 0  = -464 

********************************************************************************************************************************************

4: SELL 1 FV   MAR 15 Futures on 12/12/2014 at USD 119,281 each gives PROFIT of USD 255 equals GBP 153.347
 Commission USD 1.46000 and taxes USD 0 on SELL
Trade details:ID 231 Code FV   MAR 15 Date 2014-12-12 10:27:18 Quantity -1 Price 119.281 Value per block 119,281
Total allowable cost USD 1.46000   Total disposal proceeds USD 256.352

Matches with:
PRO-RATA SECTION 104: Quantity 1.000000 FV   MAR 15 allocated from total holding of 6, made up of 3 trades between 2014-11-21 and 2014-11-27
 At average value of USD 119,023 Commissions USD 1.46000 Taxes USD 0  

Trades:
ID 224c Code FV   MAR 15 Date 2014-11-21 10:21:16 Quantity 0.166667 Price 118.836 Value per block 118,836 (Allocated from: ID 224 Quantity 1)
ID 225c Code FV   MAR 15 Date 2014-11-25 09:42:33 Quantity 0.666667 Price 118.984 Value per block 118,984 (Allocated from: ID 225 Quantity 4)
ID 226c Code FV   MAR 15 Date 2014-11-27 10:05:54 Quantity 0.166667 Price 119.367 Value per block 119,367 (Allocated from: ID 226 Quantity 1)

CALCULATION: (1*119281) - 1.46000 - 0 -(1*119023) - 1.46000 - 0  = 255 

********************************************************************************************************************************************

5: SELL 1 FV   MAR 15 Futures on 20/01/2015 at USD 120,836 each gives PROFIT of USD 1,810 equals GBP 1,088.67
 Commission USD 1.46000 and taxes USD 0 on SELL
Trade details:ID 232 Code FV   MAR 15 Date 2015-01-20 09:03:31 Quantity -1 Price 120.836 Value per block 120,836
Total allowable cost USD 1.46000   Total disposal proceeds USD 1,811.04

Matches with:
PRO-RATA SECTION 104: Quantity 1.000000 FV   MAR 15 allocated from total holding of 6, made up of 3 trades between 2014-11-21 and 2014-11-27
 At average value of USD 119,023 Commissions USD 1.46000 Taxes USD 0  

Trades:
ID 224d Code FV   MAR 15 Date 2014-11-21 10:21:16 Quantity 0.166667 Price 118.836 Value per block 118,836 (Allocated from: ID 224 Quantity 1)
ID 225d Code FV   MAR 15 Date 2014-11-25 09:42:33 Quantity 0.666667 Price 118.984 Value per block 118,984 (Allocated from: ID 225 Quantity 4)
ID 226d Code FV   MAR 15 Date 2014-11-27 10:05:54 Quantity 0.166667 Price 119.367 Value per block 119,367 (Allocated from: ID 226 Quantity 1)

CALCULATION: (1*120836) - 1.46000 - 0 -(1*119023) - 1.46000 - 0  = 1,810 

********************************************************************************************************************************************

1: SELL 2 FV   SEP 14 Futures on 23/06/2014 at USD 118,992 each gives LOSS of USD -787 equals GBP -473.550
 Commission USD 2.94000 and taxes USD 0 on SELL
Trade details:ID 241 Code FV   SEP 14 Date 2014-06-23 09:03:42 Quantity -2 Price 118.992 Value per block 118,992
Total allowable cost USD 2.94000   Total disposal proceeds USD -784.190

Matches with:
SUBSEQUENT 2 TRADE(S) Within 30 days between 2014-06-27 and 2014-07-10: Matches with BUY of 2 FV   SEP 14 at of USD 119,383 each 
 Commissions USD 2.94000 Taxes USD 0  

Trades:
ID 236 Code FV   SEP 14 Date 2014-06-27 10:57:28 Quantity 1 Price 119.422 Value per block 119,422
ID 237 Code FV   SEP 14 Date 2014-07-10 12:03:19 Quantity 1 Price 119.344 Value per block 119,344

CALCULATION: (2*118992) - 2.94000 - 0 -(2*119383) - 2.94000 - 0  = -787 

********************************************************************************************************************************************

2: SELL 1 FV   SEP 14 Futures on 08/07/2014 at USD 119,062 each gives LOSS of USD -229 equals GBP -138.071
 Commission USD 1.47000 and taxes USD 0 on SELL
Trade details:ID 242 Code FV   SEP 14 Date 2014-07-08 10:18:11 Quantity -1 Price 119.062 Value per block 119,062
Total allowable cost USD 1.47000   Total disposal proceeds USD -228.030

Matches with:
SUBSEQUENT 1 TRADE(S) Within 30 days between 2014-07-15 and 2014-07-15: Matches with BUY of 1 FV   SEP 14 at of USD 119,289 each 
 Commissions USD 1.47000 Taxes USD 0  

Trades:
ID 238 Code FV   SEP 14 Date 2014-07-15 10:16:27 Quantity 1 Price 119.289 Value per block 119,289

CALCULATION: (1*119062) - 1.47000 - 0 -(1*119289) - 1.47000 - 0  = -229 

********************************************************************************************************************************************

3: SELL 1 FV   SEP 14 Futures on 25/07/2014 at USD 119,055 each gives LOSS of USD -81 equals GBP -48.7670
 Commission USD 1.47000 and taxes USD 0 on SELL
Trade details:ID 243 Code FV   SEP 14 Date 2014-07-25 09:08:08 Quantity -1 Price 119.055 Value per block 119,055
Total allowable cost USD 1.47000   Total disposal proceeds USD -79.5900

Matches with:
SUBSEQUENT 1 TRADE(S) Within 30 days between 2014-07-29 and 2014-07-29: Matches with BUY of 1 FV   SEP 14 at of USD 119,133 each 
 Commissions USD 1.47000 Taxes USD 0  

Trades:
ID 239 Code FV   SEP 14 Date 2014-07-29 09:29:59 Quantity 1 Price 119.133 Value per block 119,133

CALCULATION: (1*119055) - 1.47000 - 0 -(1*119133) - 1.47000 - 0  = -81 

********************************************************************************************************************************************

4: SELL 1 FV   SEP 14 Futures on 30/07/2014 at USD 118,797 each gives LOSS of USD -1,042 equals GBP -626.884
 Commission USD 1.47000 and taxes USD 0 on SELL
Trade details:ID 244 Code FV   SEP 14 Date 2014-07-30 10:44:34 Quantity -1 Price 118.797 Value per block 118,797
Total allowable cost USD 1.47000   Total disposal proceeds USD -1,040.53

Matches with:
SUBSEQUENT 1 TRADE(S) Within 30 days between 2014-08-15 and 2014-08-15: Matches with BUY of 1 FV   SEP 14 at of USD 119,836 each 
 Commissions USD 1.47000 Taxes USD 0  

Trades:
ID 240 Code FV   SEP 14 Date 2014-08-15 10:14:17 Quantity 1 Price 119.836 Value per block 119,836

CALCULATION: (1*118797) - 1.47000 - 0 -(1*119836) - 1.47000 - 0  = -1,042 

********************************************************************************************************************************************

5: SELL 1 FV   SEP 14 Futures on 07/08/2014 at USD 119,414 each gives PROFIT of USD 83 equals GBP 49.9311
 Commission USD 1.47000 and taxes USD 0 on SELL
Trade details:ID 245 Code FV   SEP 14 Date 2014-08-07 09:20:36 Quantity -1 Price 119.414 Value per block 119,414
Total allowable cost USD 1.47000   Total disposal proceeds USD 84.4650

Matches with:
PRO-RATA SECTION 104: Quantity 1.000000 FV   SEP 14 allocated from total holding of 6, made up of 3 trades between 2014-05-27 and 2014-06-20
 At average value of USD 119,328 Commissions USD 1.47000 Taxes USD 0  

Trades:
ID 233a Code FV   SEP 14 Date 2014-05-27 09:08:39 Quantity 0.666667 Price 119.523 Value per block 119,523 (Allocated from: ID 233 Quantity 4)
ID 234a Code FV   SEP 14 Date 2014-06-20 12:20:09 Quantity 0.166667 Price 118.930 Value per block 118,930 (Allocated from: ID 234 Quantity 1)
ID 235a Code FV   SEP 14 Date 2014-06-20 13:05:59 Quantity 0.166667 Price 118.945 Value per block 118,945 (Allocated from: ID 235 Quantity 1)

CALCULATION: (1*119414) - 1.47000 - 0 -(1*119328) - 1.47000 - 0  = 83 

********************************************************************************************************************************************

6: SELL 5 FV   SEP 14 Futures on 25/08/2014 at USD 119,367 each gives PROFIT of USD 181 equals GBP 108.661
 Commission USD 7.35000 and taxes USD 0 on SELL
Trade details:ID 246 Code FV   SEP 14 Date 2014-08-25 12:20:59 Quantity -5 Price 119.367 Value per block 119,367
Total allowable cost USD 7.35000   Total disposal proceeds USD 187.965

Matches with:
PRO-RATA SECTION 104: Quantity 5.000000 FV   SEP 14 allocated from total holding of 6, made up of 3 trades between 2014-05-27 and 2014-06-20
 At average value of USD 119,328 Commissions USD 7.35000 Taxes USD 0  

Trades:
ID 233b Code FV   SEP 14 Date 2014-05-27 09:08:39 Quantity 3.33333 Price 119.523 Value per block 119,523 (Allocated from: ID 233 Quantity 4)
ID 234b Code FV   SEP 14 Date 2014-06-20 12:20:09 Quantity 0.833333 Price 118.930 Value per block 118,930 (Allocated from: ID 234 Quantity 1)
ID 235b Code FV   SEP 14 Date 2014-06-20 13:05:59 Quantity 0.833333 Price 118.945 Value per block 118,945 (Allocated from: ID 235 Quantity 1)

CALCULATION: (5*119367) - 7.35000 - 0 -(5*119328) - 7.35000 - 0  = 181 

********************************************************************************************************************************************

1: CLOSE SHORT 35 FVS AUG 14 Futures on 07/07/2014 at EUR 1,545 each gives PROFIT of EUR 1,182 equals GBP 940.688
 Commission EUR 70 and taxes EUR 0 on CLOSE SHORT
Trade details:ID 1775 Code FVS AUG 14 Date 2014-07-07 04:20:19 Quantity 35 Price 15.4500 Value per block 1,545
Total allowable cost EUR 70   Total disposal proceeds EUR 1,252.03

Matches with:
SUBSEQUENT 4 TRADE(S) Within 30 days between 2014-07-09 and 2014-07-10: Matches with OPEN SHORT of 15 FVS AUG 14 at of EUR 1,598 each 
 Commissions EUR 30 Taxes EUR 0  

Trades:
ID 1783 Code FVS AUG 14 Date 2014-07-09 03:06:49 Quantity -8 Price 16.0500 Value per block 1,605
ID 1784 Code FVS AUG 14 Date 2014-07-09 03:28:41 Quantity -3 Price 15.9000 Value per block 1,590
ID 1785 Code FVS AUG 14 Date 2014-07-09 10:27:27 Quantity -1 Price 15.9000 Value per block 1,590
ID 1786 Code FVS AUG 14 Date 2014-07-10 03:31:25 Quantity -3 Price 15.9000 Value per block 1,590
PRO-RATA SECTION 104: Quantity 20.000000 FVS AUG 14 allocated from total holding of -37, made up of 2 trades between 2014-07-02 and 2014-07-02
 At average value of EUR 1,571.35 Commissions EUR 40 Taxes EUR 0  

Trades:
ID 1781a Code FVS AUG 14 Date 2014-07-02 06:04:01 Quantity -2.70270 Price 15.8000 Value per block 1,580.00 (Allocated from: ID 1781 Quantity -5)
ID 1782a Code FVS AUG 14 Date 2014-07-02 08:15:15 Quantity -17.2973 Price 15.7000 Value per block 1,570 (Allocated from: ID 1782 Quantity -32)

CALCULATION: -(35*1545) - 70 - 0 +(15*1598) - 30 - 0 +(20*1571.35) - 40 - 0  = 1,182 

********************************************************************************************************************************************

2: CLOSE SHORT 2 FVS AUG 14 Futures on 07/07/2014 at EUR 1,570 each gives LOSS of EUR -5 equals GBP -4.21350
 Commission EUR 4 and taxes EUR 0 on CLOSE SHORT
Trade details:ID 1776 Code FVS AUG 14 Date 2014-07-07 11:28:21 Quantity 2 Price 15.7000 Value per block 1,570
Total allowable cost EUR 4   Total disposal proceeds EUR -1.29730

Matches with:
PRO-RATA SECTION 104: Quantity 2.000000 FVS AUG 14 allocated from total holding of -37, made up of 2 trades between 2014-07-02 and 2014-07-02
 At average value of EUR 1,571.35 Commissions EUR 4 Taxes EUR 0  

Trades:
ID 1781b Code FVS AUG 14 Date 2014-07-02 06:04:01 Quantity -0.270270 Price 15.8000 Value per block 1,580.00 (Allocated from: ID 1781 Quantity -5)
ID 1782b Code FVS AUG 14 Date 2014-07-02 08:15:15 Quantity -1.72973 Price 15.7000 Value per block 1,570.00 (Allocated from: ID 1782 Quantity -32)

CALCULATION: -(2*1570) - 4 - 0 +(2*1571.35) - 4 - 0  = -5 

********************************************************************************************************************************************

3: CLOSE SHORT 9 FVS AUG 14 Futures on 08/08/2014 at EUR 1,990 each gives LOSS of EUR -3,804 equals GBP -3,038.11
 Commission EUR 18 and taxes EUR 0 on CLOSE SHORT
Trade details:ID 1777 Code FVS AUG 14 Date 2014-08-08 03:27:30 Quantity 9 Price 19.9000 Value per block 1,990
Total allowable cost EUR 18.0000   Total disposal proceeds EUR -3,785.84

Matches with:
PRO-RATA SECTION 104: Quantity 9.000000 FVS AUG 14 allocated from total holding of -37, made up of 2 trades between 2014-07-02 and 2014-07-02
 At average value of EUR 1,571.35 Commissions EUR 18.0000 Taxes EUR 0  

Trades:
ID 1781c Code FVS AUG 14 Date 2014-07-02 06:04:01 Quantity -1.21622 Price 15.8000 Value per block 1,580.00 (Allocated from: ID 1781 Quantity -5)
ID 1782c Code FVS AUG 14 Date 2014-07-02 08:15:15 Quantity -7.78378 Price 15.7000 Value per block 1,570.00 (Allocated from: ID 1782 Quantity -32)

CALCULATION: -(9*1990) - 18 - 0 +(9*1571.35) - 18.0000 - 0  = -3,804 

********************************************************************************************************************************************

4: CLOSE SHORT 1 FVS AUG 14 Futures on 08/08/2014 at EUR 2,000 each gives LOSS of EUR -433 equals GBP -345.555
 Commission EUR 2 and taxes EUR 0 on CLOSE SHORT
Trade details:ID 1778 Code FVS AUG 14 Date 2014-08-08 10:36:07 Quantity 1 Price 20 Value per block 2,000
Total allowable cost EUR 2   Total disposal proceeds EUR -430.649

Matches with:
PRO-RATA SECTION 104: Quantity 1.000000 FVS AUG 14 allocated from total holding of -37, made up of 2 trades between 2014-07-02 and 2014-07-02
 At average value of EUR 1,571.35 Commissions EUR 2 Taxes EUR 0  

Trades:
ID 1781d Code FVS AUG 14 Date 2014-07-02 06:04:01 Quantity -0.135135 Price 15.8000 Value per block 1,580.00 (Allocated from: ID 1781 Quantity -5)
ID 1782d Code FVS AUG 14 Date 2014-07-02 08:15:15 Quantity -0.864865 Price 15.7000 Value per block 1,570.00 (Allocated from: ID 1782 Quantity -32)

CALCULATION: -(1*2000) - 2 - 0 +(1*1571.35) - 2 - 0  = -433 

********************************************************************************************************************************************

5: CLOSE SHORT 1 FVS AUG 14 Futures on 11/08/2014 at EUR 1,900 each gives LOSS of EUR -333 equals GBP -265.684
 Commission EUR 2 and taxes EUR 0 on CLOSE SHORT
Trade details:ID 1779 Code FVS AUG 14 Date 2014-08-11 08:37:14 Quantity 1 Price 19 Value per block 1,900
Total allowable cost EUR 2   Total disposal proceeds EUR -330.649

Matches with:
PRO-RATA SECTION 104: Quantity 1.000000 FVS AUG 14 allocated from total holding of -37, made up of 2 trades between 2014-07-02 and 2014-07-02
 At average value of EUR 1,571.35 Commissions EUR 2 Taxes EUR 0  

Trades:
ID 1781e Code FVS AUG 14 Date 2014-07-02 06:04:01 Quantity -0.135135 Price 15.8000 Value per block 1,580.00 (Allocated from: ID 1781 Quantity -5)
ID 1782e Code FVS AUG 14 Date 2014-07-02 08:15:15 Quantity -0.864865 Price 15.7000 Value per block 1,570 (Allocated from: ID 1782 Quantity -32)

CALCULATION: -(1*1900) - 2 - 0 +(1*1571.35) - 2 - 0  = -333 

********************************************************************************************************************************************

6: CLOSE SHORT 4 FVS AUG 14 Futures on 14/08/2014 at EUR 1,815 each gives LOSS of EUR -991 equals GBP -791.174
 Commission EUR 8 and taxes EUR 0 on CLOSE SHORT
Trade details:ID 1780 Code FVS AUG 14 Date 2014-08-14 03:13:52 Quantity 4 Price 18.1500 Value per block 1,815
Total allowable cost EUR 8   Total disposal proceeds EUR -982.595

Matches with:
PRO-RATA SECTION 104: Quantity 4.000000 FVS AUG 14 allocated from total holding of -37, made up of 2 trades between 2014-07-02 and 2014-07-02
 At average value of EUR 1,571.35 Commissions EUR 8 Taxes EUR 0  

Trades:
ID 1781f Code FVS AUG 14 Date 2014-07-02 06:04:01 Quantity -0.540541 Price 15.8000 Value per block 1,580.00 (Allocated from: ID 1781 Quantity -5)
ID 1782f Code FVS AUG 14 Date 2014-07-02 08:15:15 Quantity -3.45946 Price 15.7000 Value per block 1,570 (Allocated from: ID 1782 Quantity -32)

CALCULATION: -(4*1815) - 8 - 0 +(4*1571.35) - 8 - 0  = -991 

********************************************************************************************************************************************

1: CLOSE SHORT 1 FVS DEC 14 Futures on 15/10/2014 at EUR 2,025 each gives LOSS of EUR -257 equals GBP -203.896
 Commission EUR 2 and taxes EUR 0 on CLOSE SHORT
Trade details:ID 1787 Code FVS DEC 14 Date 2014-10-15 03:08:49 Quantity 1 Price 20.2500 Value per block 2,025
Total allowable cost EUR 2   Total disposal proceeds EUR -255.333

Matches with:
PRO-RATA SECTION 104: Quantity 1.000000 FVS DEC 14 allocated from total holding of -3, made up of 2 trades between 2014-10-06 and 2014-10-06
 At average value of EUR 1,771.67 Commissions EUR 2 Taxes EUR 0  

Trades:
ID 1789a Code FVS DEC 14 Date 2014-10-06 03:27:22 Quantity -0.333333 Price 17.7500 Value per block 1,775 (Allocated from: ID 1789 Quantity -1)
ID 1790a Code FVS DEC 14 Date 2014-10-06 06:21:01 Quantity -0.666667 Price 17.7000 Value per block 1,770 (Allocated from: ID 1790 Quantity -2)

CALCULATION: -(1*2025) - 2 - 0 +(1*1771.67) - 2 - 0  = -257 

********************************************************************************************************************************************

2: CLOSE SHORT 2 FVS DEC 14 Futures on 15/10/2014 at EUR 2,015 each gives LOSS of EUR -495 equals GBP -391.411
 Commission EUR 4 and taxes EUR 0 on CLOSE SHORT
Trade details:ID 1788 Code FVS DEC 14 Date 2014-10-15 06:21:33 Quantity 2 Price 20.1500 Value per block 2,015
Total allowable cost EUR 4   Total disposal proceeds EUR -490.667

Matches with:
PRO-RATA SECTION 104: Quantity 2.000000 FVS DEC 14 allocated from total holding of -3, made up of 2 trades between 2014-10-06 and 2014-10-06
 At average value of EUR 1,771.67 Commissions EUR 4 Taxes EUR 0  

Trades:
ID 1789b Code FVS DEC 14 Date 2014-10-06 03:27:22 Quantity -0.666667 Price 17.7500 Value per block 1,775 (Allocated from: ID 1789 Quantity -1)
ID 1790b Code FVS DEC 14 Date 2014-10-06 06:21:01 Quantity -1.33333 Price 17.7000 Value per block 1,770.00 (Allocated from: ID 1790 Quantity -2)

CALCULATION: -(2*2015) - 4 - 0 +(2*1771.67) - 4 - 0  = -495 

********************************************************************************************************************************************

1: CLOSE SHORT 4 FVS FEB 15 Futures on 12/12/2014 at EUR 2,250 each gives LOSS of EUR -116 equals GBP -91.7674
 Commission EUR 8 and taxes EUR 0 on CLOSE SHORT
Trade details:ID 1791 Code FVS FEB 15 Date 2014-12-12 09:43:46 Quantity 4 Price 22.5000 Value per block 2,250
Total allowable cost EUR 8   Total disposal proceeds EUR -108

Matches with:
SUBSEQUENT 4 TRADE(S) Within 30 days between 2014-12-18 and 2014-12-29: Matches with OPEN SHORT of 4 FVS FEB 15 at of EUR 2,225 each 
 Commissions EUR 8 Taxes EUR 0  

Trades:
ID 1809 Code FVS FEB 15 Date 2014-12-18 10:01:28 Quantity -1 Price 22.3000 Value per block 2,230
ID 1810 Code FVS FEB 15 Date 2014-12-19 05:39:48 Quantity -1 Price 22.2000 Value per block 2,220
ID 1811 Code FVS FEB 15 Date 2014-12-22 10:31:18 Quantity -1 Price 22.3000 Value per block 2,230
ID 1812a Code FVS FEB 15 Date 2014-12-29 03:35:10 Quantity -1 Price 22.2000 Value per block 2,220 (Allocated from: ID 1812 Quantity -2)

CALCULATION: -(4*2250) - 8 - 0 +(4*2225) - 8 - 0  = -116 

********************************************************************************************************************************************

2: CLOSE SHORT 4 FVS FEB 15 Futures on 15/12/2014 at EUR 2,285 each gives LOSS of EUR -1,128 equals GBP -892.394
 Commission EUR 8 and taxes EUR 0 on CLOSE SHORT
Trade details:ID 1792 Code FVS FEB 15 Date 2014-12-15 03:49:18 Quantity 4 Price 22.8500 Value per block 2,285
Total allowable cost EUR 8   Total disposal proceeds EUR -1,119.84

Matches with:
SUBSEQUENT 1 TRADE(S) Within 30 days between 2014-12-29 and 2014-12-29: Matches with OPEN SHORT of 1 FVS FEB 15 at of EUR 2,220 each 
 Commissions EUR 2 Taxes EUR 0  

Trades:
ID 1812 Code FVS FEB 15 Date 2014-12-29 03:35:10 Quantity -1 Price 22.2000 Value per block 2,220
PRO-RATA SECTION 104: Quantity 3.000000 FVS FEB 15 allocated from total holding of -19, made up of 4 trades between 2014-12-04 and 2014-12-04
 At average value of EUR 1,936.05 Commissions EUR 6 Taxes EUR 0  

Trades:
ID 1805a Code FVS FEB 15 Date 2014-12-04 03:05:30 Quantity -1.57895 Price 19.4000 Value per block 1,940 (Allocated from: ID 1805 Quantity -10)
ID 1806a Code FVS FEB 15 Date 2014-12-04 03:20:43 Quantity -0.947368 Price 19.3500 Value per block 1,935 (Allocated from: ID 1806 Quantity -6)
ID 1807a Code FVS FEB 15 Date 2014-12-04 05:40:33 Quantity -0.315789 Price 19.2500 Value per block 1,925 (Allocated from: ID 1807 Quantity -2)
ID 1808a Code FVS FEB 15 Date 2014-12-04 06:45:00 Quantity -0.157895 Price 19.2500 Value per block 1,925 (Allocated from: ID 1808 Quantity -1)

CALCULATION: -(4*2285) - 8 - 0 +(1*2220) - 2 - 0 +(3*1936.05) - 6 - 0  = -1,128 

********************************************************************************************************************************************

3: CLOSE SHORT 1 FVS FEB 15 Futures on 15/12/2014 at EUR 2,290 each gives LOSS of EUR -358 equals GBP -282.717
 Commission EUR 2 and taxes EUR 0 on CLOSE SHORT
Trade details:ID 1793 Code FVS FEB 15 Date 2014-12-15 03:49:24 Quantity 1 Price 22.9000 Value per block 2,290
Total allowable cost EUR 2   Total disposal proceeds EUR -355.947

Matches with:
PRO-RATA SECTION 104: Quantity 1.000000 FVS FEB 15 allocated from total holding of -19, made up of 4 trades between 2014-12-04 and 2014-12-04
 At average value of EUR 1,936.05 Commissions EUR 2 Taxes EUR 0  

Trades:
ID 1805b Code FVS FEB 15 Date 2014-12-04 03:05:30 Quantity -0.526316 Price 19.4000 Value per block 1,940 (Allocated from: ID 1805 Quantity -10)
ID 1806b Code FVS FEB 15 Date 2014-12-04 03:20:43 Quantity -0.315789 Price 19.3500 Value per block 1,935.00 (Allocated from: ID 1806 Quantity -6)
ID 1807b Code FVS FEB 15 Date 2014-12-04 05:40:33 Quantity -0.105263 Price 19.2500 Value per block 1,925 (Allocated from: ID 1807 Quantity -2)
ID 1808b Code FVS FEB 15 Date 2014-12-04 06:45:00 Quantity -0.0526316 Price 19.2500 Value per block 1,925 (Allocated from: ID 1808 Quantity -1)

CALCULATION: -(1*2290) - 2 - 0 +(1*1936.05) - 2 - 0  = -358 

********************************************************************************************************************************************

4: CLOSE SHORT 1 FVS FEB 15 Futures on 16/12/2014 at EUR 2,435 each gives LOSS of EUR -503 equals GBP -396.796
 Commission EUR 2 and taxes EUR 0 on CLOSE SHORT
Trade details:ID 1794 Code FVS FEB 15 Date 2014-12-16 07:21:49 Quantity 1 Price 24.3500 Value per block 2,435
Total allowable cost EUR 2   Total disposal proceeds EUR -500.947

Matches with:
PRO-RATA SECTION 104: Quantity 1.000000 FVS FEB 15 allocated from total holding of -19, made up of 4 trades between 2014-12-04 and 2014-12-04
 At average value of EUR 1,936.05 Commissions EUR 2 Taxes EUR 0  

Trades:
ID 1805c Code FVS FEB 15 Date 2014-12-04 03:05:30 Quantity -0.526316 Price 19.4000 Value per block 1,940 (Allocated from: ID 1805 Quantity -10)
ID 1806c Code FVS FEB 15 Date 2014-12-04 03:20:43 Quantity -0.315789 Price 19.3500 Value per block 1,935.00 (Allocated from: ID 1806 Quantity -6)
ID 1807c Code FVS FEB 15 Date 2014-12-04 05:40:33 Quantity -0.105263 Price 19.2500 Value per block 1,925 (Allocated from: ID 1807 Quantity -2)
ID 1808c Code FVS FEB 15 Date 2014-12-04 06:45:00 Quantity -0.0526316 Price 19.2500 Value per block 1,925 (Allocated from: ID 1808 Quantity -1)

CALCULATION: -(1*2435) - 2 - 0 +(1*1936.05) - 2 - 0  = -503 

********************************************************************************************************************************************

5: CLOSE SHORT 1 FVS FEB 15 Futures on 17/12/2014 at EUR 2,385 each gives LOSS of EUR -453 equals GBP -357.348
 Commission EUR 2 and taxes EUR 0 on CLOSE SHORT
Trade details:ID 1795 Code FVS FEB 15 Date 2014-12-17 05:43:26 Quantity 1 Price 23.8500 Value per block 2,385
Total allowable cost EUR 2   Total disposal proceeds EUR -450.947

Matches with:
PRO-RATA SECTION 104: Quantity 1.000000 FVS FEB 15 allocated from total holding of -19, made up of 4 trades between 2014-12-04 and 2014-12-04
 At average value of EUR 1,936.05 Commissions EUR 2 Taxes EUR 0  

Trades:
ID 1805d Code FVS FEB 15 Date 2014-12-04 03:05:30 Quantity -0.526316 Price 19.4000 Value per block 1,940 (Allocated from: ID 1805 Quantity -10)
ID 1806d Code FVS FEB 15 Date 2014-12-04 03:20:43 Quantity -0.315789 Price 19.3500 Value per block 1,935.00 (Allocated from: ID 1806 Quantity -6)
ID 1807d Code FVS FEB 15 Date 2014-12-04 05:40:33 Quantity -0.105263 Price 19.2500 Value per block 1,925.00 (Allocated from: ID 1807 Quantity -2)
ID 1808d Code FVS FEB 15 Date 2014-12-04 06:45:00 Quantity -0.0526316 Price 19.2500 Value per block 1,925.00 (Allocated from: ID 1808 Quantity -1)

CALCULATION: -(1*2385) - 2 - 0 +(1*1936.05) - 2 - 0  = -453 

********************************************************************************************************************************************

6: CLOSE SHORT 1 FVS FEB 15 Futures on 02/01/2015 at EUR 2,345 each gives LOSS of EUR -413 equals GBP -325.791
 Commission EUR 2 and taxes EUR 0 on CLOSE SHORT
Trade details:ID 1796 Code FVS FEB 15 Date 2015-01-02 03:08:26 Quantity 1 Price 23.4500 Value per block 2,345
Total allowable cost EUR 2   Total disposal proceeds EUR -410.947

Matches with:
PRO-RATA SECTION 104: Quantity 1.000000 FVS FEB 15 allocated from total holding of -19, made up of 4 trades between 2014-12-04 and 2014-12-04
 At average value of EUR 1,936.05 Commissions EUR 2 Taxes EUR 0  

Trades:
ID 1805e Code FVS FEB 15 Date 2014-12-04 03:05:30 Quantity -0.526316 Price 19.4000 Value per block 1,940.00 (Allocated from: ID 1805 Quantity -10)
ID 1806e Code FVS FEB 15 Date 2014-12-04 03:20:43 Quantity -0.315789 Price 19.3500 Value per block 1,935.00 (Allocated from: ID 1806 Quantity -6)
ID 1807e Code FVS FEB 15 Date 2014-12-04 05:40:33 Quantity -0.105263 Price 19.2500 Value per block 1,925.00 (Allocated from: ID 1807 Quantity -2)
ID 1808e Code FVS FEB 15 Date 2014-12-04 06:45:00 Quantity -0.0526316 Price 19.2500 Value per block 1,925.00 (Allocated from: ID 1808 Quantity -1)

CALCULATION: -(1*2345) - 2 - 0 +(1*1936.05) - 2 - 0  = -413 

********************************************************************************************************************************************

7: CLOSE SHORT 1 FVS FEB 15 Futures on 02/01/2015 at EUR 2,480 each gives LOSS of EUR -548 equals GBP -431.729
 Commission EUR 2 and taxes EUR 0 on CLOSE SHORT
Trade details:ID 1797 Code FVS FEB 15 Date 2015-01-02 04:05:53 Quantity 1 Price 24.8000 Value per block 2,480
Total allowable cost EUR 2   Total disposal proceeds EUR -545.947

Matches with:
PRO-RATA SECTION 104: Quantity 1.000000 FVS FEB 15 allocated from total holding of -19, made up of 4 trades between 2014-12-04 and 2014-12-04
 At average value of EUR 1,936.05 Commissions EUR 2 Taxes EUR 0  

Trades:
ID 1805f Code FVS FEB 15 Date 2014-12-04 03:05:30 Quantity -0.526316 Price 19.4000 Value per block 1,940.00 (Allocated from: ID 1805 Quantity -10)
ID 1806f Code FVS FEB 15 Date 2014-12-04 03:20:43 Quantity -0.315789 Price 19.3500 Value per block 1,935.00 (Allocated from: ID 1806 Quantity -6)
ID 1807f Code FVS FEB 15 Date 2014-12-04 05:40:33 Quantity -0.105263 Price 19.2500 Value per block 1,925.00 (Allocated from: ID 1807 Quantity -2)
ID 1808f Code FVS FEB 15 Date 2014-12-04 06:45:00 Quantity -0.0526316 Price 19.2500 Value per block 1,925.00 (Allocated from: ID 1808 Quantity -1)

CALCULATION: -(1*2480) - 2 - 0 +(1*1936.05) - 2 - 0  = -548 

********************************************************************************************************************************************

8: CLOSE SHORT 1 FVS FEB 15 Futures on 02/01/2015 at EUR 2,445 each gives LOSS of EUR -513 equals GBP -404.153
 Commission EUR 2 and taxes EUR 0 on CLOSE SHORT
Trade details:ID 1798 Code FVS FEB 15 Date 2015-01-02 05:42:11 Quantity 1 Price 24.4500 Value per block 2,445
Total allowable cost EUR 2   Total disposal proceeds EUR -510.947

Matches with:
PRO-RATA SECTION 104: Quantity 1.000000 FVS FEB 15 allocated from total holding of -19, made up of 4 trades between 2014-12-04 and 2014-12-04
 At average value of EUR 1,936.05 Commissions EUR 2 Taxes EUR 0  

Trades:
ID 1805g Code FVS FEB 15 Date 2014-12-04 03:05:30 Quantity -0.526316 Price 19.4000 Value per block 1,940 (Allocated from: ID 1805 Quantity -10)
ID 1806g Code FVS FEB 15 Date 2014-12-04 03:20:43 Quantity -0.315789 Price 19.3500 Value per block 1,935.00 (Allocated from: ID 1806 Quantity -6)
ID 1807g Code FVS FEB 15 Date 2014-12-04 05:40:33 Quantity -0.105263 Price 19.2500 Value per block 1,925.00 (Allocated from: ID 1807 Quantity -2)
ID 1808g Code FVS FEB 15 Date 2014-12-04 06:45:00 Quantity -0.0526316 Price 19.2500 Value per block 1,925.00 (Allocated from: ID 1808 Quantity -1)

CALCULATION: -(1*2445) - 2 - 0 +(1*1936.05) - 2 - 0  = -513 

********************************************************************************************************************************************

9: CLOSE SHORT 1 FVS FEB 15 Futures on 05/01/2015 at EUR 2,490 each gives LOSS of EUR -558 equals GBP -439.608
 Commission EUR 2 and taxes EUR 0 on CLOSE SHORT
Trade details:ID 1799 Code FVS FEB 15 Date 2015-01-05 05:32:33 Quantity 1 Price 24.9000 Value per block 2,490
Total allowable cost EUR 2   Total disposal proceeds EUR -555.947

Matches with:
PRO-RATA SECTION 104: Quantity 1.000000 FVS FEB 15 allocated from total holding of -19, made up of 4 trades between 2014-12-04 and 2014-12-04
 At average value of EUR 1,936.05 Commissions EUR 2 Taxes EUR 0  

Trades:
ID 1805h Code FVS FEB 15 Date 2014-12-04 03:05:30 Quantity -0.526316 Price 19.4000 Value per block 1,940.00 (Allocated from: ID 1805 Quantity -10)
ID 1806h Code FVS FEB 15 Date 2014-12-04 03:20:43 Quantity -0.315789 Price 19.3500 Value per block 1,935.00 (Allocated from: ID 1806 Quantity -6)
ID 1807h Code FVS FEB 15 Date 2014-12-04 05:40:33 Quantity -0.105263 Price 19.2500 Value per block 1,925.00 (Allocated from: ID 1807 Quantity -2)
ID 1808h Code FVS FEB 15 Date 2014-12-04 06:45:00 Quantity -0.0526316 Price 19.2500 Value per block 1,925.00 (Allocated from: ID 1808 Quantity -1)

CALCULATION: -(1*2490) - 2 - 0 +(1*1936.05) - 2 - 0  = -558 

********************************************************************************************************************************************

10: CLOSE SHORT 1 FVS FEB 15 Futures on 06/01/2015 at EUR 2,575 each gives LOSS of EUR -643 equals GBP -506.582
 Commission EUR 2 and taxes EUR 0 on CLOSE SHORT
Trade details:ID 1800 Code FVS FEB 15 Date 2015-01-06 06:32:02 Quantity 1 Price 25.7500 Value per block 2,575
Total allowable cost EUR 2   Total disposal proceeds EUR -640.947

Matches with:
PRO-RATA SECTION 104: Quantity 1.000000 FVS FEB 15 allocated from total holding of -19, made up of 4 trades between 2014-12-04 and 2014-12-04
 At average value of EUR 1,936.05 Commissions EUR 2 Taxes EUR 0  

Trades:
ID 1805i Code FVS FEB 15 Date 2014-12-04 03:05:30 Quantity -0.526316 Price 19.4000 Value per block 1,940.00 (Allocated from: ID 1805 Quantity -10)
ID 1806i Code FVS FEB 15 Date 2014-12-04 03:20:43 Quantity -0.315789 Price 19.3500 Value per block 1,935.00 (Allocated from: ID 1806 Quantity -6)
ID 1807i Code FVS FEB 15 Date 2014-12-04 05:40:33 Quantity -0.105263 Price 19.2500 Value per block 1,925 (Allocated from: ID 1807 Quantity -2)
ID 1808i Code FVS FEB 15 Date 2014-12-04 06:45:00 Quantity -0.0526316 Price 19.2500 Value per block 1,925 (Allocated from: ID 1808 Quantity -1)

CALCULATION: -(1*2575) - 2 - 0 +(1*1936.05) - 2 - 0  = -643 

********************************************************************************************************************************************

11: CLOSE SHORT 1 FVS FEB 15 Futures on 06/01/2015 at EUR 2,565 each gives LOSS of EUR -633 equals GBP -498.703
 Commission EUR 2 and taxes EUR 0 on CLOSE SHORT
Trade details:ID 1801 Code FVS FEB 15 Date 2015-01-06 06:51:42 Quantity 1 Price 25.6500 Value per block 2,565
Total allowable cost EUR 2   Total disposal proceeds EUR -630.947

Matches with:
PRO-RATA SECTION 104: Quantity 1.000000 FVS FEB 15 allocated from total holding of -19, made up of 4 trades between 2014-12-04 and 2014-12-04
 At average value of EUR 1,936.05 Commissions EUR 2 Taxes EUR 0  

Trades:
ID 1805j Code FVS FEB 15 Date 2014-12-04 03:05:30 Quantity -0.526316 Price 19.4000 Value per block 1,940.00 (Allocated from: ID 1805 Quantity -10)
ID 1806j Code FVS FEB 15 Date 2014-12-04 03:20:43 Quantity -0.315789 Price 19.3500 Value per block 1,935.00 (Allocated from: ID 1806 Quantity -6)
ID 1807j Code FVS FEB 15 Date 2014-12-04 05:40:33 Quantity -0.105263 Price 19.2500 Value per block 1,925 (Allocated from: ID 1807 Quantity -2)
ID 1808j Code FVS FEB 15 Date 2014-12-04 06:45:00 Quantity -0.0526316 Price 19.2500 Value per block 1,925 (Allocated from: ID 1808 Quantity -1)

CALCULATION: -(1*2565) - 2 - 0 +(1*1936.05) - 2 - 0  = -633 

********************************************************************************************************************************************

12: CLOSE SHORT 4 FVS FEB 15 Futures on 07/01/2015 at EUR 2,570 each gives LOSS of EUR -2,552 equals GBP -2,010.57
 Commission EUR 8 and taxes EUR 0 on CLOSE SHORT
Trade details:ID 1802 Code FVS FEB 15 Date 2015-01-07 03:19:44 Quantity 4 Price 25.7000 Value per block 2,570
Total allowable cost EUR 8   Total disposal proceeds EUR -2,543.79

Matches with:
PRO-RATA SECTION 104: Quantity 4.000000 FVS FEB 15 allocated from total holding of -19, made up of 4 trades between 2014-12-04 and 2014-12-04
 At average value of EUR 1,936.05 Commissions EUR 8 Taxes EUR 0  

Trades:
ID 1805k Code FVS FEB 15 Date 2014-12-04 03:05:30 Quantity -2.10526 Price 19.4000 Value per block 1,940.00 (Allocated from: ID 1805 Quantity -10)
ID 1806k Code FVS FEB 15 Date 2014-12-04 03:20:43 Quantity -1.26316 Price 19.3500 Value per block 1,935.00 (Allocated from: ID 1806 Quantity -6)
ID 1807k Code FVS FEB 15 Date 2014-12-04 05:40:33 Quantity -0.421053 Price 19.2500 Value per block 1,925 (Allocated from: ID 1807 Quantity -2)
ID 1808k Code FVS FEB 15 Date 2014-12-04 06:45:00 Quantity -0.210526 Price 19.2500 Value per block 1,925 (Allocated from: ID 1808 Quantity -1)

CALCULATION: -(4*2570) - 8 - 0 +(4*1936.05) - 8 - 0  = -2,552 

********************************************************************************************************************************************

13: CLOSE SHORT 2 FVS FEB 15 Futures on 07/01/2015 at EUR 2,575 each gives LOSS of EUR -1,286 equals GBP -1,013.16
 Commission EUR 4 and taxes EUR 0 on CLOSE SHORT
Trade details:ID 1803 Code FVS FEB 15 Date 2015-01-07 03:19:49 Quantity 2 Price 25.7500 Value per block 2,575
Total allowable cost EUR 4   Total disposal proceeds EUR -1,281.89

Matches with:
PRO-RATA SECTION 104: Quantity 2.000000 FVS FEB 15 allocated from total holding of -19, made up of 4 trades between 2014-12-04 and 2014-12-04
 At average value of EUR 1,936.05 Commissions EUR 4 Taxes EUR 0  

Trades:
ID 1805l Code FVS FEB 15 Date 2014-12-04 03:05:30 Quantity -1.05263 Price 19.4000 Value per block 1,940.00 (Allocated from: ID 1805 Quantity -10)
ID 1806l Code FVS FEB 15 Date 2014-12-04 03:20:43 Quantity -0.631579 Price 19.3500 Value per block 1,935.00 (Allocated from: ID 1806 Quantity -6)
ID 1807l Code FVS FEB 15 Date 2014-12-04 05:40:33 Quantity -0.210526 Price 19.2500 Value per block 1,925.00 (Allocated from: ID 1807 Quantity -2)
ID 1808l Code FVS FEB 15 Date 2014-12-04 06:45:00 Quantity -0.105263 Price 19.2500 Value per block 1,925.00 (Allocated from: ID 1808 Quantity -1)

CALCULATION: -(2*2575) - 4 - 0 +(2*1936.05) - 4 - 0  = -1,286 

********************************************************************************************************************************************

14: CLOSE SHORT 1 FVS FEB 15 Futures on 19/01/2015 at EUR 2,540 each gives LOSS of EUR -608 equals GBP -479.005
 Commission EUR 2 and taxes EUR 0 on CLOSE SHORT
Trade details:ID 1804 Code FVS FEB 15 Date 2015-01-19 03:41:21 Quantity 1 Price 25.4000 Value per block 2,540
Total allowable cost EUR 2.00000   Total disposal proceeds EUR -605.947

Matches with:
PRO-RATA SECTION 104: Quantity 1.000000 FVS FEB 15 allocated from total holding of -19, made up of 4 trades between 2014-12-04 and 2014-12-04
 At average value of EUR 1,936.05 Commissions EUR 2.00000 Taxes EUR 0  

Trades:
ID 1805m Code FVS FEB 15 Date 2014-12-04 03:05:30 Quantity -0.526316 Price 19.4000 Value per block 1,940.00 (Allocated from: ID 1805 Quantity -10)
ID 1806m Code FVS FEB 15 Date 2014-12-04 03:20:43 Quantity -0.315789 Price 19.3500 Value per block 1,935.00 (Allocated from: ID 1806 Quantity -6)
ID 1807m Code FVS FEB 15 Date 2014-12-04 05:40:33 Quantity -0.105263 Price 19.2500 Value per block 1,925 (Allocated from: ID 1807 Quantity -2)
ID 1808m Code FVS FEB 15 Date 2014-12-04 06:45:00 Quantity -0.0526316 Price 19.2500 Value per block 1,925 (Allocated from: ID 1808 Quantity -1)

CALCULATION: -(1*2540) - 2 - 0 +(1*1936.05) - 2.00000 - 0  = -608 

********************************************************************************************************************************************

1: CLOSE SHORT 1 FVS JAN 15 Futures on 16/10/2014 at EUR 2,225 each gives LOSS of EUR -134 equals GBP -105.678
 Commission EUR 2 and taxes EUR 0 on CLOSE SHORT
Trade details:ID 1813 Code FVS JAN 15 Date 2014-10-16 03:20:05 Quantity 1 Price 22.2500 Value per block 2,225
Total allowable cost EUR 2   Total disposal proceeds EUR -132

Matches with:
SUBSEQUENT 1 TRADE(S) Within 30 days between 2014-10-20 and 2014-10-20: Matches with OPEN SHORT of 1 FVS JAN 15 at of EUR 2,095 each 
 Commissions EUR 2 Taxes EUR 0  

Trades:
ID 1837:1 Code FVS JAN 15 Date 2014-10-20 04:02:56 Quantity -1 Price 20.9500 Value per block 2,095

CALCULATION: -(1*2225) - 2 - 0 +(1*2095) - 2 - 0  = -134 

********************************************************************************************************************************************

2: CLOSE SHORT 7 FVS JAN 15 Futures on 16/10/2014 at EUR 2,290 each gives LOSS of EUR -1,503 equals GBP -1,185.36
 Commission EUR 14 and taxes EUR 0 on CLOSE SHORT
Trade details:ID 1814 Code FVS JAN 15 Date 2014-10-16 08:33:44 Quantity 7 Price 22.9000 Value per block 2,290
Total allowable cost EUR 14   Total disposal proceeds EUR -1,489

Matches with:
SUBSEQUENT 5 TRADE(S) Within 30 days between 2014-10-20 and 2014-10-22: Matches with OPEN SHORT of 7 FVS JAN 15 at of EUR 2,079.29 each 
 Commissions EUR 14 Taxes EUR 0  

Trades:
ID 1837:2 Code FVS JAN 15 Date 2014-10-20 04:02:57 Quantity -3 Price 20.9500 Value per block 2,095
ID 1838 Code FVS JAN 15 Date 2014-10-20 05:52:51 Quantity -1 Price 20.9500 Value per block 2,095
ID 1839 Code FVS JAN 15 Date 2014-10-21 03:23:30 Quantity -1 Price 20.9000 Value per block 2,090
ID 1840 Code FVS JAN 15 Date 2014-10-21 05:31:15 Quantity -1 Price 20.7000 Value per block 2,070
ID 1841a Code FVS JAN 15 Date 2014-10-22 03:43:27 Quantity -1 Price 20.1500 Value per block 2,015 (Allocated from: ID 1841 Quantity -7)

CALCULATION: -(7*2290) - 14 - 0 +(7*2079.29) - 14 - 0  = -1,503 

********************************************************************************************************************************************

3: CLOSE SHORT 2 FVS JAN 15 Futures on 06/11/2014 at EUR 1,980 each gives LOSS of EUR -58 equals GBP -45.5751
 Commission EUR 4 and taxes EUR 0 on CLOSE SHORT
Trade details:ID 1816 Code FVS JAN 15 Date 2014-11-06 04:27:23 Quantity 2 Price 19.8000 Value per block 1,980
Total allowable cost EUR 4   Total disposal proceeds EUR -54

Matches with:
SAME DAY TRADE(S) Matches with OPEN SHORT of 1 FVS JAN 15 at average of EUR 1,965 each 
 Commissions EUR 2 Taxes EUR 0 

Trades:
ID 1854 Code FVS JAN 15 Date 2014-11-06 03:26:22 Quantity -1 Price 19.6500 Value per block 1,965
SUBSEQUENT 1 TRADE(S) Within 30 days between 2014-11-10 and 2014-11-10: Matches with OPEN SHORT of 1 FVS JAN 15 at of EUR 1,945 each 
 Commissions EUR 2 Taxes EUR 0  

Trades:
ID 1855 Code FVS JAN 15 Date 2014-11-10 03:27:36 Quantity -1 Price 19.4500 Value per block 1,945

CALCULATION: -(2*1980) - 4 - 0 +(1*1965) - 2 - 0 +(1*1945) - 2 - 0  = -58 

********************************************************************************************************************************************

4: CLOSE SHORT 2 FVS JAN 15 Futures on 19/11/2014 at EUR 1,945 each gives LOSS of EUR -68 equals GBP -53.4297
 Commission EUR 4 and taxes EUR 0 on CLOSE SHORT
Trade details:ID 1817 Code FVS JAN 15 Date 2014-11-19 10:18:19 Quantity 2 Price 19.4500 Value per block 1,945
Total allowable cost EUR 4   Total disposal proceeds EUR -64

Matches with:
SUBSEQUENT 1 TRADE(S) Within 30 days between 2014-11-21 and 2014-11-21: Matches with OPEN SHORT of 2 FVS JAN 15 at of EUR 1,915 each 
 Commissions EUR 4 Taxes EUR 0  

Trades:
ID 1865a Code FVS JAN 15 Date 2014-11-21 05:40:15 Quantity -2 Price 19.1500 Value per block 1,915 (Allocated from: ID 1865 Quantity -6)

CALCULATION: -(2*1945) - 4 - 0 +(2*1915) - 4 - 0  = -68 

********************************************************************************************************************************************

5: CLOSE SHORT 3 FVS JAN 15 Futures on 20/11/2014 at EUR 1,980 each gives LOSS of EUR -207 equals GBP -162.019
 Commission EUR 6 and taxes EUR 0 on CLOSE SHORT
Trade details:ID 1818 Code FVS JAN 15 Date 2014-11-20 04:05:42 Quantity 3 Price 19.8000 Value per block 1,980
Total allowable cost EUR 6   Total disposal proceeds EUR -201

Matches with:
SUBSEQUENT 1 TRADE(S) Within 30 days between 2014-11-21 and 2014-11-21: Matches with OPEN SHORT of 3 FVS JAN 15 at of EUR 1,915 each 
 Commissions EUR 6 Taxes EUR 0  

Trades:
ID 1865b Code FVS JAN 15 Date 2014-11-21 05:40:15 Quantity -3 Price 19.1500 Value per block 1,915 (Allocated from: ID 1865 Quantity -6)

CALCULATION: -(3*1980) - 6 - 0 +(3*1915) - 6 - 0  = -207 

********************************************************************************************************************************************

6: CLOSE SHORT 2 FVS JAN 15 Futures on 20/11/2014 at EUR 1,990 each gives LOSS of EUR -153 equals GBP -119.745
 Commission EUR 4 and taxes EUR 0 on CLOSE SHORT
Trade details:ID 1819 Code FVS JAN 15 Date 2014-11-20 06:20:50 Quantity 2 Price 19.9000 Value per block 1,990
Total allowable cost EUR 4   Total disposal proceeds EUR -149

Matches with:
SUBSEQUENT 2 TRADE(S) Within 30 days between 2014-11-21 and 2014-11-21: Matches with OPEN SHORT of 2 FVS JAN 15 at of EUR 1,917.50 each 
 Commissions EUR 4 Taxes EUR 0  

Trades:
ID 1865 Code FVS JAN 15 Date 2014-11-21 05:40:15 Quantity -1 Price 19.1500 Value per block 1,915
ID 1866 Code FVS JAN 15 Date 2014-11-21 08:12:00 Quantity -1 Price 19.2000 Value per block 1,920

CALCULATION: -(2*1990) - 4 - 0 +(2*1917.50) - 4 - 0  = -153 

********************************************************************************************************************************************

7: CLOSE SHORT 10 FVS JAN 15 Futures on 28/11/2014 at EUR 1,930 each gives PROFIT of EUR 600 equals GBP 469.524
 Commission EUR 20 and taxes EUR 0 on CLOSE SHORT
Trade details:ID 1820 Code FVS JAN 15 Date 2014-11-28 08:47:45 Quantity 10 Price 19.3000 Value per block 1,930
Total allowable cost EUR 20.4348   Total disposal proceeds EUR 620.761

Matches with:
PRO-RATA SECTION 104: Quantity 10.000000 FVS JAN 15 allocated from total holding of -93, made up of 31 trades between 2014-10-14 and 2014-11-27
 At average value of EUR 1,994.08 Commissions EUR 20.4348 Taxes EUR 0  

Trades:
ID 1836a Code FVS JAN 15 Date 2014-10-14 10:41:48 Quantity -0.869565 Price 21.4000 Value per block 2,140 (Allocated from: ID 1836 Quantity -8)
ID 1815a Code FVS JAN 15 Date 2014-10-16 10:34:35 Quantity 0.108696 Price 22.0500 Value per block 2,205 (Allocated from: ID 1815 Quantity 1)
ID 1841b Code FVS JAN 15 Date 2014-10-22 03:43:27 Quantity -0.652174 Price 20.1500 Value per block 2,015 (Allocated from: ID 1841 Quantity -7)
ID 1842a Code FVS JAN 15 Date 2014-10-24 03:32:54 Quantity -3.36957 Price 20.4500 Value per block 2,045 (Allocated from: ID 1842 Quantity -31)
ID 1843a Code FVS JAN 15 Date 2014-10-27 06:28:25 Quantity -0.108696 Price 20.4000 Value per block 2,040 (Allocated from: ID 1843 Quantity -1)
ID 1844a Code FVS JAN 15 Date 2014-10-28 05:30:58 Quantity -0.108696 Price 20.1500 Value per block 2,015 (Allocated from: ID 1844 Quantity -1)
ID 1845a Code FVS JAN 15 Date 2014-10-28 07:54:01 Quantity -0.217391 Price 20.1500 Value per block 2,015 (Allocated from: ID 1845 Quantity -2)
ID 1846a Code FVS JAN 15 Date 2014-10-29 04:27:34 Quantity -0.108696 Price 19.5000 Value per block 1,950 (Allocated from: ID 1846 Quantity -1)
ID 1847a Code FVS JAN 15 Date 2014-10-29 05:32:22 Quantity -0.108696 Price 19.4500 Value per block 1,945 (Allocated from: ID 1847 Quantity -1)
ID 1848a Code FVS JAN 15 Date 2014-10-29 07:17:04 Quantity -0.217391 Price 19.6000 Value per block 1,960 (Allocated from: ID 1848 Quantity -2)
ID 1849a Code FVS JAN 15 Date 2014-10-30 09:37:50 Quantity -0.108696 Price 19.8500 Value per block 1,985 (Allocated from: ID 1849 Quantity -1)
ID 1850a Code FVS JAN 15 Date 2014-10-31 04:25:16 Quantity -0.217391 Price 19.5000 Value per block 1,950 (Allocated from: ID 1850 Quantity -2)
ID 1851a Code FVS JAN 15 Date 2014-10-31 05:26:58 Quantity -0.108696 Price 19.4000 Value per block 1,940.00 (Allocated from: ID 1851 Quantity -1)
ID 1852a Code FVS JAN 15 Date 2014-11-04 03:26:15 Quantity -0.326087 Price 19.5000 Value per block 1,950.00 (Allocated from: ID 1852 Quantity -3)
ID 1853a Code FVS JAN 15 Date 2014-11-04 04:25:02 Quantity -0.108696 Price 19.5000 Value per block 1,950 (Allocated from: ID 1853 Quantity -1)
ID 1856a Code FVS JAN 15 Date 2014-11-10 05:45:30 Quantity -0.326087 Price 19.5500 Value per block 1,955 (Allocated from: ID 1856 Quantity -3)
ID 1857a Code FVS JAN 15 Date 2014-11-11 05:44:40 Quantity -0.326087 Price 19 Value per block 1,900 (Allocated from: ID 1857 Quantity -3)
ID 1858a Code FVS JAN 15 Date 2014-11-11 10:04:08 Quantity -0.108696 Price 19 Value per block 1,900 (Allocated from: ID 1858 Quantity -1)
ID 1859a Code FVS JAN 15 Date 2014-11-13 03:27:39 Quantity -0.108696 Price 19.1000 Value per block 1,910 (Allocated from: ID 1859 Quantity -1)
ID 1860a Code FVS JAN 15 Date 2014-11-13 06:22:29 Quantity -0.543478 Price 19 Value per block 1,900.00 (Allocated from: ID 1860 Quantity -5)
ID 1861a Code FVS JAN 15 Date 2014-11-18 03:30:06 Quantity -0.108696 Price 19.1000 Value per block 1,910 (Allocated from: ID 1861 Quantity -1)
ID 1862a Code FVS JAN 15 Date 2014-11-18 04:24:41 Quantity -0.108696 Price 19.1000 Value per block 1,910 (Allocated from: ID 1862 Quantity -1)
ID 1863a Code FVS JAN 15 Date 2014-11-18 06:13:02 Quantity -0.108696 Price 19.0500 Value per block 1,905 (Allocated from: ID 1863 Quantity -1)
ID 1864a Code FVS JAN 15 Date 2014-11-18 07:19:52 Quantity -0.108696 Price 19 Value per block 1,900 (Allocated from: ID 1864 Quantity -1)
ID 1867a Code FVS JAN 15 Date 2014-11-21 10:25:13 Quantity -0.434783 Price 19.3500 Value per block 1,935.00 (Allocated from: ID 1867 Quantity -4)
ID 1868a Code FVS JAN 15 Date 2014-11-24 10:14:26 Quantity -0.108696 Price 19.4000 Value per block 1,940.00 (Allocated from: ID 1868 Quantity -1)
ID 1869a Code FVS JAN 15 Date 2014-11-25 03:25:11 Quantity -0.434783 Price 19.4500 Value per block 1,945 (Allocated from: ID 1869 Quantity -4)
ID 1870a Code FVS JAN 15 Date 2014-11-25 05:30:57 Quantity -0.108696 Price 19.2500 Value per block 1,925 (Allocated from: ID 1870 Quantity -1)
ID 1871a Code FVS JAN 15 Date 2014-11-26 03:25:11 Quantity -0.217391 Price 19.2500 Value per block 1,925 (Allocated from: ID 1871 Quantity -2)
ID 1872a Code FVS JAN 15 Date 2014-11-27 03:25:50 Quantity -0.108696 Price 19.3500 Value per block 1,935.00 (Allocated from: ID 1872 Quantity -1)
ID 1873a Code FVS JAN 15 Date 2014-11-27 03:28:22 Quantity -0.217391 Price 19.3000 Value per block 1,930 (Allocated from: ID 1873 Quantity -2)

CALCULATION: -(10*1930) - 20 - 0 +(10*1994.08) - 20.4348 - 0  = 600 

********************************************************************************************************************************************

8: CLOSE SHORT 6 FVS JAN 15 Futures on 01/12/2014 at EUR 1,970 each gives PROFIT of EUR 120 equals GBP 94.0644
 Commission EUR 12 and taxes EUR 0 on CLOSE SHORT
Trade details:ID 1821 Code FVS JAN 15 Date 2014-12-01 07:16:33 Quantity 6 Price 19.7000 Value per block 1,970
Total allowable cost EUR 12.2609   Total disposal proceeds EUR 132.457

Matches with:
PRO-RATA SECTION 104: Quantity 6.000000 FVS JAN 15 allocated from total holding of -93, made up of 31 trades between 2014-10-14 and 2014-11-27
 At average value of EUR 1,994.08 Commissions EUR 12.2609 Taxes EUR 0  

Trades:
ID 1836b Code FVS JAN 15 Date 2014-10-14 10:41:48 Quantity -0.521739 Price 21.4000 Value per block 2,140 (Allocated from: ID 1836 Quantity -8)
ID 1815b Code FVS JAN 15 Date 2014-10-16 10:34:35 Quantity 0.0652174 Price 22.0500 Value per block 2,205 (Allocated from: ID 1815 Quantity 1)
ID 1841c Code FVS JAN 15 Date 2014-10-22 03:43:27 Quantity -0.391304 Price 20.1500 Value per block 2,015.00 (Allocated from: ID 1841 Quantity -7)
ID 1842b Code FVS JAN 15 Date 2014-10-24 03:32:54 Quantity -2.02174 Price 20.4500 Value per block 2,045.00 (Allocated from: ID 1842 Quantity -31)
ID 1843b Code FVS JAN 15 Date 2014-10-27 06:28:25 Quantity -0.0652174 Price 20.4000 Value per block 2,040 (Allocated from: ID 1843 Quantity -1)
ID 1844b Code FVS JAN 15 Date 2014-10-28 05:30:58 Quantity -0.0652174 Price 20.1500 Value per block 2,015.00 (Allocated from: ID 1844 Quantity -1)
ID 1845b Code FVS JAN 15 Date 2014-10-28 07:54:01 Quantity -0.130435 Price 20.1500 Value per block 2,015.00 (Allocated from: ID 1845 Quantity -2)
ID 1846b Code FVS JAN 15 Date 2014-10-29 04:27:34 Quantity -0.0652174 Price 19.5000 Value per block 1,950.00 (Allocated from: ID 1846 Quantity -1)
ID 1847b Code FVS JAN 15 Date 2014-10-29 05:32:22 Quantity -0.0652174 Price 19.4500 Value per block 1,945 (Allocated from: ID 1847 Quantity -1)
ID 1848b Code FVS JAN 15 Date 2014-10-29 07:17:04 Quantity -0.130435 Price 19.6000 Value per block 1,960.00 (Allocated from: ID 1848 Quantity -2)
ID 1849b Code FVS JAN 15 Date 2014-10-30 09:37:50 Quantity -0.0652174 Price 19.8500 Value per block 1,985 (Allocated from: ID 1849 Quantity -1)
ID 1850b Code FVS JAN 15 Date 2014-10-31 04:25:16 Quantity -0.130435 Price 19.5000 Value per block 1,950.00 (Allocated from: ID 1850 Quantity -2)
ID 1851b Code FVS JAN 15 Date 2014-10-31 05:26:58 Quantity -0.0652174 Price 19.4000 Value per block 1,940.00 (Allocated from: ID 1851 Quantity -1)
ID 1852b Code FVS JAN 15 Date 2014-11-04 03:26:15 Quantity -0.195652 Price 19.5000 Value per block 1,950.00 (Allocated from: ID 1852 Quantity -3)
ID 1853b Code FVS JAN 15 Date 2014-11-04 04:25:02 Quantity -0.0652174 Price 19.5000 Value per block 1,950.00 (Allocated from: ID 1853 Quantity -1)
ID 1856b Code FVS JAN 15 Date 2014-11-10 05:45:30 Quantity -0.195652 Price 19.5500 Value per block 1,955 (Allocated from: ID 1856 Quantity -3)
ID 1857b Code FVS JAN 15 Date 2014-11-11 05:44:40 Quantity -0.195652 Price 19 Value per block 1,900.00 (Allocated from: ID 1857 Quantity -3)
ID 1858b Code FVS JAN 15 Date 2014-11-11 10:04:08 Quantity -0.0652174 Price 19 Value per block 1,900 (Allocated from: ID 1858 Quantity -1)
ID 1859b Code FVS JAN 15 Date 2014-11-13 03:27:39 Quantity -0.0652174 Price 19.1000 Value per block 1,910 (Allocated from: ID 1859 Quantity -1)
ID 1860b Code FVS JAN 15 Date 2014-11-13 06:22:29 Quantity -0.326087 Price 19 Value per block 1,900 (Allocated from: ID 1860 Quantity -5)
ID 1861b Code FVS JAN 15 Date 2014-11-18 03:30:06 Quantity -0.0652174 Price 19.1000 Value per block 1,910 (Allocated from: ID 1861 Quantity -1)
ID 1862b Code FVS JAN 15 Date 2014-11-18 04:24:41 Quantity -0.0652174 Price 19.1000 Value per block 1,910 (Allocated from: ID 1862 Quantity -1)
ID 1863b Code FVS JAN 15 Date 2014-11-18 06:13:02 Quantity -0.0652174 Price 19.0500 Value per block 1,905.00 (Allocated from: ID 1863 Quantity -1)
